id,created_at,closed_at,state,comments,title
2712,2019-07-29 12:18:31.000000000,2019-07-29 16:06:42.000000000,closed,0,"Change box and ""Create dropdown"" to show ""Create Skill"", ""Create Bot"", ""Add Device"""
2711,2019-07-29 12:13:59.000000000,2019-08-01 10:10:04.000000000,closed,1,"Chat box: Corner too rounded, font too big, playing videos does not show screen entirely"
2710,2019-07-29 12:02:19.000000000,2019-08-08 10:14:26.000000000,closed,3,"Email Config not working, No test emails, Form Issues"
2709,2019-07-29 11:49:10.000000000,2019-08-03 21:41:56.000000000,closed,1,"Make Admin Dashboard subtabs uniform, use material-table"
2708,2019-07-29 11:11:44.000000000,2019-08-12 19:35:50.000000000,closed,0,"Admin Dashboard: Device Tab - Add Device Added Date and Last Active, show device location, edit device"
2707,2019-07-29 10:54:52.000000000,2019-07-30 12:33:39.000000000,closed,0,Unable to signup in SUSI
2706,2019-07-29 10:50:42.000000000,2019-08-03 13:03:12.000000000,closed,4,"Admin Dashboard: Show box ""Devices"" and ""Devices over Time"""
2705,2019-07-29 07:47:02.000000000,2019-08-01 09:45:38.000000000,closed,1,"Getting email link for ""Forget password"" even for a unregistered email address"
2704,2019-07-29 07:23:44.000000000,2020-01-16 10:14:34.000000000,closed,4,Unnecessary notification below password in the Login Panel
2703,2019-07-29 00:25:37.000000000,2020-01-23 23:25:03.000000000,closed,2,Add webpack to improve performance #2702
2702,2019-07-28 20:43:58.000000000,2020-01-25 12:38:45.000000000,closed,3,"Add webpack, react-loadable to improve performance"
2701,2019-07-28 17:59:30.000000000,2019-07-30 11:20:25.000000000,closed,5,Fix Users Tab in Admin
2700,2019-07-28 16:48:36.000000000,2019-07-28 23:08:23.000000000,closed,0,Change Search in Message Design
2699,2019-07-28 16:27:09.000000000,2019-07-28 22:21:48.000000000,closed,2,Enhance preview chat #1
2698,2019-07-28 14:54:16.000000000,2019-07-30 13:13:33.000000000,closed,3,"Now the menu that pops on hovering on ""?"" is completely inside the display console"
2697,2019-07-28 13:24:37.000000000,2019-08-01 09:36:54.000000000,closed,6,"Remove image required for skillCreation, botBuilder, language options in search"
2696,2019-07-28 12:20:55.000000000,1970-01-01 00:00:00.000000001,open,2,Add scroll card for category and browse history skills
2695,2019-07-28 11:39:35.000000000,2019-08-02 18:39:19.000000000,closed,2,Settings page breaking on local device
2694,2019-07-28 11:35:38.000000000,2019-08-01 09:40:58.000000000,closed,0,Fix language options on category change
2693,2019-07-28 11:10:50.000000000,2019-08-10 15:41:42.000000000,closed,1,Add a tab in Settings for storing API's
2692,2019-07-28 10:59:08.000000000,2019-07-30 11:20:25.000000000,closed,0,Fix Users Tab in Admin
2691,2019-07-28 09:10:10.000000000,2019-10-09 09:44:23.000000000,closed,4,Fix the language popover 
2690,2019-07-28 09:08:33.000000000,2019-07-28 11:11:38.000000000,closed,1,"Fix #2671 and now the menu under """"?"""" is completely inside the display"
2689,2019-07-28 00:53:48.000000000,2019-07-28 18:46:20.000000000,closed,2,"Remove BrowseSkillByCategory, BrowseSkillByLanguage"
2688,2019-07-27 23:49:34.000000000,2019-07-28 19:24:28.000000000,closed,0,"Remove BrowseSkillByCategory, BrowseSkillByLanguage"
2687,2019-07-27 23:46:33.000000000,2019-07-30 12:19:07.000000000,closed,10,Scroll bar does not disappear
2686,2019-07-27 22:09:39.000000000,2019-08-04 15:41:25.000000000,closed,4,Enhance preview chat
2685,2019-07-27 21:15:15.000000000,2019-07-27 21:51:45.000000000,closed,1,Show LoginsOverTime and SignUpOverTime in AdminPanel
2684,2019-07-27 14:29:22.000000000,2019-07-28 09:08:56.000000000,closed,2,"Now the menu pops by hovering ""?"" is completely under display"
2683,2019-07-27 10:01:19.000000000,2019-07-27 19:58:21.000000000,closed,1,Improve Dashboard Conformity across pages and fix minor bugs
2682,2019-07-27 06:26:29.000000000,2019-07-27 21:14:06.000000000,closed,0,Fix heading Share missing in the Settings page and increase font size of text input in chat bubble 
2681,2019-07-27 06:11:57.000000000,2019-07-27 20:38:31.000000000,closed,3,Add System Skills tab under Skill in Admin
2680,2019-07-26 23:24:59.000000000,2019-07-27 11:38:55.000000000,closed,3,Proper mobile view in chat app
2679,2019-07-26 20:50:52.000000000,2019-07-27 13:25:46.000000000,closed,5,"the menu that pops on hovering on ""?"" is completely inside the display console"
2678,2019-07-26 19:59:55.000000000,2019-07-26 20:00:44.000000000,closed,0,susi.io chatbot donot show images related to information asked to it.
2677,2019-07-26 18:21:49.000000000,2019-07-26 18:30:59.000000000,closed,0,"the menu under ""?"" is not lying completely inside the screen"
2676,2019-07-26 10:19:27.000000000,2019-07-28 20:40:53.000000000,closed,3,Fixes #2520: Make the Control page section for device
2675,2019-07-25 20:40:21.000000000,2019-07-26 20:40:33.000000000,closed,2,"menu pops by hovering ""?"" is now inside the screen"
2674,2019-07-25 20:19:07.000000000,2019-07-28 10:30:01.000000000,closed,8,"Fix scroll behaviour on skill example, chatApp code"
2673,2019-07-25 20:18:10.000000000,2019-07-28 10:30:01.000000000,closed,0,"Fix redux code for chatApp, testExample"
2672,2019-07-25 20:09:46.000000000,2019-07-25 20:19:42.000000000,closed,0,"menu pops by hovering ""?"" is now inside the screen"
2671,2019-07-25 12:47:59.000000000,2019-08-17 17:46:13.000000000,closed,3,"menu under ""?"" is not completely inside the screen "
2670,2019-07-25 09:08:26.000000000,2019-07-27 11:39:04.000000000,closed,0,Proper mobile view in chat app
2669,2019-07-25 06:03:47.000000000,2019-07-28 18:38:20.000000000,closed,1,Admin: Add Devices Tab
2668,2019-07-25 05:03:43.000000000,2019-07-25 17:34:27.000000000,closed,1,Fix username width in navigation bar and redirect on device delete
2667,2019-07-25 04:56:32.000000000,2019-07-25 17:34:27.000000000,closed,0,Remove minor bugs
2666,2019-07-25 01:35:50.000000000,2019-07-27 10:58:26.000000000,closed,6,"Show user, Statistics in Admin #2550, Skill Example #2635"
2665,2019-07-24 21:29:52.000000000,2019-07-28 18:16:53.000000000,closed,0,Fix scroll behaviour in chat app
2664,2019-07-24 18:29:46.000000000,2019-07-24 19:42:24.000000000,closed,0,"Add server side validation for SignUp user, session storage for user"
2663,2019-07-24 18:04:35.000000000,2019-07-24 19:42:24.000000000,closed,0,Add server side recaptcha validation
2662,2019-07-24 14:09:55.000000000,2019-07-24 21:02:26.000000000,closed,0,Use session storage for storing login attempts
2661,2019-07-23 20:04:11.000000000,2019-07-24 09:38:55.000000000,closed,2,"Fix validation #2546,#2555, searchbar bug #2640, avatar UI #2638"
2660,2019-07-23 18:13:22.000000000,2019-07-24 20:58:30.000000000,closed,3,Fixed ipad view in skills category
2659,2019-07-23 16:09:35.000000000,2019-07-23 22:55:40.000000000,closed,1,Fix Menu Bar icons on the right disappear on small screens
2658,2019-07-23 08:59:37.000000000,2019-07-23 09:11:24.000000000,closed,0,Fix Components Remounting due to HOC #2657
2657,2019-07-23 01:16:14.000000000,2019-07-23 09:11:24.000000000,closed,1,"Start page refreshes on login, opening chat etc."
2656,2019-07-23 01:01:26.000000000,2019-07-23 22:55:40.000000000,closed,1,Menu Bar icons on the right disappear on small screens
2655,2019-07-22 17:43:53.000000000,2019-07-24 20:58:30.000000000,closed,0,Fix ipad view in skills category
2654,2019-07-22 07:21:12.000000000,2019-07-30 11:24:47.000000000,closed,9,Admin: Bots
2653,2019-07-21 20:06:13.000000000,2019-07-21 22:35:34.000000000,closed,2,Fixes #2652: Integrate listUserDevices API and call on My Devices cDM
2652,2019-07-21 19:52:40.000000000,2019-07-21 22:35:34.000000000,closed,0,Integrate /listUserDevices API and call on My Devices cDM
2651,2019-07-21 19:10:09.000000000,2019-07-28 18:17:01.000000000,closed,0,"Fix browseskill filter order, add url params on filter apply"
2650,2019-07-21 18:47:08.000000000,2019-07-21 19:07:12.000000000,closed,0,Fixes #2643: Remove server url hardcoding
2649,2019-07-21 15:55:15.000000000,2019-07-21 16:24:15.000000000,closed,0,Control Page for web
2648,2019-07-21 15:50:32.000000000,2019-07-23 20:05:41.000000000,closed,0,Fix settings overflow height
2647,2019-07-21 15:33:17.000000000,2019-07-23 10:51:42.000000000,closed,3,Fix list highlight on Customer Review Select #2646
2646,2019-07-21 14:35:48.000000000,2019-07-23 10:51:42.000000000,closed,0,Fix list highlight on Customer Review Select
2645,2019-07-21 14:30:17.000000000,2019-07-23 20:05:37.000000000,closed,0,Add scroll to top on metric/entity changes
2644,2019-07-21 14:18:45.000000000,2019-08-01 09:42:26.000000000,closed,4,Fix bugs related to skillcreation and botcreation and followups
2643,2019-07-21 13:38:12.000000000,2019-07-21 19:07:12.000000000,closed,0,Server link is Hardcoded at same places
2642,2019-07-21 13:37:23.000000000,2019-07-21 18:25:21.000000000,closed,0,Frontend Url should be part of Config keys
2641,2019-07-21 08:30:37.000000000,2019-07-30 21:33:32.000000000,closed,0,styled Component in MobileTab.react.js
2640,2019-07-20 16:35:27.000000000,2019-07-24 09:39:48.000000000,closed,0,Fix email autofill in searchbar
2639,2019-07-20 16:28:12.000000000,2019-07-23 20:02:20.000000000,closed,0,"[WIP] Improve user security #2546, #2555, avatar interaction #2638"
2638,2019-07-20 16:24:22.000000000,2019-07-24 09:39:53.000000000,closed,0,Fix avatar upload user interaction
2637,2019-07-20 09:05:43.000000000,2019-07-21 14:15:30.000000000,closed,1,All the styled components in a single file of NavigationBar
2636,2019-07-19 01:16:27.000000000,2019-07-25 01:37:24.000000000,closed,2,"Show user, Statistics in Admin #2550, Skill Example #2635"
2635,2019-07-19 00:54:21.000000000,2019-07-27 13:09:13.000000000,closed,0,Fix show more example arrow
2634,2019-07-19 00:20:09.000000000,2019-07-22 09:17:35.000000000,closed,8,"Add Google Analytics, Matoma/Piwik Tracking #2612"
2633,2019-07-18 19:49:31.000000000,2019-07-19 20:29:00.000000000,closed,11,Option to stop a skill playing audio #2614
2632,2019-07-18 13:18:52.000000000,2019-07-18 18:13:16.000000000,closed,2,Fix Cancel search in search bar
2631,2019-07-18 13:14:55.000000000,2019-07-18 18:25:08.000000000,closed,0,Fixes #2630: Use common dialog for all use-cases
2630,2019-07-18 13:12:44.000000000,2019-07-18 18:25:08.000000000,closed,0,Few components use Dialog inside their code instead of common one
2629,2019-07-18 13:04:10.000000000,2019-07-18 13:31:27.000000000,closed,0,Next arrow is behind chat window
2628,2019-07-18 09:26:04.000000000,2019-07-18 10:14:09.000000000,closed,0,Fixes #2627: Make standard reusable dialog components
2627,2019-07-18 08:52:48.000000000,2019-07-18 10:14:08.000000000,closed,0,There is redundant code for same type of dialog
2626,2019-07-18 07:38:55.000000000,2019-07-18 12:12:48.000000000,closed,1,Add chat bubble in Preview in Create Skill
2625,2019-07-18 07:22:12.000000000,2019-07-18 12:12:48.000000000,closed,0,Add chat bubble in Preview in Create Skill
2624,2019-07-18 01:44:42.000000000,2019-07-18 19:30:54.000000000,closed,6,Fix mobile view for skill search #2622
2623,2019-07-17 21:51:15.000000000,2019-07-27 21:49:23.000000000,closed,1,Mobile: clicking on example bubble opens answer but previous messages are not available
2622,2019-07-17 21:46:28.000000000,2019-07-18 19:30:54.000000000,closed,0,Mobile View: no skill example bubble
2621,2019-07-17 19:56:27.000000000,2019-07-17 23:17:08.000000000,closed,0,Fixes #2618: Add reconfirmation to delete skill dialog
2620,2019-07-17 16:29:49.000000000,2019-07-17 17:22:38.000000000,closed,0,Fixes #2617: Fix delete skill bug from skill details & edit page
2619,2019-07-17 16:11:31.000000000,2019-07-17 17:22:38.000000000,closed,0,Skill Feedback page is broken
2618,2019-07-17 15:44:35.000000000,2019-07-17 23:17:08.000000000,closed,0,Delete skill modal doesn't reconfirm
2617,2019-07-17 15:35:14.000000000,2019-07-17 17:22:38.000000000,closed,0,Delete skill from skill details page doesn't work
2616,2019-07-17 14:42:03.000000000,2019-08-27 18:00:56.000000000,closed,0,The UI for navigation bar is not ideal for mobile view
2615,2019-07-17 13:37:55.000000000,2019-07-17 22:10:40.000000000,closed,6,Footer: Increase gray area
2614,2019-07-17 13:26:34.000000000,2019-07-19 20:29:00.000000000,closed,3,"Options to stop a skill, reduce the volume of playing music"
2613,2019-07-17 13:10:26.000000000,2019-07-17 22:10:39.000000000,closed,1,Footer: Increase gray area bottom by about 30-40 px to show the menu above the chat icon
2612,2019-07-17 13:05:38.000000000,2019-08-10 13:38:10.000000000,closed,9,Admin: Add options for Matomo and Google Analytics
2611,2019-07-17 12:42:25.000000000,2019-07-28 18:38:20.000000000,closed,2,Admin: Add Devices Tab
2610,2019-07-17 11:41:59.000000000,2019-07-18 20:10:26.000000000,closed,15,Fix remaining bugs and implement search bar in chat bubble
2609,2019-07-17 11:22:15.000000000,2019-07-18 14:39:38.000000000,closed,2,"Slideshow: Rework the ""play shakira"" slide using a picture"
2608,2019-07-17 09:24:26.000000000,2019-07-18 13:31:27.000000000,closed,1,Next arrow is overlapping on chat window
2607,2019-07-17 00:50:15.000000000,2019-07-17 01:07:50.000000000,closed,0,Fix Slider Skill to open in chat example
2606,2019-07-17 00:28:59.000000000,2019-08-05 11:48:26.000000000,closed,5,Add Wolfram Alpha to admin config
2605,2019-07-17 00:23:27.000000000,2019-07-17 01:07:50.000000000,closed,1,Slides: Skills linked on the slideshow should open on the same page in chat instead of /chat
2604,2019-07-16 22:43:50.000000000,2019-07-17 09:17:38.000000000,closed,0,Fixes #2603: Put all build files into root in local-pages
2603,2019-07-16 22:42:04.000000000,2019-07-17 09:17:38.000000000,closed,0,Issue with local-pages build
2602,2019-07-16 21:17:37.000000000,2019-07-18 15:05:23.000000000,closed,14,"Add ""Create"" and chat icon to top menu"
2601,2019-07-16 20:47:53.000000000,2019-07-17 01:09:28.000000000,closed,3,Fix Skills filter page - fix filters#2580
2600,2019-07-16 20:02:15.000000000,2019-07-16 21:10:50.000000000,closed,2,Fixes UI and i18n issue: 1-3 out of 3 result(s) #2579
2599,2019-07-16 19:22:25.000000000,2019-07-16 22:44:34.000000000,closed,6,Fix Search box color fix and dropdown view #2589
2598,2019-07-16 19:06:10.000000000,2019-07-16 19:33:43.000000000,closed,0,Fixes #2597: Remove FAB from skill slider in mobile view
2597,2019-07-16 18:54:22.000000000,2019-07-16 19:33:43.000000000,closed,0,FABs present in Skill Slider in mobile
2596,2019-07-16 18:03:43.000000000,2019-07-16 19:24:27.000000000,closed,0,Fixes #2595: Fix the skill status change feature in Admin panel
2595,2019-07-16 18:02:07.000000000,2019-07-16 19:24:27.000000000,closed,0,The skill statuses change feature from the Admin panel doesn't work
2594,2019-07-16 16:42:23.000000000,2019-07-16 18:15:44.000000000,closed,0,Fixes #2496: Show banner and disable device settings in local env
2593,2019-07-16 16:02:01.000000000,2019-07-16 22:14:39.000000000,closed,6,Fix #2586
2592,2019-07-16 14:53:00.000000000,2019-07-16 15:02:52.000000000,closed,0,Fixes #2591: Add charts loader js file
2591,2019-07-16 14:51:56.000000000,2019-07-16 15:02:52.000000000,closed,0,Skill details page not opening
2590,2019-07-16 13:38:28.000000000,2019-07-16 14:06:13.000000000,closed,2,Fixes #2585: Add static css/js/fonts files locally
2589,2019-07-16 13:38:24.000000000,2019-07-16 22:44:34.000000000,closed,0,Search box color fix and dropdown view
2588,2019-07-16 13:11:07.000000000,2019-07-16 13:45:30.000000000,closed,0,Fixes #2587: Refactor devices page and remove redundancy
2587,2019-07-16 13:00:46.000000000,2019-07-16 13:45:30.000000000,closed,0,Devices (About) pages has lot of redundant code
2586,2019-07-16 03:31:37.000000000,2019-07-16 22:14:39.000000000,closed,1,Admin: Dashboard - Provide sufficient space for numbers in color boxes
2585,2019-07-16 03:25:40.000000000,2019-07-16 14:06:13.000000000,closed,1,Include libraries/components/css in repo instead of calling it from external sources
2584,2019-07-16 01:33:16.000000000,2019-07-16 03:26:31.000000000,closed,2,SLIDER - Fonts inconsistent
2583,2019-07-16 01:22:20.000000000,2019-08-11 11:26:13.000000000,closed,1,Slider - lots of artefacts
2581,2019-07-16 00:38:39.000000000,2019-07-18 14:49:13.000000000,closed,2,Clear between headline and **** selection
2580,2019-07-16 00:29:56.000000000,2019-07-17 01:09:28.000000000,closed,2,Skills filter page - fix design and filters
2579,2019-07-16 00:24:52.000000000,2019-07-16 21:10:50.000000000,closed,4,UI and i18n issue: 1-3 out of 3 result(s) 
2578,2019-07-16 00:18:11.000000000,2019-07-27 19:58:21.000000000,closed,4,Improve Dashboard Conformity across pages
2577,2019-07-15 22:32:05.000000000,2019-07-16 09:29:59.000000000,closed,3,"Remove antd package, migrate related components to material"
2572,2019-07-15 21:02:47.000000000,2019-07-18 14:49:59.000000000,closed,3,Links broken
2571,2019-07-15 20:58:39.000000000,2019-07-16 00:57:53.000000000,closed,1,Reviewed skills need to include a picture
2570,2019-07-15 20:53:37.000000000,1970-01-01 00:00:00.000000001,open,2,Farming Skill creation time
2569,2019-07-15 20:48:34.000000000,1970-01-01 00:00:00.000000001,open,2,Skill: Adress 134 geek questions
2567,2019-07-15 20:25:27.000000000,1970-01-01 00:00:00.000000001,open,3,Skill: 94 funny personal questions
2565,2019-07-15 20:20:32.000000000,2019-07-16 03:33:45.000000000,closed,0,Fix SearchBar language search bug#2556
2556,2019-07-15 12:51:07.000000000,2019-07-16 03:33:44.000000000,closed,0,Fix SearchBar and language search bug
2555,2019-07-15 12:42:27.000000000,2019-07-24 09:40:33.000000000,closed,1,Only allow usernames with up to 51 characters
2554,2019-07-15 12:40:20.000000000,2019-08-23 07:00:46.000000000,closed,0,Admin: Provide more options to edit users
2553,2019-07-15 11:08:39.000000000,2019-07-16 09:29:59.000000000,closed,0,Remove antd package
2552,2019-07-15 08:41:41.000000000,2019-07-15 09:21:31.000000000,closed,0,Fixes #2548: Show Cookies/Terns on top of chat icon
2551,2019-07-14 21:05:19.000000000,2019-07-30 11:24:47.000000000,closed,1,Admin: Add Bots Tab 
2550,2019-07-14 20:13:46.000000000,2019-07-27 10:58:26.000000000,closed,1,Admin Dashboard: Show User and Skill Statistics
2549,2019-07-14 20:00:53.000000000,2019-07-15 08:48:42.000000000,closed,4,"Fix TopMenu Popper#2545, Slider#2542, #2544"
2548,2019-07-14 19:32:50.000000000,2019-07-15 09:21:31.000000000,closed,1,Show Cookies/Terms info on top of Chat Icon
2547,2019-07-14 18:52:35.000000000,2019-08-05 00:03:09.000000000,closed,1,Implement Messages and Message Admin Control
2546,2019-07-14 18:34:11.000000000,2019-07-24 09:38:55.000000000,closed,0,Login and Password reset: Improve user security
2545,2019-07-14 17:47:16.000000000,2019-07-15 08:48:42.000000000,closed,0,Menu Bar: Unexpected dropdown menu
2544,2019-07-14 17:34:13.000000000,2019-07-16 13:41:11.000000000,closed,1,Admin: Slider Page buggy
2543,2019-07-14 11:56:33.000000000,2019-07-15 01:50:10.000000000,closed,1,"Fix admin loading users #2524, antd to material-table#2198"
2542,2019-07-14 11:37:24.000000000,2019-07-17 00:54:14.000000000,closed,0,Fix Slider in mobile view
2541,2019-07-14 02:46:20.000000000,2019-07-14 20:41:22.000000000,closed,2,Slide: Quote by Donald Trump
2540,2019-07-14 02:25:44.000000000,2019-07-14 13:00:38.000000000,closed,1,Integrate Styled-component in Not Found #2377
2539,2019-07-14 02:10:22.000000000,2019-07-19 00:07:47.000000000,closed,2,Enhance Admin Skills Section
2538,2019-07-13 20:27:55.000000000,2019-07-16 18:15:08.000000000,closed,14,"Add speech box for skill example sentences on front, cat and all pages with skills"
2537,2019-07-13 18:46:47.000000000,2019-07-14 02:40:23.000000000,closed,10,"Search Enhance #2532, #2531, #2536"
2536,2019-07-13 17:14:28.000000000,2019-07-15 01:25:02.000000000,closed,0,Frontpage: Implement top bar for mobile views
2535,2019-07-13 17:06:02.000000000,2019-07-15 23:52:14.000000000,closed,1,Rename /Botbuilder to /mybots and alter UI
2534,2019-07-13 13:37:32.000000000,2019-07-15 01:24:44.000000000,closed,2,Dashboard: Different size of gray area padding
2533,2019-07-13 02:26:17.000000000,2019-07-14 08:41:15.000000000,closed,2,Fix Edit Skill in SkillCreator and bugs #2519
2532,2019-07-13 02:10:14.000000000,2019-07-14 02:40:23.000000000,closed,2,Redirect to Browse skills search on search enter
2531,2019-07-13 01:22:56.000000000,2019-07-15 01:24:23.000000000,closed,3,Change the style of the language dropdown and make it smaller
2530,2019-07-13 01:21:32.000000000,2019-08-04 23:18:20.000000000,closed,1,"Clicking on ""Create"" on the left side it results in disappearing the scroll bar of the site"
2529,2019-07-13 00:04:38.000000000,2019-07-13 17:25:09.000000000,closed,5,"Create getImage helper#2507, Popper position#2513"
2528,2019-07-12 23:06:02.000000000,2019-07-18 15:05:23.000000000,closed,1,"Add ""Create"" and chat icon to top menu"
2527,2019-07-12 22:34:53.000000000,2019-07-13 13:20:38.000000000,closed,15,Enhance multi search functionality #2473 part 2
2526,2019-07-12 15:55:12.000000000,2019-07-12 20:51:59.000000000,closed,0,Add list of System Skills on start page
2525,2019-07-12 12:07:12.000000000,2019-08-04 16:00:22.000000000,closed,1,Admin: Fix and Improve Skills Overview Table
2524,2019-07-12 12:02:32.000000000,2019-07-15 01:50:10.000000000,closed,1,Admin: List of Users not loading
2523,2019-07-12 11:29:09.000000000,2019-07-18 20:10:25.000000000,closed,0,Fix remaining bugs and implement search bar in chat bubble
2522,2019-07-12 08:57:50.000000000,2019-07-12 12:12:52.000000000,closed,2,Add All Option in Search Functionality
2521,2019-07-12 08:07:46.000000000,2019-07-12 22:39:15.000000000,closed,4,Add Dashboard icon and deleted dropdown of the skills
2520,2019-07-12 03:38:01.000000000,2019-07-28 20:40:53.000000000,closed,4,Show the control webpage on the devices section of the webclient(smart speaker)
2519,2019-07-11 23:08:01.000000000,2019-07-14 08:41:15.000000000,closed,0,Fix Edit Skill in SkillCreator and bugs
2518,2019-07-11 22:40:20.000000000,2019-07-20 22:31:20.000000000,closed,12,Add Configure Email settings in Admin#2454
2517,2019-07-11 19:15:04.000000000,2019-07-12 08:37:51.000000000,closed,1,Show Login on protected routes#2512
2516,2019-07-11 19:13:27.000000000,2019-07-12 09:28:42.000000000,closed,0,"Fixes #2495: Add ""local pages"" for smart devices to build script"
2515,2019-07-11 18:38:31.000000000,2019-07-12 11:00:10.000000000,closed,5,Fix Icon and name not portrayed as expected #2513
2514,2019-07-11 16:09:58.000000000,2019-07-12 20:51:59.000000000,closed,1,"Add list of System Skills above ""Staff Picks"" on start page"
2513,2019-07-11 14:47:53.000000000,2019-07-14 02:12:10.000000000,closed,3,Icon and name not portrayed as expected
2512,2019-07-11 14:44:22.000000000,2019-07-12 08:37:51.000000000,closed,1,"Show ""You need to login.."" for existing pages instead of 404"
2511,2019-07-11 14:23:50.000000000,2019-07-16 18:15:08.000000000,closed,1,"Add speech box for skill example sentences on front, cat and all pages with skills"
2510,2019-07-11 13:49:30.000000000,2019-07-13 18:25:24.000000000,closed,5,Change and add more slides to front page
2509,2019-07-11 12:11:11.000000000,2019-07-13 18:25:33.000000000,closed,1,Move search bar to top of page
2508,2019-07-11 07:50:58.000000000,2019-07-11 13:19:10.000000000,closed,3,Commented code for popup video
2507,2019-07-11 01:49:48.000000000,2019-07-13 17:25:09.000000000,closed,0,Create getImage helper function to fetch image from SUSI server folder
2506,2019-07-10 15:53:46.000000000,2019-07-15 23:52:13.000000000,closed,1,Rename /Botbuilder to /mybots and alter UI
2505,2019-07-10 15:38:26.000000000,2019-07-12 22:39:15.000000000,closed,5,Add Dashboard icon
2504,2019-07-10 10:58:57.000000000,2019-07-11 13:19:10.000000000,closed,1,Take out Popup video
2503,2019-07-10 08:03:18.000000000,2019-07-11 08:40:14.000000000,closed,1,Removed unnecessary choose button and fixed the bug when avatar image is removed
2502,2019-07-09 21:57:26.000000000,2019-07-11 10:32:19.000000000,closed,3,Implement Subtab for Slider Details on Admin #2455
2501,2019-07-09 21:19:07.000000000,2019-07-10 19:41:51.000000000,closed,3,Icons overlapping 
2500,2019-07-09 17:36:08.000000000,2019-07-16 12:17:52.000000000,closed,16,Device Page: Add configuration options
2499,2019-07-09 10:12:22.000000000,2019-07-09 17:20:25.000000000,closed,3,Device Page: Add configuration options
2498,2019-07-09 04:19:17.000000000,2019-07-12 02:48:49.000000000,closed,2,Forgot password and sign up not working
2497,2019-07-08 12:08:52.000000000,2019-07-08 12:19:30.000000000,closed,1,Sign up modal opens now
2496,2019-07-08 11:00:11.000000000,2019-07-16 18:15:43.000000000,closed,0,"Add local device features and settings to ""Device Settings Page"""
2495,2019-07-08 10:39:33.000000000,2019-07-16 18:15:44.000000000,closed,4,"Add ""local pages"" for smart devices to build script"
2494,2019-07-08 07:58:21.000000000,2019-07-18 18:13:16.000000000,closed,0,Cancel search not working
2493,2019-07-08 06:16:37.000000000,2019-07-08 10:25:33.000000000,closed,0,Fix Circular Loader Bug
2492,2019-07-08 05:46:34.000000000,2019-07-08 10:25:33.000000000,closed,0,Fix Circular Loader Bug
2491,2019-07-08 05:37:51.000000000,2019-07-08 10:41:12.000000000,closed,0,Shared Ace Editor Component
2490,2019-07-07 23:42:06.000000000,2019-07-08 02:22:30.000000000,closed,0,Remove slug /skills across web-app
2489,2019-07-07 23:05:40.000000000,2019-07-08 02:22:30.000000000,closed,1,Take out the slug /skills from dashboard etc.
2488,2019-07-07 22:47:43.000000000,2019-07-16 12:17:51.000000000,closed,1,Device Page: Add configuration options / settings
2487,2019-07-07 14:03:06.000000000,2019-07-08 12:19:30.000000000,closed,0,SignUp modal does not open.
2486,2019-07-07 11:06:45.000000000,2019-07-07 22:51:18.000000000,closed,0,Fixes #2439: Create Tabs on Dashboard page
2485,2019-07-07 10:28:52.000000000,2019-08-17 21:32:28.000000000,closed,0,The repository size is approximate ~700mb
