id,created_at,closed_at,state,comments,title
1839,2018-12-13 15:35:29.000000000,2018-12-22 11:48:00.000000000,closed,3,Fixes #1838: Initial state of settings must be hydrated with cookies [WIP]
1838,2018-12-13 15:08:59.000000000,2018-12-22 11:48:26.000000000,closed,0,Hydrate initial state of settings.
1837,2018-12-13 13:45:09.000000000,2019-06-03 08:09:50.000000000,closed,3,Integrate User Avatar in User Account Section with Redux
1836,2018-12-13 00:03:44.000000000,2018-12-13 22:53:24.000000000,closed,0,"Add getAdmin in action Creator,reducer,use axios #1808"
1835,2018-12-12 21:32:43.000000000,2018-12-12 23:42:23.000000000,closed,1,"Add getAdmin in action Creator,reducer,use axios #1808"
1834,2018-12-12 20:51:53.000000000,2018-12-15 14:08:11.000000000,closed,8,Share on Google+ is now aligned
1833,2018-12-12 19:04:39.000000000,2018-12-18 13:35:16.000000000,closed,0,Share on Google+ is not aligned
1832,2018-12-12 14:47:56.000000000,2018-12-14 14:22:31.000000000,closed,0,"Remove timeout from section ""Explore What it can do"" once a user selects a GIF."
1831,2018-12-12 14:19:23.000000000,2018-12-14 14:22:30.000000000,closed,0,"Remove timeout from section ""Explore What it can do"" once a user selects a GIF."
1830,2018-12-12 11:10:33.000000000,2018-12-14 21:29:07.000000000,closed,1,UI of message pane is same in dark and light theme
1829,2018-12-12 10:34:28.000000000,2018-12-14 23:00:35.000000000,closed,2,Made the blog page more reseponsive
1828,2018-12-12 09:53:37.000000000,2018-12-14 23:00:35.000000000,closed,0,UI issue for the Blog Page
1827,2018-12-12 09:45:06.000000000,2018-12-17 18:48:43.000000000,closed,0,Blog TAB is not fetching on a refresh of the page
1826,2018-12-12 01:06:08.000000000,2018-12-14 07:49:59.000000000,closed,3,Make play button and watch text vertically aligned.
1825,2018-12-12 00:59:24.000000000,2018-12-14 07:49:59.000000000,closed,0,Make play button and watch text vertically aligned
1824,2018-12-12 00:52:19.000000000,2018-12-20 09:22:40.000000000,closed,2,Fixes #1823: Snackbar moved to parent component.
1823,2018-12-11 19:12:47.000000000,2018-12-20 09:22:40.000000000,closed,0,Move Snackbar to Parent component without breaking functionality
1822,2018-12-11 16:30:55.000000000,2018-12-19 18:12:41.000000000,closed,4,Footer consistent with other site
1821,2018-12-11 15:57:22.000000000,2019-05-24 16:32:08.000000000,closed,0,Error pops up when menu button is clicked
1820,2018-12-11 13:41:00.000000000,2019-05-24 16:32:08.000000000,closed,5,Bug in Like and dislike button
1819,2018-12-11 12:34:22.000000000,2019-05-24 16:32:07.000000000,closed,1,Add smooth scrolling when clicked on UP and DOWN icons.
1818,2018-12-11 04:40:31.000000000,2018-12-11 16:26:45.000000000,closed,1,"Fixes #1817 Login, Signup and ForgotPassword component shifted to common parent component"
1817,2018-12-11 02:18:03.000000000,2018-12-11 16:26:45.000000000,closed,0,"Shift Login, Signup into higher level components and reuse them for all routes."
1816,2018-12-11 01:18:26.000000000,2019-05-24 16:32:07.000000000,closed,0,Connect Settings component with the redux store and refactor it
1815,2018-12-10 18:41:08.000000000,2018-12-15 16:48:58.000000000,closed,25,search counter issue solved
1814,2018-12-10 16:56:32.000000000,2018-12-18 16:07:20.000000000,closed,1,"Remove jQuery from PreviewThemeChat, Blog, MessageComposer #1812"
1813,2018-12-10 04:20:14.000000000,2018-12-23 08:47:01.000000000,closed,10,"Fixes #1811: Logout action added, force refresh has been removed"
1812,2018-12-10 02:38:43.000000000,2018-12-22 00:30:16.000000000,closed,2,"Remove jQuery from PreviewThemeChat, Blog.react.js, and MessageComposer"
1811,2018-12-10 02:13:11.000000000,2018-12-23 08:47:01.000000000,closed,0,Create a LOGOUT actionType to clean up the store instead of force reloading.
1810,2018-12-10 01:32:53.000000000,2019-01-18 21:56:49.000000000,closed,0,Connecting StatticAppBar.react.js to redux store
1809,2018-12-10 01:26:06.000000000,2018-12-12 21:33:07.000000000,closed,3,"Add getAdmin in action Creator, reducer, use axios for api"
1808,2018-12-09 23:06:17.000000000,2019-01-14 19:54:07.000000000,closed,0,"Add getAdmin in action Creator, reducer, use axios for api"
1807,2018-12-09 21:32:15.000000000,2018-12-24 21:54:35.000000000,closed,25,add a share dialog
1806,2018-12-09 18:32:21.000000000,2018-12-18 19:56:36.000000000,closed,2,"Add reducers, actionCreators, actionTypes for Settings#1802"
1805,2018-12-09 16:51:12.000000000,2018-12-14 21:57:47.000000000,closed,3,Use helper ajax function instead of jQuery in api.actions.js
1804,2018-12-09 16:09:22.000000000,2019-05-24 16:32:07.000000000,closed,2,Map isn't show correctly.
1803,2018-12-09 15:57:53.000000000,2019-03-11 09:06:39.000000000,closed,1,[Fixes #1773] Fixed nav bar
1802,2018-12-09 14:29:37.000000000,2018-12-21 22:15:32.000000000,closed,0,"Add Action creator, reducers, api for settings components"
1801,2018-12-09 10:07:30.000000000,2019-05-27 15:18:14.000000000,closed,1,remove jquery usage for handling the dom
1800,2018-12-08 20:26:48.000000000,2019-01-07 15:56:12.000000000,closed,3,Create Developers.md
1799,2018-12-08 17:48:01.000000000,2019-01-07 16:01:01.000000000,closed,5,Update Android Screenshot (#1789)
1798,2018-12-08 14:45:41.000000000,2019-05-24 16:32:07.000000000,closed,0,Android Screenshots are old.
1797,2018-12-08 14:10:26.000000000,2018-12-20 14:48:35.000000000,closed,1,"Refactor redux bindActionCreator, actionTypes, actions #1796"
1796,2018-12-08 14:08:34.000000000,2019-05-24 16:32:07.000000000,closed,0,"Refactor Redux actions, actionTypes"
1795,2018-12-07 14:42:14.000000000,2018-12-10 23:15:25.000000000,closed,30,Added an example section
1794,2018-12-07 08:14:12.000000000,2019-01-07 15:59:18.000000000,closed,8,fix css bugs in ChatApp.css
1793,2018-12-07 08:08:34.000000000,2019-01-07 15:59:18.000000000,closed,0,css bugs in text field in ChatApp
1792,2018-12-06 15:17:31.000000000,2018-12-06 15:32:15.000000000,closed,0,Added an example section
1791,2018-12-06 15:15:51.000000000,2018-12-10 23:15:25.000000000,closed,0,Examples Section for new users
1790,2018-12-06 01:35:30.000000000,2018-12-06 10:03:07.000000000,closed,4,Added lottie and started the build of a better introductory section
1789,2018-12-05 13:22:50.000000000,2018-12-06 12:39:16.000000000,closed,3,"Fixes#1788, #1784, Remove jQuery scroll animation"
1788,2018-12-05 13:18:41.000000000,2018-12-06 12:39:16.000000000,closed,0,"Fix imports for Terms.react.js, Devices.react.js"
1787,2018-12-04 23:04:32.000000000,2018-12-05 21:27:51.000000000,closed,5,New design mockup propasals
1786,2018-12-02 23:23:03.000000000,2018-12-05 04:07:13.000000000,closed,2,Scrolling: jQuery to Vanilla JS
1785,2018-12-02 22:18:10.000000000,2019-05-24 16:32:07.000000000,closed,0,Better Introductory section for new users
1784,2018-12-02 20:44:13.000000000,2018-12-06 21:11:35.000000000,closed,0,Remove jQuery used for fast page scroll
1783,2018-12-02 17:24:42.000000000,2018-12-02 17:30:03.000000000,closed,2,Login modal needs fixes.
1782,2018-12-02 12:17:23.000000000,2018-12-09 01:38:57.000000000,closed,8,Initial ActionType and state defined ( messages )
1781,2018-12-02 12:01:42.000000000,2018-12-03 15:03:03.000000000,closed,0,Fixes #1780: Replaced == with === in toFormData.js
1780,2018-12-02 11:59:53.000000000,2018-12-03 15:03:03.000000000,closed,0,Replace == with === in toFormData.js ( linter warning messages )
1779,2018-12-02 11:52:16.000000000,2019-05-24 16:32:06.000000000,closed,0,Add more networks on share button
1778,2018-12-02 04:42:22.000000000,2018-12-18 20:44:37.000000000,closed,2,Fix npm run build error
1777,2018-12-02 04:36:51.000000000,2018-12-06 12:11:29.000000000,closed,2,"Refactor RemoveDialogDevice, TableComplex fixes#1704"
1776,2018-12-01 22:00:04.000000000,2018-12-09 01:38:57.000000000,closed,1,"Initial redux setup for handling messages ( Reducer, Actions and ActionTypes )"
1775,2018-12-01 13:20:48.000000000,2018-12-02 15:39:26.000000000,closed,0,Fixes #1774: Add utils for checking valid email and phone number
1774,2018-12-01 12:57:03.000000000,2018-12-02 15:39:26.000000000,closed,0,Add utils for checking valid email and phone number
1773,2018-12-01 09:29:39.000000000,2019-05-24 16:32:06.000000000,closed,7,Fix nav bar!
1772,2018-11-30 22:48:58.000000000,2018-12-01 08:37:57.000000000,closed,0,Updated the SearchField.js
1771,2018-11-30 22:46:49.000000000,2019-05-24 16:32:06.000000000,closed,0,searchfield.js (mountwillopen)
1770,2018-11-30 02:40:37.000000000,2018-12-14 18:25:45.000000000,closed,2,Fixes #1769: MessageComposer.react.js refactored
1769,2018-11-29 21:19:49.000000000,2018-12-14 18:25:45.000000000,closed,0,Refactor MessageComposer.react.js
1768,2018-11-29 21:02:17.000000000,2018-12-24 15:30:24.000000000,closed,0,Integrate MessageComposer.react.js with redux store
1767,2018-11-28 23:32:32.000000000,2019-01-10 00:56:39.000000000,closed,0,Fixes #1765: password and passwordConfirm tightly coupled
1766,2018-11-28 21:55:32.000000000,2018-12-19 17:49:13.000000000,closed,1,Fixed #1764: Fixed login button activation
1765,2018-11-28 01:17:42.000000000,2019-01-10 00:56:39.000000000,closed,0,Password and Confirm password should be tightly coupled.
1764,2018-11-28 01:12:28.000000000,2018-12-19 17:49:13.000000000,closed,2,Login button activates with empty password field
1763,2018-11-27 00:51:03.000000000,2019-05-24 16:32:06.000000000,closed,6,Accessibility Issues
1762,2018-11-26 17:17:13.000000000,2018-11-26 18:08:26.000000000,closed,0,Proper responsive with in menu settings
1761,2018-11-25 15:53:58.000000000,2018-11-25 16:05:13.000000000,closed,0,Fixes #1760: Integrate the Matzo web analytics
1760,2018-11-25 15:52:27.000000000,2018-11-25 16:05:13.000000000,closed,0,Integration of Matzo web analytics isn't working
1759,2018-11-25 13:55:31.000000000,2018-11-25 15:03:33.000000000,closed,1,Fixes #1758: Login loading animation stops if login fails
1758,2018-11-25 04:15:37.000000000,2018-11-25 15:03:33.000000000,closed,0,Loader persists indefintly. 
1757,2018-11-23 13:46:56.000000000,2018-11-25 17:14:35.000000000,closed,2, Fixes #1756: Integrated Redux into ChangePassword.react.js 
1756,2018-11-23 12:53:08.000000000,2018-11-25 17:14:39.000000000,closed,0,Integrate redux in ChangePassword.react.js
1755,2018-11-23 01:16:47.000000000,2018-11-26 02:50:55.000000000,closed,5,Fixes #1753: Redux integration for Forgot password component
1754,2018-11-22 23:50:01.000000000,2018-12-19 18:12:41.000000000,closed,2,Footer should be consistent
1753,2018-11-22 23:17:00.000000000,2018-11-26 02:50:54.000000000,closed,0,Integrateing redux in ForgotPassoword.react.js
1752,2018-11-22 13:00:36.000000000,2019-05-24 16:32:06.000000000,closed,1,Scroll to bottom stays even when user is at the bottom.
1751,2018-11-22 11:46:32.000000000,2018-11-24 22:23:02.000000000,closed,1,Fixes #1749: Integrate Redux for Settings component
1750,2018-11-22 10:18:41.000000000,2018-11-22 19:06:55.000000000,closed,3,It's not suitable a dropdown always.
1749,2018-11-21 23:18:19.000000000,2018-11-24 22:23:02.000000000,closed,0,Integrate Redux for implementing Settings
1748,2018-11-21 19:08:03.000000000,2018-11-25 18:17:14.000000000,closed,5,Redux signup integration
1747,2018-11-21 15:27:11.000000000,2018-11-25 18:17:14.000000000,closed,0,Integrating redux in Signup component
1746,2018-11-20 21:47:28.000000000,2018-11-21 15:01:29.000000000,closed,0,Refactor ShareOnSocialMedia.js
1745,2018-11-20 20:52:12.000000000,2018-11-25 17:27:43.000000000,closed,1,"Refactor Overview, StaticAppBar#1697"
1744,2018-11-20 20:18:33.000000000,2018-11-22 00:00:53.000000000,closed,3,Fixes #1743: Action types added
1743,2018-11-20 20:16:41.000000000,2018-11-27 11:55:16.000000000,closed,0,Adding actionTypes to redux
1742,2018-11-20 14:03:42.000000000,2018-12-14 21:29:07.000000000,closed,0,UI of message pane should same in dark and light theme
1741,2018-11-19 21:27:15.000000000,2018-11-26 18:14:35.000000000,closed,3,Maximum characters limit for password field added
1740,2018-11-19 20:34:00.000000000,2018-11-26 18:08:26.000000000,closed,0,Responsive desgin of the menu section is not proper
1739,2018-11-19 01:33:35.000000000,2019-05-24 16:32:06.000000000,closed,5,feedback.react.js not working skill rating failed
1738,2018-11-19 01:27:19.000000000,2019-05-24 16:32:05.000000000,closed,4,Share chats of susi implement for facebook
1737,2018-11-19 01:24:55.000000000,2019-05-24 16:32:05.000000000,closed,3,Scroll not working in search on chat.susi.ai
1736,2018-11-19 00:14:04.000000000,2018-12-15 16:48:58.000000000,closed,4,Search number is not changing
1735,2018-11-18 10:07:47.000000000,2018-11-27 18:03:33.000000000,closed,4,No need of forgot password form
1734,2018-11-17 22:44:21.000000000,2018-11-21 00:17:56.000000000,closed,2,Fixes #1733: Integrate Redux into Login component and refactor
1733,2018-11-17 22:42:36.000000000,2018-11-21 00:17:56.000000000,closed,0,Integrate Redux in the Login component and refactor
1732,2018-11-15 22:06:54.000000000,2018-12-11 04:42:39.000000000,closed,3,Add initial states to reducers
1731,2018-11-13 20:09:23.000000000,2018-11-15 14:05:59.000000000,closed,2,Minimum password length warning removed from the Current password field
1730,2018-11-13 18:00:54.000000000,2018-11-15 14:05:59.000000000,closed,0,Remove minimum required password lengths where not required
1729,2018-11-12 21:43:41.000000000,2018-11-26 18:14:35.000000000,closed,1,Maximum limit of allowed password length in password fields needs to added
1728,2018-11-11 17:22:21.000000000,2018-11-26 02:30:45.000000000,closed,15,Remove JQuery from DOM manipulation
1727,2018-11-10 21:35:23.000000000,2018-11-11 17:19:19.000000000,closed,5,Remove JQuery from DOM manipulation
1726,2018-11-10 21:04:55.000000000,2018-11-15 21:25:03.000000000,closed,2,Add PR welcoming badge
1725,2018-11-10 12:24:45.000000000,2019-05-24 16:32:05.000000000,closed,1,Remove jquery's usage for DOM manipulation
1724,2018-11-10 12:04:15.000000000,2018-11-12 18:59:14.000000000,closed,2,Scrolltop button appears when list is scrolled down using scrolldown button
1723,2018-11-10 11:56:42.000000000,2018-11-12 18:59:14.000000000,closed,1,ScrollTop button does not appear when chat is scrolled down using scrolldown button
1722,2018-11-10 01:20:28.000000000,2018-11-10 02:45:01.000000000,closed,0,closes #1720
1721,2018-11-09 20:55:33.000000000,2018-11-15 14:22:08.000000000,closed,5,refactored MapContainer
1720,2018-11-09 13:15:02.000000000,2018-11-10 12:10:39.000000000,closed,3,Refractor ChangePassword component
1719,2018-11-09 00:31:12.000000000,2018-11-09 21:02:23.000000000,closed,1,Refactor mapContainer.react.js
1718,2018-11-09 00:10:47.000000000,2018-11-15 14:22:08.000000000,closed,1,Refactor MapContainer
1717,2018-11-08 19:25:01.000000000,2018-12-18 00:56:19.000000000,closed,1,MessageSection refactored
1716,2018-11-08 13:44:20.000000000,2018-12-23 18:43:40.000000000,closed,0,Integrate with store and Refactor MessageSection components
1715,2018-11-08 13:21:13.000000000,2018-12-03 14:48:17.000000000,closed,1,"Refactor VoiceRecognition, TopBar#1714"
1714,2018-11-08 12:22:04.000000000,2018-12-03 14:48:17.000000000,closed,0,"Refactor VoiceRecognition, TopBar"
1713,2018-11-08 02:26:37.000000000,2018-12-29 23:22:34.000000000,closed,0,MessageListItem components refactored
1712,2018-11-07 21:41:30.000000000,2019-01-04 06:49:57.000000000,closed,0,Integrate with store and Refactor MessageListItem components.
1711,2018-11-07 17:34:22.000000000,2018-11-23 13:42:20.000000000,closed,1,ForgotPassword.react.js refactored
1710,2018-11-07 15:44:01.000000000,2018-12-11 04:42:55.000000000,closed,0,Refactor ForgotPassword.react.js
1709,2018-11-07 14:04:24.000000000,2018-11-19 16:52:03.000000000,closed,2,logout after password reset fixed
1708,2018-11-06 20:12:46.000000000,2018-11-19 16:52:03.000000000,closed,0,Automatic logout after password change not working
1707,2018-11-06 20:04:58.000000000,2018-11-23 13:47:36.000000000,closed,1,ChangePassword.react.js refactored
1706,2018-11-06 20:02:19.000000000,2018-12-02 04:37:07.000000000,closed,0,"Refactor RemoveDialogDevice, TableComplex fixes#1704"
1705,2018-11-06 19:50:57.000000000,2018-11-27 11:59:05.000000000,closed,0,Confirm button activated even though passwords don't match 
1704,2018-11-06 18:35:29.000000000,2018-12-06 12:11:29.000000000,closed,2,"Refactor RemoveDialogDevice, TableComplex"
1703,2018-11-06 18:14:00.000000000,2018-12-02 09:27:23.000000000,closed,1,"Refactor Contact.react.js, Blog.react.js"
1702,2018-11-06 17:38:31.000000000,2018-12-02 09:27:23.000000000,closed,0,"Refactor Contact.react.js, Blog.react.js"
1701,2018-11-06 17:37:30.000000000,2018-11-27 11:58:13.000000000,closed,0,Refactor ChangePassword.react.js
1700,2018-11-06 17:33:19.000000000,2018-11-20 20:52:27.000000000,closed,1,"Refactor Overview, StaticAppBar#1697"
1699,2018-11-06 17:30:55.000000000,2018-11-26 08:31:35.000000000,closed,1,Support.react.js refactored
1698,2018-11-06 17:01:48.000000000,2018-11-26 08:31:35.000000000,closed,0,Refactor Support.react.js
1697,2018-11-06 16:54:23.000000000,2018-11-25 17:27:43.000000000,closed,0,"Refactor Overview.react.js, StaticAppBar.react.js"
1696,2018-11-06 16:46:27.000000000,2018-12-03 14:59:13.000000000,closed,7,"Refactor Privacy.react.js, convert to functional component"
1695,2018-11-06 16:29:33.000000000,2018-12-03 14:59:13.000000000,closed,0,"Refactor Privacy.react.js, make it functional component"
1694,2018-11-06 16:23:03.000000000,2018-11-11 10:05:02.000000000,closed,2,Code refactoring for NotFound.react.js#1693
1693,2018-11-06 16:18:30.000000000,2018-11-11 10:05:02.000000000,closed,1,Code refactoring for NotFound.react.js
1692,2018-11-06 16:07:27.000000000,2018-11-20 21:48:15.000000000,closed,4,Refactor ShareOnSocialMedia.js
1691,2018-11-06 15:52:40.000000000,2018-11-21 15:01:29.000000000,closed,0,Refactor ShareOnSocialMedia.js
1690,2018-11-06 15:25:16.000000000,2018-11-22 00:01:44.000000000,closed,0,Signup.react.js refactored
1689,2018-11-06 12:05:48.000000000,2018-11-27 11:58:02.000000000,closed,0,Code refactoring and cleanup needed in Signup.react.js
1688,2018-11-05 18:38:58.000000000,2018-11-23 13:26:42.000000000,closed,4,Refactored Login.react.js
1687,2018-11-05 18:01:08.000000000,2018-11-27 11:58:26.000000000,closed,0,Refactoring needed in Login.react.js
1686,2018-11-05 01:48:43.000000000,2018-11-26 02:36:08.000000000,closed,2,Language feature fixed
1685,2018-11-05 01:41:30.000000000,2018-11-26 02:36:08.000000000,closed,0,The language feature is not working
1684,2018-11-04 22:29:03.000000000,2018-11-19 17:15:22.000000000,closed,2,converting all normal functions to arrow functions in utils
1683,2018-11-04 22:28:08.000000000,2018-11-19 17:15:22.000000000,closed,0,Refactoring in ./src/utils
1682,2018-11-04 21:09:48.000000000,2018-11-18 14:36:25.000000000,closed,3,Make stateless components into functional components #1681
1681,2018-11-04 20:36:12.000000000,2018-11-18 14:36:25.000000000,closed,1,Make stateless components into functional components
1680,2018-11-04 20:26:22.000000000,2018-11-26 02:45:50.000000000,closed,3,Updated SearchField
1679,2018-11-03 19:24:52.000000000,2018-11-05 01:54:03.000000000,closed,3,Select default language feature not working
1678,2018-11-03 16:47:58.000000000,2018-11-26 03:08:01.000000000,closed,4,Added german localization
1677,2018-11-01 14:24:26.000000000,2018-11-01 15:24:28.000000000,closed,0,Include playstore and appstore links
1676,2018-11-01 11:20:01.000000000,2018-11-26 03:08:01.000000000,closed,0,Adds German localisation.
1675,2018-11-01 00:40:04.000000000,2018-11-03 17:47:30.000000000,closed,9,Fixed minor problem in searchField
1674,2018-11-01 00:19:00.000000000,2018-11-03 17:47:30.000000000,closed,0,Bug in the SearchField
1673,2018-10-31 21:07:34.000000000,2018-11-02 21:56:14.000000000,closed,2,"Unused classes leftDiv, rightDiv removed from Devices.css and Footer.css"
1672,2018-10-31 21:06:21.000000000,2018-11-02 21:56:14.000000000,closed,0,Cleanup Footer.css
1671,2018-10-30 20:35:19.000000000,2018-11-10 16:25:00.000000000,closed,2,Code clean up in Overview.css
1670,2018-10-30 18:54:28.000000000,2018-12-22 12:02:58.000000000,closed,4,Fixed external links in devices pages
1669,2018-10-30 16:12:18.000000000,2019-07-08 01:51:13.000000000,closed,6,Shifting from CSS to Styled-Components
1668,2018-10-29 21:23:10.000000000,2018-10-30 16:06:29.000000000,closed,0,.siteTitle class was misplaced in Overview.css.
1667,2018-10-29 19:51:28.000000000,2018-11-10 16:25:00.000000000,closed,0,Clean up and refactoring in Overview.react.js and Overview.css
1666,2018-10-29 16:41:24.000000000,2018-10-31 12:13:38.000000000,closed,3,Removed redundant import statement
1665,2018-10-29 15:53:52.000000000,2018-10-31 12:13:38.000000000,closed,0,Settings.css imported twice in Settings.react.js
1664,2018-10-28 18:41:44.000000000,2018-10-31 10:06:36.000000000,closed,0,Add helper for making ajax calls and add related utils
1663,2018-10-28 13:12:34.000000000,2019-05-16 18:00:45.000000000,closed,15,Use Axios or fetch instead of jQuery for AJAX calls.
1662,2018-10-28 12:02:10.000000000,2019-05-27 15:05:53.000000000,closed,1,Links returning 404 in devices page
1661,2018-10-28 06:15:45.000000000,2019-01-07 16:05:25.000000000,closed,11,Fixed email validation on signup page
1660,2018-10-28 06:04:59.000000000,2019-02-03 01:43:38.000000000,closed,3,Email validation is not working on signup modal
1659,2018-10-28 02:47:44.000000000,2018-11-04 14:47:45.000000000,closed,2,"Use let, const instead of var#1658"
1658,2018-10-28 02:23:37.000000000,2018-11-04 14:47:45.000000000,closed,0,"Use ES6 let, const instead of var"
1657,2018-10-27 23:54:49.000000000,2018-10-31 10:06:36.000000000,closed,0,No common helper function/middleware for making API calls
1656,2018-10-27 16:39:10.000000000,2019-05-16 18:01:17.000000000,closed,4,No results found
1655,2018-10-27 07:10:50.000000000,2018-11-16 12:08:45.000000000,closed,4,Removed duplicate code on signup.react.js
1654,2018-10-27 07:02:23.000000000,2018-11-16 12:08:45.000000000,closed,0,Duplicate code in SignUp.react.js
1653,2018-10-27 01:03:51.000000000,2018-10-30 22:14:29.000000000,closed,1,Remove legacy String Refs and findDOMNode #1652
1652,2018-10-27 00:57:32.000000000,2018-10-30 22:14:29.000000000,closed,0,Remove legacy String Refs and findDOMNode
1651,2018-10-27 00:33:47.000000000,2018-10-27 23:53:17.000000000,closed,0,Use arrow function(ES6) instead of bind #1650
1650,2018-10-26 15:53:30.000000000,2018-10-27 23:53:17.000000000,closed,0,Use arrow function(ES6) instead of bind
1649,2018-10-26 04:39:37.000000000,2018-10-26 10:39:39.000000000,closed,0,Moved Close Button in Video
1648,2018-10-26 00:00:56.000000000,2019-02-03 01:44:12.000000000,closed,2,Improve validation code on signup page
1647,2018-10-25 19:55:50.000000000,2018-10-26 10:39:39.000000000,closed,0,Close Button of Video in Overview Overlaps with Share Button
1646,2018-10-25 17:35:27.000000000,2018-10-25 18:30:04.000000000,closed,2,Overflow background!
1645,2018-10-25 17:11:55.000000000,2019-06-12 08:35:23.000000000,closed,2,Redundant/Duplicate code present in various CSS files.
1644,2018-10-25 07:39:16.000000000,2018-10-25 08:20:39.000000000,closed,1,Added Control+F Shortcut
1643,2018-10-25 07:02:11.000000000,2018-10-25 08:20:39.000000000,closed,0,Find functionality of browser overlaps with search functionality
1642,2018-10-25 00:22:58.000000000,2018-11-15 21:02:02.000000000,closed,3,Fixes #1633: Integrate the initial setup for Redux
1641,2018-10-24 17:54:39.000000000,2019-05-24 16:32:05.000000000,closed,6,New Improved UI Design
1640,2018-10-23 08:06:41.000000000,2018-10-25 15:19:47.000000000,closed,1,Added password strength on signup modal
1639,2018-10-22 22:21:10.000000000,2018-10-25 15:19:47.000000000,closed,0,Add password strength
1638,2018-10-21 21:33:04.000000000,2018-10-23 10:56:50.000000000,closed,0,Fixes #1637: vscode is not present in .gitignore
1637,2018-10-21 21:27:23.000000000,2018-10-23 10:56:50.000000000,closed,0,.vscode is not present in .gitignore
1636,2018-10-21 19:01:43.000000000,2018-10-23 21:03:28.000000000,closed,3,Fixes field text color  in password tab (default custom theme)
1635,2018-10-21 18:47:19.000000000,2018-10-23 21:03:28.000000000,closed,0,Field names not visible in password section when selecting custom theme (default settings)
1634,2018-10-21 17:16:19.000000000,2018-10-26 10:15:58.000000000,closed,2,Improve Lighthouse score #1632
1633,2018-10-21 17:14:46.000000000,2018-11-15 21:02:02.000000000,closed,7,Integrate Redux 
1632,2018-10-21 16:43:01.000000000,2018-10-26 10:15:58.000000000,closed,0,Improve Lighthouse score
1631,2018-10-21 07:41:47.000000000,2018-10-21 16:14:20.000000000,closed,0,Remove duplicated code
1630,2018-10-21 07:37:11.000000000,2018-10-21 16:14:20.000000000,closed,0,Duplicate code in ThemeChanger.js
1629,2018-10-19 18:44:00.000000000,2019-05-24 16:32:05.000000000,closed,0,Add Avatar Preview In Account Settings
1628,2018-10-19 16:33:48.000000000,2018-10-20 11:20:56.000000000,closed,0,set user uuid cookie
1627,2018-10-19 12:20:59.000000000,2018-10-25 09:52:09.000000000,closed,0,fix broken analyze text
1626,2018-10-18 23:38:07.000000000,2018-11-05 15:32:45.000000000,closed,6,"Refactor Settings Code, Fix Cyclic Complexity#1621"
1625,2018-10-18 19:41:42.000000000,2018-10-21 17:18:20.000000000,closed,0,Placeholder text added in password tab fields
1624,2018-10-18 19:25:47.000000000,2018-10-21 17:18:20.000000000,closed,1,Placeholder text required in password tab
1623,2018-10-18 08:59:31.000000000,2018-11-26 02:36:56.000000000,closed,0,Theme is uniform at the bottom speech setting
1622,2018-10-18 06:51:42.000000000,2018-11-26 02:36:56.000000000,closed,0,Theme is not uniform at bottom of speech setting
1621,2018-10-18 00:53:31.000000000,2018-11-05 15:32:45.000000000,closed,0,Refactor Settings Code and Fix Cyclic Complexity
1620,2018-10-18 00:38:56.000000000,2018-10-20 20:32:47.000000000,closed,0,Fix complexity of UserPreferenceStore Fix#1619
