id,created_at,closed_at,state,comments,title
908,2017-05-07 20:10:56.000000000,2017-05-07 20:47:56.000000000,closed,1,Fixing Travis-CI hugo doc build failed
907,2017-05-07 19:56:12.000000000,2017-05-14 14:09:02.000000000,closed,9,laravel dusk in multiple projects setup
906,2017-05-07 19:06:09.000000000,2017-05-07 19:39:35.000000000,closed,1,Fixing Aerospike
905,2017-05-07 17:18:48.000000000,2017-05-07 19:39:48.000000000,closed,0,Docs update
904,2017-05-07 14:45:07.000000000,2017-05-07 17:26:05.000000000,closed,0,Fixed broken adoption for PUID and PGID for Non-Root User laradock.
903,2017-05-07 07:06:46.000000000,2017-05-07 15:01:54.000000000,closed,1,Less log info
902,2017-05-06 19:32:42.000000000,1970-01-01 00:00:00.000000001,open,7,Nginx Proxy image
901,2017-05-06 11:24:12.000000000,2017-05-06 18:56:58.000000000,closed,1,Split Travis-CI build jobs and fix php-fpm mssql
900,2017-05-06 06:10:58.000000000,2017-06-22 07:09:43.000000000,closed,4,Postgres-postgis does not create database with name set in .env
899,2017-05-05 18:14:17.000000000,2017-05-05 19:44:34.000000000,closed,10,Mysql container can't start 
898,2017-05-05 17:29:45.000000000,2017-05-06 04:49:31.000000000,closed,0,connection is closed by foreign host ssh
897,2017-05-05 15:08:44.000000000,2017-05-05 16:02:50.000000000,closed,1,Upgrede aerospike-client-php  version to 3.4.14
896,2017-05-05 08:38:40.000000000,2017-05-05 09:35:22.000000000,closed,0,workspace/Dockerfile-71 fill missing MSSQL section
895,2017-05-04 18:47:31.000000000,2017-05-05 09:35:22.000000000,closed,9,Service workspace failed to build 
894,2017-05-04 17:23:51.000000000,2017-05-06 04:48:30.000000000,closed,4,What is workflow debug in docker?
893,2017-05-04 16:58:35.000000000,2017-05-06 04:47:41.000000000,closed,9,Not enable debug in workspace
892,2017-05-04 15:22:56.000000000,2020-02-23 18:07:31.000000000,closed,11,Cleanup xDebug documentation
891,2017-05-04 14:08:17.000000000,2017-05-05 09:35:48.000000000,closed,0,git clone only need one depth.
890,2017-05-04 12:45:07.000000000,2017-05-04 12:46:50.000000000,closed,1,Fixed Travis CI build failed for PHP_VERSION=56
889,2017-05-04 12:18:52.000000000,2017-05-07 19:41:48.000000000,closed,3,Error: Build failed
888,2017-05-04 11:22:58.000000000,2017-05-16 04:58:13.000000000,closed,2,Update Redis Docker File
887,2017-05-04 01:40:22.000000000,2017-05-04 10:49:27.000000000,closed,1,Fixing V8JS
886,2017-05-03 20:38:15.000000000,2017-07-04 07:30:13.000000000,closed,4,Too many errors
885,2017-05-03 15:20:19.000000000,2017-05-03 15:21:19.000000000,closed,0,Fix CI build forget update PHP_VERSION in .env
884,2017-05-02 08:00:20.000000000,2017-05-02 17:28:49.000000000,closed,0,Created a helpful issues template.
883,2017-05-02 00:26:52.000000000,2017-05-02 17:29:45.000000000,closed,0,Add sqlsrv to php-fpm php71
882,2017-05-02 00:22:16.000000000,2017-05-02 17:29:27.000000000,closed,0,Upgrading sqlsrv to version without error
881,2017-05-01 23:02:24.000000000,2017-05-01 23:11:57.000000000,closed,0,Reverting unintended MD formatting
880,2017-05-01 14:43:42.000000000,2017-05-01 18:43:30.000000000,closed,1,Fixing webroot issues (public folder)
879,2017-05-01 09:23:16.000000000,2017-05-01 18:43:13.000000000,closed,0,Merging workspace Dockerfiles
878,2017-05-01 08:31:02.000000000,2017-05-01 18:43:30.000000000,closed,10,403 Forbidden - nginx error
877,2017-04-30 18:10:43.000000000,2017-05-02 08:14:42.000000000,closed,3,fixing Travis-CI build problem
876,2017-04-30 16:07:10.000000000,2017-05-02 08:14:42.000000000,closed,3,"ERROR happen when build, but Travis-CI still PASSED"
875,2017-04-28 17:48:49.000000000,2020-02-23 21:07:17.000000000,closed,3,Experience with Amazon ECS CLI
874,2017-04-28 10:25:01.000000000,2017-04-28 10:37:43.000000000,closed,0,Fix image path on doc guides
873,2017-04-27 21:59:27.000000000,2017-05-04 00:52:42.000000000,closed,4,Added support for MS SQL server driver for PHP 7.0
872,2017-04-27 20:41:37.000000000,2017-04-28 11:20:00.000000000,closed,3,Failed to build workspace
871,2017-04-27 19:13:51.000000000,2017-04-27 22:14:53.000000000,closed,4,Workspace on PHP 7.0 PHP Warning:  Module 'soap' already loaded in Unknown on line 0
870,2017-04-27 16:33:26.000000000,2017-05-01 23:45:05.000000000,closed,2,Don't work cron in workspace container with PHP 7.1
869,2017-04-27 14:16:00.000000000,2017-07-04 07:30:33.000000000,closed,12,Connecting Laravel Project with Host Mysql
868,2017-04-27 13:59:29.000000000,2017-04-27 14:24:31.000000000,closed,4,mysql start failed
867,2017-04-27 11:53:19.000000000,2017-04-27 19:38:02.000000000,closed,0,cp env-example .env
866,2017-04-27 11:47:00.000000000,2017-07-04 07:30:27.000000000,closed,1,can't connect to localhost
865,2017-04-26 15:01:45.000000000,2017-04-26 15:21:50.000000000,closed,2,ERROR: Validation failed in file './docker-compose.yml'
864,2017-04-25 22:10:26.000000000,2017-05-04 18:49:06.000000000,closed,6,Workspace fails to build
863,2017-04-25 17:21:48.000000000,1970-01-01 00:00:00.000000001,open,3,applications exited with code 0
862,2017-04-25 13:03:10.000000000,1970-01-01 00:00:00.000000001,open,3,Improve support for i18n with locales
861,2017-04-25 06:01:51.000000000,2018-04-06 06:06:05.000000000,closed,4,Upgrade Docker-Compose Syntax to V3
860,2017-04-24 02:11:08.000000000,2017-04-27 19:38:41.000000000,closed,0,Updating workspace to use latest base image
859,2017-04-24 02:00:48.000000000,2017-04-27 19:38:57.000000000,closed,0,Locking Adminer to stable version
858,2017-04-24 01:47:13.000000000,2017-04-27 19:39:30.000000000,closed,0,Changing PMA/adminer default port to 8080
857,2017-04-24 01:43:49.000000000,2017-04-27 19:39:49.000000000,closed,0,Add apt update to intl install
856,2017-04-24 01:23:24.000000000,2017-04-24 12:34:41.000000000,closed,0,Fixing soap being loaded twice
855,2017-04-24 00:40:51.000000000,2017-05-07 19:41:39.000000000,closed,3,Enabling workspace/aerospike causes fatal error 
854,2017-04-23 23:34:23.000000000,2017-04-27 19:40:14.000000000,closed,0,Fixing typo in the workspace V8 args
853,2017-04-23 23:33:08.000000000,2017-04-24 01:42:06.000000000,closed,1,Add apt update to intl install
852,2017-04-23 23:18:26.000000000,2017-04-23 23:31:27.000000000,closed,1,Fixing typo in the workspace V8JS args
851,2017-04-23 23:11:23.000000000,2017-04-25 12:18:12.000000000,closed,1,Upgrading compose file to recommended version
850,2017-04-23 22:45:07.000000000,2017-04-30 20:46:58.000000000,closed,1,Updating webroots to have the same defaults
849,2017-04-23 21:27:38.000000000,2017-05-01 09:25:26.000000000,closed,6,Apache2 Docroot
848,2017-04-23 17:13:11.000000000,2017-04-27 21:19:14.000000000,closed,2,add support for php-fpm 5.3
847,2017-04-23 05:21:49.000000000,2017-04-27 19:39:50.000000000,closed,0,php-fpm:1.4-71 build failing to install INTL
846,2017-04-22 15:58:42.000000000,2020-03-28 08:14:06.000000000,closed,19,MSSQL Initialise Problem 
845,2017-04-22 10:03:08.000000000,2017-08-14 06:10:17.000000000,closed,6,add pgadmin backup 
844,2017-04-22 06:22:18.000000000,2017-04-22 07:53:26.000000000,closed,0,Fix git's BUG & add plugin
843,2017-04-21 21:57:52.000000000,2017-05-02 17:30:28.000000000,closed,3,Undefined class constant 'SQLSRV_ATTR_FETCHES_NUMERIC_TYPE' for mssql driver
842,2017-04-21 12:55:14.000000000,2020-02-23 21:07:15.000000000,closed,3,The pg_dump file is missing when pgadmin is backed up in pgadmin container
841,2017-04-21 10:39:57.000000000,2017-04-21 21:48:08.000000000,closed,0,update cadddy version to 0.10.0
840,2017-04-21 10:20:14.000000000,2017-04-21 21:49:08.000000000,closed,1,cannot  install caddy
839,2017-04-21 09:34:26.000000000,2017-04-21 11:51:46.000000000,closed,2,Imagick installed but not working
838,2017-04-21 04:19:54.000000000,2017-04-21 23:25:05.000000000,closed,3,PHP mysqli failed
837,2017-04-21 04:00:12.000000000,2017-04-22 22:42:19.000000000,closed,2,Upgrade hugo to 0.20.2
836,2017-04-21 02:17:20.000000000,2017-04-21 03:11:59.000000000,closed,0,Feature blackfire container
835,2017-04-21 00:06:42.000000000,2020-02-23 22:07:05.000000000,closed,4,Cannot get php-worker container to work
834,2017-04-20 18:38:31.000000000,2017-04-20 21:46:03.000000000,closed,0,Run apt-get update before installing intl extension
833,2017-04-20 18:15:37.000000000,2017-04-20 18:16:33.000000000,closed,0,Install wkhtmltopdf
832,2017-04-20 17:59:39.000000000,2017-04-24 10:34:33.000000000,closed,10,The display_errors is not working
831,2017-04-20 16:26:46.000000000,2017-04-20 21:14:53.000000000,closed,0,Fixing Unable to connect to postgresql server
830,2017-04-20 14:51:33.000000000,2019-02-28 13:58:10.000000000,closed,1,Can not connect to database server after change default .env file
829,2017-04-20 14:47:11.000000000,2017-04-20 21:14:53.000000000,closed,0,Pgadmin Can not connect to the postgres DB
828,2017-04-20 11:30:23.000000000,2017-04-27 22:21:16.000000000,closed,1,Update .env-example to fix phpmyadmin default configuration
827,2017-04-20 07:10:39.000000000,2017-04-20 21:22:49.000000000,closed,1,Missing documentation on setting timezone
826,2017-04-20 07:09:08.000000000,2017-04-20 23:11:57.000000000,closed,4,date.timezone clarity on php-fpm
825,2017-04-18 11:28:36.000000000,2017-04-18 19:32:52.000000000,closed,0,Install all ext to run CI build.
824,2017-04-18 10:52:54.000000000,2017-04-18 18:38:57.000000000,closed,2,Issue with PHP and redis extension with latest update
823,2017-04-18 08:02:31.000000000,2017-04-18 08:23:45.000000000,closed,0,Fixing could not resolve host: elasticsearch
822,2017-04-18 05:29:18.000000000,2017-04-18 08:16:22.000000000,closed,0,Fixing typo and Markdown syntax.
821,2017-04-18 05:04:40.000000000,2017-04-18 19:30:54.000000000,closed,0,Revert to Hugo v0.19
820,2017-04-18 04:15:59.000000000,2017-04-18 08:17:39.000000000,closed,0,Included Percona in the docs
819,2017-04-18 02:30:38.000000000,2017-04-18 03:52:05.000000000,closed,1,Added percona container
818,2017-04-18 00:24:10.000000000,2017-04-18 00:30:01.000000000,closed,1,Fix small typo ‘Giude’ -> ‘Guide’
817,2017-04-17 20:37:12.000000000,2017-04-18 01:16:27.000000000,closed,0,Fixing typo in docs menu
816,2017-04-17 14:09:39.000000000,2017-04-18 05:18:06.000000000,closed,18,How to connect database with my own project with laradock?
815,2017-04-17 09:41:35.000000000,2017-04-17 19:22:51.000000000,closed,0,Fixing Adminer can’t login
814,2017-04-17 09:37:47.000000000,2017-04-17 19:22:51.000000000,closed,0,Adminer can't login
813,2017-04-17 08:26:30.000000000,2017-04-24 03:05:24.000000000,closed,5,Don't use the latest adminer (4.3.1) for docker container
812,2017-04-17 06:48:41.000000000,2017-04-17 19:22:34.000000000,closed,0,Add Travis CI status image.
811,2017-04-16 15:43:48.000000000,2020-02-23 20:07:41.000000000,closed,21,Distributed Laradock environments
810,2017-04-16 15:10:40.000000000,2017-04-16 19:51:33.000000000,closed,2,set data save path(mysql/redis/memcached..)
809,2017-04-15 05:10:45.000000000,2020-02-23 21:07:22.000000000,closed,7,Jenkins PR (803) causing issues
808,2017-04-14 21:45:45.000000000,2017-04-14 22:56:23.000000000,closed,9,Use Travis CI for building docs & building containers
807,2017-04-14 14:40:33.000000000,2017-04-18 07:48:48.000000000,closed,4,"'error' => 'Could not resolve host: elasticsearch', 'errno' => 6"
806,2017-04-14 11:46:25.000000000,2017-04-14 23:06:06.000000000,closed,5,Let's starting CI
805,2017-04-14 06:11:19.000000000,2017-04-14 11:24:55.000000000,closed,0,Fixing php fpm ghostscript
804,2017-04-13 03:04:50.000000000,2017-04-25 18:23:26.000000000,closed,12,Add Vim to MySQL container (and others?)
803,2017-04-12 19:55:57.000000000,2017-04-13 19:48:57.000000000,closed,2,Added support for jenkins official container
802,2017-04-12 17:58:33.000000000,2017-04-12 17:59:58.000000000,closed,0,Merge pull request #1 from laradock/master
801,2017-04-12 13:32:56.000000000,2017-04-12 13:40:19.000000000,closed,3,Failed Build INSTALL_EXIF and INSTALL_PHPREDIS in php-fpm 5.6
800,2017-04-12 12:17:44.000000000,2017-04-12 12:19:34.000000000,closed,0,Update Dockerfile-70
799,2017-04-12 02:31:49.000000000,2017-04-12 05:33:38.000000000,closed,0,Fixing soap already loaded warning in workspace
798,2017-04-12 01:43:15.000000000,2017-04-23 20:59:35.000000000,closed,3,Php-fpm ghostscript
797,2017-04-12 01:37:52.000000000,2020-02-23 21:07:19.000000000,closed,2,Php-fpm Tokenizer arg
796,2017-04-12 01:23:50.000000000,2017-04-12 05:34:46.000000000,closed,0,Fixing the php ext already loaded warnings
795,2017-04-12 01:22:06.000000000,2017-04-12 08:53:52.000000000,closed,0,pdo_dblib
794,2017-04-12 01:21:15.000000000,2017-04-12 05:35:03.000000000,closed,0,Moving php-fpm xdebug config to proper location
793,2017-04-12 01:20:46.000000000,2017-04-12 05:36:14.000000000,closed,0,Fixing not-consumed buildargs php-fpm-56
792,2017-04-12 00:27:11.000000000,2017-05-04 10:49:27.000000000,closed,0,Workspace V8JS is broken
791,2017-04-12 00:10:02.000000000,1970-01-01 00:00:00.000000001,open,2,Install `pip` into workspace container
790,2017-04-11 23:53:57.000000000,2017-04-11 23:57:44.000000000,closed,0,Fixing ghostscript env option
789,2017-04-11 23:24:08.000000000,2017-04-12 05:35:17.000000000,closed,0,Fixing whitespaces and tailing spaces
788,2017-04-11 22:50:00.000000000,2017-04-11 23:01:43.000000000,closed,0,Adding exif/redis to php-fpm 56 and 71
787,2017-04-11 21:56:38.000000000,2017-04-12 05:33:38.000000000,closed,1,PHP Warning:  Module 'soap' already loaded in Unknown on line 0
786,2017-04-11 18:55:17.000000000,2017-04-11 21:38:02.000000000,closed,1,Adding exif/redis to php-fpm 56 and 71
785,2017-04-11 18:54:15.000000000,2017-04-11 21:24:43.000000000,closed,0,Fixing INTL ext in php-fpm for php71
784,2017-04-11 18:53:27.000000000,2017-04-11 21:24:29.000000000,closed,0,Fixing ghostscript env option
783,2017-04-11 18:52:25.000000000,2017-04-12 05:33:09.000000000,closed,4,Bringing Dockerfile 71 up-to-date with 70
782,2017-04-11 18:50:25.000000000,2017-04-11 21:39:06.000000000,closed,1,Fixing whitespaces and tailing spaces
781,2017-04-11 15:32:48.000000000,2017-04-11 21:23:46.000000000,closed,0,Merging removed MySQL ext into MySQLi setting
780,2017-04-10 22:29:45.000000000,2017-04-12 00:09:27.000000000,closed,2,ERROR: Service 'php-fpm' failed to build
779,2017-04-10 18:21:49.000000000,2017-05-02 01:13:59.000000000,closed,10,"a little help setting up deploy to staging, production"
778,2017-04-10 17:40:48.000000000,2017-05-04 12:19:54.000000000,closed,1,Cannot make pgsql database dump: aborting because of server version mismatch
777,2017-04-10 11:21:35.000000000,2017-04-11 21:23:33.000000000,closed,0,use PHP71 build workspace get ERROR
776,2017-04-10 07:19:55.000000000,2017-04-22 08:13:56.000000000,closed,23,Select PHP71 does not install PHP 7.1
775,2017-04-10 05:51:17.000000000,2017-04-10 05:55:56.000000000,closed,0,Fixing can't login to PHPMyAdmin
774,2017-04-10 05:45:17.000000000,2017-04-24 04:38:59.000000000,closed,4,Docker for Laravel dev - Setup video
773,2017-04-10 00:16:44.000000000,2017-07-04 03:42:25.000000000,closed,0,Support Multiple Databases
772,2017-04-10 00:00:18.000000000,2017-04-10 05:56:47.000000000,closed,0,Adding log directories to prevent errors
771,2017-04-09 23:33:30.000000000,2017-04-10 00:19:42.000000000,closed,2,Multiple MySql
770,2017-04-09 22:44:50.000000000,2017-04-09 22:45:11.000000000,closed,0,"bugfix/769 fix linuxbrew, deployer configuration"
769,2017-04-09 22:32:52.000000000,2017-04-10 03:56:58.000000000,closed,0,Incorrect configuration for Linuxbrew and Deployer
768,2017-04-09 22:21:15.000000000,1970-01-01 00:00:00.000000001,open,9,Add python container
767,2017-04-09 17:17:50.000000000,2017-05-07 19:57:09.000000000,closed,5,Workspace error after pulling latest
766,2017-04-09 12:43:09.000000000,2017-04-09 20:26:42.000000000,closed,0,fix typo in README.md
765,2017-04-09 00:05:59.000000000,2020-02-23 20:07:19.000000000,closed,6,ERROR: Service 'nginx' failed to build
764,2017-04-07 21:44:28.000000000,2017-04-12 00:06:23.000000000,closed,2,[Warning] One or more build-args [INSTALL_MYSQL] were not consumed
763,2017-04-07 21:00:50.000000000,2020-02-23 21:07:16.000000000,closed,3,Missing container environments
762,2017-04-07 19:04:02.000000000,2017-04-07 19:26:38.000000000,closed,0,Master
761,2017-04-07 14:21:44.000000000,2017-07-04 07:30:45.000000000,closed,3,curl: (7) Failed to connect to localhost port 80: Connection refused
760,2017-04-07 11:18:59.000000000,2017-04-07 19:27:39.000000000,closed,0,fix php-fpm PHP56 can't enabled MySQL Support
759,2017-04-07 11:10:00.000000000,2017-04-07 19:27:39.000000000,closed,3,php-fpm can't enabled MySQL Support
758,2017-04-07 06:29:25.000000000,2017-04-07 19:27:33.000000000,closed,0,MySQL fix
757,2017-04-07 02:23:32.000000000,2017-04-07 04:12:19.000000000,closed,0,Symfony support in workspace
756,2017-04-07 01:14:17.000000000,2017-04-07 22:00:20.000000000,closed,5,deployment to digital ocean faliure
755,2017-04-06 20:27:44.000000000,2017-04-07 04:12:11.000000000,closed,0,remove /Volumes and /private entries for d4m-nfs from docs
754,2017-04-06 15:08:31.000000000,2017-04-10 05:55:56.000000000,closed,25,Can't login to PHPMyAdmin
753,2017-04-05 19:49:21.000000000,2020-02-23 16:07:16.000000000,closed,7,Directory/file ownership (root/laradock)
752,2017-04-05 19:09:09.000000000,2017-04-11 21:23:33.000000000,closed,8,Workspace build error with PHP7.1
751,2017-04-05 17:07:35.000000000,2017-04-06 04:54:18.000000000,closed,1,Fix PHP Zip library installation
750,2017-04-05 15:55:44.000000000,2017-04-07 08:32:46.000000000,closed,4,[Help] Need to increase Adminer import file size...
749,2017-04-05 14:07:46.000000000,2017-05-14 23:35:50.000000000,closed,15,Time out in the first docker-compose up
748,2017-04-05 13:43:48.000000000,2017-05-07 19:52:40.000000000,closed,6,Workspace php56
747,2017-04-05 13:38:35.000000000,2017-04-07 01:48:50.000000000,closed,2,Error in php-fpm ZIP ext
746,2017-04-05 10:09:36.000000000,2017-04-12 18:11:58.000000000,closed,11,"[emerg] 1#1: open() ""/var/log/nginx/access.log"" failed (13: Permission denied)"
745,2017-04-05 08:00:49.000000000,2017-04-05 09:45:29.000000000,closed,1,Fixing specified Dockerfile name
744,2017-04-05 06:57:24.000000000,2017-04-05 07:26:46.000000000,closed,0,Fixing specified Dockerfile name
743,2017-04-05 02:42:20.000000000,2017-04-05 04:48:19.000000000,closed,0,:sparkles: Sending logs to docker `stdout` and `stderr`.
742,2017-04-05 02:34:24.000000000,2017-04-05 04:47:53.000000000,closed,0,Updating the DigitalOcean guide
741,2017-04-05 01:44:52.000000000,2017-04-05 04:46:15.000000000,closed,0,Updating env to switch workspace php version
740,2017-04-05 01:17:25.000000000,2017-04-05 04:44:58.000000000,closed,0,Simplifying PHP_FPM version
739,2017-04-04 21:51:18.000000000,2017-04-05 04:47:41.000000000,closed,6,Credentials from env not applied to mariadb
738,2017-04-04 18:44:53.000000000,2017-04-05 04:43:40.000000000,closed,0,Adding option to install Php5 MySQL extension
737,2017-04-04 02:07:42.000000000,2017-04-04 06:10:39.000000000,closed,1,Fixing MariaDB root password variable. #736
736,2017-04-03 23:22:53.000000000,2017-04-04 06:11:43.000000000,closed,9,Can't connect to mariadb
735,2017-04-03 18:03:32.000000000,2017-04-14 22:45:41.000000000,closed,11,CI integration to auto-generate the Hugo docs
734,2017-04-03 14:21:30.000000000,2017-04-04 17:21:02.000000000,closed,2,Add image magick and EXIF
733,2017-04-03 11:39:46.000000000,2020-02-23 20:07:15.000000000,closed,7,xdebug on Mac needs nginx REMOTE_ADDR set
732,2017-04-03 09:31:07.000000000,2017-04-03 17:56:13.000000000,closed,0,Update supervisord.conf
731,2017-04-03 06:17:52.000000000,2017-05-07 20:01:54.000000000,closed,2,php-worker config file is broken
730,2017-04-01 01:01:29.000000000,2017-04-03 17:55:42.000000000,closed,0,Correct Supported Software list bullet points
729,2017-03-31 19:52:50.000000000,2017-04-03 17:55:26.000000000,closed,0,Marked toolbox as outdated in docs
728,2017-03-31 13:47:32.000000000,2020-02-23 22:06:59.000000000,closed,2,php artisan error AppNamespaceDetectorTrait not found
727,2017-03-31 05:23:59.000000000,2017-03-31 08:35:40.000000000,closed,0,Add Adminer container
726,2017-03-31 00:28:14.000000000,2017-03-31 08:30:32.000000000,closed,7,Fixed typo
725,2017-03-30 15:26:49.000000000,2017-03-31 00:47:49.000000000,closed,2,gulp watch not working in workspace 
724,2017-03-29 15:04:39.000000000,2017-04-05 04:45:09.000000000,closed,1,workspace and php-fpm should run the same PHP version
723,2017-03-28 21:41:36.000000000,2017-04-03 18:00:07.000000000,closed,1,YARN version
722,2017-03-28 19:56:22.000000000,2017-04-05 04:44:11.000000000,closed,3,mysql_connect adapter?
721,2017-03-27 21:26:07.000000000,2017-03-27 23:35:14.000000000,closed,2,How to set php max file size?
720,2017-03-27 18:53:31.000000000,2017-04-02 06:11:46.000000000,closed,1,Class mysqli is not installed
719,2017-03-27 15:08:17.000000000,2020-02-23 22:07:04.000000000,closed,4,Neo4j auth error
718,2017-03-26 08:39:39.000000000,2020-02-23 22:07:00.000000000,closed,4,[Question] Is there benefit using PHP-PM with docker/laradock?
717,2017-03-26 05:39:15.000000000,2017-04-03 17:54:28.000000000,closed,1,Merge with Proxy branch
716,2017-03-26 01:50:40.000000000,2017-03-26 01:56:27.000000000,closed,0,Change Apache2 document root
715,2017-03-25 17:44:44.000000000,2017-03-26 06:47:03.000000000,closed,0,Fixing from #708
714,2017-03-24 21:13:34.000000000,2017-04-05 04:46:23.000000000,closed,0,Workspace container Dockerfile-71 is just a placeholder
713,2017-03-24 21:10:08.000000000,2020-02-23 22:07:01.000000000,closed,5,PHPUnit not working on the workspace container
712,2017-03-24 19:38:00.000000000,2017-03-26 00:55:35.000000000,closed,0,adding MsSQL DATABASE support
711,2017-03-24 11:19:47.000000000,2017-03-24 12:01:18.000000000,closed,1,apt-get install in workspace.
710,2017-03-24 05:27:13.000000000,2017-05-14 22:55:19.000000000,closed,6,LDAP support
709,2017-03-23 19:22:33.000000000,2017-03-23 19:45:24.000000000,closed,3,Recompile PHP with --enable-calendar
708,2017-03-23 14:52:42.000000000,2017-03-26 00:55:18.000000000,closed,0,fix yarn again after #662 reverted it
707,2017-03-23 11:04:12.000000000,2017-03-29 14:29:05.000000000,closed,2,Load balancer using Haproxy & Varnish
706,2017-03-22 20:57:42.000000000,2017-03-26 00:55:18.000000000,closed,1,YARN_VERSION from wrong variable
705,2017-03-21 14:42:50.000000000,2017-03-22 18:19:32.000000000,closed,6,Define a specific static IP for nginx
704,2017-03-21 14:23:28.000000000,2017-03-21 17:59:58.000000000,closed,0,Fixed path variable for windows users
703,2017-03-21 09:59:41.000000000,2017-03-21 18:02:37.000000000,closed,8,Missing APPLICATION variable in yml file
702,2017-03-21 02:24:08.000000000,2017-03-21 23:11:35.000000000,closed,3,Can not connect to the postgres DB
701,2017-03-20 13:34:55.000000000,2017-03-20 21:15:40.000000000,closed,0,Fix yarn installation
700,2017-03-20 11:51:11.000000000,2017-03-20 21:16:10.000000000,closed,1,fix some errors in mysql setup file for latest mysql image
699,2017-03-20 11:18:15.000000000,2017-03-20 11:23:59.000000000,closed,0,use CREATE USER to define account authentication characteristics
698,2017-03-20 08:34:24.000000000,2017-03-22 18:18:22.000000000,closed,9,"Cannot up docker when it does not have .evn file, in v5.0.0"
697,2017-03-18 21:35:46.000000000,2017-03-19 23:38:50.000000000,closed,5,Running Container - Error (PMA_password variable not set)
696,2017-03-18 21:07:08.000000000,2017-03-22 02:01:52.000000000,closed,18,help
695,2017-03-18 16:08:35.000000000,2020-02-23 19:07:23.000000000,closed,3,ERROR: Service 'hhvm' failed to build
694,2017-03-17 19:57:08.000000000,2017-03-20 21:22:49.000000000,closed,0,Docker-71 and Nginx examples
693,2017-03-17 18:18:41.000000000,2017-03-17 21:27:06.000000000,closed,2,Getting syntax error on step 32/40
692,2017-03-17 15:08:57.000000000,2017-03-20 11:40:26.000000000,closed,5,Multiple postgres containers: no pg_hba.conf entry for host
691,2017-03-17 13:15:20.000000000,2017-03-17 19:07:37.000000000,closed,0,Fix Dockerfile-70
690,2017-03-17 12:55:51.000000000,2017-04-11 21:24:48.000000000,closed,9,ERROR: Service 'php-fpm' failed to build
689,2017-03-17 12:38:01.000000000,2017-03-17 19:07:22.000000000,closed,0,Update env-example
688,2017-03-17 11:49:53.000000000,2017-03-17 19:07:07.000000000,closed,2,"re-added .gitignore for nginx dir, still do not want configs in git"
687,2017-03-17 10:40:05.000000000,2017-03-17 19:09:45.000000000,closed,0,Jefhar patch 1
686,2017-03-17 04:32:48.000000000,2017-03-17 19:08:30.000000000,closed,0,Update Dockerfile-71
685,2017-03-17 01:47:55.000000000,2017-03-17 19:10:24.000000000,closed,2,Lack of production documentation
684,2017-03-16 22:40:56.000000000,2017-03-16 22:41:13.000000000,closed,0,"Revert ""Add apache conf file for specific virtualhost ServerName"""
683,2017-03-16 22:02:58.000000000,2017-03-16 23:57:41.000000000,closed,18,Too many errors 
682,2017-03-16 21:26:39.000000000,2017-03-16 21:35:25.000000000,closed,0,Elasticsearch - Fix plugins directory
681,2017-03-16 20:51:46.000000000,2017-05-07 20:07:02.000000000,closed,6,Call to undefined function imap_open()
680,2017-03-16 04:01:45.000000000,2017-03-17 04:57:47.000000000,closed,4,Adding intl support to php-fpm container
679,2017-03-16 03:56:16.000000000,2017-03-16 21:10:01.000000000,closed,0,Refine container name retrieval
678,2017-03-15 20:26:35.000000000,1970-01-01 00:00:00.000000001,open,1,Notifications (Toast)
677,2017-03-15 18:14:18.000000000,2017-03-16 02:36:50.000000000,closed,0,updated env-example and removed .env.example
676,2017-03-15 17:48:23.000000000,2017-04-12 20:45:25.000000000,closed,5,make docker-compose available global | <laradock up -d nginx> from an…
675,2017-03-15 12:13:47.000000000,2017-03-15 18:13:07.000000000,closed,2,Multiple projects improvement
674,2017-03-15 10:30:26.000000000,2017-03-16 23:21:01.000000000,closed,1,docker-compose up failed
