id,created_at,closed_at,state,comments,title
2027,2019-03-01 09:11:06.000000000,2019-03-01 09:16:10.000000000,closed,0,fix ipython-controller build fail
2026,2019-02-28 22:42:43.000000000,2019-03-01 09:16:09.000000000,closed,0,Build fail on step 5/9 ipython-controller
2025,2019-02-28 21:20:38.000000000,2019-03-01 08:02:14.000000000,closed,0, php-fpm and workspace replace base image
2024,2019-02-28 08:34:49.000000000,2019-03-03 06:46:09.000000000,closed,1,Laradock.io Website Expired
2023,2019-02-28 05:23:41.000000000,2019-03-07 18:50:50.000000000,closed,4,could not find driver
2022,2019-02-26 19:19:19.000000000,2019-03-01 08:04:03.000000000,closed,0,Auth file for magento 2 installation
2021,2019-02-26 16:34:01.000000000,2019-02-26 17:12:17.000000000,closed,0,Auth file for magento 2 installation
2020,2019-02-26 16:30:59.000000000,2019-02-26 16:31:32.000000000,closed,0,Auth file for magento 2 installation
2019,2019-02-26 10:44:31.000000000,2020-02-23 10:07:28.000000000,closed,7,Can't spin up Caddy
2018,2019-02-26 09:57:18.000000000,2019-02-27 23:33:59.000000000,closed,1,Credentials from env not applied to postgres
2017,2019-02-26 06:18:58.000000000,2019-02-26 06:24:39.000000000,closed,0,0226 fix
2016,2019-02-25 19:05:42.000000000,2019-02-26 18:14:33.000000000,closed,0,added variable for xsl in docker-compose.yml
2015,2019-02-23 13:05:55.000000000,2019-02-23 13:46:46.000000000,closed,0,Optimize php-fpm and workspace Dockerfile.
2014,2019-02-23 12:37:46.000000000,2019-02-23 21:14:18.000000000,closed,13,Can't start mongo container
2013,2019-02-23 08:44:51.000000000,2019-02-23 09:24:58.000000000,closed,0,Fix workspace php56 install V8JS build fail
2012,2019-02-22 21:32:20.000000000,2019-02-22 21:52:15.000000000,closed,0,Fix workspace php56 build fail
2011,2019-02-22 21:19:06.000000000,2019-02-23 08:37:39.000000000,closed,0,php 5.6 install swoole-2.0.11 get Segmentation fault
2010,2019-02-22 20:44:12.000000000,2019-02-22 20:45:22.000000000,closed,0,php 7.0 PECL install sqlsrv pdo_sqlsrv specify 5.3.0 version
2009,2019-02-22 15:37:00.000000000,2019-02-22 20:39:37.000000000,closed,0,php 7.0 PECL install sqlsrv pdo_sqlsrv specify 5.3.0 version
2008,2019-02-22 14:45:58.000000000,2019-02-22 14:46:25.000000000,closed,0,reorganizaion aerospike extension install
2007,2019-02-22 14:43:51.000000000,2019-02-22 20:45:22.000000000,closed,0,PECL pdo_sqlsrv sqlsrv dropped support for PHP 7.0
2006,2019-02-21 07:48:45.000000000,2020-02-23 13:07:31.000000000,closed,4,An error occurred while running the code
2005,2019-02-20 21:25:06.000000000,2019-02-22 15:30:06.000000000,closed,0,php-fpm install mysql-client
2004,2019-02-19 20:43:52.000000000,2019-07-17 10:48:10.000000000,closed,2,Auto build on dockerhub
2003,2019-02-19 08:47:53.000000000,2020-02-23 13:07:30.000000000,closed,2,Percona Container Exit code 1
2002,2019-02-19 01:08:43.000000000,2020-02-29 02:38:33.000000000,closed,12,How to use with laravel websockets?
2001,2019-02-18 14:15:54.000000000,2019-02-25 18:18:10.000000000,closed,1,added tokenizer support (required for magento 2)
2000,2019-02-17 21:30:06.000000000,2019-02-20 15:07:08.000000000,closed,1,docker php-fpm image crontab not found
1999,2019-02-17 15:50:45.000000000,2020-02-23 12:07:27.000000000,closed,6,node: not found & npm: not found
1998,2019-02-16 22:18:12.000000000,2019-02-16 22:19:20.000000000,closed,0,fix install zip fail
1997,2019-02-16 21:48:01.000000000,2019-02-16 21:52:07.000000000,closed,0,fix install zip fail
1996,2019-02-15 01:47:55.000000000,2019-02-23 09:19:34.000000000,closed,0,update version of elastic and kibana
1995,2019-02-14 19:39:11.000000000,2019-02-16 20:03:42.000000000,closed,1,xsl support added (feature for magento 2)
1994,2019-02-13 23:48:22.000000000,2020-02-23 13:07:26.000000000,closed,4,PATH set with ENV does not persist
1993,2019-02-13 11:22:17.000000000,2020-02-23 13:07:39.000000000,closed,6,Nginx build fails when COMPOSE_PROJECT_NAME changed
1992,2019-02-13 00:02:30.000000000,2020-03-23 21:31:49.000000000,closed,4,Changes on project are not synchronized
1991,2019-02-12 15:45:28.000000000,2019-02-12 18:24:07.000000000,closed,0,fix adminer INSTALL_MSSQL build fail.
1990,2019-02-12 14:06:22.000000000,2019-02-12 15:37:39.000000000,closed,0,workspace redis extension use apt install.
1989,2019-02-11 16:26:53.000000000,2019-02-11 18:23:07.000000000,closed,2,E: Failed to fetch libgs9_9.26~dfsg-0+deb9u2_amd64.deb  404  Not Found
1988,2019-02-10 17:24:06.000000000,1970-01-01 00:00:00.000000001,open,2,need coexist php version
1987,2019-02-10 14:15:42.000000000,2019-02-11 08:36:31.000000000,closed,0,Ask for help! How do I install PECL install trader
1986,2019-02-07 02:35:53.000000000,2019-02-10 20:38:56.000000000,closed,0,163774116 dima demo
1985,2019-02-06 22:15:29.000000000,2019-02-09 13:28:51.000000000,closed,0,Create test.md
1984,2019-02-06 14:51:30.000000000,2019-02-06 17:21:33.000000000,closed,1,Install whois tool
1983,2019-02-06 06:10:15.000000000,2020-02-23 13:07:19.000000000,closed,2,refer to directory in workspace for executable
1982,2019-02-03 20:37:01.000000000,1970-01-01 00:00:00.000000001,open,0,"fix ""Exit immediately after startup"" problem for zookeeper"
1981,2019-02-02 07:21:54.000000000,2019-02-16 20:38:19.000000000,closed,0,Support Redis Cluster
1980,2019-02-01 15:35:36.000000000,2019-02-09 13:18:39.000000000,closed,0, -v
1979,2019-02-01 13:27:27.000000000,1970-01-01 00:00:00.000000001,open,0,Couchbase support
1978,2019-02-01 12:15:40.000000000,2019-02-01 12:20:45.000000000,closed,0,miss
1977,2019-01-31 19:34:45.000000000,2019-02-09 16:28:30.000000000,closed,1,fix caddy  failed download
1976,2019-01-31 18:09:07.000000000,2019-02-14 18:52:41.000000000,closed,0,Support for additional locales in PHP-FPM
1975,2019-01-30 22:15:02.000000000,2020-03-19 19:07:19.000000000,closed,3,Install Magento NGINX
1974,2019-01-29 09:43:36.000000000,2019-02-09 17:07:37.000000000,closed,1,Add CouchDB
1973,2019-01-29 00:30:13.000000000,2019-01-29 00:57:00.000000000,closed,1,Can Laradock php-fpm run 2 requests parallel?
1972,2019-01-26 21:37:10.000000000,1970-01-01 00:00:00.000000001,open,0,[ Request ] Zabbix support
1971,2019-01-25 15:56:32.000000000,2020-02-23 13:07:17.000000000,closed,2,Enable JSON1 Extension for SQLite
1970,2019-01-25 15:51:44.000000000,2019-02-09 16:25:50.000000000,closed,0,Add `gloga` alias
1969,2019-01-25 08:00:56.000000000,2020-02-23 12:07:41.000000000,closed,8,GD Library Error 500
1968,2019-01-24 22:25:37.000000000,2019-10-25 20:31:17.000000000,closed,2,Set my.cnf permissions
1967,2019-01-24 19:56:22.000000000,1970-01-01 00:00:00.000000001,open,0,Feature Suggestion - Request Baskets container
1966,2019-01-24 11:21:51.000000000,2020-02-23 13:07:27.000000000,closed,4,How to run Nginx to test controller from workspace
1965,2019-01-23 09:28:32.000000000,2019-02-09 13:33:06.000000000,closed,0,"fix php-fpm build for 5.6, 7.0 and 7.1"
1964,2019-01-22 07:54:07.000000000,2020-02-23 14:07:41.000000000,closed,2,Nginx ssl documentation
1963,2019-01-22 01:51:49.000000000,2019-02-11 18:16:10.000000000,closed,1,APCU/YAML + PHP56 doesn't install
1962,2019-01-21 18:49:40.000000000,2020-02-23 14:07:40.000000000,closed,2,Deploying on Jelastic
1960,2019-01-21 15:58:52.000000000,2020-02-23 14:07:39.000000000,closed,2,Yarn reports trouble with your network connection. No internet connection inside workspace service/container
1959,2019-01-19 12:25:01.000000000,1970-01-01 00:00:00.000000001,open,4,missing redis.conf file is added for secured redis connection
1958,2019-01-17 05:45:35.000000000,2019-02-11 17:51:03.000000000,closed,1,Use of IDE-theia
1957,2019-01-15 22:23:20.000000000,2019-02-09 16:29:52.000000000,closed,0,"fix build Solr, failed in https://travis-ci.org/laradock/laradock/jobs/479960032"
1956,2019-01-15 21:06:08.000000000,2019-02-09 16:29:25.000000000,closed,0,persistent RabbitMQ
1955,2019-01-15 02:54:55.000000000,2020-02-23 14:07:37.000000000,closed,2,"Apache appears to be case-insensitive, defying norms (and perhaps RFCs)"
1954,2019-01-14 15:13:22.000000000,2020-02-23 14:07:36.000000000,closed,2,ERROR: Service 'redis' failed to build: COPY failed: stat /var/lib/docker/tmp/docker-builder841250484/redis.conf: no such file or directory
1953,2019-01-13 21:57:37.000000000,2019-01-16 22:19:42.000000000,closed,14,New daily log files created by root instead of laradock user
1952,2019-01-13 20:35:31.000000000,2020-02-23 10:07:26.000000000,closed,4,"There is no existing directory at ""local path directory /MyLaravelApp/storage/logs"" and its not buildable: Permission denied"
1951,2019-01-11 14:11:17.000000000,1970-01-01 00:00:00.000000001,open,0,correct configuration for IonCube
1950,2019-01-11 13:36:01.000000000,2019-01-11 15:52:13.000000000,closed,0,"using Alpine for Beanstalkd and RabbitMQ, list all ports exposed for RabbitMQ"
1949,2019-01-11 13:27:18.000000000,2019-02-09 13:34:35.000000000,closed,0,add MYSQL_CLIENT and AMQP for php-worker
1948,2019-01-10 19:33:59.000000000,2019-01-10 20:23:52.000000000,closed,0,Fix aerospike build fail
1947,2019-01-10 18:43:56.000000000,2019-01-10 18:50:59.000000000,closed,0,fix install APCu and not install Phalcon build fail
1946,2019-01-10 18:14:35.000000000,1970-01-01 00:00:00.000000001,open,0,Add Sphinx search engine 3.x
1945,2019-01-10 16:15:28.000000000,1970-01-01 00:00:00.000000001,open,2,specifying which files to Gzip compress and increase grade in Google page speed
1944,2019-01-10 10:21:02.000000000,2020-02-29 04:37:58.000000000,closed,6,Service 'php-fpm' failed to build: The command '/bin/sh -c if [ ${INSTALL_APCU} = true ]; then     pecl install apcu &&     docker-php-ext-enable apcu USER root' returned a non-zero co de: 2
1943,2019-01-09 18:00:23.000000000,2019-01-10 15:52:51.000000000,closed,5,installation problem on ubuntu 18.04
1942,2019-01-09 15:23:03.000000000,2019-01-09 18:22:43.000000000,closed,0,modify syntax error
1941,2019-01-08 22:35:08.000000000,2019-01-09 18:33:39.000000000,closed,1,"fix errors build: unable to fetch some archives, typo in if fi;"
1940,2019-01-08 20:49:18.000000000,2019-02-09 13:21:20.000000000,closed,2,"if should be closed after     docker-php-ext-enable apcu \ "";fi"" cmon guys could not you notice that before since 8 years ????"
1939,2019-01-08 16:30:45.000000000,2019-01-09 18:33:03.000000000,closed,1,"fixed syntax error: end of file unexpected (expecting ""fi"") from commit  #1831"
1938,2019-01-08 14:30:59.000000000,2019-01-09 18:32:24.000000000,closed,1,Fix Syntax error in php-fpm Dockerfile
1937,2019-01-08 02:43:14.000000000,2019-02-09 16:26:51.000000000,closed,0,Backup Rethikdb
1936,2019-01-07 10:34:19.000000000,2019-01-13 20:03:25.000000000,closed,0,chore(pgadmin) use alpine
1935,2019-01-07 10:29:27.000000000,2019-01-17 04:39:21.000000000,closed,0,Add Redis Worker Support
1934,2019-01-04 21:51:54.000000000,2019-01-04 21:54:47.000000000,closed,0,"Lh 3140 : [Inv] [See PR LH-3140] AA Dev, I try to make laravel telescope work"
1933,2019-01-03 17:49:17.000000000,2019-01-08 12:31:22.000000000,closed,0,Typo in PHP_VERSION (It should be LARADOCK_PHP_VERSION) for PHP gmp extension in workspace container Dockerfile
1932,2019-01-03 06:26:51.000000000,2019-02-16 20:16:41.000000000,closed,1,workspace/aliases.sh: Correct confused lines
1931,2019-01-02 14:24:51.000000000,2020-02-23 13:07:23.000000000,closed,3,How to access Laradock from other VM (Parallels)
1930,2019-01-02 14:22:44.000000000,2019-01-08 12:30:54.000000000,closed,0,add new conf example file to run laravel scheduler in php-worker
1929,2019-01-02 13:45:40.000000000,2019-01-09 20:53:49.000000000,closed,0,"add gitignore for nginx/ssl folder, prevent keeping cert files in git"
1928,2019-01-02 13:41:55.000000000,2019-01-09 20:54:33.000000000,closed,0,php-worker: add laradock user
1927,2019-01-02 12:05:18.000000000,2019-01-03 10:55:02.000000000,closed,0,php7.2 install swoole fail
1926,2019-01-02 06:20:58.000000000,2019-02-10 20:40:30.000000000,closed,1,`apt-get update` needs to be run for mssql to work properly
1925,2018-12-31 22:03:31.000000000,2019-01-01 14:11:23.000000000,closed,1,php-fpm rebuild add phalcon ext error
1924,2018-12-28 04:45:22.000000000,2019-01-02 05:30:22.000000000,closed,0,Change the listening port of nginx in version3 
1923,2018-12-26 17:46:22.000000000,2019-01-08 12:35:23.000000000,closed,0,Install socket extension for php-fpm
1922,2018-12-26 12:56:21.000000000,2019-01-08 12:34:19.000000000,closed,0,Add more `git` aliases
1921,2018-12-22 23:36:59.000000000,2020-05-15 21:09:39.000000000,closed,9,Workspace crash after few seconds
1920,2018-12-22 19:35:37.000000000,2019-02-09 13:27:46.000000000,closed,1,Fix issue where `MYSQL_VERSION` cannot be overridden via `.env` file
1919,2018-12-20 11:38:33.000000000,2018-12-31 18:31:14.000000000,closed,1,docker-compose up postgres failed
1918,2018-12-20 04:00:31.000000000,2019-09-09 22:38:41.000000000,closed,1,ERROR: Service 'workspace' failed to build
1917,2018-12-16 08:31:49.000000000,2020-02-23 14:07:24.000000000,closed,2,Multi tenant - nginx commands and conf files
1916,2018-12-13 23:49:15.000000000,2019-02-09 16:25:22.000000000,closed,1,Add traefik
1915,2018-12-13 15:47:30.000000000,2020-02-23 13:07:21.000000000,closed,3,PHP 7.1.3 version needed
1914,2018-12-13 00:40:29.000000000,2019-01-08 12:33:41.000000000,closed,0,Add mosquitto broker
1913,2018-12-08 08:13:32.000000000,2019-02-13 04:53:07.000000000,closed,2,"You should add ""extension=redis.so"" to php.ini"
1912,2018-12-07 15:34:28.000000000,2018-12-10 06:26:13.000000000,closed,1,nginx.conf need the gzip，but not set success
1911,2018-12-06 18:14:12.000000000,2019-03-01 12:48:23.000000000,closed,0,add an official redis stable config file
1910,2018-12-06 07:27:04.000000000,2019-02-09 14:11:02.000000000,closed,0,Merge pull request #1 from laradock/master
1909,2018-12-05 14:40:52.000000000,2020-02-23 10:07:17.000000000,closed,3,How to enable php-gettext extention?
1908,2018-12-05 13:47:13.000000000,2020-02-23 14:07:33.000000000,closed,3,certbot
1907,2018-12-05 11:55:30.000000000,2019-01-11 13:48:02.000000000,closed,4,"php-worker: add mysql client, add laradock user; add .gitignore for nginx ssl folder to ignore SSL certs"
1906,2018-12-05 03:30:44.000000000,2019-02-18 23:45:27.000000000,closed,9,Incorrect PHP versions launched
1905,2018-12-03 21:55:59.000000000,2019-12-06 16:25:03.000000000,closed,11,perf: change some container source when in china
1904,2018-12-03 14:10:38.000000000,2020-02-23 14:07:21.000000000,closed,2,How to use deployer with Laradock
1903,2018-12-01 22:46:15.000000000,2019-02-16 20:32:04.000000000,closed,7,added zip to workspace/php-fpm container (so there is no composer warning)
1902,2018-12-01 19:08:21.000000000,2020-02-23 14:07:27.000000000,closed,11,laradock_nginx_1 exited with code 2
1901,2018-11-30 12:43:23.000000000,2020-02-04 15:57:27.000000000,closed,3,"ERROR: Service 'workspace' failed to build: The command '/bin/sh -c php -v | head -n 1 | grep -q ""PHP ${LARADOCK_PHP_VERSION}.""' returned a non-zero code: 1"
1900,2018-11-29 16:46:46.000000000,2019-01-09 18:31:19.000000000,closed,0,Update to fresh version Adminer 4.x
1899,2018-11-29 11:48:06.000000000,2019-01-08 12:29:04.000000000,closed,0,Add ZooKeeper Component
1898,2018-11-28 18:10:07.000000000,2020-07-30 14:10:09.000000000,closed,7,npm run dev error - Node Sass does not yet support your current environment
1897,2018-11-28 17:06:00.000000000,2018-11-28 17:06:46.000000000,closed,2,Business
1896,2018-11-28 00:49:52.000000000,2020-02-23 14:07:28.000000000,closed,3,Session does not working.
1895,2018-11-26 15:50:50.000000000,2018-11-27 02:21:08.000000000,closed,0,Append phalcon module
1894,2018-11-25 07:32:47.000000000,2018-11-27 14:00:04.000000000,closed,2,Fix issue 1874
1893,2018-11-25 07:12:07.000000000,2018-11-27 13:57:37.000000000,closed,0,Fix issue 1889
1892,2018-11-25 01:53:50.000000000,2018-11-27 13:59:14.000000000,closed,0,MySQL Client in Workspace
1891,2018-11-25 01:31:51.000000000,2020-02-23 12:07:14.000000000,closed,5,Caddy 504 Gatweay Timeout. Can't increase timeouts
1890,2018-11-24 10:16:48.000000000,2020-02-23 13:07:24.000000000,closed,7,"building php-fpm with imagick on results in 404 package not found (solution in, PR needed?)"
1889,2018-11-22 16:42:42.000000000,2018-11-27 13:57:37.000000000,closed,9,workspace - Permission denied: '/etc/container_environment'
1888,2018-11-22 14:35:00.000000000,2018-11-22 19:24:51.000000000,closed,1,FIX PHP YAML extension #1798
1887,2018-11-22 07:24:26.000000000,2018-11-22 08:44:29.000000000,closed,0, Update Install YAML PHP extension title
1886,2018-11-21 14:28:06.000000000,2020-02-23 12:07:23.000000000,closed,4,"When I am modifying code in controllers,it doesn't work"
1885,2018-11-20 12:32:56.000000000,2020-02-23 13:07:37.000000000,closed,3,Can't curl on same server IP Address from php-fpm bash
1884,2018-11-19 21:33:55.000000000,2020-02-23 14:07:17.000000000,closed,2,"Curl timeout between sites, hosted on same docker"
1883,2018-11-19 19:36:21.000000000,2020-02-23 14:07:18.000000000,closed,3,Call to Envoy from PHP script gets a SSH 'Host key verification failed'
1882,2018-11-19 12:57:24.000000000,2018-11-21 09:37:18.000000000,closed,0,Change text error
1881,2018-11-19 11:30:32.000000000,2019-02-19 08:12:55.000000000,closed,1,Nginx Container and SSL - Subject Alternative Name missing
1880,2018-11-17 04:59:01.000000000,2020-02-27 00:08:39.000000000,closed,5,Multiple Sites - PHP Fatal Error: Cannot declare class because name is already in use
1879,2018-11-17 01:25:46.000000000,2019-01-08 12:24:33.000000000,closed,3,Nginx for Windows
1878,2018-11-16 17:44:44.000000000,2020-02-23 14:07:26.000000000,closed,18,Nginx not running with State Exit 2
1877,2018-11-16 07:44:07.000000000,2018-11-16 07:45:44.000000000,closed,1,Merge pull request #1 from laradock/master
1876,2018-11-14 21:50:02.000000000,2019-03-01 10:22:06.000000000,closed,4,E: Unable to locate package php7.2-phpdbg
1875,2018-11-14 07:34:58.000000000,2018-11-22 05:10:09.000000000,closed,1,Update default user for workspace container
1874,2018-11-13 20:11:40.000000000,2018-11-27 14:00:04.000000000,closed,0,ZipArchive not found from php-worker
1873,2018-11-13 10:58:45.000000000,2019-12-04 23:47:32.000000000,closed,4,[How-To] Using the dump-server
1872,2018-11-13 06:51:08.000000000,2020-02-23 13:07:32.000000000,closed,3,"Problem start nginx, php-fpm"
1871,2018-11-10 22:00:28.000000000,2018-11-15 11:31:05.000000000,closed,1,Can't install elasticsearch plugin
1870,2018-11-10 16:40:40.000000000,2020-02-23 14:07:14.000000000,closed,2,no unzip command in workspace container
1869,2018-11-08 20:58:36.000000000,2018-11-22 05:10:34.000000000,closed,0,Update docker-compose.yml to add 'dind' to 'workspace'
1868,2018-11-05 18:58:30.000000000,2020-02-23 15:07:40.000000000,closed,3,Parameter DOCKER_SYNC_STRATEGY is set twice in env-example 
1867,2018-11-05 13:56:13.000000000,1970-01-01 00:00:00.000000001,open,0,Net tool added
1866,2018-11-04 16:27:56.000000000,2018-11-13 17:53:28.000000000,closed,1,Remove duplicated docker-sync-strategy
1865,2018-11-02 15:02:57.000000000,2018-11-03 09:00:38.000000000,closed,2,xDebug 404 not found on laradock/workspace:2.2
1864,2018-10-31 15:33:58.000000000,2018-11-13 18:31:06.000000000,closed,0,Add default pgadmin credentials to docs allow log in
1863,2018-10-31 11:00:50.000000000,2020-02-23 15:07:41.000000000,closed,5,Mysql config .env failed to increase username and password
1862,2018-10-30 12:03:37.000000000,2020-02-23 15:07:37.000000000,closed,3,[How to] Unable run node js script under php (www-data can't run external program)
1861,2018-10-30 01:54:18.000000000,2019-02-28 15:58:41.000000000,closed,6,Unable to start Jenkins in Laradock
1860,2018-10-29 22:03:15.000000000,2018-11-13 19:23:58.000000000,closed,2,pgadmin can't startup
1859,2018-10-29 18:16:36.000000000,2020-02-23 15:07:36.000000000,closed,2,laradock_default
1858,2018-10-29 12:40:32.000000000,2018-10-31 10:19:49.000000000,closed,0,I want to install multiple versions of PHP. What should I do?
1857,2018-10-26 22:02:09.000000000,2019-02-16 21:08:33.000000000,closed,1,Added WORKSPACE_INSTALL_NPM_ANGULAR_CLI option to install Angular CLI…
1856,2018-10-26 21:44:02.000000000,2018-10-26 21:47:07.000000000,closed,0,Added WORKSPACE_INSTALL_NPM_ANGULAR_CLI option to install Angular CLI…
1855,2018-10-26 10:00:15.000000000,2020-03-31 01:27:52.000000000,closed,9,mysql won't downgrade from 8 to 5.7
1854,2018-10-25 14:50:06.000000000,2018-11-23 17:47:27.000000000,closed,5,laravel-horizon
1853,2018-10-24 11:38:03.000000000,2018-10-24 12:00:15.000000000,closed,0,Fix php5.6 workspace aerospike travis-ci build failed
1852,2018-10-23 19:22:32.000000000,2019-02-09 13:40:15.000000000,closed,3,Add logstash support
1851,2018-10-23 01:13:31.000000000,2018-10-24 16:07:26.000000000,closed,1,added config file for beanstalkd console with correct server settings…
1850,2018-10-22 12:48:04.000000000,2020-02-23 14:07:16.000000000,closed,4,Gitlab wont start having issue on permission
1849,2018-10-22 12:05:12.000000000,2018-10-22 19:40:35.000000000,closed,1,Can't run gitlab on local pc
1848,2018-10-21 09:09:03.000000000,2018-11-13 17:47:52.000000000,closed,0,Update Doc '.php-fpm' to './php-fpm'
1847,2018-10-20 18:44:31.000000000,2018-11-04 11:32:09.000000000,closed,6,Php 7.2 XDebug install error
1846,2018-10-20 10:26:05.000000000,2020-02-23 14:07:35.000000000,closed,3,How to deploy a Laravel Application to AWS ElasticBeanstalk with AWS ECS using AWS CodePipeline?
1845,2018-10-19 15:43:40.000000000,2018-10-19 15:44:13.000000000,closed,0,php pcl
1844,2018-10-18 11:54:05.000000000,2020-02-23 15:07:35.000000000,closed,4,create phalcon.ini  Directory nonexistent
1843,2018-10-17 22:56:11.000000000,2018-11-13 17:54:03.000000000,closed,0,Fix typo in seed alias
1842,2018-10-17 21:26:26.000000000,2019-01-08 12:36:21.000000000,closed,2,[ Fixing Permission Error ]
1841,2018-10-17 21:18:43.000000000,2018-10-17 21:31:24.000000000,closed,2,Permission Denied error installing ide-theia
1840,2018-10-17 04:35:09.000000000,2018-10-23 21:29:15.000000000,closed,1,Nginx: ERR_EMPTY_RESPONSE
1839,2018-10-17 03:30:05.000000000,2020-02-23 14:07:30.000000000,closed,6,"Can not connect mysql to sequel pro, phpmyadmin, or while trying to migrate DB using artisan"
1838,2018-10-16 20:10:59.000000000,2020-02-23 11:07:32.000000000,closed,5,Cant install Caddy
1837,2018-10-15 19:23:42.000000000,2020-02-23 15:07:32.000000000,closed,3,Unable to locate package php7.2-xdebug
1836,2018-10-12 12:33:02.000000000,2018-11-03 11:03:06.000000000,closed,4,Laradock + Laravel-Swoole - Page show 502 Bad Gateway
1835,2018-10-11 17:54:51.000000000,2020-02-23 15:07:30.000000000,closed,2,Add TypeSense Container
1834,2018-10-11 12:25:16.000000000,2018-11-13 18:35:20.000000000,closed,0,fix typo in env-example
1833,2018-10-10 06:40:13.000000000,2018-11-13 18:34:44.000000000,closed,1,remove duplication in env-example
1832,2018-10-09 14:06:48.000000000,2018-10-10 13:04:24.000000000,closed,2,Try build workspace or up some container say: `docker-default profile could not be loaded`
1831,2018-10-09 11:03:10.000000000,2019-01-08 12:30:13.000000000,closed,1,Added APCU installation option
1830,2018-10-09 10:06:42.000000000,2018-10-09 10:36:09.000000000,closed,2,FROM must to be the first instructions. Fixing error with docker-comp…
1829,2018-10-09 07:54:14.000000000,2018-11-13 17:58:01.000000000,closed,1,add mssql support for solr
1828,2018-10-04 03:31:43.000000000,2018-10-07 00:40:59.000000000,closed,1,Service Mysql failed to build 
1827,2018-10-03 17:45:46.000000000,2020-02-21 11:21:02.000000000,closed,3,Postgres not working
1826,2018-10-03 08:30:28.000000000,2020-02-23 15:07:31.000000000,closed,3,Unable to locate package php7.1-sybase
1825,2018-10-02 13:14:37.000000000,2020-02-23 15:07:26.000000000,closed,2,Get the url of laravel echo server.
1824,2018-09-30 02:31:17.000000000,2020-02-02 14:03:26.000000000,closed,2,Add php7.3
1823,2018-09-28 18:38:19.000000000,2018-09-30 18:49:41.000000000,closed,3,Connect to local mysql from container
1822,2018-09-28 16:23:36.000000000,2019-02-14 18:57:00.000000000,closed,0,Fixed docker command permission denied in jenkins error while building
1821,2018-09-28 14:19:38.000000000,1970-01-01 00:00:00.000000001,open,8,add node.js
1820,2018-09-28 13:37:16.000000000,2020-02-23 15:07:25.000000000,closed,2,Consider increasing the Postgres upgrade.
1819,2018-09-28 08:57:49.000000000,2018-09-28 08:58:01.000000000,closed,1,ecs compatibility and separation for docker-compose
1818,2018-09-27 10:40:46.000000000,2018-09-27 12:54:51.000000000,closed,3,mysqli_real_connect(): (HY000/2002): Connection refused
1817,2018-09-27 02:07:56.000000000,2018-11-13 17:55:16.000000000,closed,0,added SOAP ext to php-worker
1816,2018-09-26 11:35:50.000000000,2019-04-23 12:19:07.000000000,closed,1,Fix Caddy file path
1815,2018-09-25 11:37:09.000000000,2020-02-23 11:07:18.000000000,closed,8,ffmpeg/ffprobe
1814,2018-09-25 04:56:57.000000000,2020-02-23 15:07:24.000000000,closed,2,HTTP Status 201 Response
1813,2018-09-24 23:15:20.000000000,2018-11-22 19:25:40.000000000,closed,0,Updated Chrome Driver to latest stable version (2.32 to 2.42) in env-example
1812,2018-09-23 08:21:01.000000000,2020-02-23 15:07:22.000000000,closed,3,Containers file didn't change in centos 7 with VirtualBox (Should I run with 'sync.sh'?)
1811,2018-09-23 00:09:08.000000000,2019-01-10 07:56:30.000000000,closed,3,fixed php-fpm install phalcon ext bug
1810,2018-09-22 07:17:05.000000000,1970-01-01 00:00:00.000000001,open,0,Refactoring nginx.conf
1809,2018-09-22 05:33:58.000000000,2019-10-25 20:49:10.000000000,closed,1,Rename env-example file
1808,2018-09-22 05:12:43.000000000,2018-11-13 17:51:26.000000000,closed,1,Remove duplicate key
1807,2018-09-22 03:55:55.000000000,2020-08-24 21:39:43.000000000,closed,7,[DOCS] no search
1806,2018-09-21 11:38:53.000000000,2018-09-22 11:45:42.000000000,closed,2,add phalcon ext
