id,created_at,closed_at,state,comments,title
441,2018-06-30 14:21:26.000000000,2018-08-21 18:57:00.000000000,closed,3,Check if usageIdentifierKey returned by an authorizer is a valid API key
440,2018-06-24 08:27:49.000000000,2018-09-20 18:52:11.000000000,closed,2,Update dependencies to fix security vulnerability
439,2018-06-20 18:16:52.000000000,2018-06-27 16:53:41.000000000,closed,1,Spelling
438,2018-06-17 16:02:42.000000000,2019-01-16 01:55:52.000000000,closed,5,Testing sls-offline - Run offline instance from test
437,2018-06-16 14:17:32.000000000,2018-06-27 17:00:43.000000000,closed,4,Only call end() from the corresponding lifecycle hook
436,2018-06-14 13:02:18.000000000,2018-06-27 17:00:43.000000000,closed,1,Hook to clean up after interactive offline session
435,2018-06-09 03:02:53.000000000,2019-07-07 17:41:05.000000000,closed,5,Environment Variable for local development only via .env file
434,2018-06-08 14:05:34.000000000,2018-06-27 17:01:30.000000000,closed,8,Unclear warning message: Warning: handler '{function_name}' returned a promise and also use a callback!
433,2018-06-07 19:09:09.000000000,2018-06-13 15:00:01.000000000,closed,0,intermittent timeout ahead of handler
432,2018-06-07 18:38:49.000000000,2018-06-27 16:58:16.000000000,closed,2,Custom Authorizer type REQUEST not supported offline
431,2018-06-06 15:52:15.000000000,2018-06-06 19:54:58.000000000,closed,1,Protocol is missing in faked lambda proxy context
430,2018-06-05 01:33:52.000000000,2018-06-05 12:42:45.000000000,closed,1,Normalize Hapi queryParameters to be compliant with API Gateway
429,2018-06-04 18:02:06.000000000,2018-06-04 19:27:17.000000000,closed,1,Custom authorize on different services
428,2018-06-04 14:22:13.000000000,2018-06-05 16:59:48.000000000,closed,3,Query parameter behaviour differs to API gateway
427,2018-06-01 22:11:19.000000000,2018-06-04 19:32:39.000000000,closed,2,save and restore original String prototypes
426,2018-05-31 18:46:12.000000000,2018-06-04 19:32:53.000000000,closed,4,String prototype mutation
425,2018-05-30 22:33:51.000000000,2018-05-31 17:09:35.000000000,closed,1,Add myself to contributors
424,2018-05-30 22:31:05.000000000,2018-05-31 17:09:14.000000000,closed,0,Fix eslint issues
423,2018-05-30 22:20:49.000000000,2018-05-31 17:08:32.000000000,closed,1,Add support for async authorizers
422,2018-05-30 00:10:57.000000000,2018-05-30 11:08:36.000000000,closed,0,Update lockfile
421,2018-05-30 00:09:32.000000000,2018-05-30 11:12:19.000000000,closed,0,Show the right waning on promise vs callback conflict.
420,2018-05-29 20:49:15.000000000,2018-05-31 00:15:36.000000000,closed,5,Custom authorizer timeouts with async handler
419,2018-05-29 20:14:21.000000000,2018-05-30 11:08:04.000000000,closed,1,Fix small typo
418,2018-05-29 17:47:59.000000000,2019-06-06 08:32:22.000000000,closed,3,Context.fail('test') different response than in cloud
417,2018-05-29 01:17:27.000000000,2018-05-29 19:06:40.000000000,closed,1,add failing unittest
416,2018-05-28 13:11:38.000000000,2018-05-28 21:46:27.000000000,closed,1,Don't work httpsProtocol option.
415,2018-05-24 22:18:13.000000000,2018-10-22 17:01:09.000000000,closed,2,Adds validation for policy documents
414,2018-05-24 21:05:53.000000000,2018-05-26 17:08:07.000000000,closed,5,Fix protected routes
413,2018-05-24 15:35:54.000000000,2018-05-26 17:14:17.000000000,closed,1,Confusing versioning
412,2018-05-24 15:22:56.000000000,2018-05-26 17:11:55.000000000,closed,1,Fix Allow statement case sensitivity
411,2018-05-23 15:36:57.000000000,2018-05-26 17:10:31.000000000,closed,6,Case insensitive header handling
410,2018-05-22 03:48:39.000000000,2018-05-23 11:45:26.000000000,closed,4,read content-type header in a case insensitive manner
409,2018-05-14 22:18:23.000000000,2018-05-15 16:10:38.000000000,closed,1,skip HEAD routes to avoid HAPI error
408,2018-05-11 00:48:24.000000000,2018-05-12 19:41:27.000000000,closed,1,Vulnerability from dependencies
407,2018-05-10 21:38:14.000000000,2018-05-20 10:21:33.000000000,closed,3,Error when debugging
406,2018-04-26 10:34:50.000000000,2019-06-06 08:28:25.000000000,closed,1,Passing a custom cognito identity in the event header
405,2018-04-21 19:52:43.000000000,2018-05-30 11:12:19.000000000,closed,21,v3.20.3 on Node 8.10 causes Warning: context.done called twice within handler 
404,2018-04-19 19:37:40.000000000,2018-11-05 18:44:43.000000000,closed,5,Serverless offline does not have access to files bundled with the file-loader
403,2018-04-19 12:11:00.000000000,2018-04-20 16:59:52.000000000,closed,2,Upgrade jsonwebtoken
402,2018-04-18 16:09:16.000000000,2018-05-12 19:50:18.000000000,closed,0,Add binary support when using lambda integration
401,2018-04-18 06:56:39.000000000,2018-04-18 23:05:23.000000000,closed,2,does serverless-offline has support with dotnetcore 2.0
400,2018-04-16 21:03:55.000000000,2018-04-17 06:49:06.000000000,closed,7,Disable response body logging
399,2018-04-16 19:46:18.000000000,2019-08-27 13:01:38.000000000,closed,8,AppSync support
398,2018-04-16 12:09:56.000000000,2018-04-18 23:01:11.000000000,closed,0,Add async handler support for nodejs8.10 runtime
397,2018-04-14 13:00:11.000000000,2018-09-20 18:55:21.000000000,closed,2,Is there python support?
396,2018-04-13 19:23:35.000000000,2019-01-07 15:40:07.000000000,closed,2,Symbolic links support
395,2018-04-13 04:07:35.000000000,2018-05-12 19:29:17.000000000,closed,0,Option to preserve trailing slash
394,2018-04-12 04:41:39.000000000,2018-04-12 15:43:34.000000000,closed,0,Adds special encoding for multipart/form-data
393,2018-04-09 15:14:12.000000000,2018-04-12 15:43:20.000000000,closed,0,Adding process.env._HANDLER
392,2018-04-08 17:14:04.000000000,2019-01-16 20:59:51.000000000,closed,26,Add python support via `sls invoke local`
391,2018-04-07 11:35:51.000000000,2018-04-12 15:43:08.000000000,closed,0,Fixes the case when policy === *
390,2018-04-06 11:04:07.000000000,2019-06-02 17:07:55.000000000,closed,1,h2o2 version gets tripped-up by latest joi version
389,2018-04-06 10:27:10.000000000,2018-04-19 14:37:05.000000000,closed,1,Support for Azure Functions
388,2018-04-05 19:53:22.000000000,1970-01-01 00:00:00.000000001,open,7,Support for cross stack references
387,2018-04-05 02:25:13.000000000,2018-04-12 15:43:08.000000000,closed,3,Error when custom authorizer's Resource is '*'
386,2018-04-04 22:00:13.000000000,2018-04-05 00:08:56.000000000,closed,2,Fix for broken AWS resources
385,2018-04-04 19:37:31.000000000,2018-04-04 19:37:52.000000000,closed,2,cookie parsing is poor emulation of lambda
384,2018-04-04 06:42:38.000000000,2018-04-18 23:01:11.000000000,closed,10,Full nodejs8.10 Support
383,2018-04-03 19:57:55.000000000,2018-04-05 00:08:56.000000000,closed,4,3.20.0 Breaks Access to Resources
382,2018-04-03 08:40:01.000000000,2018-04-03 14:32:42.000000000,closed,1,Add support for nodejs8.10
381,2018-04-03 06:26:22.000000000,2018-04-03 14:32:42.000000000,closed,8,Why serverless offline says found unsupported runtime nodejs8.10?
380,2018-03-31 21:21:13.000000000,2018-04-03 14:33:43.000000000,closed,0,Update README with info for changing AWS profile
379,2018-03-20 19:37:57.000000000,2018-05-26 17:06:38.000000000,closed,4,Use Response.header rather than Response.headers
378,2018-03-20 10:03:43.000000000,2018-05-17 11:05:57.000000000,closed,3,Add exposed headers
377,2018-03-18 21:31:02.000000000,2018-03-27 18:33:30.000000000,closed,1,Improves support authorizer.type == request
376,2018-03-17 12:02:33.000000000,2018-03-19 01:35:21.000000000,closed,1,Fix for lower cased Authorization header not being catered for
375,2018-03-17 12:02:06.000000000,2018-03-27 18:33:30.000000000,closed,1,Support for authorizerType.type=request with comma-separated identitySource
374,2018-03-15 08:26:09.000000000,2018-06-10 19:18:01.000000000,closed,2,how about support gcp 
373,2018-03-14 16:54:57.000000000,2018-03-27 18:33:46.000000000,closed,6,Add support for complex policies with wildcards
372,2018-03-12 18:54:17.000000000,2018-09-14 15:43:01.000000000,closed,4,babel-register dependency causes conflicts with babel 7
371,2018-03-12 18:26:25.000000000,2018-03-14 15:35:03.000000000,closed,6,Release Notes for 3.18?
370,2018-03-10 08:43:44.000000000,2018-03-11 19:15:35.000000000,closed,1,Lambda Proxy is broken and event.body is gone
369,2018-03-10 03:33:32.000000000,2019-06-02 17:10:54.000000000,closed,5,Request Validation 
368,2018-03-01 06:58:52.000000000,2018-04-13 00:10:05.000000000,closed,6,Add option to run handlers in separate node processes
367,2018-02-26 20:32:46.000000000,2018-03-27 18:34:01.000000000,closed,3,Added support to noEnvironment flag
366,2018-02-22 03:26:31.000000000,2018-02-22 06:58:22.000000000,closed,0,Add name to contributors 
365,2018-02-21 15:28:00.000000000,2019-07-07 17:46:42.000000000,closed,1,Event resource and path parameters do not take into account prefix
364,2018-02-19 20:59:06.000000000,2018-10-15 22:12:28.000000000,closed,5,API keys available on the Serverless Offline framework?
363,2018-02-14 20:59:36.000000000,2018-02-15 17:44:06.000000000,closed,2,Does this plugin simulate the Lambda execution model?
362,2018-02-14 11:47:20.000000000,2018-02-14 16:35:12.000000000,closed,0,improved error logging
361,2018-02-13 11:20:57.000000000,2018-02-14 16:35:12.000000000,closed,1,Insufficient error logging in _reply500
360,2018-02-09 12:45:08.000000000,2018-02-15 17:44:35.000000000,closed,2,Does not emulate the way lambda handles the Event loop 
359,2018-02-08 03:29:41.000000000,2018-09-20 18:56:30.000000000,closed,1,`print` statements in handler eat response body
358,2018-02-08 02:35:53.000000000,2018-02-13 18:48:25.000000000,closed,0,* handle base64 encoded binary response from aws lambda function
357,2018-02-08 00:16:10.000000000,2018-02-13 18:48:36.000000000,closed,4,aws lambda base64 encoded binary
356,2018-02-04 20:37:44.000000000,2018-02-07 00:39:44.000000000,closed,0,Update README: add usage with flow
355,2018-02-03 22:50:57.000000000,2019-08-12 01:15:09.000000000,closed,14,Fatal error = status code 200?
354,2018-02-03 07:30:05.000000000,2018-05-17 11:11:15.000000000,closed,0,Accessing other services on localhost
353,2018-01-29 22:39:36.000000000,2018-09-20 18:55:05.000000000,closed,0,variables as objects act inconsistently offline vs online
352,2018-01-26 18:06:25.000000000,2018-02-07 18:45:53.000000000,closed,1,Golang
351,2018-01-23 02:33:28.000000000,2018-07-19 17:06:58.000000000,closed,8,Golang support?
350,2018-01-15 21:51:42.000000000,2018-01-15 21:54:23.000000000,closed,0,Fix headers issue [EP-1664]
349,2018-01-13 00:23:33.000000000,2018-05-17 11:07:41.000000000,closed,0,serverless-plugin-browserify suport ?
348,2018-01-11 00:39:13.000000000,2018-05-23 11:46:26.000000000,closed,7,Added validation for policy documents
347,2018-01-07 02:18:57.000000000,2018-01-07 03:32:57.000000000,closed,1,Usage with existing tables
346,2018-01-06 05:48:18.000000000,2018-08-07 16:40:16.000000000,closed,2,#242 Split handler into method name and path i.e. handler.run at the …
345,2018-01-05 08:16:27.000000000,2018-01-15 23:10:22.000000000,closed,0,Use header (singular) to follow API Gateway conventions
344,2018-01-03 07:35:10.000000000,2018-02-18 04:19:46.000000000,closed,1,Code coverage?
343,2018-01-03 05:30:04.000000000,2018-09-20 18:54:36.000000000,closed,0,Configure API gateway response templates locally ? 
342,2018-01-03 05:10:54.000000000,2018-05-17 11:07:52.000000000,closed,0,Headers missing in response
341,2018-01-02 14:32:38.000000000,2018-05-29 13:58:10.000000000,closed,3,Update offline-default.req.vm
340,2017-12-29 01:04:10.000000000,2019-03-06 18:14:25.000000000,closed,6,Custom Authorizer is not fully implemented
339,2017-12-23 10:00:33.000000000,2018-01-15 23:12:50.000000000,closed,0,enforces upper case on method names for protected routes mapping
338,2017-12-21 23:41:24.000000000,2019-03-19 12:11:26.000000000,closed,6,setting 'stage' in serverless.yml with serverless-offline doesn't load the proper environment variables
337,2017-12-17 05:25:48.000000000,2018-02-14 16:37:39.000000000,closed,0,Stop stripping newlines and tabs from body
336,2017-12-06 18:52:01.000000000,2018-01-15 23:12:49.000000000,closed,1,Token Authorizers not Working Offline
335,2017-12-06 04:57:46.000000000,2018-02-14 16:39:30.000000000,closed,1,Support binary responses using isBase64Encoded flag
334,2017-12-06 01:45:39.000000000,2019-06-03 06:13:15.000000000,closed,5,Can't expose header
333,2017-11-29 21:53:40.000000000,2019-06-03 06:05:31.000000000,closed,13,request optional path parameter don't work
332,2017-11-28 02:04:04.000000000,2018-01-15 23:08:28.000000000,closed,0,Fix minor typos
331,2017-11-23 04:52:19.000000000,2019-06-02 16:50:38.000000000,closed,4,how does serverless offline start local dynamodb?
330,2017-11-20 11:07:23.000000000,2019-08-27 07:31:17.000000000,closed,1,X-Forwarded-For in event headers
329,2017-11-17 08:04:14.000000000,2018-01-15 23:47:20.000000000,closed,7,Adding support for request-type authorizers
328,2017-11-14 12:01:26.000000000,2018-05-17 10:57:37.000000000,closed,0,noEnvironment does not work
327,2017-11-08 06:26:33.000000000,1970-01-01 00:00:00.000000001,open,5,AWS X-Ray in offline mode
326,2017-11-07 18:37:36.000000000,2018-01-15 23:47:20.000000000,closed,1,"Handle ""REQUEST"" authorizer type"
325,2017-11-05 02:51:36.000000000,2019-06-02 16:51:48.000000000,closed,1,babel-polyfill error (when invoked for second time).
324,2017-11-05 02:38:23.000000000,2018-09-20 18:54:20.000000000,closed,1,Useful to be able to override environment variables when running offline.
323,2017-11-03 20:03:18.000000000,2018-09-20 18:54:00.000000000,closed,3,Use @str/esm with Serverless
322,2017-11-03 19:15:23.000000000,2019-06-03 06:06:58.000000000,closed,10,Unable to stop serverless offline process with CTRL+C
321,2017-11-01 23:53:31.000000000,2018-01-25 00:35:16.000000000,closed,2,Made check for Content-Type header case insensitive before setting
320,2017-10-26 23:42:37.000000000,2018-06-04 19:42:11.000000000,closed,3,first cut of iot support
319,2017-10-25 13:54:05.000000000,2017-10-25 13:59:27.000000000,closed,1,Accept lower case auth header
318,2017-10-23 13:50:32.000000000,2018-02-18 04:00:46.000000000,closed,2,Host should default to smth. like 0.0.0.0 rather than localhost
317,2017-10-23 05:02:00.000000000,2017-10-31 04:17:25.000000000,closed,1,"Error ""Error: Unable to expose method"" "
316,2017-10-21 02:40:17.000000000,2018-05-28 21:41:38.000000000,closed,1,Pass provider environment to shell
315,2017-10-18 15:12:26.000000000,2018-02-18 03:58:33.000000000,closed,1,BUG: Custom Authorizer Environment Variables
314,2017-10-17 07:15:35.000000000,2018-02-18 04:23:23.000000000,closed,1,Stop invalidating requires for things that have not changed
313,2017-10-17 07:13:58.000000000,2018-05-17 10:57:12.000000000,closed,2,serverless-offline without skipCacheInvalidation option specified does not play well with serverless-webpack
312,2017-10-13 00:16:50.000000000,2017-10-13 05:16:25.000000000,closed,3,Serverless-offline: route not found.
311,2017-10-10 12:43:55.000000000,2018-05-17 10:57:00.000000000,closed,1,Request for information: firing a server grammatically for tests
310,2017-10-09 15:07:20.000000000,2018-10-04 13:12:35.000000000,closed,1,Serverless offline merges headers of differing case
309,2017-10-03 23:02:48.000000000,2018-02-07 00:44:36.000000000,closed,1,Include environment variables defined for the authorizer function when the authorizer function runs.
308,2017-10-03 18:30:26.000000000,2017-10-03 22:47:23.000000000,closed,0,Can't start anymore in newest version
307,2017-10-03 11:13:29.000000000,2018-05-20 10:23:05.000000000,closed,0,FIXED: Random requestId generation.
306,2017-10-01 17:40:30.000000000,2018-02-18 04:03:06.000000000,closed,3,Conent-Encoding gzip handling in serverless-offline
305,2017-09-12 19:03:13.000000000,2018-05-17 11:09:14.000000000,closed,3,event.headers is empty
304,2017-09-11 17:44:12.000000000,2018-10-23 17:03:33.000000000,closed,24,Looking for maintainers
303,2017-09-10 13:45:50.000000000,2018-03-26 10:58:10.000000000,closed,2,Start offline to the background
302,2017-09-07 20:58:53.000000000,2017-09-18 12:01:25.000000000,closed,2,Don't swallow error message when creating auth function handler
301,2017-09-04 04:21:40.000000000,2018-05-28 21:38:10.000000000,closed,6,Fix default response template
300,2017-09-02 23:08:05.000000000,2018-05-17 11:11:59.000000000,closed,6,Debug in Docker
299,2017-08-30 06:37:55.000000000,2018-04-25 17:08:02.000000000,closed,7,Support another HTTP Proxy methods
298,2017-08-30 06:36:21.000000000,2018-04-25 17:08:02.000000000,closed,0,Support other HTTP Proxy Methods
297,2017-08-29 12:11:45.000000000,2019-06-02 18:36:32.000000000,closed,3,Debug cache invalidation issues
296,2017-08-28 17:21:29.000000000,2018-05-17 11:01:51.000000000,closed,0,Unsupported crypto package
295,2017-08-27 06:54:52.000000000,2018-05-28 21:36:56.000000000,closed,5,fixed bugs for unprocessedHeaders and headers
294,2017-08-24 19:24:40.000000000,2017-09-18 11:54:34.000000000,closed,3,Added --noAuth CLI option to disable Authorizer
293,2017-08-24 15:09:11.000000000,2018-02-18 04:07:56.000000000,closed,1,Debugging in node 8
292,2017-08-24 02:01:19.000000000,2017-09-18 11:53:31.000000000,closed,4,Added claims field to authorizer requestContext for lambdaProxyContex…
291,2017-08-24 01:33:56.000000000,2018-05-17 10:56:38.000000000,closed,1,Code not changing
290,2017-08-23 13:52:09.000000000,2018-09-20 18:53:45.000000000,closed,0,event undefined when using POST method
289,2017-08-23 00:36:28.000000000,2018-02-18 04:07:16.000000000,closed,4,Binary Media Types support?
288,2017-08-20 03:38:16.000000000,2018-01-15 23:12:49.000000000,closed,2,apiKey Created but never checked
287,2017-08-18 07:27:43.000000000,2017-09-18 11:52:13.000000000,closed,3,removed npm crypto from dependency and used node-native crypto
286,2017-08-17 00:51:42.000000000,2019-04-12 18:41:39.000000000,closed,3,How to configure response templates locally?
285,2017-08-10 18:23:33.000000000,2017-09-18 11:50:25.000000000,closed,3,Fix lambda integration returning just newlines for all lambda responses.
284,2017-08-10 17:27:05.000000000,2017-09-18 11:50:25.000000000,closed,3,lambda integration: all responses are empty due to default template file containing newline.
283,2017-08-10 14:13:46.000000000,2017-09-18 11:49:42.000000000,closed,11,Increase payload size limit from 1MB default to match AWS 10MB limit.
282,2017-08-10 14:12:59.000000000,2017-09-18 11:49:42.000000000,closed,4,Error due to arbitrary request size limit not reflecting AWS infra
281,2017-08-08 13:24:06.000000000,2017-08-10 05:49:40.000000000,closed,1,TypeError: BbPromise.config is not a function
280,2017-08-08 03:53:12.000000000,2017-09-05 11:25:12.000000000,closed,3,Support for Java 8 Runtime
279,2017-08-04 06:40:31.000000000,2017-09-18 11:48:53.000000000,closed,2,Remove stage prefix from auth event methodArn
278,2017-08-04 01:56:47.000000000,2017-08-04 01:59:03.000000000,closed,1,Difference in `event.methodArn` in authorizer between offline and API Gateway
277,2017-08-01 02:03:21.000000000,2018-11-30 18:09:53.000000000,closed,7,Cookie with JSON string value considered invalid by Hapi/Statehood
276,2017-07-28 17:17:00.000000000,2019-06-02 18:29:51.000000000,closed,3,Only unprocessed headers in API Gateway event since v3.15.3
275,2017-07-27 01:11:49.000000000,2017-07-27 01:48:53.000000000,closed,1,Add license scan report and status
274,2017-07-24 19:13:10.000000000,2017-07-26 21:22:24.000000000,closed,2,methodArn should contain request.path
273,2017-07-24 19:03:44.000000000,2017-07-26 21:23:15.000000000,closed,2,"methodArn should contain request.path, not endpointPath"
272,2017-07-22 14:06:11.000000000,2018-02-18 04:06:42.000000000,closed,1,Use without AWS account
271,2017-07-22 00:59:05.000000000,2017-07-26 21:22:24.000000000,closed,9,Ensure path parameters are url encoded to match aws behavior
270,2017-07-20 19:31:35.000000000,2017-07-26 21:23:59.000000000,closed,2,Any videos on line debugging with serverless-offline?
269,2017-07-14 23:03:30.000000000,2017-07-15 16:54:38.000000000,closed,1,updates protectedRoutes logic to include request method
268,2017-07-14 22:10:15.000000000,2017-07-15 16:54:38.000000000,closed,0,API key protected routes do not include the request method
267,2017-07-13 23:50:31.000000000,2017-07-15 16:53:41.000000000,closed,2,Add apiId to requestContext
266,2017-07-12 14:01:38.000000000,2017-07-27 00:01:30.000000000,closed,7,How to show console.log statements locally?
265,2017-07-11 17:03:26.000000000,2017-07-26 21:22:24.000000000,closed,6,Discrepancy between how serverless offline and AWS handles encoding in path params
264,2017-07-06 13:47:12.000000000,2019-09-14 16:02:59.000000000,closed,11,Faking a Cognito user pool authorizer
263,2017-07-06 12:39:58.000000000,2017-07-06 16:30:26.000000000,closed,1,Service wide environment variables passed on in authorizer
262,2017-07-05 18:20:46.000000000,2017-07-06 16:26:20.000000000,closed,2,:wrench: Implement HTTP Proxy
261,2017-07-05 18:19:41.000000000,2017-07-06 16:31:01.000000000,closed,1,Allow offline to serve static files by using HTTP proxies.
260,2017-07-01 04:00:34.000000000,2018-05-28 21:48:41.000000000,closed,11,Headers in production and offline are different
259,2017-06-28 15:11:33.000000000,2019-06-02 16:57:03.000000000,closed,1,Set process.env in shell script
258,2017-06-26 06:53:42.000000000,2017-07-06 16:54:28.000000000,closed,19,"Mongoose & serverless offline ""Cannot overwrite model once compiled."""
257,2017-06-22 09:01:57.000000000,2017-07-06 17:04:56.000000000,closed,1,"callback data without JSON.stringify(data) works locally, but fails in production"
256,2017-06-19 17:00:54.000000000,2018-11-30 18:08:43.000000000,closed,3,Sls offline get Internal Server Error after update to 3.14.2
255,2017-06-16 21:00:57.000000000,2017-07-26 21:22:25.000000000,closed,9,Server crashes on unhandled promise rejection
254,2017-06-09 17:35:49.000000000,2017-06-14 17:32:10.000000000,closed,1,Assign process.env per function calls. 
253,2017-06-09 12:06:56.000000000,2017-06-14 17:26:39.000000000,closed,1,Create README.md
252,2017-06-08 10:05:00.000000000,2018-05-17 10:55:56.000000000,closed,2,Create / integrate hello-world example
251,2017-05-31 23:33:14.000000000,2017-06-02 12:41:55.000000000,closed,1,add support for nodejs6.10 into serverless_0.5
250,2017-05-30 22:59:49.000000000,2017-06-03 18:39:38.000000000,closed,4,Disabling node socket timeout
249,2017-05-30 17:21:04.000000000,2017-06-02 12:38:50.000000000,closed,1,fix typos
248,2017-05-23 17:15:45.000000000,1970-01-01 00:00:00.000000001,open,1,Offline does not response cache-control header
247,2017-05-23 16:59:29.000000000,2017-05-29 12:12:31.000000000,closed,2,Add test for default content-type and content-size
246,2017-05-22 10:54:12.000000000,2017-07-06 16:54:21.000000000,closed,2,Issues after first request
245,2017-05-19 15:07:35.000000000,2019-12-12 08:06:05.000000000,closed,1,"AWS Lambda ""hidden"" limits"
244,2017-05-08 21:34:58.000000000,2017-05-09 02:57:25.000000000,closed,3,Added support for authorizer type `AWS_IAM`
243,2017-05-04 15:31:13.000000000,2017-07-10 18:35:42.000000000,closed,2,serverless-webpack not called when using serverless offline start
242,2017-04-28 22:45:28.000000000,2018-08-16 15:29:21.000000000,closed,4,Handler path with dot in folder can't find handler
241,2017-04-24 03:45:17.000000000,2017-04-25 05:14:19.000000000,closed,5,Added ignore the authorizer for the non custom authorizers.
240,2017-04-23 07:37:32.000000000,2018-11-30 18:08:17.000000000,closed,3,Cognito authoriser destroys routes
239,2017-04-20 14:59:58.000000000,2017-04-24 16:06:25.000000000,closed,2,fix setting default for identitySource
238,2017-04-19 06:38:33.000000000,2017-04-24 16:03:52.000000000,closed,2,Added short-circuit guard against functions that have no events
237,2017-04-18 04:28:34.000000000,2017-07-06 17:02:35.000000000,closed,6,"event.body is undefined on serverless-offline, but works on Lambda."
236,2017-04-17 10:16:42.000000000,2017-07-26 21:32:44.000000000,closed,2,Discrepancy between Lambda+API Gateway and serverless-offline for some headers
235,2017-04-13 17:52:21.000000000,2019-07-07 18:14:05.000000000,closed,6,Offline SNS to invoke lambda
234,2017-04-12 13:06:40.000000000,2017-07-06 17:01:40.000000000,closed,4,Any chance of a gitter or discord room to discuss about this?
233,2017-04-11 19:16:33.000000000,2017-07-06 16:55:01.000000000,closed,2,Deploy babel transpiled functions
232,2017-04-10 08:26:34.000000000,2017-04-13 06:55:08.000000000,closed,2,"handler works the first time. Gets a ""retryDelay"" error every call thereafter"
231,2017-04-07 19:17:41.000000000,2017-04-27 06:29:56.000000000,closed,2,Serverless Offline should support long format for specifying an authorizer
230,2017-04-05 11:01:57.000000000,2018-04-12 15:43:33.000000000,closed,15,Payload conversion converts data to utf8
229,2017-04-05 04:15:05.000000000,2017-04-06 12:53:10.000000000,closed,2,Support new runtime nodejs6.10 of the last serverless and lambda versions
228,2017-04-05 02:16:18.000000000,2017-04-11 15:55:41.000000000,closed,5,Add support to forbidden access if you deny on custom rule
227,2017-04-04 10:00:19.000000000,2017-04-04 12:01:44.000000000,closed,1,replaces fat arrows with functions so 'this' refers to global String object
226,2017-04-03 17:57:43.000000000,2017-04-14 11:53:16.000000000,closed,5,Move any packages to devDependencies?
225,2017-03-27 03:39:12.000000000,2017-04-19 07:01:14.000000000,closed,8,"AWS lambda-proxy return event.body URLencoded, but sls offline JSON encodes it"
224,2017-03-25 23:51:24.000000000,2017-03-27 17:05:44.000000000,closed,2,app - preventing hapi from parsing payloads; resolves #177.
223,2017-03-23 09:05:08.000000000,2017-03-23 11:46:31.000000000,closed,1,Added support for Node.js 6.10.
222,2017-03-23 08:55:01.000000000,2017-03-23 12:53:22.000000000,closed,1,Support for Node.js 6.10
