id,created_at,closed_at,state,comments,title
1025,2018-08-29 20:33:33.000000000,2018-09-10 18:53:36.000000000,closed,4,min-shards-available violations don't always result in http500
1024,2018-08-29 19:54:44.000000000,2020-04-11 15:39:02.000000000,closed,1,misc index notes for improvements
1023,2018-08-28 22:16:15.000000000,1970-01-01 00:00:00.000000001,open,11,update '/metrics/delete' to support deleting tagged metrics
1022,2018-08-28 19:05:35.000000000,2019-02-07 23:10:07.000000000,closed,10,Modify lag rate calculations
1021,2018-08-28 18:16:06.000000000,2018-10-11 13:53:45.000000000,closed,8,Limit series from clusterByFind operation
1020,2018-08-28 15:35:30.000000000,1970-01-01 00:00:00.000000001,open,0,Integrate automaxprocs ?
1019,2018-08-28 13:06:42.000000000,2018-08-30 17:24:19.000000000,closed,0,report RSS
1018,2018-08-28 10:52:20.000000000,2018-10-24 14:42:49.000000000,closed,2,peerQuerySpeculative should use a channel for responses
1017,2018-08-28 00:47:04.000000000,2018-09-14 20:33:09.000000000,closed,1,change cassandra timeout to duration var
1016,2018-08-27 16:42:13.000000000,2018-10-24 21:55:01.000000000,closed,1,Remove offest tracking in Kafka plugins
1015,2018-08-26 20:54:04.000000000,2018-09-29 21:32:43.000000000,closed,2,Benchmarks cluster queries
1014,2018-08-26 12:46:26.000000000,2018-09-17 11:24:10.000000000,closed,2,some shards down with min-available-shards=$all-shards -> some http 500 but also http 200
1013,2018-08-22 22:24:56.000000000,2019-03-27 15:48:14.000000000,closed,0,cluster-mode single vs multi is confusing
1012,2018-08-22 21:15:39.000000000,2018-08-22 21:39:32.000000000,closed,0,suffix filter for mt-index-cat
1011,2018-08-22 20:49:06.000000000,1970-01-01 00:00:00.000000001,open,2,v1 checklist
1010,2018-08-22 00:52:46.000000000,2018-08-30 21:25:32.000000000,closed,10,Block to submit accounting events
1009,2018-08-22 00:10:19.000000000,2018-08-25 02:05:34.000000000,closed,4,Find random corruptions
1008,2018-08-21 21:19:05.000000000,2020-07-16 20:25:26.000000000,closed,7,graphite dot munging overhaul
1007,2018-08-21 14:58:57.000000000,2020-04-11 15:39:00.000000000,closed,1,cleanup post-speculative execution querying
1006,2018-08-21 14:31:41.000000000,2018-08-21 17:59:00.000000000,closed,0,Fix chunk cache add range corruption
1005,2018-08-20 21:02:57.000000000,2018-08-20 21:48:09.000000000,closed,0,Update promql
1004,2018-08-20 20:17:23.000000000,2018-08-20 21:47:55.000000000,closed,0,Fix dep
1003,2018-08-20 15:12:19.000000000,2018-08-21 15:20:56.000000000,closed,0,Cass docs
1002,2018-08-19 15:04:15.000000000,2020-04-11 14:38:42.000000000,closed,6,Metricpoint batch format
1001,2018-08-15 20:43:04.000000000,2018-08-21 14:57:05.000000000,closed,1,speculative execution in cluster mode single leads to panic
1000,2018-08-15 18:48:03.000000000,2018-08-21 14:56:34.000000000,closed,5,Enable transport and client settings even in single mode
999,2018-08-15 16:49:47.000000000,2018-08-15 20:50:35.000000000,closed,1,slightly better error message.
998,2018-08-15 16:10:19.000000000,2018-08-15 18:07:59.000000000,closed,3,full functions overview
997,2018-08-14 22:35:43.000000000,2018-08-15 14:27:34.000000000,closed,0,"Add sortBy, sortByMaxima, and sortByTotal functions"
996,2018-08-14 22:14:09.000000000,2018-08-15 14:05:31.000000000,closed,0,Add derivative and nonNegativeDerivative functions
995,2018-08-14 19:50:46.000000000,2018-08-15 20:49:46.000000000,closed,6,Add keepLastValue function
994,2018-08-14 11:56:40.000000000,2018-08-15 01:05:48.000000000,closed,1,read from first chunks
993,2018-08-14 11:19:59.000000000,2018-08-21 15:20:58.000000000,closed,0,update docs/cassandra.md to reflect schema templates
992,2018-08-14 00:43:44.000000000,2018-08-15 20:48:51.000000000,closed,1,Add removeAbovePercentile and removeBelowPercentile functions
991,2018-08-13 21:15:19.000000000,2018-08-15 18:15:31.000000000,closed,4,fix logger again
990,2018-08-13 15:18:05.000000000,2018-08-15 12:56:08.000000000,closed,3,"Revert ""fix tests"""
989,2018-08-10 19:52:59.000000000,2019-03-27 15:48:14.000000000,closed,9,Support external query layer
988,2018-08-10 14:05:45.000000000,2018-08-15 01:05:48.000000000,closed,0,new data doesn't show up immediately
987,2018-08-09 21:35:51.000000000,2018-08-15 16:45:49.000000000,closed,4,Fix http4608
986,2018-08-09 20:10:02.000000000,2018-08-21 13:55:37.000000000,closed,4,Ignore chunk cache on corruption
985,2018-08-09 18:23:32.000000000,2020-04-06 11:43:42.000000000,closed,10,Transparent peer retry for certain peer status codes
984,2018-08-09 17:42:52.000000000,2018-08-15 16:50:39.000000000,closed,3,Metrictank Peer sometimes returns http code 4608
983,2018-08-09 00:25:51.000000000,2020-05-19 14:00:27.000000000,closed,4,Timestamps returned with small MaxDataPoints value are completely wrong
982,2018-08-08 17:52:00.000000000,2020-04-11 14:38:59.000000000,closed,6,slow query log
981,2018-08-07 19:37:23.000000000,2018-08-13 14:47:36.000000000,closed,0,Add removeAboveValue and removeBelowValue functions
980,2018-08-07 19:36:15.000000000,2018-08-13 13:56:33.000000000,closed,1,Add filterSeries function 
979,2018-08-07 04:47:39.000000000,2018-08-07 19:37:22.000000000,closed,0,Speculative execution fixes
978,2018-08-07 02:17:54.000000000,2020-04-11 15:38:54.000000000,closed,1,MembersForSpeculativeQuery assumes priorities don't change
977,2018-08-07 02:00:57.000000000,2020-04-11 15:38:53.000000000,closed,1,MembersForSpeculativeQuery load balancing suboptimal
976,2018-08-07 00:53:31.000000000,2018-08-07 21:05:52.000000000,closed,0,"Revert ""Speculative queries"""
975,2018-08-06 23:35:16.000000000,2018-08-07 19:10:02.000000000,closed,0,no need to clean plan as no data is loaded
974,2018-08-02 23:37:15.000000000,2018-08-13 12:41:01.000000000,closed,0,Add countSeries function
973,2018-08-02 00:20:40.000000000,2018-08-02 01:09:36.000000000,closed,0,fix tests
972,2018-08-02 00:04:05.000000000,2018-08-02 00:15:53.000000000,closed,1,update schema.v1
971,2018-08-01 20:33:02.000000000,2018-08-14 19:16:45.000000000,closed,3,Implement highest and lowest function families
970,2018-08-01 20:07:31.000000000,2018-08-07 19:54:31.000000000,closed,2,Add scaleToSeconds function 
969,2018-07-31 00:04:24.000000000,2018-08-02 00:09:18.000000000,closed,5,Regen for test check
968,2018-07-28 00:13:50.000000000,2018-10-11 13:53:44.000000000,closed,2,Metrictank OOM due to expensive queries
967,2018-07-27 02:31:46.000000000,2018-09-18 16:29:21.000000000,closed,2,Chunk Cache Corruption causes request failures
966,2018-07-27 00:17:56.000000000,2018-08-14 19:29:17.000000000,closed,25,Add asPercent function
965,2018-07-26 23:09:29.000000000,2020-04-11 11:38:53.000000000,closed,13,add index count api call
964,2018-07-25 23:41:02.000000000,2018-07-26 17:24:08.000000000,closed,1,update gziper to latest master
963,2018-07-19 21:58:19.000000000,2018-08-14 21:03:35.000000000,closed,9,account for the cap() of byte slices in ccache
962,2018-07-16 12:46:16.000000000,1970-01-01 00:00:00.000000001,open,8,pointSlicePool issues
961,2018-07-13 03:32:32.000000000,2018-07-25 23:35:26.000000000,closed,2,Add show plan endpoint
960,2018-07-11 23:35:21.000000000,2019-06-10 17:24:02.000000000,closed,1,[wip] Meta Tag Index
959,2018-07-09 22:59:33.000000000,2018-07-20 00:31:04.000000000,closed,5,Add isNonNull function
958,2018-06-29 22:41:48.000000000,2019-06-10 23:22:49.000000000,closed,2,Point slice pool fixes
957,2018-06-29 01:43:29.000000000,2018-06-29 19:45:52.000000000,closed,0,fix pointsReturn to consider MaxDataPoints based consolidation
956,2018-06-28 23:37:55.000000000,2018-07-25 23:58:37.000000000,closed,8,Speculative queries
955,2018-06-28 22:44:10.000000000,2018-08-13 15:06:02.000000000,closed,0,log response sizes for all response types
954,2018-06-28 01:10:18.000000000,2018-07-26 17:42:00.000000000,closed,1,Support speculative / failover querying to peers
953,2018-06-27 23:43:34.000000000,2018-06-28 15:07:37.000000000,closed,0,Fix points return measurement overflow
952,2018-06-27 22:57:01.000000000,2018-07-25 23:35:57.000000000,closed,3,Persist partition
951,2018-06-26 23:14:29.000000000,2020-01-30 15:12:10.000000000,closed,7,"remove excessive request alignment, add MDP optimization and pre-normalisation"
950,2018-06-26 01:40:19.000000000,2018-07-25 23:35:56.000000000,closed,2,kafka-cluster partitions don't necessarily match kafka-mdm-in partitions
949,2018-06-22 14:03:29.000000000,2018-07-31 01:41:24.000000000,closed,0,fix issue 946
948,2018-06-22 08:02:09.000000000,2018-10-29 16:46:50.000000000,closed,5,cluster: drop node updates that are old or about thisNode
947,2018-06-21 00:29:10.000000000,2018-10-29 16:46:50.000000000,closed,2,sometimes pod doesn't become ready. I think because of problem with .State attribute
946,2018-06-16 00:42:25.000000000,2018-07-31 01:41:24.000000000,closed,1,Race condition in `FindTags`
945,2018-06-14 19:26:57.000000000,2018-08-27 18:22:20.000000000,closed,10,Use atomic operations and a read lock instead of a write lock
944,2018-06-14 12:22:32.000000000,2018-12-14 23:31:27.000000000,closed,7,flag.Duration and flag.DurationVar parse errors not handled properly
943,2018-06-13 14:37:33.000000000,2018-06-19 00:39:07.000000000,closed,4,chunk cache perf fixes: AddRange + batched accounting
942,2018-06-13 12:31:41.000000000,2020-04-11 14:38:55.000000000,closed,5,"Failed to submit event to accounting, channel was blocked"
941,2018-06-12 00:29:05.000000000,2019-02-13 14:22:13.000000000,closed,1,which characters are valid in tag values
940,2018-06-08 23:33:28.000000000,2018-06-13 14:38:00.000000000,closed,1,[WIP] Add method to cache many chunks at once
939,2018-06-08 22:47:22.000000000,2018-06-09 00:48:47.000000000,closed,0,fix go get tutorials
938,2018-06-08 19:41:12.000000000,2018-06-09 01:18:36.000000000,closed,1,go get path
937,2018-06-08 15:24:09.000000000,2020-04-11 14:38:40.000000000,closed,1,mt-store-cat pointSummary doesn't print metric name anymore
936,2018-06-07 17:45:45.000000000,2018-06-07 17:47:03.000000000,closed,0,Misc
935,2018-06-07 14:17:56.000000000,2018-06-08 10:14:37.000000000,closed,1,move metrictank.go to cmd directory
934,2018-06-07 06:52:43.000000000,2018-06-07 21:58:25.000000000,closed,3,set jaeger-client-go source path and updates vendor
933,2018-06-07 06:11:56.000000000,2018-06-07 21:58:25.000000000,closed,1,cant run `dep ensure` due to uber/jaeger-tracing no longer existing
932,2018-06-06 16:00:28.000000000,2018-06-07 10:42:52.000000000,closed,0,endpoint for analyzing priority calculation
931,2018-06-06 14:02:54.000000000,2018-06-16 15:27:58.000000000,closed,5,refactor cassandra read queries
930,2018-06-05 17:42:16.000000000,2018-10-24 13:37:41.000000000,closed,3,no need for jaeger tracing on health checks
929,2018-06-04 18:32:43.000000000,2018-06-04 19:02:38.000000000,closed,0,export getFromTo() so it can be used in other projects
928,2018-05-31 01:02:29.000000000,2018-06-04 21:22:49.000000000,closed,6,Fix summarize function
927,2018-05-30 13:13:21.000000000,2018-06-07 10:43:10.000000000,closed,1,Doc updates
926,2018-05-29 22:49:38.000000000,2020-02-06 15:55:29.000000000,closed,9,alignRequests is too coarse grained (for timeshift functions etc)
925,2018-05-28 14:58:31.000000000,2018-06-07 14:08:08.000000000,closed,6,Cassandra config
924,2018-05-24 17:22:36.000000000,2018-10-24 12:00:05.000000000,closed,5,make index pruning configurable via index-rules.conf
923,2018-05-23 11:23:17.000000000,2018-06-08 10:14:37.000000000,closed,0,metrictank.go should be moved to cmd/metrictank/
922,2018-05-23 11:02:05.000000000,2018-05-28 13:58:05.000000000,closed,2,update to work with cosmosdb
921,2018-05-23 10:56:50.000000000,2018-05-23 18:09:58.000000000,closed,0,mode to print only invalid data
920,2018-05-21 11:14:32.000000000,2018-05-21 19:01:33.000000000,closed,0,Counter rate
919,2018-05-20 23:05:31.000000000,2018-05-21 01:35:44.000000000,closed,1,Timestamp fixes etc 
918,2018-05-18 22:57:22.000000000,2018-05-28 15:40:38.000000000,closed,8,set deadline before stats write/read
917,2018-05-18 15:11:17.000000000,2018-05-21 10:30:12.000000000,closed,0,Fix panic and convey assertion
916,2018-05-18 13:52:45.000000000,2018-05-20 23:02:20.000000000,closed,0,Timestamp fixes etc
915,2018-05-17 22:46:16.000000000,2018-05-18 16:00:40.000000000,closed,1,Timestamp fixes
914,2018-05-17 16:37:48.000000000,2018-05-17 18:27:36.000000000,closed,0,mark summarize as unstable.
913,2018-05-17 14:30:22.000000000,2019-09-12 01:32:50.000000000,closed,4,interval change resulting in unequal length series triggering panic in mergeSeries
912,2018-05-16 00:17:43.000000000,2018-05-21 01:35:46.000000000,closed,1,"errors like ""invalid request. to must > from"""
911,2018-05-15 21:35:13.000000000,2018-05-16 11:21:38.000000000,closed,0,support some long spans
910,2018-05-14 14:34:41.000000000,1970-01-01 00:00:00.000000001,open,2,Msgpack int/uint interoperation problem in kafka-mdm input
909,2018-05-11 02:07:18.000000000,2018-09-06 18:26:13.000000000,closed,5,Provide a tool to copy data between Cassandra clusters
908,2018-05-09 13:30:26.000000000,2018-05-29 21:53:16.000000000,closed,1,stats library very slow to reconnect when graphite endpoint goes down
907,2018-05-08 15:28:34.000000000,2018-05-14 21:23:33.000000000,closed,2,data disappears
906,2018-05-04 16:27:46.000000000,2018-05-15 21:23:39.000000000,closed,7,Sarama update
905,2018-05-04 13:20:45.000000000,2018-05-16 10:36:49.000000000,closed,0,update to new tsdbgw that uses sarama again
904,2018-05-03 17:00:13.000000000,2018-05-03 21:27:04.000000000,closed,2,support adding arbitrary extra tags in jaeger traces
903,2018-05-02 21:43:53.000000000,2018-06-04 21:22:49.000000000,closed,6,summarize function returning incorrect results
902,2018-05-02 21:20:29.000000000,2020-04-11 15:38:52.000000000,closed,2,metricpersist format optimization
901,2018-05-02 19:29:21.000000000,2018-05-02 19:59:36.000000000,closed,0,fix path to storage-schemas.conf
900,2018-05-02 19:16:31.000000000,2018-05-15 21:25:56.000000000,closed,1,"upgrade to latest sarama, confirm stability with our current kafka and newer versions"
899,2018-04-30 22:26:39.000000000,2020-04-11 15:38:51.000000000,closed,1,MemoryIdx.FindByTag doesn't handle publicOrgId properly
898,2018-04-27 17:16:18.000000000,2018-05-02 23:58:28.000000000,closed,1,Schema templates + scylladb docker stack
897,2018-04-26 22:00:30.000000000,2018-05-16 17:25:27.000000000,closed,5,Fix multi-interval series issue
896,2018-04-23 13:06:01.000000000,2018-04-25 18:33:59.000000000,closed,0,Fix chunks - not for merging
895,2018-04-20 23:38:12.000000000,2018-04-30 22:18:03.000000000,closed,0,Accept bool strings for ArgBool
894,2018-04-20 21:23:06.000000000,2018-04-20 22:06:29.000000000,closed,1,Fix archive conversion by increasing space for span id
893,2018-04-20 13:28:43.000000000,2018-04-20 13:56:28.000000000,closed,1,better GC related instrumentation
892,2018-04-17 20:39:11.000000000,2018-04-27 17:17:44.000000000,closed,1,Extract CQL vars into toml templates
891,2018-04-17 13:48:45.000000000,2018-04-17 14:22:33.000000000,closed,0,report MetricPoint and MetricPointWithoutOrg separately
890,2018-04-17 10:23:02.000000000,2018-04-17 14:08:51.000000000,closed,0,sync configs for new org-id kafka option
889,2018-04-13 13:24:54.000000000,2018-04-13 14:18:57.000000000,closed,1,Version was invalid for dpkg based packages used tag-commitssincetag
888,2018-04-12 12:01:15.000000000,2018-05-02 23:58:30.000000000,closed,4,Feature: Use scylladb as C* compatible storage backend
887,2018-04-12 11:54:54.000000000,2018-04-13 14:18:01.000000000,closed,3,debian package are not installable (tried on jessie and stretch)
886,2018-04-11 22:01:12.000000000,2018-04-12 17:34:46.000000000,closed,0,reduce default kafka-mdm channel-buffer-size
885,2018-04-11 16:24:03.000000000,2018-04-13 10:06:25.000000000,closed,0,Orgid uint
884,2018-04-11 11:56:29.000000000,2018-04-11 12:04:38.000000000,closed,0,Membersforquery fixes2
883,2018-04-10 11:09:10.000000000,2018-04-10 12:09:57.000000000,closed,1,Configurable publicorgid
882,2018-04-09 00:13:04.000000000,2018-04-09 18:43:57.000000000,closed,0,allow org-id 0
881,2018-04-05 22:13:11.000000000,2018-05-09 00:27:33.000000000,closed,4,add graphite stats to import reader
880,2018-03-30 18:30:20.000000000,2018-04-04 19:58:33.000000000,closed,3,public orgId -1 -> 0 and related cleanups
879,2018-03-23 00:22:51.000000000,2018-05-15 21:25:41.000000000,closed,23,Use Confluent and move the kafka-consumers into one consumer struct
878,2018-03-20 17:23:22.000000000,2018-03-22 20:46:25.000000000,closed,3,Dual-license for smaller parts of metrictank
877,2018-03-19 14:03:49.000000000,2018-04-11 11:39:11.000000000,closed,4,"remove deprecated ""safety feature"" in CassandraIdx"
876,2018-03-16 17:08:00.000000000,2018-04-11 09:34:00.000000000,closed,8,Optimize kafka format
875,2018-03-16 15:08:55.000000000,1970-01-01 00:00:00.000000001,open,5,msgp: too few bytes left to read object
874,2018-03-16 14:47:31.000000000,2019-09-12 01:32:50.000000000,closed,2,different-sized series causing panic in seriesaggregator
873,2018-03-16 12:34:27.000000000,2020-04-11 10:38:33.000000000,closed,1,"now that grafana supports visualizing graphite histograms, send the data"
872,2018-03-15 22:34:00.000000000,2018-03-15 22:52:33.000000000,closed,0,use nameWithTags to match schema by pattern
871,2018-03-15 21:44:01.000000000,2018-03-15 21:59:56.000000000,closed,0,fix panic in GC
870,2018-03-15 21:32:31.000000000,2018-10-24 19:57:18.000000000,closed,1,panic during shutdown flow
869,2018-03-15 00:20:41.000000000,2018-03-15 18:59:27.000000000,closed,1,Issue 844
868,2018-03-14 15:32:19.000000000,2018-10-24 12:00:07.000000000,closed,1,cassandra-idx-max-stale configurable via patterns
867,2018-03-08 22:52:50.000000000,2018-04-30 22:18:03.000000000,closed,4,ArgBool not compatible with graphite
866,2018-03-08 22:37:53.000000000,2020-04-11 11:38:59.000000000,closed,6,"offset ""auto"" does not work as expected"
865,2018-03-08 00:53:28.000000000,2020-04-11 15:38:48.000000000,closed,4,"Better support for ephemeral time-series / ""series churn"""
864,2018-03-08 00:39:36.000000000,2019-05-01 22:10:35.000000000,closed,6,"Support a ""Show plan"" endpoint with cost estimation"
863,2018-03-07 19:49:35.000000000,2018-03-07 20:54:24.000000000,closed,2,getOffset.py can set a negative offset
862,2018-03-06 23:39:34.000000000,2018-08-20 21:48:10.000000000,closed,2,bogus test flags in usage output of some of our executables
861,2018-03-06 14:14:39.000000000,2018-03-07 14:45:54.000000000,closed,0,"when duration kafka offset fails, fall back to oldest"
860,2018-03-05 18:18:55.000000000,2018-03-07 14:45:56.000000000,closed,5,MT cant start if it has no data in kafka and kafka-mdm-in-offset=auto
859,2018-03-02 00:57:17.000000000,2020-04-11 11:38:42.000000000,closed,2,Feature Request: Kinesis ingestion support
858,2018-02-27 18:54:34.000000000,2018-03-07 01:25:34.000000000,closed,1,Promql integration v2
857,2018-02-27 00:57:56.000000000,2018-04-11 12:04:38.000000000,closed,0,Membersforquery fixes was never merged
856,2018-02-27 00:46:19.000000000,2018-03-07 01:28:47.000000000,closed,0,update clustering docs
855,2018-02-23 23:46:16.000000000,2018-10-11 14:58:08.000000000,closed,0,clean target
854,2018-02-21 13:48:55.000000000,2018-04-11 11:49:09.000000000,closed,4,move tsdb-gw into metrictank
853,2018-02-21 13:45:12.000000000,2020-04-11 15:38:51.000000000,closed,3,Handle malformed messages consumed from Kafka
852,2018-02-16 19:57:04.000000000,2018-03-06 23:30:21.000000000,closed,6,WIP: Promql integration
851,2018-02-14 14:58:03.000000000,2018-02-16 11:01:41.000000000,closed,2,move backend stores into their own package
850,2018-02-13 23:41:26.000000000,2018-02-22 17:21:18.000000000,closed,2,set kafka offset to retention - segmentSize
849,2018-02-11 15:45:38.000000000,2018-04-11 09:36:19.000000000,closed,10,WIP: Automatic detection of metric interval
848,2018-02-10 02:36:15.000000000,2018-02-19 23:38:09.000000000,closed,4,Initial tag query performance improvements
847,2018-02-09 00:13:38.000000000,2018-02-26 20:09:51.000000000,closed,1,Added missing batch/agg functions
846,2018-02-08 13:00:36.000000000,2018-02-08 13:02:50.000000000,closed,0,tagdb routes need to have the same prefix
845,2018-02-07 19:21:38.000000000,2018-03-15 22:52:33.000000000,closed,7,"Support tag expressions in storage-{aggregations,schemas}.conf"
844,2018-02-07 05:53:17.000000000,2018-03-15 18:59:28.000000000,closed,5,GC task too eagerly closes chunks
843,2018-02-06 04:44:40.000000000,2018-02-22 21:08:20.000000000,closed,1,mt-update-ttl multithreaded + more
842,2018-02-03 00:40:06.000000000,2020-07-13 14:21:02.000000000,closed,4,Multi-series requests result in a lot of round-trips to peers
841,2018-01-31 22:11:08.000000000,2018-02-19 15:08:43.000000000,closed,0,fix bad argument error display
840,2018-01-31 01:03:53.000000000,2018-03-08 18:09:24.000000000,closed,3,Make sure rollup data is persisted before GC
839,2018-01-30 23:01:00.000000000,2018-01-31 13:38:25.000000000,closed,2,Fix crashing when non-configured consolidation function used
838,2018-01-30 15:30:14.000000000,2020-04-11 15:38:59.000000000,closed,1,from-based filtering for index searching prevents certain null-query alerts from working
837,2018-01-29 20:21:19.000000000,2018-03-08 18:28:55.000000000,closed,20,Add support for `summarize`
836,2018-01-28 02:31:11.000000000,2018-01-31 03:00:27.000000000,closed,1,Fix broken consolidation
835,2018-01-27 23:06:13.000000000,2018-01-31 13:38:25.000000000,closed,2,Metrictank crashes when asking for an aggregation that doesn't exist
834,2018-01-26 01:50:27.000000000,2018-03-08 18:09:24.000000000,closed,6,Rollups can get lost if data stops being published for a long interval
833,2018-01-25 03:19:50.000000000,2018-01-31 02:51:39.000000000,closed,4,Add support for `divideSeriesLists`
832,2018-01-24 23:15:51.000000000,2018-01-31 12:33:04.000000000,closed,0,mt binaries should be in /usr/bin not /usr/sbin
831,2018-01-24 23:07:18.000000000,2018-01-30 20:32:16.000000000,closed,1,build metrictank-gcr docker image automatically in MT repo
830,2018-01-24 17:02:22.000000000,2018-04-11 11:15:07.000000000,closed,5,Refactor chaos dir to stacktest dir
829,2018-01-23 23:56:57.000000000,2020-05-22 18:21:00.000000000,closed,3,"Some functions modify series' in place, which effects names in other functions"
828,2018-01-23 00:12:06.000000000,2018-01-23 00:12:14.000000000,closed,0,WIP: feature/summarize
827,2018-01-22 23:10:37.000000000,2018-01-23 22:18:55.000000000,closed,9,Add support for `sortByName`
826,2018-01-19 23:33:29.000000000,2018-01-22 16:37:37.000000000,closed,2,Add functions `grep` and `exclude`
825,2018-01-19 21:57:01.000000000,2018-01-22 22:18:08.000000000,closed,0,Init Logger before Configs
824,2018-01-19 00:06:18.000000000,2018-01-19 19:24:02.000000000,closed,0,New funcs
823,2018-01-18 23:12:57.000000000,2018-01-19 21:43:57.000000000,closed,3,Init Logger before Configs
822,2018-01-18 13:30:03.000000000,2020-07-29 15:01:18.000000000,closed,7,better way to do api/rpc
821,2018-01-16 09:27:19.000000000,2018-01-16 23:51:51.000000000,closed,0,export mdata.ChunkWriteRequest fields
820,2018-01-15 13:25:20.000000000,2018-01-31 12:33:03.000000000,closed,0,binaries should go in /usr/bin not /usr/sbin
819,2018-01-12 14:07:51.000000000,2018-05-15 16:36:08.000000000,closed,1,replace sarama with confluent-kafka-go
818,2018-01-11 18:10:31.000000000,2018-09-14 20:33:09.000000000,closed,3,poorly formatted cassandra-timeout value results in 0
817,2018-01-10 21:16:03.000000000,2018-01-11 18:55:00.000000000,closed,0,mt-index-cat tags valid filter
816,2018-01-10 17:11:21.000000000,2018-01-11 02:19:11.000000000,closed,1,only prune metrics where all MDs of name are stale
815,2018-01-10 14:40:07.000000000,2018-01-10 22:49:41.000000000,closed,0,proxy /functions to graphite
814,2018-01-09 18:54:21.000000000,2018-01-11 02:19:43.000000000,closed,0,keep import position in whisper reader
813,2018-01-09 14:03:11.000000000,2018-01-11 02:19:12.000000000,closed,0,historical data is lost after a restart when the series interval has changed
812,2018-01-08 17:07:57.000000000,2018-01-24 17:18:51.000000000,closed,5,add clauses to detect nil Node's in idx.Find
811,2018-01-04 16:50:31.000000000,1970-01-01 00:00:00.000000001,open,9,PANIC: runtime error: invalid memory address or nil pointer dereference
810,2018-01-03 23:39:32.000000000,2018-01-23 14:03:25.000000000,closed,3,split up circleCI jobs into parallel workflows
809,2018-01-03 20:09:02.000000000,2018-01-04 16:21:54.000000000,closed,6,increased memory consumption after upgrade
808,2018-01-03 17:33:29.000000000,2018-01-10 22:49:09.000000000,closed,1,Membersforquery fixes
807,2017-12-30 03:21:19.000000000,2018-01-05 20:56:31.000000000,closed,1,better CI ?
806,2017-12-29 19:24:52.000000000,2018-01-23 13:55:34.000000000,closed,9,No tags in tree index
805,2017-12-29 19:20:36.000000000,2017-12-29 21:13:00.000000000,closed,0,cleanup
804,2017-12-28 20:28:07.000000000,2017-12-29 16:20:58.000000000,closed,0,ROB tweaks
803,2017-12-26 19:41:57.000000000,2018-01-02 17:57:49.000000000,closed,5,reorganize scripts + switch to circleCI 2.0 + various new qa scripts and their corresponding fixes
802,2017-12-26 17:05:23.000000000,2017-12-30 17:02:18.000000000,closed,2,do something with err
801,2017-12-25 14:00:47.000000000,2017-12-25 17:49:12.000000000,closed,1,panic during kafka problem
800,2017-12-23 05:17:16.000000000,2017-12-27 15:38:30.000000000,closed,0,"if max-stale 0, load all series into mem instead of none"
799,2017-12-21 20:57:41.000000000,2017-12-27 08:04:37.000000000,closed,1,prune correctly when series is both leaf and branch
798,2017-12-21 19:45:04.000000000,2018-01-23 13:55:34.000000000,closed,2,Remove tagged series from tree index
797,2017-12-21 18:57:04.000000000,2017-12-27 08:04:37.000000000,closed,0,statMetricsActive is incorrect because we prune recursively.
