id,created_at,closed_at,state,comments,title
570,2017-03-17 22:09:58.000000000,2017-03-21 00:08:39.000000000,closed,0,Graphitey consolidation step and 3 (redo)
569,2017-03-17 21:45:45.000000000,2017-03-28 17:18:53.000000000,closed,7,559 deterministic update distribution
568,2017-03-17 01:41:34.000000000,2017-03-27 06:40:21.000000000,closed,8,Backfilling data results in metricDef writes to cassandra for every metric received
567,2017-03-17 00:28:43.000000000,2020-04-11 11:38:38.000000000,closed,1,carbon-in partition validation broken?
566,2017-03-16 02:42:25.000000000,2017-03-16 15:21:08.000000000,closed,2,Idx adds updates can only succeed
565,2017-03-15 22:49:48.000000000,2017-03-17 02:32:31.000000000,closed,6,Optionally disable cassidx update
564,2017-03-15 19:17:18.000000000,2017-03-20 14:25:15.000000000,closed,8,Org query to ALL does not work with -1
563,2017-03-15 17:52:36.000000000,2020-04-11 14:38:38.000000000,closed,1,nicer rendering of timestamps in tools like mt-index-cat
562,2017-03-13 22:31:52.000000000,2017-03-16 00:27:16.000000000,closed,2,support msgp output for render responses
561,2017-03-08 19:42:19.000000000,2017-03-27 06:41:40.000000000,closed,2,"when writing old data, we hammer cassandra index with metricdef updates"
560,2017-03-08 19:23:04.000000000,2017-03-15 16:05:37.000000000,closed,2,add metricdefs to cassandra if memory idx DID succeed
559,2017-03-07 23:27:02.000000000,2017-03-27 06:41:52.000000000,closed,6,Use deterministic method to distribute across fuzziness window
558,2017-03-07 23:23:17.000000000,2017-03-07 23:41:00.000000000,closed,0,fix metricDef fuzzy formula
557,2017-03-01 03:26:42.000000000,2017-03-17 22:25:13.000000000,closed,16,WIP Graphitey consolidation step 2 and 3
556,2017-02-28 02:34:27.000000000,2017-03-01 13:55:01.000000000,closed,0,Lil idx cleans
555,2017-02-27 18:11:42.000000000,2018-01-04 15:31:47.000000000,closed,14,Clear cache api
554,2017-02-27 11:20:29.000000000,2017-02-27 18:10:03.000000000,closed,0,Fix memory idx deletes
553,2017-02-24 20:57:48.000000000,2017-02-27 15:45:31.000000000,closed,0,fix lastUpdate filtering. fix #550
552,2017-02-24 17:41:52.000000000,2017-02-27 18:10:03.000000000,closed,0,[memory.go:507 delete()] [E] memory-idx: node <metric> missing. Index is corrupt.
551,2017-02-24 17:37:10.000000000,2017-02-24 17:40:05.000000000,closed,0,instrument how many series are being filtered from responses
550,2017-02-24 16:48:10.000000000,2017-02-27 15:45:33.000000000,closed,1,lastUpdate filtering not applied on clustered requests
549,2017-02-24 15:16:15.000000000,2020-04-11 15:38:58.000000000,closed,2,clean up api metrics not tied to a specific path
548,2017-02-24 00:30:31.000000000,2017-02-24 14:45:22.000000000,closed,1,Improve http stats
547,2017-02-23 21:58:44.000000000,1970-01-01 00:00:00.000000001,open,6,Improve cache efficiency / Reduce number of Cassandra queries
546,2017-02-23 18:36:57.000000000,2017-02-23 22:41:04.000000000,closed,0,Lag monitor better calc
545,2017-02-23 17:57:27.000000000,2017-02-24 14:45:22.000000000,closed,1,provide improved http request metrics
544,2017-02-23 16:42:40.000000000,2017-02-24 02:49:52.000000000,closed,2,chuck cache not working as expected
543,2017-02-23 05:12:14.000000000,2017-02-23 12:55:19.000000000,closed,0,delete unused variable
542,2017-02-22 23:09:50.000000000,2017-02-22 23:38:46.000000000,closed,1,support configuring http client timeout for inter-cluster requests
541,2017-02-22 13:16:04.000000000,2017-02-23 12:54:14.000000000,closed,1,use node priority for routing requests
540,2017-02-21 23:24:58.000000000,2017-02-22 00:10:01.000000000,closed,1,reduce the log volume
539,2017-02-21 18:40:28.000000000,2020-04-11 16:38:48.000000000,closed,3,sometimes chunks fail to save due to cassandra errors and doesn't resolve
538,2017-02-21 14:07:21.000000000,2017-02-21 14:22:59.000000000,closed,0,remove state transfer between nodes. fixes #535
537,2017-02-21 13:34:23.000000000,2017-02-24 14:45:52.000000000,closed,0,enable gzip compression HTTP responses
536,2017-02-21 12:41:37.000000000,2018-01-02 18:46:23.000000000,closed,1,add config variables for kafka tunables to increase performance
535,2017-02-21 12:18:25.000000000,2017-02-21 14:23:01.000000000,closed,0,race condition in cluster manger
534,2017-02-17 18:02:21.000000000,2017-02-21 13:29:01.000000000,closed,7,Graphitey consolidation part 1
533,2017-02-17 03:10:37.000000000,2017-03-16 15:03:59.000000000,closed,8,Whisper importer
532,2017-02-16 20:38:46.000000000,2017-09-30 21:41:38.000000000,closed,4,Some thoughts on tagging
531,2017-02-15 14:17:37.000000000,2017-02-15 21:13:43.000000000,closed,0,add filter options to mt-kafka-mdm-sniff
530,2017-02-14 19:13:09.000000000,2017-02-15 13:10:35.000000000,closed,1,consolidateBy doesn't seem to work properly
529,2017-02-14 02:58:44.000000000,2017-03-21 00:16:26.000000000,closed,4,Add tool for cross-cluster split-metric migrations
528,2017-02-14 02:54:06.000000000,2017-03-21 00:16:26.000000000,closed,0,Need a cross cluster migration tool for split tables migration
527,2017-02-13 17:36:43.000000000,2017-02-13 19:34:10.000000000,closed,0,add tool for migrating index from one cass cluster to another
526,2017-02-11 17:29:23.000000000,2017-02-11 23:49:36.000000000,closed,1,split off cluster partitioner to separate package
525,2017-02-11 17:05:29.000000000,2018-10-24 15:58:56.000000000,closed,4,WIP: docker-cluster-relay stack with rules to feed back key metrics to customers
524,2017-02-09 20:50:40.000000000,2017-02-11 00:30:10.000000000,closed,0,fix garbled output
523,2017-02-08 23:08:59.000000000,2017-02-16 22:24:24.000000000,closed,6,Replicator update
522,2017-02-08 04:56:18.000000000,2020-04-11 16:38:50.000000000,closed,1,config validation
521,2017-02-08 03:10:51.000000000,2020-04-11 15:38:57.000000000,closed,2,promotion wait is incorrect when replaying old data
520,2017-02-07 13:39:15.000000000,2018-01-31 02:46:09.000000000,closed,10,better error message when kafka's offset doesn't exist anymore
519,2017-02-06 23:08:40.000000000,2017-02-23 12:54:14.000000000,closed,5,improve how node ready state is set and handled
518,2017-02-04 00:21:02.000000000,2018-01-16 01:34:01.000000000,closed,11,fix centos6/amzn rpm packager
517,2017-02-03 20:39:39.000000000,2017-02-24 13:51:38.000000000,closed,0,Faq
516,2017-02-03 02:08:58.000000000,2017-02-03 03:59:50.000000000,closed,4,metrictank install script broken 
515,2017-02-03 00:06:24.000000000,2017-02-28 20:18:23.000000000,closed,3,mt-update-ttl
514,2017-02-02 13:12:42.000000000,1970-01-01 00:00:00.000000001,open,2,cancelation support for all index calls
513,2017-01-31 23:40:10.000000000,1970-01-01 00:00:00.000000001,open,0,document different deployment strategies/topologies
512,2017-01-27 23:52:24.000000000,2020-04-11 16:38:51.000000000,closed,2,dashboard redesign
511,2017-01-27 20:02:57.000000000,2020-06-15 21:37:06.000000000,closed,6,support for rewrite / overwrite / seek back in time
510,2017-01-27 19:29:57.000000000,2017-09-29 18:25:03.000000000,closed,1,get an expert to review our cassandra schemas
509,2017-01-27 18:24:24.000000000,2017-02-15 21:46:03.000000000,closed,3,Collect metrics about datapoints sent to graphite-api
508,2017-01-27 15:30:42.000000000,2017-01-27 17:53:51.000000000,closed,0,Standardizing
507,2017-01-27 09:21:50.000000000,2017-01-27 10:39:31.000000000,closed,0,fix handling metricPersist messages for aggregations.
506,2017-01-27 08:23:06.000000000,2017-01-27 17:50:02.000000000,closed,0,Improve logs and telemetry of kafka-cluster notifier
505,2017-01-27 08:21:01.000000000,2017-01-27 10:39:31.000000000,closed,0,persisting chunk save state of aggregations has never worked
504,2017-01-26 22:01:15.000000000,2017-02-01 00:54:59.000000000,closed,4,Idx metrics and fixes
503,2017-01-26 19:23:31.000000000,2017-02-21 13:29:03.000000000,closed,1,Metrictank selects aggmetric without taking TTL into account
502,2017-01-26 10:17:17.000000000,2017-01-26 11:56:11.000000000,closed,0,fix metricpersist message handling
501,2017-01-26 02:12:47.000000000,2017-01-26 16:17:49.000000000,closed,2,tiny optimization because we know required capacity of slice
500,2017-01-25 17:49:08.000000000,2017-02-01 00:55:01.000000000,closed,0,ES index does not update definitions like cassandra does
499,2017-01-25 16:30:49.000000000,2020-04-11 16:38:46.000000000,closed,1,#485 followup
498,2017-01-24 22:00:20.000000000,2018-06-07 14:09:24.000000000,closed,2,upgrade to latest go-tsz which should be faster
497,2017-01-24 17:40:30.000000000,2020-04-11 16:38:52.000000000,closed,2,Feed back incorrect interval information.
496,2017-01-23 23:22:53.000000000,2017-01-31 20:06:45.000000000,closed,3,mt-kafka-mdm-sniff
495,2017-01-22 20:58:17.000000000,2017-01-23 12:39:53.000000000,closed,0,add mt-view-boundaries tool
494,2017-01-22 20:35:00.000000000,2017-01-23 21:34:54.000000000,closed,2,fail build if code is not formatted and simplified
493,2017-01-22 20:05:42.000000000,2017-01-23 14:25:50.000000000,closed,0,document tools. fix #442
492,2017-01-22 19:22:53.000000000,2017-01-23 12:39:25.000000000,closed,1,build with go1.8 rc2
491,2017-01-22 19:10:22.000000000,2017-01-23 12:38:41.000000000,closed,0,Update metrics20
490,2017-01-20 22:32:32.000000000,2017-02-05 14:10:46.000000000,closed,4,remove branch vs leaf node restriction in index
489,2017-01-20 21:31:02.000000000,2017-01-20 22:44:08.000000000,closed,1,initialize nodePrimary metrics when we initialize the cluster
488,2017-01-20 21:27:49.000000000,2017-01-20 22:44:08.000000000,closed,0,primary metric reported to graphite not set when node starts as primary
487,2017-01-20 20:44:19.000000000,2017-01-23 14:15:45.000000000,closed,1,457 experiment
486,2017-01-19 23:02:05.000000000,2017-01-20 14:45:13.000000000,closed,0,add offset tracking metrics to kafkaMdm
485,2017-01-19 22:09:59.000000000,2017-01-25 08:50:43.000000000,closed,3,process old metricPersist messages before consuming metrics.
484,2017-01-19 21:15:33.000000000,2017-02-01 23:07:13.000000000,closed,2,distribute metrics across tables of varying compaction windows
483,2017-01-18 19:34:55.000000000,2017-01-22 19:25:46.000000000,closed,2,go vet on circleci not working -> upgrade to 1.8
482,2017-01-18 18:01:47.000000000,2017-01-18 22:17:19.000000000,closed,0,472 cleanup
481,2017-01-18 17:42:52.000000000,2020-04-11 14:38:39.000000000,closed,1,make notifier kafka messages compression configurable
480,2017-01-18 16:34:43.000000000,2017-01-18 16:44:50.000000000,closed,0,fix primary parameter name
479,2017-01-17 19:34:19.000000000,2017-01-17 22:45:51.000000000,closed,2,set mode by string
478,2017-01-17 00:26:43.000000000,2017-01-17 20:44:50.000000000,closed,1,reset cache instead of reinstantiating it in tests
477,2017-01-16 16:24:39.000000000,2017-01-20 14:21:04.000000000,closed,1,store save state as a property of the aggemtric instead of chunk
476,2017-01-16 14:39:42.000000000,2017-01-16 18:04:50.000000000,closed,0,minor improvements on test of #473
475,2017-01-16 03:48:35.000000000,2017-01-16 07:15:53.000000000,closed,0,change default partition from 1 to 0 in all configs
474,2017-01-16 03:39:29.000000000,2017-01-16 14:20:49.000000000,closed,0,Improve GetSeriesCachedStore unit test
473,2017-01-15 22:07:54.000000000,2017-01-16 07:22:52.000000000,closed,0,unit test for cache search on connected & disconnected chunks
472,2017-01-14 00:34:04.000000000,2017-01-18 11:06:00.000000000,closed,0,Make kafka-cluster chunk save messages partition aware.
471,2017-01-13 22:04:48.000000000,2017-01-18 21:41:56.000000000,closed,10,Cassandra-idx load timeout
470,2017-01-13 21:51:45.000000000,2020-04-11 16:38:53.000000000,closed,2,When querying very short ranges I get misleading errors
469,2017-01-13 21:49:58.000000000,2017-01-16 10:21:41.000000000,closed,1,fixed a minor typo in all config examples
468,2017-01-13 02:35:21.000000000,2017-01-13 18:38:03.000000000,closed,3,Metrictank crashes when ugly on certain combation of data + query
467,2017-01-13 01:51:46.000000000,2017-01-16 07:15:53.000000000,closed,0,carbon partitioning should start at 0 and the default partition should be 0 not 1
466,2017-01-12 17:47:29.000000000,2017-01-12 18:27:50.000000000,closed,0,update schema to v1.4 to have better KeyByOrg* functions
465,2017-01-12 14:39:38.000000000,2017-01-16 18:35:28.000000000,closed,6,update cassandraIdx schema to parition based on Partition Id
464,2017-01-11 03:01:15.000000000,2017-04-12 16:29:44.000000000,closed,4,better handling of raw interval > agg-interval
463,2017-01-11 00:54:41.000000000,2017-03-27 20:49:07.000000000,closed,18,maxDataPoints handling
462,2017-01-11 00:26:02.000000000,2017-01-16 14:20:50.000000000,closed,0,extend TestGetSeriesCachedStore to validate cache hits for all scenarios
461,2017-01-10 21:13:19.000000000,2017-01-23 14:17:38.000000000,closed,10,Push chunks of hot metrics into cache when they get completed by `AggMetric`
460,2017-01-10 21:11:00.000000000,2017-01-12 17:34:13.000000000,closed,6,"set default cassandra keyspace to ""metrictank"""
459,2017-01-10 17:31:56.000000000,2017-01-17 13:48:59.000000000,closed,9,Peer discovery
458,2017-01-09 23:15:06.000000000,2017-01-10 21:44:15.000000000,closed,3,mt-store-cat 
457,2017-01-09 20:49:52.000000000,2017-01-24 17:43:28.000000000,closed,5,Add new chunks to cache if metric is hot
456,2017-01-09 15:08:41.000000000,2020-04-11 16:38:45.000000000,closed,11,configuration management
455,2017-01-08 23:41:14.000000000,2017-01-10 00:01:32.000000000,closed,0,Fix #454
454,2017-01-08 06:40:48.000000000,2017-01-10 00:01:33.000000000,closed,3,"""start must be before end"" when requested time range is correct"
453,2017-01-06 23:48:10.000000000,2017-01-16 18:35:28.000000000,closed,7,poor performance of querying metric_idx
452,2017-01-06 21:21:09.000000000,2017-01-27 10:39:31.000000000,closed,10,Keep track of last chunk save for each metric
451,2017-01-06 20:27:24.000000000,2017-01-17 02:52:38.000000000,closed,6,Better mt index migrate
450,2017-01-06 20:08:24.000000000,2020-04-11 16:38:44.000000000,closed,5,Chunkspan wrapping seconds should be shifted across metrics
449,2017-01-05 14:23:11.000000000,2017-02-07 22:50:49.000000000,closed,17,update configs and docs
448,2017-01-03 23:37:22.000000000,2017-01-20 14:45:12.000000000,closed,0,monitor kafka offset delta
447,2017-01-03 18:55:37.000000000,2017-01-03 23:56:25.000000000,closed,0,add tools to packages
446,2017-01-02 21:00:24.000000000,2017-01-05 01:55:49.000000000,closed,1,add some instrumentation to chunk cache
445,2017-01-02 17:31:27.000000000,2017-01-03 18:40:24.000000000,closed,0,0.6.x mt-store-cat
444,2017-01-02 16:21:49.000000000,2017-01-09 23:27:55.000000000,closed,0,NOT FOR MERGING TO MASTER: 0.6.x stable branch
443,2016-12-30 17:10:35.000000000,2017-01-05 14:12:43.000000000,closed,4,0.7.0-beta1
442,2016-12-30 17:07:49.000000000,2017-01-23 14:25:51.000000000,closed,0,document tools bundled with MT
441,2016-12-29 19:23:26.000000000,2016-12-29 22:49:29.000000000,closed,0,Refactor dataprocessor
440,2016-12-27 14:34:37.000000000,2020-04-11 16:38:54.000000000,closed,2,"""standard"" benchmark"
439,2016-12-27 14:03:37.000000000,2016-12-27 23:28:12.000000000,closed,1,make it easier to run docker env and get dashboards/datasources
438,2016-12-26 20:25:32.000000000,2017-01-12 17:34:13.000000000,closed,1,fix default cassandra keyspaces
437,2016-12-24 18:47:56.000000000,2016-12-27 23:23:58.000000000,closed,0,mt-index-cat
436,2016-12-23 23:24:01.000000000,2017-01-17 13:48:59.000000000,closed,5,Support dynamically adding peers
435,2016-12-23 21:20:45.000000000,2017-01-10 23:59:56.000000000,closed,6,add tool for replicating metrics to second kafka cluster
434,2016-12-23 09:48:44.000000000,2016-12-23 13:26:34.000000000,closed,1,add orgId column to metric_idx table
433,2016-12-22 21:53:47.000000000,2016-12-23 13:26:34.000000000,closed,0,org-id not saved in cass idx 
432,2016-12-22 21:47:20.000000000,2020-04-11 15:38:55.000000000,closed,3,'x-org-id: 0' -> x-org-id header missing incorrect error
431,2016-12-22 09:37:10.000000000,2017-01-17 22:45:51.000000000,closed,2,cant set primary to false via /node endpoint
430,2016-12-20 20:38:19.000000000,2017-01-17 13:49:00.000000000,closed,0,node primaryChange value changes even if you don't really change the value
429,2016-12-20 16:11:53.000000000,2016-12-27 00:18:29.000000000,closed,4,Adds curl examples to Http API docs
428,2016-12-20 11:23:02.000000000,2016-12-21 00:58:25.000000000,closed,2,update sarama to latest tag relase. fixes compression handling
427,2016-12-19 16:19:16.000000000,2020-04-11 16:38:55.000000000,closed,1,Reorganize docs
426,2016-12-17 18:41:19.000000000,1970-01-01 00:00:00.000000001,open,3,profiletrigger too eager
425,2016-12-16 14:27:50.000000000,2016-12-23 14:06:01.000000000,closed,4,idx_migration tool
424,2016-12-15 18:05:09.000000000,2016-12-16 11:18:47.000000000,closed,0,Fixes makefile circleci
423,2016-12-15 16:28:57.000000000,2016-12-27 00:20:57.000000000,closed,1,pre-cluster to post-cluster index migration tool
422,2016-12-13 14:04:34.000000000,2020-04-11 16:38:43.000000000,closed,1,cleanup error passing
421,2016-12-13 13:19:52.000000000,2016-12-13 13:31:54.000000000,closed,2,circleCI builds don't properly abort when they hit failures
420,2016-12-12 18:12:11.000000000,2020-04-11 16:38:57.000000000,closed,2,requesting same series with different consolidateBy's not handled properly
419,2016-12-12 18:07:56.000000000,2017-09-30 21:43:23.000000000,closed,1,usage tracking does not work with clustering feature
418,2016-12-12 11:26:43.000000000,2016-12-14 20:03:39.000000000,closed,8,Introduces a second chunk format to include length
417,2016-12-07 19:57:59.000000000,2017-01-05 04:23:16.000000000,closed,10,Chunk cache
416,2016-12-07 15:45:44.000000000,2016-12-07 19:57:35.000000000,closed,2,[WIP] Chunk cache
415,2016-12-07 10:41:48.000000000,2016-12-07 19:11:15.000000000,closed,1,Refactor iterators to add a way to get size of data
414,2016-12-06 21:28:52.000000000,2016-12-07 07:38:31.000000000,closed,3,Refactor iterators to add a way to get size of data
413,2016-12-04 20:37:11.000000000,2016-12-13 14:40:46.000000000,closed,5,Multi docker stack
412,2016-11-29 02:30:52.000000000,2017-02-07 22:50:50.000000000,closed,2,"use cassandra idx by default in all configs, make it the ""preferred"" idx"
411,2016-11-29 02:17:53.000000000,2016-11-29 02:19:30.000000000,closed,0,switch docker image to use cassandra index
410,2016-11-26 13:55:37.000000000,2016-11-28 20:05:15.000000000,closed,0,Fix backslash escaping for all affected http endpoints (render and index.json)
409,2016-11-26 13:05:57.000000000,2020-07-12 22:58:34.000000000,closed,2,official benchmarks
408,2016-11-26 11:11:53.000000000,2016-11-28 20:05:15.000000000,closed,2,invalid json produced: bad backslash escape sequence
407,2016-11-25 18:16:10.000000000,2020-04-06 21:03:09.000000000,closed,2,need more metrics to get better insights into aggregations/aggsettings/numchunks/etc performance
406,2016-11-22 11:36:57.000000000,2017-01-20 21:27:14.000000000,closed,5,options requests to / result in 200 OK despite node not ready. also incorrect started timestamp
405,2016-11-21 14:31:14.000000000,2016-11-21 19:24:31.000000000,closed,0,go vet fixes
404,2016-11-21 11:59:37.000000000,2016-11-21 12:16:23.000000000,closed,0,update gocql to 47f897f054183a4c891f27b235f11221683982dc
403,2016-11-21 11:53:53.000000000,2016-11-21 13:20:54.000000000,closed,1,adopt grafana trick to get golang 1.7.3
402,2016-11-18 21:03:14.000000000,2016-11-21 12:16:23.000000000,closed,0,"panic in gocql, requires gocql upgrade"
401,2016-11-18 16:10:14.000000000,2017-01-05 04:28:32.000000000,closed,3,facilitating cache warmup / caching cassandra data
400,2016-11-18 00:32:09.000000000,2016-12-13 14:39:28.000000000,closed,14,Clustering
399,2016-11-17 20:31:04.000000000,2016-11-17 23:14:31.000000000,closed,0,memory idx: sometimes DefById will not match the Tree. is this normal?
398,2016-11-17 19:27:29.000000000,2016-11-17 23:14:24.000000000,closed,1,Issue #397
397,2016-11-17 17:39:03.000000000,2016-11-17 23:14:31.000000000,closed,0,bug with deleted metric [and carbon input?]
396,2016-11-17 13:01:27.000000000,2016-11-21 17:03:05.000000000,closed,5,stats versioning
395,2016-11-17 12:42:05.000000000,2020-07-12 22:58:33.000000000,closed,7,automatically pushing dashboard updates to grafana.net
394,2016-11-16 23:12:16.000000000,2016-11-18 00:41:07.000000000,closed,1,remove kafkamdam input plugin
393,2016-11-16 20:18:52.000000000,2017-01-31 20:06:57.000000000,closed,0,kafka sniff tool
392,2016-11-16 20:18:32.000000000,2017-02-05 14:10:46.000000000,closed,1,remove branch vs leaf node restriction in index
391,2016-11-15 22:37:03.000000000,2016-11-16 16:08:24.000000000,closed,1,is pickle protocol supported for input ? if so is it documented
390,2016-11-15 18:11:44.000000000,2016-11-15 22:01:14.000000000,closed,0,Simplify json bench
389,2016-11-15 15:17:38.000000000,2020-04-11 16:38:57.000000000,closed,3,confirm validation of web api ( ~ #378 )
388,2016-11-15 01:27:18.000000000,2016-11-21 14:01:36.000000000,closed,3,go vet errors due to use of unkeyed struct literals
387,2016-11-14 22:33:42.000000000,2017-02-01 00:55:01.000000000,closed,1,datarace in ES test on circleci
386,2016-11-14 22:28:02.000000000,2016-11-15 16:26:13.000000000,closed,0,Fix bench
385,2016-11-14 21:30:01.000000000,2016-11-15 12:31:15.000000000,closed,3,no need to go get anything. since we use vendoring
384,2016-11-14 00:15:20.000000000,2017-01-03 19:32:25.000000000,closed,7,replace statsd[aemon] metrics with built-in metrics library
383,2016-11-12 22:22:01.000000000,2020-04-11 14:38:35.000000000,closed,1,re-use buffer in cassandra_store.processWriteQueue
382,2016-11-12 19:09:47.000000000,2017-02-01 23:07:13.000000000,closed,9,use separate cassandra tables for raw and rollup data
381,2016-11-11 20:57:08.000000000,2016-11-12 18:01:56.000000000,closed,0,Notifier fixups
380,2016-11-10 19:55:48.000000000,2018-01-30 15:30:40.000000000,closed,7,"""include old metricdefs up to 24h"" prevents from new higher res data to become visible"
379,2016-11-10 15:59:57.000000000,2017-03-16 15:04:49.000000000,closed,5,whisper to MT/cassandra tool
378,2016-11-09 14:43:29.000000000,2016-11-15 17:46:31.000000000,closed,17,refactor HTTP capabilitiies into its own package
377,2016-11-09 13:05:48.000000000,2016-11-09 16:05:40.000000000,closed,0,be clear and explicit about our versioning
376,2016-11-08 10:58:19.000000000,2016-11-09 12:45:17.000000000,closed,1,Code cleanup
375,2016-11-07 19:51:16.000000000,2019-05-28 16:25:42.000000000,closed,0,WIP/ on hold Cass scan refactor
374,2016-11-07 15:56:24.000000000,2016-11-09 20:05:56.000000000,closed,0,"switch default policy to tokenaware,hostpool-epsilon-greedy + typo"
373,2016-11-05 21:23:22.000000000,2016-11-07 14:00:51.000000000,closed,0,Remove nsq input
372,2016-11-05 15:07:32.000000000,2016-11-05 21:26:53.000000000,closed,0,Gc objects
371,2016-11-04 19:44:13.000000000,2016-11-07 21:18:43.000000000,closed,1,"added es_list function, made graphite wildcards match exactly"
370,2016-11-04 16:00:09.000000000,2020-04-11 16:38:58.000000000,closed,1,reducing high volume error logging
369,2016-11-03 20:08:15.000000000,2016-11-04 10:14:33.000000000,closed,0,contrib script for maintaining ES index
368,2016-11-03 13:00:31.000000000,2016-11-04 11:55:38.000000000,closed,0,Statsd instance
367,2016-11-02 18:06:34.000000000,2016-11-03 17:07:48.000000000,closed,2,Add ssl and auth connection options
366,2016-11-02 15:15:51.000000000,2016-11-02 23:30:19.000000000,closed,0,Fix 359
365,2016-11-02 01:20:56.000000000,2016-11-02 10:44:51.000000000,closed,0,debug log skipped metricdefs. fix #363
364,2016-11-02 00:25:54.000000000,2016-12-30 16:17:09.000000000,closed,1,"proposal: host extra ""vital"" commands in this repository"
363,2016-11-01 23:34:16.000000000,2016-11-02 10:44:52.000000000,closed,0,debug lines when we exclude metricdefs
362,2016-11-01 23:24:40.000000000,2017-01-10 21:44:17.000000000,closed,0,cassandra data to CLI
361,2016-11-01 20:52:22.000000000,2016-11-04 11:55:39.000000000,closed,1,"use the ""instance"" name specfied in the config for metric names"
360,2016-11-01 18:57:08.000000000,1970-01-01 00:00:00.000000001,open,1,request tracing
359,2016-11-01 01:57:11.000000000,2016-11-02 23:30:20.000000000,closed,0,-config flag doesn't work anymore
358,2016-11-01 00:49:04.000000000,2016-11-03 17:41:49.000000000,closed,3,Cassandra SSL connection?
357,2016-10-31 14:18:39.000000000,2020-04-11 16:38:42.000000000,closed,2,forceable chunk saving
356,2016-10-28 14:41:15.000000000,2016-10-28 15:19:10.000000000,closed,2,Config fix
355,2016-10-27 22:51:36.000000000,2020-04-11 16:38:59.000000000,closed,3,verify whether our cassandra compression settings make sense
354,2016-10-25 08:15:13.000000000,2016-10-26 12:25:42.000000000,closed,3,make nc sleep after connect
353,2016-10-25 04:55:25.000000000,2016-10-26 17:44:27.000000000,closed,1,Remove unnecessary basename error
352,2016-10-24 18:51:34.000000000,2016-10-28 11:43:25.000000000,closed,4,scripts/wait_for_endpoint.sh doesn't seem to actually hold conn open for a few seconds
351,2016-10-22 22:45:25.000000000,2016-10-24 13:19:11.000000000,closed,0,fix docker-compose minimum version requirement
350,2016-10-20 19:55:36.000000000,2020-04-11 16:39:00.000000000,closed,3,CassandraStore refactor
349,2016-10-19 18:20:20.000000000,2017-02-01 00:55:01.000000000,closed,1,index op duration confusing
348,2016-10-19 00:39:24.000000000,2016-10-21 10:08:44.000000000,closed,5,End2end test for metric tank in docker
347,2016-10-18 20:53:13.000000000,2016-10-18 21:31:59.000000000,closed,1,Update gocql
346,2016-10-18 00:45:22.000000000,2016-10-19 00:41:38.000000000,closed,2,End2end test for Metrictank
345,2016-10-17 21:51:29.000000000,2016-10-18 21:32:01.000000000,closed,1,vendored gocql version is wrong
344,2016-10-14 16:57:36.000000000,2016-10-26 18:33:10.000000000,closed,9,add support for retrying cassandra queries
