id,created_at,closed_at,state,comments,title
725,2018-09-12 17:26:19.000000000,1970-01-01 00:00:00.000000001,open,4,Invasive when not even in use
724,2018-09-12 17:08:14.000000000,2018-09-12 18:28:59.000000000,closed,4,Card last 4 not searchable
723,2018-09-11 20:23:23.000000000,2018-09-11 21:02:51.000000000,closed,2,Safari Extension problem with KDF 
722,2018-09-11 19:16:24.000000000,2018-09-11 19:17:29.000000000,closed,0,Sorry must have mistyped while searching for this issue.
721,2018-09-10 09:45:08.000000000,1970-01-01 00:00:00.000000001,open,1,chrome crash on right click inside extension
720,2018-09-07 13:08:11.000000000,2018-09-07 15:08:42.000000000,closed,1,Bitwarden UI vanishes if trying to enter password in Firefox 61.01
719,2018-09-06 15:00:15.000000000,2018-09-06 15:38:23.000000000,closed,1,Chromium based browsers don't automatically open the extension field to insert the master password
718,2018-09-05 21:41:01.000000000,2018-09-05 21:52:33.000000000,closed,0,Support Yurplan payment form
717,2018-09-05 21:39:52.000000000,1970-01-01 00:00:00.000000001,open,0,Support Yurplan payment form
716,2018-09-05 19:12:12.000000000,2018-09-05 19:40:17.000000000,closed,1,Bitwarden adding undefined to clipboard in FF 63 Beta after page refresh
715,2018-09-05 16:14:37.000000000,2018-09-05 16:53:05.000000000,closed,2,BUG - Bitwarden fills Forum Credentials in Biwarden Vault
714,2018-09-05 15:52:43.000000000,1970-01-01 00:00:00.000000001,open,2,BW does not ask if credentials should be saved (Safari edition)
713,2018-09-05 14:19:21.000000000,1970-01-01 00:00:00.000000001,open,14,Bitwarden can't handle ShadowDOM
712,2018-09-05 13:53:27.000000000,1970-01-01 00:00:00.000000001,open,12,BW does not ask if Credentals should be saved (Google Chrome)
711,2018-09-04 23:17:11.000000000,2018-09-05 21:27:38.000000000,closed,1,Add paymentCardExpiration met on Payplug
710,2018-08-30 23:44:21.000000000,2018-08-31 06:07:17.000000000,closed,2,auto-fill option: clipboard is set to 'undefined' every time a website is opened
709,2018-08-30 14:52:21.000000000,1970-01-01 00:00:00.000000001,open,1,Autofill not populating username when below password
708,2018-08-30 00:22:01.000000000,2018-09-01 16:00:27.000000000,closed,2,Bitwarden does not sync on Brave
707,2018-08-29 21:01:10.000000000,2018-08-29 21:39:20.000000000,closed,0,"Add card-expiry and expiry, found on IKEA website"
706,2018-08-27 19:14:42.000000000,2018-08-28 22:05:07.000000000,closed,7,Problem with custom fields
705,2018-08-23 18:07:07.000000000,1970-01-01 00:00:00.000000001,open,9,Context menu nesting structure is unnecessary and annoying
704,2018-08-20 19:10:18.000000000,2018-08-21 23:49:22.000000000,closed,4,Can't access folder details / delete folder
703,2018-08-20 17:42:31.000000000,2018-08-20 17:50:03.000000000,closed,6,search function doesn't properly work anymore
702,2018-08-20 12:45:32.000000000,2018-08-20 15:37:13.000000000,closed,2,Auto-fill with multiple accounts
701,2018-08-17 23:58:05.000000000,2020-08-13 01:25:31.000000000,closed,7,Autofill hotkey for macOS Safari and Non-US keyboard layout
700,2018-08-17 20:08:22.000000000,2018-08-17 20:28:07.000000000,closed,2,"Chrome Extension: Password Generator, cannot copy password"
699,2018-08-17 17:31:20.000000000,2018-08-17 20:33:58.000000000,closed,9,Firefox extension stops working after entering search term
698,2018-08-16 23:15:52.000000000,2018-08-16 23:16:32.000000000,closed,0,New Crowdin translations
697,2018-08-16 21:42:00.000000000,1970-01-01 00:00:00.000000001,open,1,Chrome Extension Blurriness on Retina Displays using non-default resolution
696,2018-08-15 14:26:50.000000000,2018-08-15 16:21:58.000000000,closed,4,[Google Chrome] Automatically sign in for basic authentication doesn't work anymore
695,2018-08-15 05:02:51.000000000,2018-08-15 05:27:56.000000000,closed,2,Close the popout as expected on Firefox on Android
694,2018-08-14 16:54:05.000000000,2018-08-14 17:16:20.000000000,closed,1,Extension menu instantanely hide when I click on it.
693,2018-08-11 15:45:17.000000000,2018-08-11 17:07:47.000000000,closed,2,Most icons do not show up
692,2018-08-10 12:39:31.000000000,1970-01-01 00:00:00.000000001,open,4,"""Unable to auto-fill the selected item on this page"""
691,2018-08-09 17:07:10.000000000,2018-08-09 17:31:46.000000000,closed,1,Bitwarden popup disapear when clicking the bitwarden button on firefox
690,2018-08-08 23:00:47.000000000,2018-08-08 23:00:55.000000000,closed,0,New Crowdin translations
689,2018-08-07 22:54:54.000000000,2018-08-07 22:58:26.000000000,closed,2,Cant type in the extension in Firefox 61.0.1
688,2018-08-06 21:48:14.000000000,2018-08-06 21:49:59.000000000,closed,0,New Crowdin translations
687,2018-08-06 03:18:23.000000000,2018-08-06 19:00:54.000000000,closed,3,Bitwarden Firefox addon suppresses HTTP Basic Auth dialog
686,2018-08-05 16:52:26.000000000,2018-08-05 16:54:54.000000000,closed,5,Firefox: Can't open the popup of extension
685,2018-08-05 13:06:22.000000000,1970-01-01 00:00:00.000000001,open,0,Enpass Issues with Importation of Data
684,2018-08-05 05:20:18.000000000,2018-08-05 05:21:32.000000000,closed,3,Can't log into Bitwarden in Firefox addon on Ubuntu. Addon pane closes when focusing on password
683,2018-08-04 21:05:43.000000000,1970-01-01 00:00:00.000000001,open,1,"""Never remember for this website"" is never remembering for the wrong website"
682,2018-08-01 16:54:26.000000000,2018-08-20 20:35:10.000000000,closed,9,Minimum special characters field hidden in password generator for french location
681,2018-07-31 01:13:10.000000000,2018-07-31 01:14:08.000000000,closed,0,New Crowdin translations
680,2018-07-25 18:40:36.000000000,2018-07-25 18:41:23.000000000,closed,0,New Crowdin translations
679,2018-07-25 11:47:26.000000000,2018-07-25 16:55:59.000000000,closed,2,how can i build this project... somebody help me.
678,2018-07-22 14:52:20.000000000,2018-07-22 16:04:03.000000000,closed,1,Firefox on Linux 64 bit : browserAction closes immediately if vault is locked
677,2018-07-21 18:08:45.000000000,2018-07-21 21:58:13.000000000,closed,2,More than one login item per domain confuses Bitwarden
676,2018-07-21 04:25:11.000000000,2018-07-21 06:01:07.000000000,closed,7,Automatically signs in for basic auth
675,2018-07-20 21:14:46.000000000,2018-07-31 05:23:31.000000000,closed,4,Incorrect favicon in the site selector
674,2018-07-20 01:25:46.000000000,2018-07-20 01:29:00.000000000,closed,1,Bitwarden for Edge Search Slow/Broken
673,2018-07-19 20:08:41.000000000,2018-07-19 20:25:24.000000000,closed,2,Only two letters can be typed in when searching for entry
672,2018-07-19 18:31:05.000000000,2018-07-19 18:50:58.000000000,closed,0,Fetch image from bitwarden/brand
671,2018-07-17 21:58:35.000000000,2018-07-21 00:45:20.000000000,closed,2,Cursor for Text Entry Not Active by Default (Master Password Entry + Yubikey)
670,2018-07-16 20:30:37.000000000,2018-07-21 01:31:57.000000000,closed,6,Login fill problem
669,2018-07-16 01:34:27.000000000,2018-07-16 01:45:37.000000000,closed,3,"Chrome's ""On System Lock"" setting locks the extension on a browser restart as well"
668,2018-07-14 06:57:46.000000000,1970-01-01 00:00:00.000000001,open,3,Brave browser extension is slow loading when clicking the icon
667,2018-07-11 15:30:41.000000000,2018-07-11 20:19:21.000000000,closed,4,"[chrome] Right clicking any link, folder or entry causes chrome to crash"
666,2018-07-11 00:14:06.000000000,1970-01-01 00:00:00.000000001,open,0,Login issue (psnprofiles.com) Safari only
665,2018-07-07 14:39:02.000000000,2018-07-07 16:14:55.000000000,closed,1,Clicking on bitwarden icon in chrome causes it to open and then immediately close
664,2018-07-06 08:04:02.000000000,2019-10-10 03:57:14.000000000,closed,172,Publish Safari Extensions as a Safari App Extensions
663,2018-07-05 15:58:34.000000000,1970-01-01 00:00:00.000000001,open,4,"Bitwarden popup in Firefox becomes blank while typing, after page load"
662,2018-07-05 15:44:27.000000000,1970-01-01 00:00:00.000000001,open,0,Add login notification doesnt work on some ajax or semi-ajax sites
661,2018-06-30 21:22:55.000000000,2018-08-17 21:15:42.000000000,closed,15,Bitwarden for Edge breaks on Windows Insider Build 17704
660,2018-06-29 18:11:07.000000000,1970-01-01 00:00:00.000000001,open,0,No autocompletion on Google anymore on Firefox
659,2018-06-27 11:34:19.000000000,2018-06-27 16:10:23.000000000,closed,1,Can't Enter Password On Ubuntu Firefox Extension
658,2018-06-26 17:28:37.000000000,2018-06-26 19:19:10.000000000,closed,6,Hostnames ignored?
657,2018-06-25 05:04:45.000000000,2018-06-25 15:41:23.000000000,closed,0,search webVaultUrl for settings. closes bitwarden/browser#635
656,2018-06-23 16:16:37.000000000,2019-02-08 18:01:09.000000000,closed,0,Don't try to open regex URI patterns in browser
655,2018-06-21 10:44:49.000000000,2018-07-23 22:23:31.000000000,closed,3,Start up performance is really bad
654,2018-06-19 23:45:18.000000000,2018-06-19 23:47:13.000000000,closed,1,"Browser extension disappears at password entry, can't login - Firefox 60.0.2"
653,2018-06-19 23:36:33.000000000,2018-06-19 23:42:20.000000000,closed,2,Exporting Vault
652,2018-06-16 07:31:43.000000000,2018-06-17 16:13:02.000000000,closed,5,UAC consent locks Bitwarden on system lock
651,2018-06-15 10:20:06.000000000,2018-06-15 16:07:07.000000000,closed,1,Chrome extension bugged on osx high sierra
650,2018-06-15 04:12:00.000000000,2018-06-15 21:29:35.000000000,closed,2,UX difficulties
649,2018-06-14 19:39:29.000000000,2018-06-15 02:51:55.000000000,closed,2,Wrong URI match
648,2018-06-14 00:30:26.000000000,1970-01-01 00:00:00.000000001,open,4,Edge extension is (very) slow compared to the others
647,2018-06-13 19:57:45.000000000,2018-06-13 20:34:12.000000000,closed,0,Masking Card Security Code in browser extension
646,2018-06-13 18:38:46.000000000,1970-01-01 00:00:00.000000001,open,4,Autofill is taking wrong numbers. 
645,2018-06-13 16:38:39.000000000,1970-01-01 00:00:00.000000001,open,0,Autofill while signed out fails without indication
644,2018-06-12 23:22:38.000000000,2018-06-13 00:51:40.000000000,closed,2,Edge extension does not stay signed in.
643,2018-06-09 14:30:19.000000000,2018-06-09 16:16:14.000000000,closed,1,Bitwarden Chrome Plugin problem: displaying small square when clicking on extension icon
642,2018-06-09 06:29:17.000000000,2018-08-17 05:16:09.000000000,closed,2,No feedback when auto-filling on Firefox on Android
641,2018-06-08 22:38:09.000000000,2018-06-08 22:58:26.000000000,closed,1,Chrome for Mac - Bitwarden often doesn't open properly the first time clicked (and randomly other times)
640,2018-06-08 14:38:21.000000000,1970-01-01 00:00:00.000000001,open,3,Using Chrome extension to fill passwords causes Dragon Nat. Speaking to display plaintext password in a correction box popup
639,2018-06-07 08:34:10.000000000,2018-06-07 19:57:59.000000000,closed,1,Autofill doens't work on any site with current Firefox Nightly builds
638,2018-06-07 06:15:13.000000000,2018-06-07 08:13:39.000000000,closed,1,Autofill doesn't work at hilton.com
637,2018-06-05 18:48:47.000000000,2018-06-05 18:52:48.000000000,closed,1,Precaution against iframe creating blank space on the page
636,2018-06-05 16:25:24.000000000,2018-06-05 16:29:17.000000000,closed,1,Window does not open completely on Chrome
635,2018-06-05 10:28:33.000000000,2018-06-25 15:41:24.000000000,closed,0,"When pressing ""Bitwarden Web Vault"" in the settings it will take you to vault.bitwarden.com even if you are using a self-hosted instance"
634,2018-06-05 02:10:02.000000000,1970-01-01 00:00:00.000000001,open,4,browserAction disappears from Firefox
633,2018-06-04 19:37:44.000000000,2018-06-04 19:39:24.000000000,closed,0,New Crowdin translations
632,2018-06-01 19:43:20.000000000,1970-01-01 00:00:00.000000001,open,3,Firefox 60 when running on a mixed DPI setup has unreadably small text.
631,2018-06-01 09:41:19.000000000,2018-06-01 16:33:54.000000000,closed,0,Add more expiration date fields
630,2018-06-01 06:23:42.000000000,2018-06-01 06:23:57.000000000,closed,0,New Crowdin translations
629,2018-05-30 13:16:50.000000000,2018-05-30 16:11:11.000000000,closed,3,"On firefox, bitwarden popup closes immediatley"
628,2018-05-30 00:43:41.000000000,2018-05-30 00:45:09.000000000,closed,1,Chrome extension does not open on login.salesforce.com
627,2018-05-27 13:12:02.000000000,2018-05-27 14:04:01.000000000,closed,2,[ Feature Request ] Multiple Accounts Simultaneously
626,2018-05-25 07:35:54.000000000,2018-05-25 07:36:56.000000000,closed,1,Fails to load on Gmail sometimes
625,2018-05-21 00:33:24.000000000,1970-01-01 00:00:00.000000001,open,0,"""Unable to autofill"" when extension is opened while page is loading."
624,2018-05-19 01:10:10.000000000,2018-05-19 01:11:17.000000000,closed,1,have to press extension multiple times to open
623,2018-05-18 20:10:28.000000000,1970-01-01 00:00:00.000000001,open,1,Using 'Pop out to a new window' stopped respecting auto lock
622,2018-05-13 20:42:08.000000000,2018-05-13 21:32:34.000000000,closed,1,Firefox need to click on password field to type
621,2018-05-13 17:53:26.000000000,2018-05-13 20:15:57.000000000,closed,1,[Firefox 60 Linux] Unable to enter password as pop up closes
620,2018-05-13 13:25:33.000000000,2018-05-13 16:22:06.000000000,closed,2,Display glitches in Firefox
619,2018-05-07 17:53:38.000000000,2018-05-08 17:15:19.000000000,closed,9,Firefox Add-on prompts that it cannot open in private window when opened in normal window
618,2018-05-06 21:50:31.000000000,2018-05-10 02:39:35.000000000,closed,13,Firefox Extension Consumes Memory and Firefox Becomes Unresponsive
617,2018-05-05 18:11:16.000000000,2018-05-08 18:01:30.000000000,closed,4,Chrome Browser Extension issues at HighDPI in windows 10
616,2018-05-04 18:33:51.000000000,2018-05-05 18:58:02.000000000,closed,3,Cannot edit password in Firefox
615,2018-05-04 15:46:54.000000000,2018-05-04 15:50:45.000000000,closed,1,Can't unlock vault from Firefox Toolbar
614,2018-05-02 14:51:39.000000000,2018-05-02 16:17:45.000000000,closed,1,"Firefox 59: Bitwarden unlock screen saves password in form history when ""show password"" active"
613,2018-05-01 17:39:53.000000000,2018-05-01 19:35:59.000000000,closed,1,Firefox Form & Search History
612,2018-05-01 08:52:39.000000000,1970-01-01 00:00:00.000000001,open,0,Add `Match Detection` field to export/import
611,2018-04-30 03:48:28.000000000,2018-05-01 15:49:05.000000000,closed,3,Does not open on Google Login Pages
610,2018-04-29 16:13:50.000000000,1970-01-01 00:00:00.000000001,open,0,"""Unable to auto-fill"" when multiple browser windows open. Firefox."
609,2018-04-29 14:50:25.000000000,2018-04-29 16:56:33.000000000,closed,5,Master password remembered by autocompletion in clear text when visibility is on
608,2018-04-28 23:23:35.000000000,2018-04-28 23:25:16.000000000,closed,1,Cannot log into firefox browser extension in Ubuntu 18.04 LTS
607,2018-04-28 16:10:49.000000000,2018-07-30 04:23:45.000000000,closed,4,Unlock/Log In form submission spinner missing
606,2018-04-27 21:30:20.000000000,1970-01-01 00:00:00.000000001,open,2,"With two extension windows open, delete confirmation opens in both windows"
605,2018-04-26 15:06:08.000000000,2018-04-26 16:47:07.000000000,closed,3,firefox plugin - master password is visible in autocomplete field
604,2018-04-24 19:44:57.000000000,2018-05-10 15:24:04.000000000,closed,15,Impossible to open popup in Chrome
603,2018-04-23 18:47:06.000000000,2018-04-23 19:42:03.000000000,closed,1,Firefox extension squished
602,2018-04-23 06:44:55.000000000,2018-04-23 19:54:31.000000000,closed,5,TOTP not automatically copying - Safari
601,2018-04-22 12:58:10.000000000,2018-04-23 21:49:39.000000000,closed,0,Updating readme links and images to use https
600,2018-04-20 19:28:57.000000000,2018-04-20 19:39:15.000000000,closed,1,Update the README image to reflect current styling of extension popup
599,2018-04-20 03:03:30.000000000,2018-04-20 03:04:46.000000000,closed,1,v1.26.0 on Firefox (Ubuntu 16.04): Copy buttons not working
598,2018-04-19 19:21:03.000000000,2018-04-19 19:21:59.000000000,closed,0,New Crowdin translations
597,2018-04-19 18:21:08.000000000,2018-04-19 22:44:05.000000000,closed,1,Multiple URIs shown wrong
596,2018-04-19 10:44:11.000000000,2018-04-19 16:24:47.000000000,closed,5,The Verification Code (TOTP) 'Copy' button is not working
595,2018-04-18 22:16:51.000000000,2018-04-18 22:17:19.000000000,closed,0,New Crowdin translations
594,2018-04-18 21:59:15.000000000,2018-04-18 21:59:58.000000000,closed,0,New Crowdin translations
593,2018-04-18 21:15:13.000000000,2018-04-18 21:57:25.000000000,closed,0,New Crowdin translations
592,2018-04-18 17:05:26.000000000,2018-04-18 17:07:10.000000000,closed,0,New Crowdin translations
591,2018-04-17 22:08:22.000000000,2018-04-17 22:10:09.000000000,closed,0,New Crowdin translations
590,2018-04-17 21:32:28.000000000,2018-04-17 21:33:51.000000000,closed,0,New Crowdin translations
589,2018-04-17 19:03:11.000000000,2018-04-17 21:57:35.000000000,closed,2,Autofill cuts password at tmdb.org
588,2018-04-17 13:54:29.000000000,2018-04-17 21:20:52.000000000,closed,2,Add fields seen on ATOS payment page
587,2018-04-16 20:15:58.000000000,2018-04-16 20:18:43.000000000,closed,0,New Crowdin translations
586,2018-04-16 19:46:32.000000000,2018-04-17 05:52:37.000000000,closed,1,Brave Extension Fails To Sync
585,2018-04-12 22:19:16.000000000,2018-07-29 04:17:43.000000000,closed,2,Chrome crashes when adding a card through the extension
584,2018-04-11 12:05:40.000000000,2018-04-14 06:43:22.000000000,closed,1,"Remove references to 1password in CSS, DOM"
583,2018-04-07 10:43:59.000000000,2018-04-07 16:44:52.000000000,closed,2,Slight update to danish message
582,2018-04-07 02:55:37.000000000,2018-04-07 03:00:32.000000000,closed,4,"Context menu Firefox 59 Win 10 missing ""Copy Username"", ""Copy Password"", ""Generate Password"""
581,2018-04-05 19:37:13.000000000,2018-07-27 18:22:54.000000000,closed,1,firefox: bitwarden doesn't work with an API-endpoint needing a client-certificate
580,2018-04-05 15:19:05.000000000,2018-04-21 01:45:51.000000000,closed,20,Firefox - Popup disappears when selecting password field
579,2018-04-04 17:01:38.000000000,2018-04-04 18:31:00.000000000,closed,5,Copying the TOTP code to clipboard doesn't work on Synology NAS interface
578,2018-04-04 15:50:28.000000000,2018-04-04 15:53:16.000000000,closed,1,Chrome Extension : Sync vault failed
577,2018-04-04 11:43:47.000000000,1970-01-01 00:00:00.000000001,open,2,Search field in Chrome extension repeats characters
576,2018-04-03 09:35:00.000000000,2018-05-24 17:29:56.000000000,closed,6,Autofill fails when there is an empty custom field
575,2018-04-03 02:13:51.000000000,2018-04-18 22:57:32.000000000,closed,4,Firefox extension references (but does not provide) font file 'fontawesome-webfont.woff2'
574,2018-04-02 18:25:34.000000000,2018-04-26 06:56:27.000000000,closed,4,Disable all text-replacements and substitutions
573,2018-04-02 14:47:45.000000000,2018-04-03 13:06:47.000000000,closed,2,[Vivaldi-Extension] popup size is wrong
572,2018-03-30 20:47:54.000000000,2018-03-30 20:48:37.000000000,closed,1,Fallback Icons
571,2018-03-29 12:24:04.000000000,2018-03-29 16:16:44.000000000,closed,2,Disable breach detection for passwords
570,2018-03-27 18:10:42.000000000,2018-07-26 00:13:24.000000000,closed,11,Firefox startup slow when auto-logging/unlock
569,2018-03-26 20:02:14.000000000,2019-10-17 17:16:44.000000000,closed,11,Logging in to Safari plugin doesn't get past Duo browser tab
568,2018-03-25 06:58:54.000000000,2018-03-25 18:09:48.000000000,closed,4,release note for Firefox are not updated
567,2018-03-24 14:06:03.000000000,1970-01-01 00:00:00.000000001,open,2,"Edge extension ""My Vault"" tab not working"
566,2018-03-24 02:38:47.000000000,2018-03-24 05:02:44.000000000,closed,4,"Add actions to secure notes (view, copy)"
565,2018-03-22 19:03:39.000000000,2018-03-22 20:28:56.000000000,closed,1,Credit card fill does not work to purchase Premium on bitwarden.com.
564,2018-03-22 18:50:35.000000000,2018-03-22 18:56:48.000000000,closed,4,Can no longer save logins
563,2018-03-22 10:32:45.000000000,2018-03-22 16:37:33.000000000,closed,2,Is this line correct in utils.service.spec.ts?
562,2018-03-20 23:19:10.000000000,2018-03-20 23:21:32.000000000,closed,3,Firefox MacOS: No matching logins
561,2018-03-20 10:31:48.000000000,2018-03-20 15:08:41.000000000,closed,8,[1.25.2] All URIs gone from vault in Chrome extension
560,2018-03-20 03:58:36.000000000,2018-03-20 04:01:10.000000000,closed,1,not syncing with chrome extension
559,2018-03-19 23:31:40.000000000,2018-04-16 20:11:51.000000000,closed,0,New Crowdin translations
558,2018-03-19 23:10:25.000000000,2018-03-19 23:24:28.000000000,closed,0,New Crowdin translations
557,2018-03-19 23:00:43.000000000,2018-03-19 23:01:21.000000000,closed,0,New Crowdin translations
556,2018-03-19 22:57:36.000000000,2018-03-19 22:58:23.000000000,closed,0,New Crowdin translations
555,2018-03-19 18:17:08.000000000,2018-03-19 18:18:17.000000000,closed,0,New Crowdin translations
554,2018-03-15 20:33:16.000000000,2018-03-15 20:39:57.000000000,closed,0,New Crowdin translations
553,2018-03-14 02:52:35.000000000,2018-03-14 02:53:28.000000000,closed,1,button icons are missing in Firefox browser addon
552,2018-03-13 23:10:23.000000000,2018-03-13 23:11:43.000000000,closed,0,corrupted icon display 
551,2018-03-13 23:09:33.000000000,2018-03-13 23:26:30.000000000,closed,3,No images in Firefox 55 with version 1.24.2
550,2018-03-13 22:31:54.000000000,2018-03-13 22:35:30.000000000,closed,1,Continued support for Firefox 48 (version)
549,2018-03-13 18:38:02.000000000,2018-05-15 17:19:11.000000000,closed,4,Text does not display in microsoft edge extension
548,2018-03-13 13:28:14.000000000,2018-03-13 16:56:47.000000000,closed,1,Encoding error in password mask
547,2018-03-11 15:52:01.000000000,2018-03-12 16:37:52.000000000,closed,0,Add some other french tags for credit card.
546,2018-03-11 09:34:32.000000000,2018-03-12 20:16:09.000000000,closed,11,Syncing Failed
545,2018-03-11 03:15:38.000000000,1970-01-01 00:00:00.000000001,open,0,Does not prompt for save for TSP.GOV with Firefox Add-On
544,2018-03-10 02:11:33.000000000,1970-01-01 00:00:00.000000001,open,26,Login information sporadically forgotten
543,2018-03-09 23:21:53.000000000,2018-03-10 00:11:08.000000000,closed,7,Hotkey(s) on Mac OS 10.13.3 not working
542,2018-03-07 22:18:58.000000000,1970-01-01 00:00:00.000000001,open,6,Microsoft edge: error by fetch
541,2018-03-07 21:00:54.000000000,2018-03-08 06:14:27.000000000,closed,2,Synchronize Analytics preference
540,2018-03-07 20:55:00.000000000,2018-03-07 21:13:38.000000000,closed,2,[WIP] Add possible french tags for card auto-fill
539,2018-03-07 16:56:58.000000000,2018-03-07 17:52:02.000000000,closed,1,Firefox - Overlapping Text in German UI
538,2018-03-07 01:13:23.000000000,2018-03-07 01:22:07.000000000,closed,2,Edge - GitHub Credentials not recognized and saved
537,2018-03-06 14:16:13.000000000,2018-03-06 17:42:00.000000000,closed,0,Don't leak password length through mask
536,2018-03-05 22:34:02.000000000,2018-03-08 06:14:50.000000000,closed,3,Offer TOTP during autofill on page load
535,2018-03-05 19:44:26.000000000,2018-03-05 19:47:00.000000000,closed,2,Page Load Auto-Fill Strict Mode
534,2018-03-04 04:12:49.000000000,2018-03-04 08:53:18.000000000,closed,4,Bitwarden extension is locked but the vault is accessible via context menu: 
533,2018-03-04 02:30:21.000000000,2018-03-08 06:15:06.000000000,closed,5,Add functionality to export Cards
532,2018-02-28 09:52:56.000000000,2018-02-28 09:53:20.000000000,closed,0,New Crowdin translations
531,2018-02-28 01:19:52.000000000,2018-03-08 06:15:20.000000000,closed,1,Separate favorites in the tab view
530,2018-02-27 13:15:47.000000000,2018-04-20 11:59:29.000000000,closed,7,"When clicking the (locked) bitwarden icon, it takes too long until password can be entered"
529,2018-02-24 21:52:36.000000000,2018-02-24 23:27:01.000000000,closed,1,Keyboard shortcuts for auto-filling 
528,2018-02-24 16:11:52.000000000,2018-03-08 06:16:11.000000000,closed,1,Add a button to display master password when logging in
527,2018-02-24 16:06:36.000000000,2018-02-24 18:07:36.000000000,closed,2,Copy TOTP code to clipboard when autofilling on page load or contextual menu
526,2018-02-24 03:59:16.000000000,2018-02-28 21:38:23.000000000,closed,0,Integration with Have I been pwned
525,2018-02-23 16:54:18.000000000,2018-03-08 06:16:27.000000000,closed,1,Switch account
524,2018-02-23 03:48:35.000000000,2018-04-19 20:50:58.000000000,closed,11,Vault search lags when searching a large number of records
523,2018-02-23 00:13:15.000000000,2018-02-28 21:37:12.000000000,closed,2,Support for the Pwned Passwords service
522,2018-02-22 22:39:10.000000000,2018-03-08 06:16:53.000000000,closed,1,Provide PGP signed sources and builds for each release
521,2018-02-21 14:48:03.000000000,2018-02-27 21:55:55.000000000,closed,18,Autofill of cards fail when month with 2 digits is requested
520,2018-02-20 13:38:41.000000000,2018-02-20 18:52:55.000000000,closed,1,Auto-focus on master password field / search field
519,2018-02-18 03:55:26.000000000,2018-03-08 08:23:19.000000000,closed,3,[Request] Store input field ID along with login and password
518,2018-02-17 04:40:27.000000000,2018-03-08 06:17:42.000000000,closed,4,Add option to copy secure note
517,2018-02-16 06:55:05.000000000,2018-03-10 17:58:06.000000000,closed,4,Extension doesn't load after restarting Firefox
516,2018-02-15 20:42:41.000000000,2018-02-15 21:41:52.000000000,closed,1,chromium have emply folder
515,2018-02-15 02:44:37.000000000,2018-02-15 02:48:59.000000000,closed,1,Brave browser extension sync not working correctly
514,2018-02-14 15:39:10.000000000,2018-03-08 06:18:18.000000000,closed,3,Hide block with cards in extension window
513,2018-02-13 07:04:38.000000000,2018-02-13 09:22:46.000000000,closed,1,"How to undo ""Remember me"" when 2FA enabled?"
