id,created_at,closed_at,state,comments,title
512,2018-02-13 02:01:35.000000000,2018-03-08 08:23:01.000000000,closed,2,Support changing keyboard shortcuts in Firefox 60+
511,2018-02-12 13:54:12.000000000,2018-03-08 06:20:18.000000000,closed,1,Prompt for master password to unlock on browser restart
510,2018-02-11 18:50:45.000000000,1970-01-01 00:00:00.000000001,open,0,Null/empty custom field causes item not to be autofillable
509,2018-02-08 13:41:38.000000000,2018-05-15 23:11:46.000000000,closed,11,Autofill doesn't work in Edge
508,2018-02-07 01:38:54.000000000,2018-03-08 06:24:33.000000000,closed,6,"Show site URI on ""View Item"" screen"
507,2018-02-05 20:12:53.000000000,2018-03-08 06:19:46.000000000,closed,6,"Make ""sync now"" more accessible"
506,2018-02-05 19:02:24.000000000,2018-03-08 06:31:26.000000000,closed,2,Allow edit after saving a new login
505,2018-02-05 10:10:23.000000000,2018-02-05 10:22:49.000000000,closed,1,[UI] Search icon layout issue
504,2018-02-03 23:17:14.000000000,2018-02-03 23:17:48.000000000,closed,1,Adding a button in the textbar for user names and password
503,2018-02-03 13:57:21.000000000,2018-03-08 06:35:09.000000000,closed,1,Hide collection items from the 'No Folder' group
502,2018-02-03 06:59:13.000000000,2018-03-08 06:18:54.000000000,closed,3,Permit autofill from search results
501,2018-02-03 01:50:22.000000000,2018-03-08 06:27:54.000000000,closed,2,"add ""Forced password input"""
500,2018-02-03 01:40:56.000000000,2018-02-03 01:43:32.000000000,closed,1,add options to  hide number pass in toolbar
499,2018-02-03 01:37:16.000000000,2018-03-08 06:34:50.000000000,closed,1,add auto-login checkbox 
498,2018-02-02 03:21:10.000000000,2018-02-02 05:50:41.000000000,closed,1,"""&"" imported as ""&amp;"""
497,2018-02-01 20:59:39.000000000,2018-02-01 22:02:51.000000000,closed,2,Identify sidebar shortcut in menu bar
496,2018-01-31 17:19:46.000000000,2018-03-08 06:19:19.000000000,closed,3,Get title from Website title
495,2018-01-31 01:04:23.000000000,2018-01-31 01:32:08.000000000,closed,1,Firefox Doesn't Auto-focus Password/Login Field
494,2018-01-30 23:07:33.000000000,2018-03-08 08:21:29.000000000,closed,1,Option to hide cards/identities/etc. from the main view
493,2018-01-29 11:27:57.000000000,2018-02-06 19:31:41.000000000,closed,3,Require more use of 2FA second factor
492,2018-01-29 04:24:20.000000000,2018-03-08 06:25:04.000000000,closed,4,Auto-fill TOTP code
491,2018-01-27 19:55:33.000000000,2018-03-08 06:24:06.000000000,closed,1,Manage collections (mainly add a entry to a org collection)
490,2018-01-25 02:30:52.000000000,2018-01-25 02:31:54.000000000,closed,1,"Firefox - Lock options ""On lock"" unavailable"
489,2018-01-23 14:35:20.000000000,2018-03-08 08:21:15.000000000,closed,2,Search results should prioritize titles over usernames
488,2018-01-23 13:11:39.000000000,1970-01-01 00:00:00.000000001,open,1,Opening popup should not scan page for fields - clicking credentials should do it instead
487,2018-01-19 07:38:55.000000000,2018-01-19 07:39:25.000000000,closed,0,New Crowdin translations
486,2018-01-19 05:32:45.000000000,2018-01-19 06:45:17.000000000,closed,5,Aufotill not working for George Internet Banking
485,2018-01-18 07:33:50.000000000,2018-01-18 09:25:24.000000000,closed,23,Possible vulnerability in browser extension caused by browser.storage.local API implementation
484,2018-01-16 23:23:58.000000000,2018-03-04 18:47:37.000000000,closed,3,Icon with lock shown under the label that shows if you have a site saved
483,2018-01-16 20:21:02.000000000,2018-01-30 22:22:43.000000000,closed,7,Slow for popup to appear
482,2018-01-15 20:48:14.000000000,2018-01-15 21:04:41.000000000,closed,5,Extension icon looks significantly more blurry and low res in Brave than Chrome
481,2018-01-15 12:51:12.000000000,2018-03-08 06:35:33.000000000,closed,3,Add option for partial master lock
480,2018-01-13 15:55:08.000000000,2018-01-16 07:05:06.000000000,closed,8,Password History Bug
479,2018-01-13 09:52:52.000000000,2018-01-13 19:24:55.000000000,closed,2,Localhost and domain rules
478,2018-01-13 03:54:35.000000000,1970-01-01 00:00:00.000000001,open,4,Auto fill doesn't work for economist.com
477,2018-01-12 13:44:56.000000000,1970-01-01 00:00:00.000000001,open,6,"""Confirm email"" box not filled in"
476,2018-01-12 04:09:07.000000000,2018-03-08 08:19:06.000000000,closed,1,Options to disable auto-completion and reprompt for master password
475,2018-01-11 23:43:22.000000000,2018-02-05 21:31:44.000000000,closed,2,Updates the Brave logo in the README to the latest and greatest
474,2018-01-10 19:35:30.000000000,2018-01-10 19:36:49.000000000,closed,1,[UX] Quicker Search
473,2018-01-10 19:09:14.000000000,2018-03-08 08:17:20.000000000,closed,3,Consistent behaviour on clicking a vault entry
472,2018-01-10 18:58:51.000000000,2018-03-08 08:16:43.000000000,closed,2,Improve UI for item deletion
471,2018-01-10 04:17:48.000000000,2018-02-02 04:14:42.000000000,closed,5,Delays with search filtering
470,2018-01-10 01:35:38.000000000,2018-03-08 08:16:06.000000000,closed,1,Opening one of multiple sites via extension should set the preferred login for autofill
469,2018-01-10 01:24:27.000000000,2018-03-08 08:14:34.000000000,closed,3,TOTP copy icon in login list?
468,2018-01-09 03:37:39.000000000,1970-01-01 00:00:00.000000001,open,0,Never domain doesn't work on main BOA login form
467,2018-01-09 02:28:23.000000000,2018-10-04 06:45:08.000000000,closed,8,"Change the default lock option from ""Never"" to...anything else?"
466,2018-01-08 18:40:54.000000000,2018-01-08 18:42:49.000000000,closed,1,[Vivaldi-Extension] UI doesn't fit in window
465,2018-01-08 09:21:42.000000000,2018-07-27 18:24:04.000000000,closed,3,Identity appears with favicon for an arbitrary(?) site
464,2018-01-08 05:50:05.000000000,1970-01-01 00:00:00.000000001,open,0,tobaccopipes.com forms being filled in
463,2018-01-08 03:12:20.000000000,2018-03-08 08:11:53.000000000,closed,1,Add link to open login form outside popup
462,2018-01-05 16:14:49.000000000,2018-03-08 07:15:22.000000000,closed,1,"Delete folder should not delete passwords by default, but at least prompt the user"
461,2018-01-05 04:29:50.000000000,1970-01-01 00:00:00.000000001,open,3,Prompted to save credentials that were autofilled by bitwarden (chrome)
460,2018-01-04 19:04:40.000000000,2018-03-08 08:11:02.000000000,closed,1,On-Demand TOTP code generation
459,2018-01-04 17:55:17.000000000,2018-03-08 08:10:42.000000000,closed,1,"Use ""chrome.storage.sync"" instead of ""chrome.storage.local"" for user settings, allowing to sync between browsers (Chrome)"
458,2018-01-04 17:50:44.000000000,2018-03-08 08:10:33.000000000,closed,1,"User interface to manage ""Never for this website"" domains (Chrome)"
457,2018-01-04 11:07:39.000000000,2018-03-08 08:10:25.000000000,closed,13,How to use the hotkey to change several accounts and change the hotkey?
456,2018-01-03 11:55:03.000000000,2018-03-08 08:10:07.000000000,closed,6,Autofill makes clippercard.com unusable
455,2018-01-03 00:24:52.000000000,2018-01-03 00:31:42.000000000,closed,0,Remove unused overlay directory
454,2018-01-01 15:25:51.000000000,2018-03-08 08:09:14.000000000,closed,5,2FA - TOTP not correct on Kraken.com
453,2017-12-28 02:15:39.000000000,2018-03-08 08:07:55.000000000,closed,1,Special Characters used in generated passwords
452,2017-12-28 01:18:18.000000000,2017-12-28 01:19:13.000000000,closed,0,New Crowdin translations
451,2017-12-27 16:00:49.000000000,2017-12-27 19:31:14.000000000,closed,5,Chrome extension logout 
450,2017-12-27 13:39:06.000000000,2018-01-03 08:55:00.000000000,closed,1,Bitwarden can't recognize login form inside a thread in a forum
449,2017-12-27 07:59:01.000000000,2017-12-27 08:01:32.000000000,closed,1,[Enhancement] Allow specifying more granularity for lock timeout
448,2017-12-26 15:58:44.000000000,2017-12-26 18:10:39.000000000,closed,1,[Firefox Extension] Indirect popup menu usability issue
447,2017-12-25 00:11:53.000000000,2018-03-08 08:07:04.000000000,closed,3,Custom Fields feature needs more refinement.
446,2017-12-22 09:39:45.000000000,2018-03-08 08:06:14.000000000,closed,2,FR: Add ability to search within login notes
445,2017-12-22 06:29:21.000000000,2018-03-08 08:05:58.000000000,closed,1,Thunderbird support
444,2017-12-21 21:28:59.000000000,2018-03-08 08:05:47.000000000,closed,3,[Feature Request] Implement better UX for registering for websites
443,2017-12-20 15:27:49.000000000,2018-03-08 08:05:31.000000000,closed,13,"When lossing focus, context gets lost"
442,2017-12-20 11:40:20.000000000,2017-12-22 09:34:07.000000000,closed,2,Login credentials auto-filled in wrong input boxes in Amazon site
441,2017-12-19 09:18:36.000000000,2018-05-09 18:55:01.000000000,closed,1,add the ability to search for ciphers by folder name
440,2017-12-16 02:04:55.000000000,2017-12-16 02:21:38.000000000,closed,1,Fix checkbox toggling
439,2017-12-14 15:03:42.000000000,2017-12-14 19:12:14.000000000,closed,5,Nexmo.com: Does not ask to add password
438,2017-12-14 00:19:55.000000000,2017-12-14 00:22:25.000000000,closed,3,Extension menu scales badly on larger screens
437,2017-12-13 14:56:41.000000000,2018-03-08 08:05:14.000000000,closed,7,Only filling in fields that I can see - bug or feature?
436,2017-12-13 01:36:44.000000000,2017-12-13 01:37:53.000000000,closed,3,Seperating logins for similair site domains
435,2017-12-13 00:29:33.000000000,2018-03-08 08:04:48.000000000,closed,3,"[Feature Request] Short-Lived ""Recently Used"" Sticky List"
434,2017-12-13 00:21:22.000000000,2017-12-13 00:23:56.000000000,closed,2,[Feature Request] Auto-Focus Search Input when Opening Bitwarden Browser Add-On
433,2017-12-12 18:44:16.000000000,2018-03-08 08:04:40.000000000,closed,2,[Feature Request] Open popup when autofilling using shortcut and vault is locked
432,2017-12-12 11:51:33.000000000,2017-12-12 18:26:53.000000000,closed,1,Unnecessary side scrolling bug
431,2017-12-12 00:42:28.000000000,2017-12-12 09:39:33.000000000,closed,4,Bitwarden Card Auto-Fill Fails on Bitwarden's own Website
430,2017-12-11 22:25:47.000000000,2018-05-08 22:34:49.000000000,closed,12,Scrolling issue in Firefox within BW popup
429,2017-12-11 18:48:42.000000000,2017-12-11 20:21:00.000000000,closed,8,Drag n drop into folders
428,2017-12-11 18:43:57.000000000,2017-12-11 18:54:17.000000000,closed,1,Add subfolders
427,2017-12-10 23:08:40.000000000,2017-12-11 18:05:00.000000000,closed,4,Extra step required to log into yahoo mail
426,2017-12-10 21:46:30.000000000,2018-07-27 18:19:41.000000000,closed,8,Slow to display popup when there are many cards stored
425,2017-12-10 20:15:52.000000000,2017-12-10 23:46:22.000000000,closed,4,Extension popup looses state.
424,2017-12-09 18:49:10.000000000,2017-12-11 22:05:59.000000000,closed,7,Registration doesn't provide any information if the email address is already in use.
423,2017-12-07 23:32:47.000000000,2017-12-08 02:04:44.000000000,closed,0,[Webpack] Change images to not use relative path.
422,2017-12-07 22:31:02.000000000,2017-12-08 00:01:38.000000000,closed,1,Custom field checkbox autofill problem
421,2017-12-07 09:27:13.000000000,2017-12-08 02:04:44.000000000,closed,5,Webpack task fails on Linux
420,2017-12-07 01:24:34.000000000,2018-03-08 08:03:57.000000000,closed,3,Integration with OnlyKey
419,2017-12-06 23:32:30.000000000,2017-12-06 23:51:49.000000000,closed,0,[TypeScript] Convert background entry script to TypeScript
418,2017-12-06 20:38:48.000000000,2017-12-06 21:12:29.000000000,closed,3,Username autofill issue with sso.emc.com (Dell EMC)
417,2017-12-06 19:31:27.000000000,2017-12-06 19:45:26.000000000,closed,0,New Crowdin translations
416,2017-12-05 18:52:16.000000000,2017-12-08 17:37:43.000000000,closed,3,Semicolon in notes field may interfere with vault export tool
415,2017-12-04 16:47:15.000000000,2018-03-08 08:03:41.000000000,closed,4,Generate and fill password from context menu
414,2017-12-04 01:58:32.000000000,2017-12-04 19:07:35.000000000,closed,6,Bug: Unable to use alternate Two-Factor Authentication Method
413,2017-12-01 20:21:35.000000000,2018-03-08 08:02:59.000000000,closed,1,[Feature Request] Advanced search vault options for user to tweak search settings
412,2017-12-01 16:41:39.000000000,2018-03-08 08:00:15.000000000,closed,3,Feature Request: Filters in browser extensions.
411,2017-12-01 13:31:04.000000000,2017-12-01 20:13:40.000000000,closed,3,Search in Vault does not provide desired result sometimes
410,2017-12-01 07:56:01.000000000,2017-12-04 03:48:13.000000000,closed,1,Execute the sidebar action with Ctrl+Shift+Comma
409,2017-11-30 23:29:14.000000000,2017-12-06 23:09:53.000000000,closed,9,Lock setting was reset to 'Never' on 1.22.0 update yesterday
408,2017-11-30 22:49:55.000000000,2017-12-02 01:45:07.000000000,closed,9,Fill issues since last extension update - present on all browsers and systems
407,2017-11-30 05:52:19.000000000,2017-11-30 17:48:19.000000000,closed,3,[Firefox 57] Password Generator does not remember settings
406,2017-11-29 23:01:37.000000000,1970-01-01 00:00:00.000000001,open,3,Delete the refresh token on logout
405,2017-11-29 21:38:37.000000000,2017-11-29 21:39:12.000000000,closed,0,New Crowdin translations
404,2017-11-29 16:20:19.000000000,2017-11-29 17:50:22.000000000,closed,1,First keystroke not registered when searching vault in Chrome extension
403,2017-11-28 23:25:06.000000000,2017-11-28 23:52:28.000000000,closed,10,[Firefox] Detached pop-up window starts up blank
402,2017-11-27 19:51:43.000000000,2017-11-27 19:54:41.000000000,closed,2,Different defaults between Chrome and Firefox extension
401,2017-11-27 19:43:40.000000000,2017-11-27 19:49:02.000000000,closed,1,Detect password change
400,2017-11-27 19:12:01.000000000,2017-11-27 19:49:44.000000000,closed,3,[Firefox] Search Vault
399,2017-11-27 18:09:44.000000000,2018-03-08 07:59:44.000000000,closed,2,Make autofill-animation optional
398,2017-11-26 04:53:41.000000000,2017-11-26 18:35:50.000000000,closed,0,[TypeScript] Settings module
397,2017-11-25 18:25:03.000000000,2017-11-25 20:04:32.000000000,closed,0,[TypeScript] Global module.
396,2017-11-25 04:37:18.000000000,2017-11-25 18:02:23.000000000,closed,0,[TypeScript] Convert directives
395,2017-11-25 04:01:30.000000000,2017-11-25 04:14:04.000000000,closed,0,More tests
394,2017-11-24 14:24:24.000000000,1970-01-01 00:00:00.000000001,open,8,EA.com doesn't offer to save credentials when enter button pressed to log in
393,2017-11-24 04:31:59.000000000,2018-03-08 07:58:55.000000000,closed,8,Banned IP 
392,2017-11-24 02:55:01.000000000,2017-12-04 03:48:13.000000000,closed,8,Sidebar keyboard Shortcut
391,2017-11-23 19:04:50.000000000,2017-11-23 20:37:57.000000000,closed,3,Regression: Sort exact URL matches first 
390,2017-11-23 01:55:45.000000000,2017-11-24 08:07:43.000000000,closed,3,add toggle to see plain password when adding & editing ciphers (#292)
389,2017-11-22 23:10:03.000000000,2018-03-08 07:59:10.000000000,closed,1,Enter length of randomly generated password with keyboard
388,2017-11-22 20:31:51.000000000,2017-11-22 22:45:39.000000000,closed,1,"on-premise support for ""bitwarden Web Vault"" tool"
387,2017-11-21 15:25:51.000000000,2017-11-22 18:11:52.000000000,closed,5,Extension credentials order/favourite-flag broken
386,2017-11-20 20:02:25.000000000,2017-11-20 22:50:15.000000000,closed,5,"On Firefox on Android, the bitwarden menu entry sometimes disappears."
385,2017-11-18 23:41:33.000000000,2017-11-18 23:46:39.000000000,closed,0,New Crowdin translations
384,2017-11-18 04:14:17.000000000,2018-03-08 07:58:16.000000000,closed,3,Misc enhancements surrounding the Folders management panel
383,2017-11-18 04:12:37.000000000,2018-03-08 07:58:00.000000000,closed,2,Duplicate folder names allowed
382,2017-11-18 03:23:09.000000000,1970-01-01 00:00:00.000000001,open,0,Autofill closes Google signin window on review site.
381,2017-11-18 02:02:45.000000000,2017-11-18 02:33:58.000000000,closed,0,Add support for running unit tests
380,2017-11-17 16:35:49.000000000,2018-03-08 07:57:22.000000000,closed,3,"Allow showing password in ""edit"" mode"
379,2017-11-17 04:29:59.000000000,2017-11-18 07:30:29.000000000,closed,2,[Suggestion] Extension default viewing
378,2017-11-16 19:12:16.000000000,2017-11-16 19:24:12.000000000,closed,3,[Firefox] Copy OTP to clipboard using keyboard shortcut
377,2017-11-16 17:36:39.000000000,2018-03-08 07:56:42.000000000,closed,15,Cycle logins when using autofill shortcut multiple times
376,2017-11-15 23:53:09.000000000,2017-11-15 23:53:58.000000000,closed,1,Search should look at usernames
375,2017-11-15 23:46:48.000000000,2017-11-16 00:00:50.000000000,closed,3,Have option to fill forms
374,2017-11-15 23:41:38.000000000,2017-11-15 23:55:46.000000000,closed,1,Display in entry field visual indicator that bitwarden has an associated entry.
373,2017-11-15 04:42:27.000000000,2018-03-08 07:56:18.000000000,closed,3,[Suggestion] Easier way to open site/fill password form
372,2017-11-14 23:03:40.000000000,2017-11-14 23:44:35.000000000,closed,1,[Typecript] Convert current
371,2017-11-13 02:47:49.000000000,2017-11-13 08:45:49.000000000,closed,1,Extension should open with focus on search bar
370,2017-11-12 23:48:21.000000000,2017-11-14 13:10:50.000000000,closed,2,Bitwarden icon disappears after restarting Firefox
369,2017-11-11 22:20:02.000000000,2017-11-11 22:21:54.000000000,closed,1,Unable to use Yubikey U2F with Fedora 26 and Firefox 57
368,2017-11-10 15:17:21.000000000,2017-11-10 18:52:37.000000000,closed,1,Dropdown menu on forms
367,2017-11-10 08:44:09.000000000,2017-11-10 08:45:31.000000000,closed,0,Typescript conversion
366,2017-11-10 00:59:49.000000000,2017-11-10 01:33:51.000000000,closed,0,[Typescript] Convert password generator
365,2017-11-10 00:20:55.000000000,2017-11-10 00:29:10.000000000,closed,0,[Webpack] Update filename for css.
364,2017-11-09 18:27:43.000000000,2017-11-09 20:51:43.000000000,closed,3,HTTP Authentication
363,2017-11-07 18:50:31.000000000,2017-11-07 20:45:10.000000000,closed,2,Updating to Premium failed in Firefox Extension
362,2017-11-07 14:43:06.000000000,2017-11-07 17:22:58.000000000,closed,1,Cannot add custom secure note field using iOS mobile app
361,2017-11-07 12:45:50.000000000,2018-03-08 07:55:56.000000000,closed,9,[Suggestion] Add keyboard navigation shortcuts
360,2017-11-07 12:42:58.000000000,2017-11-07 17:19:35.000000000,closed,1,[Enhancement] Automatically capture search input after clicking extension
359,2017-11-07 09:29:20.000000000,1970-01-01 00:00:00.000000001,open,0,Bitwarden login field not auto-cleared if credentials is incorrect or invalid
358,2017-11-06 16:37:35.000000000,2018-03-08 07:54:32.000000000,closed,6,Provide fingerprint support for Chrome extension
357,2017-11-06 12:40:20.000000000,2018-03-08 07:54:22.000000000,closed,1,Suggestions
356,2017-11-04 14:24:22.000000000,2017-11-12 08:00:21.000000000,closed,3,Credit card auto-fill
355,2017-11-04 01:20:40.000000000,2017-11-04 01:21:08.000000000,closed,0,Fix initListSectionItemListeners
354,2017-11-04 00:26:07.000000000,2017-11-04 00:40:45.000000000,closed,0,[TypeScript] Lock module
353,2017-11-03 22:36:54.000000000,2017-11-03 23:53:36.000000000,closed,0,[TypeScript] Popup app services
352,2017-11-03 20:16:15.000000000,2017-11-22 22:45:51.000000000,closed,7,Access to web vault on-premise server
351,2017-11-03 19:47:06.000000000,2017-11-06 20:33:47.000000000,closed,15,Auto-fill does not work for few sites
350,2017-11-03 17:53:09.000000000,1970-01-01 00:00:00.000000001,open,14,Bitwarden doesn't prompt to save new login for gmail.com
349,2017-11-02 19:07:21.000000000,2018-03-08 07:53:44.000000000,closed,1,"Feature request: Toggle hidden password in ""edit"" mode in browser"
348,2017-11-02 18:56:54.000000000,2017-11-07 01:28:28.000000000,closed,13,United.com will not fill in user name
347,2017-11-02 18:29:32.000000000,2017-11-12 08:18:28.000000000,closed,7,"""Unable to auto-fill"" for identities"
346,2017-11-02 16:25:32.000000000,2017-11-02 16:31:29.000000000,closed,2,deleting mutliple entires is painful (bulk modification)
345,2017-11-02 01:42:17.000000000,2017-11-02 03:38:30.000000000,closed,0,Upgrade ui-router to 1.0.10
344,2017-11-02 00:51:33.000000000,2017-11-02 16:02:15.000000000,closed,1,[Typescript] Convert tools page to TS 
343,2017-11-01 21:38:51.000000000,2017-11-01 22:36:36.000000000,closed,1,search by username does not work in Firefox after latest release.
342,2017-10-31 22:52:25.000000000,2017-11-01 17:18:06.000000000,closed,0,Convert utilService to Typescript.
341,2017-10-31 21:16:00.000000000,2017-11-03 00:35:11.000000000,closed,3,Added auto fill animation.
340,2017-10-30 20:50:09.000000000,2017-10-31 01:49:57.000000000,closed,0,Add TSLint
339,2017-10-30 18:29:31.000000000,2018-03-08 07:53:25.000000000,closed,2,Toggle password view on log in
338,2017-10-30 16:43:30.000000000,2017-10-30 16:46:08.000000000,closed,0,New Crowdin translations
337,2017-10-30 11:10:13.000000000,2017-10-30 15:41:45.000000000,closed,1,[Feature requests] Copy OTP code to clipboard even when using hot keys
336,2017-10-29 16:12:45.000000000,2017-10-29 16:58:51.000000000,closed,0,Minor improvements to Typescript
335,2017-10-28 19:31:07.000000000,2017-10-28 19:40:22.000000000,closed,1,[Edge] Unable to type characters using the alt-gr modifier
334,2017-10-28 17:40:19.000000000,2017-10-28 17:40:58.000000000,closed,1,Firefox scrolls down to the first password field when loading a website
333,2017-10-28 06:00:32.000000000,2017-10-28 06:04:05.000000000,closed,3,Can't add new login
332,2017-10-27 22:54:44.000000000,2017-11-20 21:52:50.000000000,closed,2,Login form fill does not work on fortuneo.fr
331,2017-10-26 22:03:39.000000000,2017-10-27 18:35:02.000000000,closed,2,Autofill does not work when a new Firefox window opens
330,2017-10-26 16:34:10.000000000,2018-03-08 07:52:57.000000000,closed,2,Memorable Password Generator
329,2017-10-25 19:49:01.000000000,1970-01-01 00:00:00.000000001,open,5,"[Firefox] Clicking on the ""launch website"" icon in pop-out window opens a new tab in the pop-out window"
328,2017-10-25 19:19:35.000000000,2017-10-25 19:40:05.000000000,closed,2,Extension interface does not fit into the browser area
327,2017-10-25 18:43:11.000000000,2017-10-31 20:29:42.000000000,closed,4,Firefox: Can't delete login info
326,2017-10-24 20:41:31.000000000,2017-10-24 21:20:29.000000000,closed,5,Set pasteboard type for clipboard contents
325,2017-10-24 19:04:28.000000000,2017-10-24 19:25:26.000000000,closed,2,Some passwords incorrectly imported from lastpass csv
324,2017-10-24 17:20:38.000000000,2017-10-24 19:41:33.000000000,closed,2,Does not ask to update username if new credentials are entered.
323,2017-10-23 23:17:08.000000000,2017-10-24 22:49:27.000000000,closed,1,"Hint longer than 50 characters comes up as ""Error occured"""
322,2017-10-22 23:30:24.000000000,2018-03-08 07:53:09.000000000,closed,3,[Feature Request] Sync Settings
321,2017-10-22 14:29:29.000000000,2017-10-23 05:49:14.000000000,closed,3,Scaling for panel wrong when using Firefox
320,2017-10-21 12:54:48.000000000,1970-01-01 00:00:00.000000001,open,33,No prompt (add login notification) offered to save the credentials for some sites
319,2017-10-21 11:52:10.000000000,2017-10-21 20:58:32.000000000,closed,1,Sort package.json in alphabetic order
318,2017-10-20 15:28:14.000000000,2017-10-20 16:25:20.000000000,closed,1,Long password not fitting into password field
317,2017-10-18 23:17:48.000000000,1970-01-01 00:00:00.000000001,open,7,Autofills incorrect fields on TD Easyweb site
316,2017-10-18 22:55:43.000000000,2017-10-29 06:14:14.000000000,closed,0,[WIP] Webpack & TypeScript
315,2017-10-18 21:47:58.000000000,2017-10-18 21:49:16.000000000,closed,0,New Crowdin translations
314,2017-10-18 08:40:27.000000000,2017-10-19 16:38:34.000000000,closed,2,"firefox: show popup when click ""vault is locked"""
313,2017-10-17 11:27:46.000000000,2017-10-18 08:52:20.000000000,closed,2,Can't login to FireFox extention offline
312,2017-10-16 06:12:40.000000000,2017-10-16 15:52:41.000000000,closed,1,Allow Multiple U2F Keys
311,2017-10-16 02:34:19.000000000,1970-01-01 00:00:00.000000001,open,6,Extension does not detect existing site and adds a new one instead of updating it
310,2017-10-16 01:23:55.000000000,2017-10-18 00:42:05.000000000,closed,5,History of generated passwords
309,2017-10-15 22:15:58.000000000,2018-03-08 07:52:14.000000000,closed,4,Autosaving for a Login with locked vault
308,2017-10-15 21:29:20.000000000,2017-10-26 17:19:33.000000000,closed,1,Autofill doesnt work on kunde.comdirect.de
307,2017-10-15 18:40:09.000000000,2018-03-08 07:51:47.000000000,closed,2,[Enhancement] Automatically open Vault when there are no matching sites
306,2017-10-13 19:09:24.000000000,2017-10-13 19:26:08.000000000,closed,1,cursor focus not on search bar in firefox extension
305,2017-10-13 07:03:05.000000000,2017-10-13 07:04:28.000000000,closed,1,Add option to hide matching login counter
304,2017-10-12 17:40:38.000000000,2017-10-12 17:41:15.000000000,closed,1,Please add Bitwarden button to password fields
303,2017-10-12 14:49:15.000000000,2017-10-12 16:28:30.000000000,closed,1,"UI cut off in Fx 57 when icon is under ""More tools.."""
302,2017-10-11 19:50:04.000000000,2017-10-11 19:54:35.000000000,closed,0,New Crowdin translations
301,2017-10-11 19:41:30.000000000,2017-10-11 19:48:58.000000000,closed,0,New Crowdin translations
300,2017-10-11 13:18:40.000000000,2018-03-08 07:51:34.000000000,closed,2,Larger fonts in extension popup
299,2017-10-10 17:23:15.000000000,2017-10-10 19:16:48.000000000,closed,2,Focus on search field when opening extension
298,2017-10-10 01:16:45.000000000,2019-02-15 08:56:13.000000000,closed,2,[WIP] Share button
297,2017-10-09 22:33:59.000000000,2017-10-09 22:36:49.000000000,closed,2,"Fix issue #271, popup window drawing cropped"
296,2017-10-09 18:11:52.000000000,2017-10-09 18:15:01.000000000,closed,2,"Please configure Bitwarden popup to be opened in a persistent window, similar to what Google Hangouts does. "
