id,created_at,closed_at,state,comments,title
1864,2018-06-22 11:55:36.000000000,2018-09-21 17:15:36.000000000,closed,0,add lang#AsciiDoc layer
1863,2018-06-22 11:48:38.000000000,2018-08-05 09:21:58.000000000,closed,0,Add lang#agda layer
1862,2018-06-21 22:04:15.000000000,2018-07-02 16:11:47.000000000,closed,1,<C-S> not working well
1861,2018-06-21 19:25:24.000000000,2018-06-29 16:03:21.000000000,closed,4,"Not Able To Set Leader to ','"
1860,2018-06-21 16:51:12.000000000,2018-06-23 10:37:42.000000000,closed,1,Website: update layer page
1859,2018-06-21 13:05:16.000000000,2018-07-01 18:13:15.000000000,closed,2,Hello Mr.Big
1858,2018-06-21 08:34:15.000000000,2018-06-27 13:19:00.000000000,closed,2,completor error when editing gitcommit from git commit --amend
1857,2018-06-21 08:26:26.000000000,2019-04-24 19:21:30.000000000,closed,13,C layer newline insert between brackets is not  indented
1856,2018-06-21 06:42:25.000000000,2019-09-18 19:15:50.000000000,closed,14,Assembly support
1855,2018-06-21 06:10:34.000000000,2018-07-17 16:56:45.000000000,closed,3,Using python 3 as default for spacevim
1854,2018-06-20 20:02:54.000000000,2019-04-28 10:00:36.000000000,closed,1,JUPYTER 3 CONSOLE IN SPACE VIM
1853,2018-06-20 19:18:54.000000000,2018-07-17 17:56:30.000000000,closed,14,Changing init.vim to init.toml
1852,2018-06-20 16:59:19.000000000,2018-06-20 17:36:51.000000000,closed,1,Improve pull request template
1851,2018-06-20 10:12:42.000000000,2018-06-21 09:21:38.000000000,closed,3,spacevim edit color abnormal
1850,2018-06-19 20:35:37.000000000,2018-06-20 06:13:52.000000000,closed,4,add julia 0.6 support by lsp
1849,2018-06-19 17:44:49.000000000,2018-06-20 16:44:09.000000000,closed,1,Add test for api
1848,2018-06-19 17:29:32.000000000,2018-06-19 17:50:20.000000000,closed,5,faq: using SpaceVim without overwrite vimrc
1847,2018-06-19 11:59:22.000000000,2018-06-19 17:17:51.000000000,closed,4,How should I set leader in init.toml
1846,2018-06-19 06:46:00.000000000,2018-06-21 04:47:43.000000000,closed,1,julia 0.6 or newer support
1845,2018-06-18 19:05:39.000000000,2018-06-19 05:27:44.000000000,closed,5,Can you safely uninstall spacevim?
1844,2018-06-18 17:58:51.000000000,2018-06-19 17:50:20.000000000,closed,2,Feature request: don't overwrite .vimrc/init.vim
1843,2018-06-18 12:10:35.000000000,2018-06-18 12:12:31.000000000,closed,1,Change spacevim option
1842,2018-06-18 10:56:25.000000000,2018-06-18 11:53:48.000000000,closed,1,Update version: 0.9.0-dev
1841,2018-06-17 16:15:14.000000000,2018-06-18 10:01:57.000000000,closed,3,Release v0.8.0
1840,2018-06-17 15:13:02.000000000,2018-07-12 17:03:06.000000000,closed,2,The SpaceVim often get stuck under the OSX
1839,2018-06-17 12:18:51.000000000,2018-06-17 14:01:11.000000000,closed,1,SpaceVim 在OSX下卡死
1838,2018-06-15 19:04:04.000000000,2018-06-19 05:21:57.000000000,closed,2,faq: clean up the English a little
1837,2018-06-15 17:11:16.000000000,2018-06-15 17:27:59.000000000,closed,1,Update doc and help file
1836,2018-06-14 16:49:44.000000000,2018-06-14 16:54:06.000000000,closed,1,Display current tag in statusline
1835,2018-06-14 16:27:08.000000000,2018-09-16 17:44:29.000000000,closed,7,Paste in fuzzy find
1834,2018-06-14 11:08:43.000000000,2018-06-14 17:12:27.000000000,closed,1,loading vim failed in WSL
1833,2018-06-14 06:01:21.000000000,2018-06-19 17:04:15.000000000,closed,1,Update colorscheme.vim
1832,2018-06-13 17:13:25.000000000,2018-06-13 17:13:44.000000000,closed,0,Fix buffer state
1831,2018-06-13 16:57:06.000000000,2018-06-13 17:03:23.000000000,closed,1,Update key binding of easymotion
1830,2018-06-13 16:44:26.000000000,2018-06-13 16:44:35.000000000,closed,0,Fix update
1829,2018-06-13 03:43:48.000000000,2018-12-30 10:31:23.000000000,closed,8,Getting started tutorial
1828,2018-06-12 22:24:51.000000000,2018-06-13 13:45:00.000000000,closed,6,Added references and more lsp features for rust
1827,2018-06-12 21:11:05.000000000,2018-06-12 22:11:29.000000000,closed,1,Added references to gc key. Added gc mapping. Added more lsp support …
1826,2018-06-12 05:58:51.000000000,2018-06-12 05:58:58.000000000,closed,0,Update manager.vim
1825,2018-06-11 23:47:50.000000000,2018-06-12 01:48:30.000000000,closed,0,Added support for having both custom toml and init files
1824,2018-06-11 19:34:38.000000000,2018-06-12 04:01:04.000000000,closed,0,Fix typo in javascript.vim
1823,2018-06-11 19:29:00.000000000,2018-06-12 10:22:44.000000000,closed,1,Cannot use Spacevim in Ubuntu16.04 WSL(Windows Sub-Linux)
1822,2018-06-11 03:42:38.000000000,2018-06-12 05:58:58.000000000,closed,3,First setup fails - Undefined variable: g:spacevim_plugin_manager_max_processes
1821,2018-06-11 00:23:09.000000000,2018-06-27 17:12:59.000000000,closed,2,`Space rl` to resume denite do not work
1820,2018-06-10 22:50:48.000000000,2018-08-04 17:04:44.000000000,closed,4,Occasional lockups/freeze when making a newline
1819,2018-06-10 18:59:37.000000000,2018-06-10 19:31:34.000000000,closed,2,Fix installation error when there are no '.config' at '$HOME' directory.
1818,2018-06-10 03:29:40.000000000,2018-06-13 17:13:44.000000000,closed,1,Error when opening buffer transient state
1817,2018-06-09 17:01:45.000000000,2018-06-10 19:30:02.000000000,closed,1,Update help file for toml
1816,2018-06-09 13:42:13.000000000,2018-06-09 15:54:22.000000000,closed,1,Select the configured projectmanager when opening a project
1815,2018-06-09 11:48:51.000000000,2018-06-12 04:01:42.000000000,closed,0,Disable the gometalinter in neomake
1814,2018-06-09 02:09:14.000000000,2018-06-09 02:34:09.000000000,closed,1,Fix a potentially misleading example in the doc
1813,2018-06-09 00:58:52.000000000,2018-06-09 02:32:49.000000000,closed,2,Fix typo
1812,2018-06-08 23:20:12.000000000,2018-06-09 02:31:31.000000000,closed,2,Fix a typo in cn/documentation.md
1811,2018-06-08 13:51:07.000000000,2018-06-08 17:59:01.000000000,closed,4,More key bingindings
1810,2018-06-08 12:29:56.000000000,2018-07-26 18:26:00.000000000,closed,3,Use denite layer RecursionError
1809,2018-06-08 11:28:53.000000000,2018-06-08 17:10:26.000000000,closed,1,How to define key bindings in init.toml
1808,2018-06-08 10:01:21.000000000,2018-06-08 17:11:05.000000000,closed,0,PLEASE  update doc soon
1807,2018-06-08 00:48:42.000000000,2018-06-26 17:47:19.000000000,closed,10,Doc clarification
1806,2018-06-07 17:08:20.000000000,2018-06-07 17:09:41.000000000,closed,1,Fix debug info
1805,2018-06-07 17:05:14.000000000,2018-06-26 17:29:48.000000000,closed,3,feature request: lsp support for typescript
1804,2018-06-07 11:07:52.000000000,2018-06-07 16:15:59.000000000,closed,1,Terminal does not work
1803,2018-06-07 08:46:40.000000000,2018-06-07 17:09:41.000000000,closed,1,Both 'SPDebugInfo' and 'SPC h I' fail
1802,2018-06-07 07:19:59.000000000,2018-07-09 13:17:31.000000000,closed,5,fix delay for fly grep in neovim
1801,2018-06-07 03:53:24.000000000,2018-06-07 19:31:32.000000000,closed,2,Documentation Question
1800,2018-06-06 21:45:21.000000000,2018-08-04 17:01:12.000000000,closed,25,E117: Unknown function: TSOnBufEnter in typescript layer with nvim
1799,2018-06-06 16:55:20.000000000,2018-06-12 04:02:48.000000000,closed,1,Add doc for format on save
1798,2018-06-06 10:28:14.000000000,2018-06-12 04:03:19.000000000,closed,4,how to make Neoformat on save??
1797,2018-06-06 06:24:50.000000000,2018-06-06 07:35:23.000000000,closed,1,fix undefined variable for g:_spacevim_config_path
1796,2018-06-05 19:58:07.000000000,2018-07-11 16:34:09.000000000,closed,10,how to set textwidth?
1795,2018-06-05 16:29:11.000000000,2018-06-05 16:29:24.000000000,closed,0,Escape file name
1794,2018-06-05 10:12:07.000000000,2019-05-06 07:33:35.000000000,closed,6,require lang#sql layer
1793,2018-06-05 09:34:39.000000000,2018-08-26 16:23:41.000000000,closed,6,Open file failed
1792,2018-06-05 06:16:48.000000000,2018-08-02 16:50:54.000000000,closed,6,hint error when use sudo
1791,2018-06-05 03:01:11.000000000,2018-06-05 05:21:19.000000000,closed,2,How to create custom layer
1790,2018-06-05 01:52:14.000000000,2018-07-12 16:58:32.000000000,closed,6,edit.vim basic mode - ability to disable floobits
1789,2018-06-04 17:33:02.000000000,2018-06-04 17:33:13.000000000,closed,0,Add Search box to the website
1788,2018-06-04 12:37:46.000000000,2019-04-13 11:29:15.000000000,closed,10,unite open file failed under windows
1787,2018-06-03 17:38:37.000000000,2018-06-03 17:38:45.000000000,closed,0,Fix rtp type
1786,2018-06-03 17:02:40.000000000,2018-09-01 06:04:40.000000000,closed,1,Fix cscope layer
1785,2018-06-03 16:37:40.000000000,2018-06-03 16:38:02.000000000,closed,0,Fix doc about enable/disable guicolors
1784,2018-06-03 16:14:05.000000000,2018-06-03 16:14:18.000000000,closed,0,Glyph free theme
1783,2018-06-03 12:17:25.000000000,2018-06-03 15:25:42.000000000,closed,0,Add doc for statusline and tabline
1782,2018-06-03 12:04:46.000000000,2018-06-19 17:04:15.000000000,closed,2,the theme 'Material' is hoped to be added to SpaceVim
1781,2018-06-03 11:10:38.000000000,2018-06-03 11:10:48.000000000,closed,0,Update community
1780,2018-06-02 16:46:13.000000000,2018-06-03 06:40:12.000000000,closed,1,Improve system api
1779,2018-06-02 12:23:04.000000000,2018-06-02 12:26:59.000000000,closed,0,Fix custom config path
1778,2018-06-02 09:52:34.000000000,2018-06-02 09:57:05.000000000,closed,1,乱码
1777,2018-06-02 08:25:40.000000000,2018-10-03 17:47:44.000000000,closed,1,Add: A better way to use find with vim
1776,2018-06-01 10:40:33.000000000,2018-06-03 17:32:16.000000000,closed,1,Some questions about Spacevim 
1775,2018-06-01 09:05:28.000000000,2018-06-01 16:42:35.000000000,closed,1,add useage of bootstrap function to docs (#1771)
1774,2018-06-01 07:51:19.000000000,2018-06-01 08:50:41.000000000,closed,1,add useage of bootstrap function to docs (#1771)
1773,2018-06-01 07:18:36.000000000,2018-06-03 17:38:45.000000000,closed,3,E734/E171 error
1772,2018-05-31 16:09:11.000000000,2018-06-05 16:29:24.000000000,closed,1,Problem with space in directory name?
1771,2018-05-31 08:37:07.000000000,2018-06-02 13:30:40.000000000,closed,4,Is there any way to disable keymapping jk?
1770,2018-05-31 04:56:08.000000000,2018-10-06 16:33:28.000000000,closed,10,neomake  not use local eslint or other local node_module 
1769,2018-05-31 00:05:31.000000000,2018-06-02 05:04:39.000000000,closed,4,Fix syntax highlight conflict under flow-typed js
1768,2018-05-30 19:07:19.000000000,2018-07-28 06:05:35.000000000,closed,2,Add document for dein package debug
1767,2018-05-30 19:04:54.000000000,2018-06-04 07:26:50.000000000,closed,2,Modulize vim functions with separated files in same layer
1766,2018-05-29 06:39:38.000000000,2018-05-31 17:18:22.000000000,closed,2,add SPC x a | to align region at |
1765,2018-05-28 17:50:18.000000000,2018-05-31 17:17:39.000000000,closed,1,Update documentation
1764,2018-05-27 18:29:05.000000000,2018-05-31 18:16:00.000000000,closed,3,Please add offline user manual download link at spacevim.org
1763,2018-05-27 18:18:47.000000000,2018-05-27 18:19:52.000000000,closed,0,Add the offline document
1762,2018-05-27 14:28:14.000000000,2018-05-27 16:54:34.000000000,closed,1,Manager post tags
1761,2018-05-27 12:17:37.000000000,2018-05-27 12:17:45.000000000,closed,0,Improve tags layer
1760,2018-05-26 22:21:54.000000000,2018-06-03 06:40:12.000000000,closed,3,Override make for vimproc?
1759,2018-05-26 22:14:44.000000000,2018-09-16 09:54:57.000000000,closed,9,High cpu/lag with anything but small files
1758,2018-05-25 18:04:40.000000000,2018-05-27 09:05:58.000000000,closed,1,Doc: improve SpaceVim doc
1757,2018-05-25 17:20:39.000000000,2018-05-25 17:20:49.000000000,closed,0,Fix flygrep detect script
1756,2018-05-25 13:33:32.000000000,2018-06-13 16:45:44.000000000,closed,5,ERROR when install SpaceVim
1755,2018-05-25 13:31:40.000000000,2018-05-25 17:34:01.000000000,closed,3,Add Ctrl-a to the vim compatibility list in the documentation
1754,2018-05-25 13:02:49.000000000,2018-05-25 17:26:33.000000000,closed,1,Specify the exact branch for git rebase
1753,2018-05-25 11:14:51.000000000,2018-05-25 17:25:06.000000000,closed,2,Type: JaveScript --> JavaScript
1752,2018-05-24 16:52:14.000000000,2018-05-24 17:22:38.000000000,closed,1,Wiki: update cn wiki
1751,2018-05-24 14:07:38.000000000,2018-09-25 11:56:42.000000000,closed,1,Feature request: random-theme switch colorscheme by custom time
1750,2018-05-24 09:45:59.000000000,2018-06-01 11:27:42.000000000,closed,1,align region at |
1749,2018-05-24 09:25:02.000000000,2018-05-25 16:22:09.000000000,closed,1,In TMUX session: Short delay when switching to insert mode and back to normal mode
1748,2018-05-23 19:46:47.000000000,2018-05-23 19:57:45.000000000,closed,2,vim-go on save GoFmt not triggering
1747,2018-05-23 17:42:51.000000000,2018-05-23 17:51:43.000000000,closed,1,Doc: update colorscheme layer doc
1746,2018-05-23 13:15:01.000000000,2018-05-23 17:14:07.000000000,closed,1,怎么添加补全。默认的补全并不能满足
1745,2018-05-23 05:54:14.000000000,2018-05-27 09:05:58.000000000,closed,4,Can't change spacevim color scheme.
1744,2018-05-22 17:48:46.000000000,2018-05-22 17:50:26.000000000,closed,0,Imporve max_column options
1743,2018-05-22 17:31:16.000000000,2018-05-22 17:36:24.000000000,closed,0,Add custom plugin
1742,2018-05-22 16:43:24.000000000,2018-05-22 17:36:24.000000000,closed,0,Custom plugins in init.toml cannot be used
1741,2018-05-22 16:34:51.000000000,2018-05-22 16:36:39.000000000,closed,0,Fix bootstrap function
1740,2018-05-22 16:07:38.000000000,2018-05-22 16:08:33.000000000,closed,0,Update readme && wiki
1739,2018-05-22 15:54:46.000000000,2018-05-22 15:54:55.000000000,closed,0,Fix doc for colorscheme_bg && close #1737
1738,2018-05-22 14:46:51.000000000,2018-05-22 16:36:39.000000000,closed,1,.SpaceVim.d/autoload/myspacevim.vim not loaded when starting nvim outside of home directory
1737,2018-05-22 12:31:25.000000000,2018-05-22 15:54:56.000000000,closed,10,init.toml background  fail to change  background color
1736,2018-05-22 12:30:31.000000000,2018-05-22 15:31:54.000000000,closed,1,"E121: Undefined variable: v:t_list, E15: Invalid expression, E714: List required"
1735,2018-05-21 17:23:02.000000000,2018-05-21 17:23:14.000000000,closed,0,Update lsp doc
1734,2018-05-21 14:14:16.000000000,2018-05-21 17:23:14.000000000,closed,2,language-server-protocol documentation update re use of toml
1733,2018-05-20 02:33:52.000000000,2018-05-22 17:50:26.000000000,closed,5,SpaceVim does not seem to respect `spacevim_max_column` setting
1732,2018-05-19 14:10:04.000000000,2018-09-01 06:30:22.000000000,closed,6,Unification for key notations in documentation
1731,2018-05-19 12:18:50.000000000,2018-05-27 09:05:58.000000000,closed,3,how can i use SPCgl instead of $ ?
1730,2018-05-18 18:03:03.000000000,2018-05-21 16:33:25.000000000,closed,11,"how to set indent by FileType, like the old vim do."
1729,2018-05-18 16:30:28.000000000,2018-05-18 16:54:35.000000000,closed,1,Update quick guide
1728,2018-05-17 20:23:15.000000000,2018-05-18 08:42:15.000000000,closed,8,SpaceVim.org is down
1727,2018-05-17 17:45:15.000000000,2018-09-01 07:18:48.000000000,closed,2,Supports old vim
1726,2018-05-17 06:23:46.000000000,2018-06-26 18:09:19.000000000,closed,7,Unknown function: term_start
1725,2018-05-16 07:00:42.000000000,2018-06-19 05:20:30.000000000,closed,7,Add [SPC]bb map to list all buffers in fzf layer
1724,2018-05-14 13:01:19.000000000,2018-05-14 17:34:59.000000000,closed,2,"Help, SpaceVim update error"
1723,2018-05-13 14:53:48.000000000,2018-07-21 11:34:14.000000000,closed,11,"raspbian jessie failed to bring up SpaceVim (E121,E15)"
1722,2018-05-13 13:05:51.000000000,2018-05-13 13:06:14.000000000,closed,0,Fix hit-enter when using timers
1721,2018-05-13 06:44:49.000000000,2018-05-13 08:59:43.000000000,closed,1,Add toml config documentation
1720,2018-05-13 06:15:01.000000000,2018-05-13 06:17:36.000000000,closed,3,Permission denied when installing.
1719,2018-05-12 19:00:15.000000000,2018-05-13 09:21:57.000000000,closed,1,Update Go layer to reflect vim-go var name change
1718,2018-05-12 16:27:43.000000000,2018-05-12 16:53:26.000000000,closed,1,Add org layer
1717,2018-05-12 16:09:39.000000000,2018-05-12 16:09:47.000000000,closed,0,Add lang#r layer
1716,2018-05-12 01:06:00.000000000,2018-05-12 14:35:18.000000000,closed,3,Yank and P not pasting from clipboard
1715,2018-05-11 21:37:51.000000000,2018-05-12 07:50:38.000000000,closed,2,Correct `rubocop` spelling in docs
1714,2018-05-11 19:48:29.000000000,2018-05-13 07:35:18.000000000,closed,3,Error - SQLComplete: The debxt plugin must be loaded for dynamic SQL completion
1713,2018-05-11 18:44:13.000000000,2018-05-12 07:51:45.000000000,closed,2,"Fix keys highlights, add missed"
1712,2018-05-11 16:18:00.000000000,2018-05-11 16:20:29.000000000,closed,0,Fix layer activation command and typo in Python layer docs
1711,2018-05-11 16:00:41.000000000,2018-05-11 16:00:59.000000000,closed,0,Fix key bindings Tab
1710,2018-05-11 15:34:39.000000000,2018-05-11 15:34:47.000000000,closed,0,Fix language
1709,2018-05-11 02:13:24.000000000,2018-06-14 05:37:04.000000000,closed,2,High latency while editing C/C++
1708,2018-05-10 17:47:44.000000000,2018-05-10 17:47:56.000000000,closed,0,Set encoding
1707,2018-05-10 16:59:00.000000000,2018-05-12 15:01:01.000000000,closed,1,HTML Improvements
1706,2018-05-10 00:02:54.000000000,2018-05-11 05:54:01.000000000,closed,3,Add auto fix feature to typescript
1705,2018-05-09 21:43:44.000000000,2018-05-13 08:59:42.000000000,closed,12,How to disable statusline via toml
1704,2018-05-09 21:25:51.000000000,2018-05-13 08:59:42.000000000,closed,9,Plugin configuration outside init.toml
1703,2018-05-09 18:22:22.000000000,2018-05-10 17:47:56.000000000,closed,0,encoding=utf-8 should be set in config/init.vim
1702,2018-05-09 18:10:21.000000000,2018-05-11 15:34:47.000000000,closed,3,en_US.UTF-8 should be used instead of en_US.utf8
1701,2018-05-09 17:59:55.000000000,2018-06-13 16:36:01.000000000,closed,45,welcome page(startify)  icon can't display
1700,2018-05-09 16:46:31.000000000,2018-05-10 16:22:27.000000000,closed,0,Fix windows support
1699,2018-05-08 17:53:54.000000000,2018-05-08 17:55:43.000000000,closed,1,Fix lint
1698,2018-05-08 17:14:40.000000000,2018-05-08 17:14:59.000000000,closed,0,Fix SPC f f key bindings
1697,2018-05-08 17:06:22.000000000,2018-06-18 17:04:25.000000000,closed,10,Add floobits layer
1696,2018-05-08 16:21:27.000000000,2018-05-08 17:14:59.000000000,closed,1,SPC f f does not work with layer unite in neovim.
1695,2018-05-06 19:29:33.000000000,2018-06-13 16:49:55.000000000,closed,2,How can I add GoReferrers to language specification key binding?
1694,2018-05-06 06:43:43.000000000,2018-06-02 12:26:59.000000000,closed,11,SpaceVim global config path variable undefined
1693,2018-05-04 10:57:44.000000000,2019-01-24 20:02:10.000000000,closed,1,show input method on status bar
1692,2018-05-03 07:19:08.000000000,2018-09-16 17:06:11.000000000,closed,4,cscope: cannot open file cscope.out
1691,2018-05-02 23:16:38.000000000,2018-05-03 02:12:38.000000000,closed,1,uninstall does not remove every spacevim things
1690,2018-05-02 16:35:55.000000000,2018-05-02 16:36:19.000000000,closed,0,Enable nocompatible for vim
1689,2018-05-02 14:54:20.000000000,2018-05-02 16:29:58.000000000,closed,4,hi MatchParen doesn't work
1688,2018-05-02 00:54:09.000000000,2018-05-02 16:36:19.000000000,closed,5,Unable to load SpaceVim due to Vim 8 syntax errors 
1687,2018-05-02 00:15:52.000000000,2018-05-02 10:37:49.000000000,closed,5,Gtags wasn't installed correctly
1686,2018-05-01 20:57:58.000000000,2018-06-04 07:29:10.000000000,closed,5,Vim Crashes
1685,2018-05-01 18:19:08.000000000,2018-05-01 18:19:17.000000000,closed,0,Detach command
1684,2018-05-01 17:54:41.000000000,2018-05-01 17:54:50.000000000,closed,0,Fix detach script
1683,2018-05-01 17:50:38.000000000,2018-05-01 18:00:43.000000000,closed,1,"After adding dart layer, code completion not work"
1682,2018-05-01 17:42:48.000000000,2018-05-01 17:42:58.000000000,closed,0,Split dein UI as plugin
1681,2018-05-01 16:25:39.000000000,2018-05-01 17:12:17.000000000,closed,0,Add compatible API for matchaddpos
1680,2018-05-01 16:02:59.000000000,2018-05-13 09:26:12.000000000,closed,1,Fix jump mappings
1679,2018-05-01 13:13:53.000000000,2018-05-01 17:12:18.000000000,closed,1,"run spacevim, hit space,then error occured"
1678,2018-05-01 11:04:49.000000000,2018-05-01 11:05:02.000000000,closed,0,Fix flygrep
1677,2018-05-01 10:46:49.000000000,2018-05-01 10:47:15.000000000,closed,0,Fix install script
1676,2018-05-01 09:19:06.000000000,2018-05-01 09:19:18.000000000,closed,0,Fix phpcd support
1675,2018-05-01 05:04:35.000000000,2018-05-10 16:22:27.000000000,closed,6,SpaceVim does not load successful while startup on windows.
1674,2018-04-30 22:51:47.000000000,2018-05-01 10:47:14.000000000,closed,0,installation of spacevim changes my terminal font color
1673,2018-04-30 16:57:52.000000000,2018-04-30 16:58:12.000000000,closed,0,Improve buffer switch key bindings
1672,2018-04-30 07:52:42.000000000,2018-05-10 16:22:27.000000000,closed,2,Installation failed on windows10
1671,2018-04-30 06:39:31.000000000,2018-04-30 09:31:34.000000000,closed,0,Add asyncomplete-clang
1670,2018-04-30 06:21:08.000000000,2018-04-30 06:21:16.000000000,closed,0,Fix Asyncomplete support
1669,2018-04-30 05:47:33.000000000,2018-04-30 06:02:32.000000000,closed,1,Plugins Installed with Dein don't stay installed
1668,2018-04-29 09:16:42.000000000,2018-04-29 16:44:26.000000000,closed,1,Update readme
1667,2018-04-29 06:34:44.000000000,2018-04-29 06:34:53.000000000,closed,0,Fix vimcompatible mode
1666,2018-04-29 05:57:14.000000000,2018-04-29 05:57:51.000000000,closed,0,Fix SPConfig
1665,2018-04-29 05:45:09.000000000,2018-04-29 05:45:19.000000000,closed,0,Improve vimcompatible mode
1664,2018-04-28 16:30:58.000000000,2018-04-29 05:46:24.000000000,closed,1,ctrl+a 会加1， 但ctrl+x 不会减1 
1663,2018-04-27 17:15:21.000000000,2018-05-01 11:05:02.000000000,closed,8,Support projective search
1662,2018-04-27 08:48:29.000000000,2018-04-28 12:15:43.000000000,closed,2,Java layer error on opening java file - No Javavi library classes found
1661,2018-04-25 17:07:28.000000000,2018-04-25 18:02:33.000000000,closed,2,Fix typo in documentation
1660,2018-04-25 15:24:29.000000000,2018-05-07 17:07:46.000000000,closed,19,Recent commit in deim.vim renders `sudo vim` unusable
1659,2018-04-24 17:35:35.000000000,2018-04-24 17:35:44.000000000,closed,0,Hot fix
1658,2018-04-24 13:46:10.000000000,2018-04-25 09:15:49.000000000,closed,1, show input menu in status bar
1657,2018-04-24 10:30:27.000000000,2018-04-24 11:28:06.000000000,closed,1,Documentation missing for gitstatus
1656,2018-04-24 08:30:20.000000000,2018-04-27 06:08:10.000000000,closed,3,Prefer local phpmd.xml
1655,2018-04-24 03:34:54.000000000,2018-04-24 04:43:36.000000000,closed,1,Change filetype assert
1654,2018-04-23 16:48:11.000000000,2018-04-23 17:30:06.000000000,closed,1,Improve toml support
1653,2018-04-23 07:44:06.000000000,2018-04-23 16:20:22.000000000,closed,1,Only Reload when the filetype is javascript
1652,2018-04-23 03:20:27.000000000,2018-04-23 16:19:55.000000000,closed,1,Add autofix feature for php with phpcbf
1651,2018-04-23 01:32:01.000000000,2018-04-23 07:54:16.000000000,closed,2,Fix error `unknown option guifont` in VimR
1650,2018-04-22 18:55:37.000000000,2018-04-22 18:55:47.000000000,closed,0,Fix denite config
1649,2018-04-22 14:53:26.000000000,2018-04-22 14:53:37.000000000,closed,0,Fix tags layer
1648,2018-04-22 13:11:01.000000000,2019-04-28 17:22:17.000000000,closed,8,Top buffer list does not scroll left / right
1647,2018-04-22 11:40:22.000000000,2018-04-22 11:40:39.000000000,closed,0,Fix UltiSnips support #1078
1646,2018-04-21 05:17:03.000000000,2018-04-21 17:00:01.000000000,closed,2,Where are custom plugins installed?
1645,2018-04-21 03:20:19.000000000,2018-04-21 04:01:54.000000000,closed,2,Correct title in haskell.md
1644,2018-04-20 18:51:53.000000000,2018-05-01 10:52:40.000000000,closed,1,How do i add a project directory to [SPC] p p
1643,2018-04-20 18:47:09.000000000,2018-04-20 18:48:42.000000000,closed,0,Where do i save my project directories
1642,2018-04-20 17:14:17.000000000,2018-06-13 17:03:23.000000000,closed,2,Suggest that SPCVim could support new feature of easymotion.
1641,2018-04-20 15:03:55.000000000,2018-04-22 18:57:33.000000000,closed,1,what's the matter with those white cube and wrong index number?
1640,2018-04-20 13:35:06.000000000,2018-04-22 19:02:03.000000000,closed,6,Disable welcome message
1639,2018-04-20 06:34:38.000000000,2018-04-30 06:21:16.000000000,closed,3,cursor jump problem in insert mode when editing CPP
1638,2018-04-19 21:11:59.000000000,2018-04-21 17:13:59.000000000,closed,8,How to show neosnip code autocomplete pop menu 
1637,2018-04-19 20:07:17.000000000,2018-04-23 16:20:43.000000000,closed,1,Remove vim-javascript due to conflicts in flow-type and in jsx
1636,2018-04-19 19:25:16.000000000,2018-04-21 18:58:24.000000000,closed,1,Add toml config support
1635,2018-04-19 16:16:14.000000000,2018-04-23 16:26:11.000000000,closed,4,Customizable statusline
1634,2018-04-18 20:28:18.000000000,2018-04-18 20:28:35.000000000,closed,0,Use stdin instead when format java file.
1633,2018-04-18 20:06:08.000000000,2018-04-18 20:28:35.000000000,closed,5,Neoformat in conjunction with google-java-format fails...
1632,2018-04-18 17:39:28.000000000,2018-04-18 18:14:51.000000000,closed,1,Add buffer directory searching
1631,2018-04-18 10:51:51.000000000,2018-06-14 16:54:06.000000000,closed,4,Display current function/tag name in statusline
1630,2018-04-18 10:29:58.000000000,2018-04-18 18:14:51.000000000,closed,1,Grep in current directory or buffer directory
1629,2018-04-17 02:06:30.000000000,2018-06-03 16:16:34.000000000,closed,20,all set declaration are beeing ignored from .SpaceVim.d/init.vim
1628,2018-04-16 12:18:22.000000000,2019-04-20 17:43:01.000000000,closed,10,Bug report: vimproc build process completion unknown
