id,created_at,closed_at,state,comments,title
2801,2019-05-08 13:47:16.000000000,2019-05-09 19:19:34.000000000,closed,1,Update SpaceVim.txt
2800,2019-05-08 07:56:55.000000000,2019-05-09 19:19:34.000000000,closed,0,vim-node-rpc required for Markdown-preview
2799,2019-05-08 07:21:56.000000000,2019-05-08 09:34:50.000000000,closed,0,Update doc && fix problems
2798,2019-05-08 06:00:27.000000000,2019-05-10 13:24:14.000000000,closed,4,Add post for php layer
2797,2019-05-07 22:15:08.000000000,2019-05-07 22:35:29.000000000,closed,0,Fix typo
2796,2019-05-07 22:13:10.000000000,2019-05-07 22:34:59.000000000,closed,0,fix typo: bidings -> bindings
2795,2019-05-07 19:22:01.000000000,2019-05-07 19:22:12.000000000,closed,0,Fix stausline windows id
2794,2019-05-07 10:36:37.000000000,2019-05-07 11:31:18.000000000,closed,0,Fix: typo in sql.vim
2793,2019-05-06 12:35:32.000000000,2019-05-07 09:00:30.000000000,closed,0,Enhance defx config
2792,2019-05-06 11:15:56.000000000,1970-01-01 00:00:00.000000001,open,0,Add support for setting the custom leader
2791,2019-05-06 10:07:41.000000000,2019-05-06 10:08:00.000000000,closed,0,Fix preview windows smart quit
2790,2019-05-06 09:15:35.000000000,2019-05-06 09:36:32.000000000,closed,0,fix neovim_floating_api_history
2789,2019-05-06 08:49:17.000000000,2019-05-06 08:50:11.000000000,closed,0,Update floating support
2788,2019-05-06 08:34:07.000000000,2019-05-06 12:15:29.000000000,closed,1,enhance the defx config
2787,2019-05-05 14:12:17.000000000,2019-05-05 14:18:13.000000000,closed,1,[Typo] mispelled word in comment
2786,2019-05-05 09:09:38.000000000,2019-05-27 16:23:52.000000000,closed,6,"SPUpdate take too much time for downloading the ""LanguageClient"""
2785,2019-05-05 07:27:35.000000000,2019-05-05 18:08:20.000000000,closed,1,Feature Request: install SpaceVim with Homebrew on macOS
2784,2019-05-05 05:02:43.000000000,2019-05-05 09:23:31.000000000,closed,0,[Fix] Fix a typo.
2783,2019-05-04 10:08:29.000000000,2019-05-06 10:11:43.000000000,closed,1,Fix Not Mapping q for Neovim LSP doc window
2782,2019-05-04 09:10:02.000000000,2019-05-06 06:34:03.000000000,closed,0,Implement Auto Reinstall Failed Plugins for #2405
2781,2019-05-03 16:47:32.000000000,2019-05-04 03:23:44.000000000,closed,0,Update: lang#scala layer
2780,2019-05-03 14:13:05.000000000,2019-05-04 03:25:52.000000000,closed,0,"Change: DefxSmartL() cancel action, ipynb.vim file head"
2779,2019-05-02 20:30:03.000000000,2019-05-05 19:30:57.000000000,closed,2,Error while run python Code completion
2778,2019-05-02 16:30:57.000000000,2019-05-04 18:20:51.000000000,closed,0,Acheve triple quotes auto insertion on python
2777,2019-04-28 20:00:39.000000000,2019-04-29 07:17:22.000000000,closed,1,"It's not intuitive how to uninstall on windows, still."
2776,2019-04-28 18:37:37.000000000,2019-05-04 18:55:56.000000000,closed,0,Fix cn doc
2775,2019-04-28 17:56:58.000000000,2019-05-05 18:20:19.000000000,closed,4,Change plugin
2774,2019-04-28 16:06:41.000000000,2019-04-28 16:44:48.000000000,closed,0,Add error handle key bindings to lsp layer
2773,2019-04-28 10:08:22.000000000,2019-05-06 07:33:35.000000000,closed,0,Add lang#sql layer
2772,2019-04-26 18:02:54.000000000,2019-04-28 10:00:37.000000000,closed,0, Add lang#ipynb layer
2771,2019-04-26 17:31:48.000000000,2019-04-26 17:43:47.000000000,closed,0,Change: enable relativenumber only in current win
2770,2019-04-26 17:18:11.000000000,2019-04-26 17:18:27.000000000,closed,0,Fix guide ctrl- key
2769,2019-04-26 06:52:40.000000000,2019-04-27 13:42:41.000000000,closed,4,"Can use ""pip install --user flake8"" to enable syntax checking."
2768,2019-04-24 19:12:35.000000000,2019-04-24 19:21:31.000000000,closed,0,Fix enter in insert mode
2767,2019-04-24 18:42:32.000000000,2019-04-24 18:54:45.000000000,closed,0,Add python plugin
2766,2019-04-24 18:07:42.000000000,2019-04-24 18:14:23.000000000,closed,0,Update doc for quickfix_doc
2765,2019-04-23 22:58:22.000000000,2019-04-24 05:48:13.000000000,closed,1,Switch installation to .toml format
2764,2019-04-23 07:51:55.000000000,2019-04-24 06:47:16.000000000,closed,6,golang environment doesn't load properly
2763,2019-04-23 05:58:10.000000000,2019-04-24 07:00:07.000000000,closed,1,Tagbar show nothing content with golang source
2762,2019-04-22 18:36:18.000000000,2019-05-06 07:35:44.000000000,closed,0,"Change: nvim floating window API in flygrep,guide.vim"
2761,2019-04-22 18:26:49.000000000,2019-04-24 17:13:21.000000000,closed,0,Update git layer
2760,2019-04-21 18:02:43.000000000,2019-04-23 16:41:52.000000000,closed,3,GTags invalid rows in quickfix window
2759,2019-04-21 16:25:15.000000000,2019-04-21 18:33:46.000000000,closed,0,Add lang#slim layer
2758,2019-04-20 21:12:20.000000000,2019-04-21 18:33:50.000000000,closed,3,[Wish]Template engine syntax highlighting
2757,2019-04-20 17:34:11.000000000,2019-04-20 17:36:22.000000000,closed,0,"can't use () because the plugin""identiLine"" was not installed"
2756,2019-04-20 12:09:15.000000000,2019-04-23 12:30:05.000000000,closed,2,"An update is need for neoformat plugin, since the upstream one got several new commits."
2755,2019-04-19 21:17:32.000000000,2019-04-20 09:10:19.000000000,closed,2,Small grammar fixes in docs
2754,2019-04-18 19:50:27.000000000,2019-04-19 05:43:56.000000000,closed,2,Python repl does not work
2753,2019-04-18 17:34:39.000000000,2019-04-18 18:09:29.000000000,closed,0,Fix SPC j d/D key binding
2752,2019-04-15 14:06:54.000000000,2019-04-16 05:56:40.000000000,closed,3,Can I set up my own .vimrc ?
2751,2019-04-15 12:16:45.000000000,2019-04-18 16:59:35.000000000,closed,1,"Can we consider to provide an ""simple"", ""basic"" version for users ?"
2750,2019-04-15 06:31:58.000000000,2019-04-15 13:03:08.000000000,closed,1,Could it change from vimfiler to nerdtree as default?
2749,2019-04-14 03:48:47.000000000,2019-04-14 23:46:42.000000000,closed,5,vimfiler lags and shows keys on file tree when gitstatus enabled
2748,2019-04-14 02:11:37.000000000,2019-04-14 06:01:36.000000000,closed,2,Enhancement: Startup time using daemon mode or similar?
2747,2019-04-13 20:28:46.000000000,2019-04-18 18:09:28.000000000,closed,0,SPC j d closes current window instead of showing the directory
2746,2019-04-13 13:18:33.000000000,2019-04-13 18:12:33.000000000,closed,0,Add bepo layout support
2745,2019-04-13 12:17:54.000000000,2019-04-13 18:12:58.000000000,closed,0,Fuzzy find tag
2744,2019-04-13 09:42:50.000000000,2019-04-13 09:56:42.000000000,closed,0,Add option for clang based syntax highlight
2743,2019-04-12 23:54:34.000000000,2019-04-13 03:48:04.000000000,closed,1,How to switch buffer based on the buffer number in tabline?
2742,2019-04-12 19:20:31.000000000,2019-04-13 09:29:15.000000000,closed,0,Fix completor delay
2741,2019-04-12 18:11:03.000000000,2019-04-12 18:20:45.000000000,closed,0,Fix defx_root_check
2740,2019-04-12 15:59:29.000000000,2019-04-12 18:20:45.000000000,closed,2,Defx can't navigate up from an empty directory
2739,2019-04-11 19:37:06.000000000,2019-04-11 19:37:36.000000000,closed,0,Fix chat key bindings
2738,2019-04-11 06:31:14.000000000,2019-04-11 07:28:51.000000000,closed,0,Change home and end key in defx buffer
2737,2019-04-11 04:28:55.000000000,2019-04-11 07:29:15.000000000,closed,0,Update fuzzy find layer doc
2736,2019-04-10 21:27:44.000000000,2019-04-11 02:47:51.000000000,closed,1,Fixes Broken Layer Links
2735,2019-04-10 19:41:19.000000000,2019-04-10 19:42:18.000000000,closed,0,Fix use stdin
2734,2019-04-10 19:38:40.000000000,2019-04-11 05:36:38.000000000,closed,1,Can you use release instead of develop version as default install
2733,2019-04-10 04:52:31.000000000,2019-04-11 05:40:30.000000000,closed,1,"Error message with Denite.nvim, or Spacevim, or neovim python3 support."
2732,2019-04-09 17:06:37.000000000,2019-04-09 17:30:49.000000000,closed,0,Update version to v1.2.0-dev
2731,2019-04-09 13:38:18.000000000,2019-04-12 17:33:05.000000000,closed,1,How can I get native ctrl-x back and keep windows_leader?
2730,2019-04-09 11:15:10.000000000,2019-04-11 16:34:35.000000000,closed,1,How to install custom theme 'ayu'
2729,2019-04-07 16:26:15.000000000,2019-04-08 02:15:24.000000000,closed,2,Modeline can't show correctly
2728,2019-04-06 12:18:42.000000000,2019-04-10 19:10:53.000000000,closed,3,Add: add 2 new key bindings 'C' and 'X' for iedit-Normal model and document them.
2727,2019-04-05 15:43:49.000000000,2019-04-05 15:55:06.000000000,closed,4,Having trouble installing
2726,2019-04-05 13:24:36.000000000,2019-04-08 03:46:57.000000000,closed,3,Release v1.1.0
2725,2019-04-05 05:27:25.000000000,2019-04-05 11:42:51.000000000,closed,0,Improve iedit mode
2724,2019-04-04 18:41:49.000000000,2019-04-12 18:54:39.000000000,closed,1,How to configure variables in spacevim?
2723,2019-04-04 09:51:24.000000000,2019-04-04 15:40:07.000000000,closed,2,Add: add a new key binding 's' for iedit-model.
2722,2019-04-03 16:45:17.000000000,2019-05-27 16:25:05.000000000,closed,1,Enable auto complete error message on CTRL N - n
2721,2019-04-03 09:21:36.000000000,2019-04-10 08:00:53.000000000,closed,4,"could you pls add cancel return to flygrep, so it will not open floating window if I quit halfway."
2720,2019-04-03 09:12:39.000000000,2019-04-03 18:04:45.000000000,closed,2,"enhance defx keymap l, choosewin not plugin ChooseWin"
2719,2019-04-02 19:03:44.000000000,2019-04-10 19:29:53.000000000,closed,4,"Could you please add s, x, r and R to the iedit model?"
2718,2019-04-02 17:17:03.000000000,2019-04-02 18:57:21.000000000,closed,0,Add fzf menu support
2717,2019-04-01 11:10:33.000000000,2019-04-03 10:28:54.000000000,closed,1,fix a typo in doc/SpaceVim.txt
2716,2019-03-31 04:39:57.000000000,2019-04-13 13:33:14.000000000,closed,2,Auto-completion not working
2715,2019-03-31 03:04:06.000000000,2019-03-31 04:03:19.000000000,closed,0,fix alias in Docker Hub README.md
2714,2019-03-30 07:21:20.000000000,2019-03-30 10:00:59.000000000,closed,0,Doc: fix a markdown sytax error.
2713,2019-03-29 18:00:15.000000000,2019-04-12 18:55:01.000000000,closed,2,Neomake is showing fly with lint_on_the_fly = false
2712,2019-03-29 17:34:44.000000000,2019-04-02 18:57:21.000000000,closed,2,[Wish] FZF Project Switcher
2711,2019-03-29 11:07:48.000000000,2019-03-30 10:00:59.000000000,closed,0,[Tips]:The CN document for developer markdown syntax wrong.
2710,2019-03-29 10:55:57.000000000,2019-04-03 18:04:44.000000000,closed,7,change nvim floating window API functions
2709,2019-03-29 07:39:46.000000000,2019-03-29 09:28:31.000000000,closed,2,change nvim_open_win API function
2708,2019-03-28 22:16:22.000000000,1970-01-01 00:00:00.000000001,open,4,[Wish] iedit - J and K equivalent of spacemacs
2707,2019-03-28 22:12:37.000000000,2019-04-24 18:17:12.000000000,closed,8,Cant enter in iedit mode from visual mode
2706,2019-03-28 22:05:05.000000000,2019-04-24 18:15:11.000000000,closed,2,[Wish] Add airblade/vim-gitgutter do git layer
2705,2019-03-28 10:58:13.000000000,2019-03-28 11:35:45.000000000,closed,0,Improve iedit mode
2704,2019-03-28 07:41:16.000000000,2019-05-07 11:29:06.000000000,closed,0,E121: Undefined variable: s:cscope_vim_dir
2703,2019-03-27 14:30:49.000000000,1970-01-01 00:00:00.000000001,open,3,enable language features for lang#asciidoc
2702,2019-03-26 17:08:39.000000000,2019-03-26 18:35:15.000000000,closed,1,Update denite to use file/rec instead of file_rec
2701,2019-03-26 08:08:17.000000000,2019-05-06 10:08:00.000000000,closed,5,press q with lsp-hover window enabled closes vim totally
2700,2019-03-26 06:27:43.000000000,2019-03-26 14:40:30.000000000,closed,0,"website: docs: Update language-server-protocol.md, correct spelling"
2699,2019-03-25 14:03:02.000000000,2019-04-27 06:32:51.000000000,closed,2,"Saving a buffer sometimes does not work `Cannot write, 'buftype' option is set`"
2698,2019-03-25 12:42:42.000000000,2019-04-02 18:17:04.000000000,closed,2,Leader Key for emmet
2697,2019-03-25 09:33:06.000000000,2019-03-28 11:35:45.000000000,closed,3,iedit I and A dont work (Multiple Cursor dont work too)
2696,2019-03-25 05:08:40.000000000,2019-03-28 10:41:53.000000000,closed,3,Could we add a lang#processing?
2695,2019-03-23 19:02:05.000000000,2019-03-24 02:33:49.000000000,closed,0,Fix: add the missing parameter '...'
2694,2019-03-23 01:43:22.000000000,2019-03-23 16:24:04.000000000,closed,1,"How can I do ""set nonumber"" in init.toml?"
2693,2019-03-21 17:30:10.000000000,2019-03-23 16:42:42.000000000,closed,2,fix defx mapping l and c
2692,2019-03-21 05:12:33.000000000,2019-04-13 11:46:22.000000000,closed,1,Remapping t does not work
2691,2019-03-20 17:59:49.000000000,2019-03-23 17:22:14.000000000,closed,0,fix Vimfiler defx support
2690,2019-03-20 16:50:34.000000000,2019-03-20 16:50:43.000000000,closed,0,Fix rust layer
2689,2019-03-20 13:59:32.000000000,2019-04-16 23:13:49.000000000,closed,7,Flygrep shows full file path
2688,2019-03-20 13:55:38.000000000,2019-05-06 08:50:14.000000000,closed,8,Errors with latest version of neovim
2687,2019-03-20 06:11:03.000000000,2019-04-02 17:08:09.000000000,closed,1,Add: option for list number of files on home
2686,2019-03-19 11:32:50.000000000,2019-04-13 18:27:38.000000000,closed,2,The gometalinter package failed to install and is deprecated
2685,2019-03-19 04:48:37.000000000,2019-03-20 16:52:38.000000000,closed,0,Update nerdtree.vim
2684,2019-03-18 20:19:15.000000000,2019-03-19 09:32:06.000000000,closed,0,"Add 3 key bindings SPC x t C, SPC x t W, SPC x t L"
2683,2019-03-18 18:36:48.000000000,2019-03-26 11:42:11.000000000,closed,1,"fix SPC ff via denite file_rec, fix ale, leaderf"
2682,2019-03-18 10:10:54.000000000,2019-03-18 10:33:43.000000000,closed,0, Fix: fix function of SPC f d to match its documentation.
2681,2019-03-18 06:25:10.000000000,2019-03-18 06:32:29.000000000,closed,0,可否在启动速度上优化一下
2680,2019-03-18 04:58:56.000000000,2019-03-20 16:50:43.000000000,closed,2,Rust layer broken
2679,2019-03-18 01:23:20.000000000,2019-03-18 03:45:40.000000000,closed,1,Update installation step in lang#go
2678,2019-03-17 20:11:02.000000000,2019-03-17 20:12:12.000000000,closed,0,Add rust layer option
2677,2019-03-17 19:14:18.000000000,2019-03-17 19:15:03.000000000,closed,0,Fix defx option
2676,2019-03-17 18:50:50.000000000,2019-03-17 18:51:56.000000000,closed,0,Fix guide for denite layer
2675,2019-03-17 17:58:40.000000000,2019-03-17 18:03:27.000000000,closed,0,Add: Count words in select region.
2674,2019-03-17 08:01:41.000000000,2019-03-17 16:35:22.000000000,closed,0,Change windows key binding and improve doc
2673,2019-03-16 23:01:27.000000000,2019-03-17 04:14:23.000000000,closed,0,fix typo
2672,2019-03-16 18:00:21.000000000,2019-03-17 20:12:11.000000000,closed,2,editorconfig tab size issue with multiple rust files open.
2671,2019-03-16 17:01:52.000000000,2019-03-17 04:15:05.000000000,closed,1,录制宏的按键映射
2670,2019-03-16 07:22:00.000000000,2019-04-10 19:42:18.000000000,closed,0,E121: Undefined variable: usestdin
2669,2019-03-15 16:27:45.000000000,2019-04-02 17:07:26.000000000,closed,1,Enable test layer configuration
2668,2019-03-15 14:25:33.000000000,2019-03-15 18:04:22.000000000,closed,0,Fix typo of methon
2667,2019-03-15 14:06:51.000000000,2019-04-03 05:13:02.000000000,closed,1,clear search highlight failed
2666,2019-03-14 21:32:19.000000000,2019-04-11 19:37:35.000000000,closed,3,E117: Unknown function: chat#weixin#OpenMsgWin
2665,2019-03-14 18:54:21.000000000,2019-03-14 19:32:20.000000000,closed,0,Change plugin list key binding
2664,2019-03-14 18:28:37.000000000,2020-07-04 08:18:22.000000000,closed,1,Add api to floating_statusline
2663,2019-03-14 18:04:20.000000000,2019-03-14 18:04:28.000000000,closed,0,Fix shell layer
2662,2019-03-14 10:42:08.000000000,2019-04-24 18:19:31.000000000,closed,1,TCP connection configuration for LSP layer
2661,2019-03-13 19:27:57.000000000,2019-03-13 20:03:36.000000000,closed,0,Filetree direction
2660,2019-03-13 07:33:34.000000000,2019-03-13 18:12:03.000000000,closed,0,Doc: fix a error in some former commit.
2659,2019-03-13 06:42:30.000000000,2019-03-20 17:16:08.000000000,closed,2,FlyGrep Mapping && How to use <cword> func? 
2658,2019-03-12 09:56:54.000000000,2019-03-20 17:21:14.000000000,closed,4,Neosnippet not called when autocomplations are open
2657,2019-03-12 07:59:51.000000000,2019-06-15 17:39:32.000000000,closed,2,"[Ruby] Indentation dont follow dots.  When insert a dot, it lose the identation"
2656,2019-03-12 00:42:40.000000000,2019-03-12 03:24:13.000000000,closed,1,Can't change UI toggles(or anything) globally
2655,2019-03-11 06:45:39.000000000,1970-01-01 00:00:00.000000001,open,0,Add: runnning command for compiling languages can be determined by language layers
2654,2019-03-11 06:24:42.000000000,2019-03-14 17:42:26.000000000,closed,0,Fix: delete current buffer without confirm
2653,2019-03-10 17:49:55.000000000,2019-03-10 17:59:20.000000000,closed,0,Auto close defx windows
2652,2019-03-10 11:43:17.000000000,2019-04-11 17:08:12.000000000,closed,0,Fix highlight mode
2651,2019-03-10 07:20:50.000000000,2019-03-10 19:06:21.000000000,closed,0,Change markdown preview plugin
2650,2019-03-10 05:54:19.000000000,2019-03-10 06:20:34.000000000,closed,0,Improve test layer
2649,2019-03-10 05:44:44.000000000,2019-03-10 05:44:54.000000000,closed,0,Fix guide content
2648,2019-03-09 10:36:09.000000000,2019-03-09 16:05:12.000000000,closed,1,No color shows in statusline when using PuTTY or a Linux terminal without GUI.
2647,2019-03-08 20:35:29.000000000,2019-03-09 09:47:20.000000000,closed,2,FlyGrep how to choose Options
2646,2019-03-08 11:51:29.000000000,2019-04-06 08:01:27.000000000,closed,2,something wrong when editing .ex or .exs files
2645,2019-03-07 20:00:14.000000000,2019-03-10 05:33:55.000000000,closed,0,Enhance folding
2644,2019-03-07 19:20:07.000000000,2019-03-10 05:34:21.000000000,closed,0,add x-mode mapping for tabular
2643,2019-03-07 15:49:37.000000000,2019-03-10 05:45:58.000000000,closed,1,"the new test layer  need plugin janko-m/vim-test, but i couldn't find it in github"
2642,2019-03-06 22:19:58.000000000,2019-03-10 07:03:23.000000000,closed,3,Show error when press SPC *
2641,2019-03-06 18:29:26.000000000,2019-03-10 19:06:21.000000000,closed,1,Please replace `iamcco/markdown-preview.vim` with `iamcco/markdown-preview.nvim`?  
2640,2019-03-05 11:59:34.000000000,2019-03-10 18:45:53.000000000,closed,0,"Fix: If the file in the current buffer is deleted, Vim shouldnot ask …"
2639,2019-03-04 13:37:48.000000000,2019-03-04 15:26:22.000000000,closed,0,Update git.md
2638,2019-03-04 07:39:29.000000000,2019-03-05 10:22:30.000000000,closed,1,"I installed global and also enabled gtags Layer , but <c-]> is not working with lines, why?"
2637,2019-03-04 06:56:10.000000000,2019-03-04 07:15:58.000000000,closed,1,Set background on gui or terminal in different way
2636,2019-03-04 02:41:11.000000000,2019-03-04 19:50:39.000000000,closed,1,improves github layer readme
2635,2019-03-04 01:08:58.000000000,2019-03-04 11:11:55.000000000,closed,1,Use colorscheme_bg not background in toml init files
2634,2019-03-03 19:12:30.000000000,2019-03-04 16:51:47.000000000,closed,1,Finish renaming enable_statusline_display_mode to enable_statusline_mode
2633,2019-03-03 16:24:41.000000000,2019-03-04 16:21:39.000000000,closed,0,Use floating windows for guide
2632,2019-03-02 17:14:30.000000000,2019-05-07 11:29:48.000000000,closed,0,[SPC] s  h  cause cursor fall in black mode
2631,2019-02-27 20:35:07.000000000,2019-03-03 15:23:58.000000000,closed,0,improve mapping guide
2630,2019-02-27 17:46:59.000000000,2019-02-27 19:13:01.000000000,closed,0,Update file tree key binding
2629,2019-02-27 15:51:40.000000000,2019-02-27 19:13:01.000000000,closed,2,Vim will die if :e! under nerd tree
2628,2019-02-26 20:04:14.000000000,2019-02-28 08:52:46.000000000,closed,0,Add: add a new key binding SPC l K
2627,2019-02-26 17:59:14.000000000,2020-07-17 18:01:39.000000000,closed,0,Neovim lsp
2626,2019-02-25 01:23:38.000000000,2019-02-25 02:52:31.000000000,closed,0,adding basic gradle bindings... 
2625,2019-02-24 19:35:54.000000000,2019-02-24 19:36:05.000000000,closed,0,Add whatsapp channel
2624,2019-02-23 10:23:05.000000000,2019-02-23 12:49:09.000000000,closed,0,Doc: doc the argument 'whitespace' in statusline.
2623,2019-02-23 10:19:57.000000000,2019-02-23 10:21:45.000000000,closed,0,Doc: doc the argument 'whitespace' in statusline.
2622,2019-02-23 02:20:41.000000000,2019-02-23 10:32:49.000000000,closed,1,Spacevim Statusline is the greatest!!!
2621,2019-02-22 11:04:31.000000000,2019-02-23 05:18:07.000000000,closed,0,Doc: fix some typos.
2620,2019-02-22 10:12:38.000000000,2019-02-23 05:19:02.000000000,closed,0,Fixed: fix a bug in markdown_insert_url.
2619,2019-02-21 19:56:11.000000000,2019-02-23 10:24:27.000000000,closed,5,Add lsp support for java
2618,2019-02-21 14:47:02.000000000,2019-03-14 18:17:59.000000000,closed,2,open/change  file/buffer gvim will error: E892  
2617,2019-02-21 08:39:28.000000000,2019-02-21 13:19:40.000000000,closed,0,Fix: replace the function markdown-insert-URL with a new one.
2616,2019-02-20 23:48:36.000000000,2019-02-27 18:56:27.000000000,closed,6,Get `<` and `>` default behavior back as operators
2615,2019-02-20 20:11:28.000000000,2019-02-23 16:26:21.000000000,closed,0,Doc: unify layers descriptions.
2614,2019-02-20 19:27:07.000000000,2019-02-20 19:33:01.000000000,closed,0,Fix cursor positon when jump split
2613,2019-02-20 14:45:10.000000000,2019-02-20 18:57:52.000000000,closed,0,Remove: Delete format markdown table key binding SPC l ft.
2612,2019-02-20 13:57:07.000000000,2019-02-23 14:46:56.000000000,closed,1,"Weekly Digest (13 February, 2019 - 20 February, 2019)"
2611,2019-02-20 10:25:56.000000000,2019-02-20 12:57:42.000000000,closed,0,Doc: add descriptions of installing formatting tools of Markdown.
2610,2019-02-20 06:41:08.000000000,2019-02-20 14:47:15.000000000,closed,2,Fixed: fix bug of formatting MarkDown table.
2609,2019-02-19 20:05:30.000000000,2019-04-13 09:29:15.000000000,closed,1,options auto-completion-delay fail
2608,2019-02-19 18:35:40.000000000,2019-02-19 18:58:48.000000000,closed,0,Doc: do some translation work in cn documentations.
2607,2019-02-19 17:06:36.000000000,2019-02-19 18:56:49.000000000,closed,0,Doc: update cn documentation for layer statusline.
2606,2019-02-18 20:51:46.000000000,2019-02-19 06:01:05.000000000,closed,0,Fixed: fix 2 typos.
2605,2019-02-18 20:40:15.000000000,2019-02-19 18:54:06.000000000,closed,0,Doc: translate <C-e> to Ctrl-e etc.
2604,2019-02-18 19:24:41.000000000,2019-02-18 19:24:52.000000000,closed,0,Fix key sort
2603,2019-02-18 18:41:52.000000000,2019-02-25 22:18:22.000000000,closed,7,Add guide for using vim as ruby ide
2602,2019-02-18 17:22:27.000000000,2019-02-18 17:22:49.000000000,closed,0,merge remote
2601,2019-02-18 08:49:08.000000000,2019-02-18 10:28:31.000000000,closed,0,Change: toggle functions of some pairs of key bindings.
2600,2019-02-17 20:34:19.000000000,2019-02-17 21:09:30.000000000,closed,1,更新后出现E171和E117错误
2599,2019-02-17 19:47:53.000000000,2019-02-18 06:03:29.000000000,closed,0,Add: add 3 new key bindings and update the documentation.
2598,2019-02-17 19:03:45.000000000,2019-02-18 06:09:21.000000000,closed,0,Fixed: add feature 'auto-indent new line' and update documentations.
2597,2019-02-17 09:33:28.000000000,2019-02-17 09:35:54.000000000,closed,0,Improve server support in windows
2596,2019-02-17 09:25:54.000000000,2019-02-17 09:42:12.000000000,closed,1,Doc: update documentations for SPC x a r.
2595,2019-02-16 20:43:29.000000000,2019-02-16 20:47:48.000000000,closed,2,Add SPC x a r key binding
2594,2019-02-16 20:29:21.000000000,2019-02-16 20:44:19.000000000,closed,0,Fixed: optimize the function 'Align at spaces'.
2593,2019-02-16 19:25:57.000000000,2019-02-17 07:30:14.000000000,closed,1,Add: add 2 new key bindings and the corresponding documentations.
2592,2019-02-16 18:02:26.000000000,2019-02-16 18:03:42.000000000,closed,0,Before opening new issue
2591,2019-02-16 17:49:41.000000000,2019-02-16 17:58:03.000000000,closed,1,Please enable use touchpad in insert mode
2590,2019-02-16 12:09:11.000000000,2019-02-16 14:41:42.000000000,closed,0,Fixed: add a reminder that 'start REPL via SPC l s i first'.
2589,2019-02-15 22:17:24.000000000,2019-03-10 08:10:40.000000000,closed,0,Cannot set transparent background with guicolors enabled
2588,2019-02-15 20:37:00.000000000,2019-02-19 18:51:39.000000000,closed,6,denite layer broken after update
2587,2019-02-15 08:21:50.000000000,2019-02-16 18:18:53.000000000,closed,2,Remove: remove two useless key bindings
2586,2019-02-14 14:55:33.000000000,2019-02-14 15:07:01.000000000,closed,2,languagetool check for grammar and spelling (vim-grammarous)
2585,2019-02-14 08:32:43.000000000,2019-02-16 19:56:47.000000000,closed,1,Please enable all syntax highlighting
2584,2019-02-14 08:31:28.000000000,2019-02-16 19:53:28.000000000,closed,0,Please enable all syntax highlighting
2583,2019-02-12 21:04:18.000000000,2019-04-13 12:31:18.000000000,closed,5,Add layer option for git layer
2582,2019-02-12 20:45:36.000000000,2019-02-18 18:13:24.000000000,closed,0,Remove crlf after generate help file in windows
2581,2019-02-12 18:30:30.000000000,2019-04-11 19:32:26.000000000,closed,6,Settings in a project folder override the ones that are set to ~ /.SpaceVim.d
2580,2019-02-12 15:01:31.000000000,2019-02-13 20:25:35.000000000,closed,0,Doc: fix typos.
2579,2019-02-12 08:57:50.000000000,2019-02-12 11:18:44.000000000,closed,3,Add use vim as perl ide post
2578,2019-02-12 07:48:52.000000000,2019-02-12 08:02:21.000000000,closed,0,Add perli support for perl repl
2577,2019-02-11 19:27:15.000000000,2019-02-16 16:36:09.000000000,closed,0,Add IssueEdit command for dev mode
2576,2019-02-11 18:43:08.000000000,2019-02-23 14:49:17.000000000,closed,1,Language Support
2575,2019-02-11 17:33:43.000000000,2019-06-07 07:59:54.000000000,closed,0,All these key bindings should support vim-repeat.
2574,2019-02-11 14:43:10.000000000,2019-02-11 15:59:33.000000000,closed,0,Doc: fix typos.
