id,created_at,closed_at,state,comments,title
2084,2020-08-31 14:40:27.000000000,1970-01-01 00:00:00.000000001,open,1,Failing rubocop's cop for grape gem
2082,2020-08-27 23:19:21.000000000,1970-01-01 00:00:00.000000001,open,4,segv running Rails Simple Benchmark's Rails app
2081,2020-08-27 20:48:33.000000000,1970-01-01 00:00:00.000000001,open,6,Rubocop test suite slow
2080,2020-08-27 00:54:50.000000000,2020-08-28 18:22:21.000000000,closed,11,Potential performance degradation of method_missing
2079,2020-08-26 23:00:50.000000000,1970-01-01 00:00:00.000000001,open,1,Dynamic constant assignment using non-ascii variable
2078,2020-08-25 13:57:40.000000000,1970-01-01 00:00:00.000000001,open,1,Test coverage report numbers are inconsistant with Ruby MRI
2077,2020-08-25 00:14:31.000000000,1970-01-01 00:00:00.000000001,open,2,Correct arity for arguments with optional kwargs
2076,2020-08-24 14:07:13.000000000,1970-01-01 00:00:00.000000001,open,3,Errno::ENOMEM: Cannot allocate memory
2075,2020-08-21 06:56:39.000000000,2020-08-24 13:59:28.000000000,closed,12,Couldn't install truffleruby 20.2.0 with ruby-build on macOS
2073,2020-08-14 09:53:03.000000000,2020-08-14 18:03:48.000000000,closed,6,deep_clone: Polyglot object DeepClone cannot be converted to i32 (LLVMPolyglotException)
2072,2020-08-13 14:11:43.000000000,1970-01-01 00:00:00.000000001,open,5,Support C++ gem extenstions
2071,2020-08-10 18:09:14.000000000,2020-08-12 22:21:06.000000000,closed,2,We need ruby-install version 0.7.1 or newer
2070,2020-08-10 11:32:47.000000000,1970-01-01 00:00:00.000000001,open,3,Temporary Slowdown/Deoptimization very late into the process in Rubykon benchmark
2069,2020-08-08 19:16:21.000000000,1970-01-01 00:00:00.000000001,open,1,cld: No enum constant com.oracle.truffle.nfi.spi.types.NativeSimpleType.STRUCT_BY_VALUE
2068,2020-08-08 13:33:15.000000000,2020-08-14 14:51:06.000000000,closed,8,Add instructions to add a manual GraalVM install to asdf
2067,2020-08-06 22:54:35.000000000,1970-01-01 00:00:00.000000001,open,7,Gem installation failure: no member named flags in struct RBasic
2066,2020-08-06 19:28:10.000000000,2020-08-18 23:17:40.000000000,closed,3,device_detector failing tests with errors
2065,2020-08-06 16:17:20.000000000,2020-08-11 22:59:21.000000000,closed,5,json_schemer failing test: JSONSchemerTest#test_json_schema_test_suite
2064,2020-08-05 21:27:52.000000000,1970-01-01 00:00:00.000000001,open,4,Intermittent Puma CI failures
2063,2020-08-04 19:59:48.000000000,1970-01-01 00:00:00.000000001,open,5,prawn test case failure: Prawn manual contains no unexpected changes
2062,2020-08-04 01:01:40.000000000,2020-08-13 18:27:01.000000000,closed,2,rubyzip test case failure: PathTraversalTest#test_entry_name_with_tilde
2061,2020-08-03 23:55:20.000000000,1970-01-01 00:00:00.000000001,open,17,Can't install any gem on AArch64
2060,2020-08-01 20:31:59.000000000,2020-08-20 00:41:06.000000000,closed,6,Considers an autoload constant as loaded when autoload is called for/from the current file
2059,2020-08-01 01:17:32.000000000,2020-08-06 20:23:14.000000000,closed,8,test-unit failing tests
2058,2020-07-31 02:26:34.000000000,2020-07-31 19:54:44.000000000,closed,7,cannot run tests for the test-unit gem
2057,2020-07-30 20:10:41.000000000,2020-08-03 18:49:22.000000000,closed,2,Float specs
2056,2020-07-30 19:53:14.000000000,2020-07-31 19:08:46.000000000,closed,2,Enumerable first
2055,2020-07-27 22:19:33.000000000,2020-07-29 23:24:43.000000000,closed,0,Handle foreign null object as falsy value
2054,2020-07-23 02:37:09.000000000,1970-01-01 00:00:00.000000001,open,3,FFI::Pointer#order not implemented
2053,2020-07-22 17:07:34.000000000,1970-01-01 00:00:00.000000001,open,1,JSON.pretty_generate generates different output to MRI for at least an empty hash
2052,2020-07-21 12:30:36.000000000,2020-07-24 23:49:45.000000000,closed,17,Ruby 2.6: String#split with block
2051,2020-07-19 00:58:30.000000000,1970-01-01 00:00:00.000000001,open,9,"SIGHUP, etc do not have a default signal handler that raises SignalException"
2050,2020-07-18 16:51:42.000000000,2020-07-24 23:49:45.000000000,closed,3,String#split with block incompatibility
2049,2020-07-15 01:55:36.000000000,2020-07-16 03:16:01.000000000,closed,0,Cache JVMCI and Eclipse in the mx cache
2048,2020-07-13 23:26:41.000000000,2020-07-17 03:38:15.000000000,closed,2,Pass activated ancestors refinements for super lookup
2047,2020-07-13 15:40:19.000000000,2020-07-21 16:24:11.000000000,closed,12,"""Rescuing"" failed `require` doesn't work as expected"
2046,2020-07-10 13:49:06.000000000,2020-07-11 15:03:28.000000000,closed,3,Rubygems CI broke yesterday against `truffleruby-head`
2045,2020-07-09 15:33:52.000000000,2020-07-18 15:35:23.000000000,closed,8,CI failures for async-container
2044,2020-07-07 15:38:34.000000000,1970-01-01 00:00:00.000000001,open,11,Problem with installing stackprof with native extensions
2043,2020-07-06 17:30:37.000000000,2020-07-06 23:09:08.000000000,closed,0,Build with 2.3
2042,2020-07-03 19:42:15.000000000,2020-07-04 04:34:01.000000000,closed,0,Fix a link to the Sulong toolchain docs.
2041,2020-07-02 17:01:28.000000000,2020-07-03 21:59:04.000000000,closed,9,Transient deadlock while running Puma tests
2040,2020-07-01 11:14:41.000000000,2020-07-03 13:19:24.000000000,closed,21,Rubygems CI broke against truffleruby-head a few days ago
2039,2020-06-30 00:42:19.000000000,2020-07-11 06:16:29.000000000,closed,4,Refinements and super
2038,2020-06-25 18:02:52.000000000,2020-07-16 02:13:37.000000000,closed,1,foreign.to_f and foreign.to_i should be supported
2037,2020-06-21 22:12:22.000000000,2020-06-22 14:31:37.000000000,closed,3,[interop] Ruby strings show odd behavior from JavaScript
2036,2020-06-18 14:56:43.000000000,2020-07-11 06:16:29.000000000,closed,1,Lookup super in ancestors of refinement module
2035,2020-06-15 21:08:30.000000000,1970-01-01 00:00:00.000000001,open,8,Multi-thread access to fastR
2034,2020-06-12 19:40:57.000000000,2020-08-31 18:13:41.000000000,closed,22,Errno::ESPIPE Illegal seek -- Docker container errrors
2033,2020-06-11 17:49:16.000000000,2020-06-23 19:40:34.000000000,closed,14,Change lookup methods to achieve Refinements specification
2032,2020-06-10 04:48:18.000000000,2020-07-10 13:35:28.000000000,closed,10,"JSON Standard Library, requiring ext.rb causes a load error"
2031,2020-06-10 00:24:18.000000000,2020-06-10 13:21:49.000000000,closed,2,Help with jar usage
2030,2020-06-09 20:23:18.000000000,1970-01-01 00:00:00.000000001,open,3,Support accessing variables of the interactive Sources via Context#getBindings()
2029,2020-06-09 05:35:33.000000000,2020-06-19 19:06:12.000000000,closed,2,mini_racer: `rb_context_init_unsafe': External function cannot be found.
2028,2020-06-06 18:33:55.000000000,2020-06-08 16:30:23.000000000,closed,1,Kernel#srand returns nil on the first call
2027,2020-06-04 18:25:35.000000000,2020-06-06 21:04:05.000000000,closed,3,Printing Python sys with #p fails
2026,2020-06-04 11:02:42.000000000,2020-06-23 20:23:39.000000000,closed,10,include within refine doesn't work
2025,2020-06-03 18:32:00.000000000,2020-06-06 20:12:40.000000000,closed,3,[interop] No parsing happening in RubyLanguage#parse(ParsingRequest request)
2024,2020-06-03 18:27:19.000000000,2020-06-04 20:28:19.000000000,closed,8,[interop] TruffleRuby does not allow binding modifications
2023,2020-06-02 18:00:09.000000000,2020-07-17 18:40:09.000000000,closed,5,[interop] irb 20.1.0 cannot access languages without support for multi threaded access
2022,2020-06-01 16:30:20.000000000,2020-06-02 21:02:51.000000000,closed,5,Improve Symbol.all_symbols
2021,2020-05-31 17:21:18.000000000,2020-06-02 16:53:04.000000000,closed,3,Add #refine support for Module
2020,2020-05-28 19:57:56.000000000,1970-01-01 00:00:00.000000001,open,2,Polyglot exception
2019,2020-05-27 22:04:12.000000000,2020-05-27 22:09:42.000000000,closed,1,Bump puma from 3.12.4 to 3.12.6 in /test/truffle/ecosystem/blog5
2018,2020-05-26 03:11:17.000000000,2020-05-26 17:21:10.000000000,closed,1,Improve Eclipse and IDEA integration and documentation
2017,2020-05-24 19:35:50.000000000,1970-01-01 00:00:00.000000001,open,0,duktape tests start hanging up and cause a segfault
2016,2020-05-23 00:43:11.000000000,1970-01-01 00:00:00.000000001,open,2,`Enumerator::Yielder#yield` with multiple arguments issue
2015,2020-05-22 16:54:51.000000000,2020-05-29 17:22:43.000000000,closed,3,SyntaxError: unexpected tIDENTIFIER with RHS or-equal assignment
2014,2020-05-21 16:36:31.000000000,2020-05-22 22:01:15.000000000,closed,6,Failed to install/build appsignal gem extensions
2013,2020-05-19 19:20:34.000000000,1970-01-01 00:00:00.000000001,open,1,The Exception#cause is not shown by the top-level exception handler
2012,2020-05-18 11:33:58.000000000,2020-07-04 15:43:32.000000000,closed,12,TruffleRuby performance or memory regression on rspec
2011,2020-05-15 20:35:01.000000000,1970-01-01 00:00:00.000000001,open,0,Optimize Thread.detect_recursion
2010,2020-05-14 19:21:07.000000000,2020-05-16 01:49:46.000000000,closed,7,Unable to install Iodine gem which uses a C extension on MacOS
2009,2020-05-14 05:49:21.000000000,2020-05-18 17:31:39.000000000,closed,15,gem update issues on PCLinuxOS
2008,2020-05-12 18:57:01.000000000,2020-07-22 14:44:29.000000000,closed,2,Cannot install on macOS with ruby-install
2007,2020-05-11 00:58:11.000000000,2020-05-11 19:54:31.000000000,closed,0,Specify and implement strtod and ruby_strtod
2006,2020-05-10 18:45:28.000000000,2020-06-02 22:17:29.000000000,closed,7,Implement integer modular exponentiation using `BigInteger#mod_pow`
2005,2020-05-09 18:22:04.000000000,2020-05-18 19:26:42.000000000,closed,4,Implemented rb_uv_to_utf8
2004,2020-05-09 15:00:56.000000000,1970-01-01 00:00:00.000000001,open,2,Ruby 2.7 support
2003,2020-05-08 23:40:12.000000000,2020-05-11 16:23:30.000000000,closed,0,"A few specs for BigDecimal(..., exception: false)"
2002,2020-05-08 23:39:34.000000000,1970-01-01 00:00:00.000000001,open,3,"BigDecimal(..., exception: false) doesn't work as intended"
2001,2020-05-07 15:58:29.000000000,2020-08-07 15:01:04.000000000,closed,7,numo-narray: `rb_exc_raise': wrong argument type (TypeError)
2000,2020-05-07 07:14:36.000000000,2020-07-24 20:51:32.000000000,closed,3,"Missing x.pow(e, m) method"
1999,2020-05-07 00:15:01.000000000,2020-06-02 22:17:29.000000000,closed,5,"Modular exponentiation with Integer#pow(exponent, modulo) is slow"
1998,2020-05-05 21:43:03.000000000,2020-05-18 19:26:41.000000000,closed,2,duktape: rb_uv_to_utf8 cannot be found
1997,2020-05-05 14:02:27.000000000,1970-01-01 00:00:00.000000001,open,3,Implementing PyCall.rb-like interop between TruffleRuby and Graal.python
1996,2020-04-28 23:16:48.000000000,2020-04-29 01:29:26.000000000,closed,0,Cleanups: consistently use #map and alias_method
1995,2020-04-28 15:11:26.000000000,1970-01-01 00:00:00.000000001,open,4,Loom compatibility?
1994,2020-04-27 18:45:23.000000000,2020-04-28 20:29:19.000000000,closed,7,Coverage for native has recently broken
1993,2020-04-26 17:15:28.000000000,1970-01-01 00:00:00.000000001,open,1,rbtrace: External LLVMFunction msgpack_unpack_next cannot be found. (LLVMLinkerException)
1992,2020-04-26 16:17:39.000000000,2020-04-27 13:47:55.000000000,closed,8,Enable lazy translation for user code by default
1991,2020-04-24 14:15:19.000000000,2020-04-24 15:57:30.000000000,closed,0,Fix TravisCI to set the correct JAVA_HOME
1990,2020-04-23 22:01:33.000000000,2020-04-28 23:47:48.000000000,closed,4,Fix Github releases download URL
1989,2020-04-22 20:34:27.000000000,2020-05-07 16:01:41.000000000,closed,22,numo-narray: codegen error
1988,2020-04-21 23:46:28.000000000,2020-04-29 02:18:39.000000000,closed,7,Fix inactive refinements for blocks
1987,2020-04-21 00:39:10.000000000,2020-05-04 23:28:10.000000000,closed,12,rails command loads the default Bundler 1.17.2 instead of newer installed Bundler 2.1.4
1985,2020-04-03 22:59:06.000000000,1970-01-01 00:00:00.000000001,open,9,--engine.Mode=latency is three times faster than throughput when running rspecs
1984,2020-04-02 20:29:30.000000000,2020-05-06 03:02:06.000000000,closed,4,Puma CI fails when using Bundler 2
1983,2020-04-02 06:02:54.000000000,2020-04-02 18:37:47.000000000,closed,2,scout_apm: events_to_events_array: unknown event 0x100000 (ArgumentError)
1982,2020-04-01 02:23:08.000000000,1970-01-01 00:00:00.000000001,open,8,grpc: lipo: can't figure out the architecture type
1981,2020-03-31 21:27:02.000000000,1970-01-01 00:00:00.000000001,open,1,bundle exec creates an extra subprocess on TruffleRuby
1980,2020-03-31 19:12:03.000000000,2020-04-01 18:32:43.000000000,closed,2,Check if all functions need to be defined in ruby.c
1979,2020-03-29 18:53:52.000000000,2020-03-29 19:22:30.000000000,closed,3,Fix typo in `jruby-migration.md`.
1978,2020-03-26 12:42:05.000000000,2020-04-22 18:50:15.000000000,closed,4,allocation_tracer: no member named 'flags' in 'struct RBasic'
1977,2020-03-24 13:06:18.000000000,2020-04-02 02:20:59.000000000,closed,1,Optimize return during parsing/translating to avoid unnecessary ReturnExceptions
1976,2020-03-23 20:13:52.000000000,2020-03-23 21:25:58.000000000,closed,5,OpenSSL extension doesn't compile on Ubuntu 20.04
1975,2020-03-21 19:05:23.000000000,1970-01-01 00:00:00.000000001,open,4,Support the bigdecimal gem and its C extension
1974,2020-03-21 17:51:19.000000000,1970-01-01 00:00:00.000000001,open,1,hiredis: External LLVMFunction redisConnectNonBlock cannot be found. (LLVMLinkerException)
1973,2020-03-19 20:48:04.000000000,2020-03-31 22:58:21.000000000,closed,2,gprc extconf.rb fails due to needing RbConfig::CONFIG['AR']
1972,2020-03-18 03:54:41.000000000,1970-01-01 00:00:00.000000001,open,5,"agoo: Exception in thread ""SIGINT handler"" java.lang.IllegalStateException: Can not create new threads in closing context."
1971,2020-03-16 13:27:00.000000000,2020-04-01 21:19:44.000000000,closed,1,ruby-gr: `type_to_nfi': -4 not implemented (NotImplementedError)
1970,2020-03-16 10:48:56.000000000,2020-03-16 14:03:10.000000000,closed,3,This should consider Renaming to graalruby
1969,2020-03-15 01:57:39.000000000,2020-03-16 14:59:46.000000000,closed,3,FrozenError when creating StringIO
1968,2020-03-14 10:33:25.000000000,2020-03-14 15:00:14.000000000,closed,1,Support for other JVMs?
1967,2020-03-12 02:14:17.000000000,2020-03-18 19:46:55.000000000,closed,4,incompatible character encodings error with cucumber and capybara gem (incompatible character encodings: ASCII-8BIT and UTF-8)
1966,2020-03-11 03:50:14.000000000,1970-01-01 00:00:00.000000001,open,3,ruby_native_statistics: Missing LLVM builtin: llvm.trunc.f64 (IllegalStateException)
1965,2020-03-10 23:10:13.000000000,2020-03-12 00:37:45.000000000,closed,1,Ensure Random::DEFAULT has new seed on boot
1964,2020-03-09 07:56:42.000000000,2020-03-10 17:57:13.000000000,closed,3,Frozen string literal modification error in place MRI doesn't
1963,2020-03-08 16:04:16.000000000,2020-03-11 02:13:33.000000000,closed,4,rails: routes with with_options cause TypeError (no implicit conversion of Symbol into String)
1962,2020-03-07 19:21:20.000000000,2020-03-09 17:23:07.000000000,closed,6,fork is not available (NotImplementedError) when running rails server as a daemon
1961,2020-03-07 17:43:37.000000000,2020-03-09 21:59:30.000000000,closed,3,File.ftype/Pathname causes TruffleRuby error
1960,2020-03-06 19:29:35.000000000,2020-03-21 16:22:30.000000000,closed,7,BigDecimal.inspect behaviour with active_record
1959,2020-03-06 15:37:30.000000000,2020-03-24 23:44:52.000000000,closed,1,rbtrace:  rb_set_end_proc not implemented (RuntimeError)
1958,2020-03-06 08:26:49.000000000,2020-04-22 16:08:45.000000000,closed,2,mustermann: Mustermann::Sinatra#equal? returns incorrectly false for identical objects
1957,2020-03-06 08:08:08.000000000,2020-03-11 22:00:17.000000000,closed,2,NoMethodError in case of calling private method has a slighly different message
1956,2020-03-06 02:30:18.000000000,2020-05-04 23:27:25.000000000,closed,5,Default gems can't be upgraded without booting RubyGems
1955,2020-03-05 23:19:23.000000000,2020-03-07 17:29:06.000000000,closed,1,rails server command not recognized (different behaviour to MRI)
1954,2020-03-05 10:39:37.000000000,2020-03-19 20:54:47.000000000,closed,2,Unable to install rmagick 4.0.0 with TruffleRuby 20.0.0
1953,2020-03-05 00:25:54.000000000,2020-03-05 00:28:54.000000000,closed,1,Bump puma from 3.12.2 to 3.12.4 in /test/truffle/ecosystem/blog5
1952,2020-03-04 08:15:19.000000000,1970-01-01 00:00:00.000000001,open,3,truffleruby: an exception escaped out of the interpreter - this is an implementation bug
1951,2020-03-03 20:47:01.000000000,2020-03-11 19:21:57.000000000,closed,11,Ctrl-C doesn't stop puma and SIGTERM does not work
1950,2020-03-03 13:15:16.000000000,2020-03-10 17:22:57.000000000,closed,3,activesupport: Array#to_sentence returns #ActiveSupport::SafeBuffer instead of #String in some cases
1949,2020-03-03 00:58:05.000000000,2020-04-30 21:43:21.000000000,closed,3,Refinements do not work inside of a `class_exec`
1948,2020-03-02 23:01:09.000000000,1970-01-01 00:00:00.000000001,open,0,Integer ** BigDecimal does not work but BigDecimal ** Integer does work
1947,2020-03-01 20:15:46.000000000,1970-01-01 00:00:00.000000001,open,0,ruby2d: `ruby2d_window_ext_show': External LLVMFunction S2D_CreateWindow cannot be found. (LLVMLinkerException)
1946,2020-03-01 09:23:16.000000000,2020-03-05 03:16:00.000000000,closed,1,"Hanami::Utils::String - value ""diseappers"" after calling Time.parse"
1945,2020-03-01 07:33:55.000000000,2020-03-03 22:26:54.000000000,closed,1,Float ArgumentError exception has different message but in MRI
1944,2020-02-29 16:41:48.000000000,2020-03-07 00:42:01.000000000,closed,3,Converted method to proc is given wrong number arguments
1943,2020-02-29 11:07:49.000000000,2020-02-29 11:10:56.000000000,closed,1,Bump puma from 3.12.2 to 3.12.3 in /test/truffle/ecosystem/blog5
1942,2020-02-29 03:21:30.000000000,2020-05-01 21:30:16.000000000,closed,3,alias_method inside refine causes `alias_method': undefined method for module
1941,2020-02-29 01:00:56.000000000,2020-03-05 03:17:07.000000000,closed,2,Comparation of String and Integer throws an exception  with slightly different error message but in MRI 
1940,2020-02-28 22:39:39.000000000,2020-02-28 22:40:48.000000000,closed,1,Bump rake from 10.5.0 to 12.3.3 in /spec/mspec
1939,2020-02-28 06:19:04.000000000,1970-01-01 00:00:00.000000001,open,7,roda/puma: big differences in performance between TruffleRuby 2.1.0-dev and MRI 2.7
1938,2020-02-28 04:05:24.000000000,1970-01-01 00:00:00.000000001,open,3,rails: Extremely slow boot with thousands routes and probably hanging
1937,2020-02-27 07:12:12.000000000,2020-03-04 00:37:23.000000000,closed,6,stackprof: rb_gc_latest_gc_info not implemented (RuntimeError)
1936,2020-02-27 06:50:43.000000000,2020-03-03 21:08:54.000000000,closed,1,scout_apm: error: use of undeclared identifier 'rb_mProcess'
1935,2020-02-27 06:43:26.000000000,2020-03-05 20:39:46.000000000,closed,2,rbtrace: error: no member named 'klass' in 'struct RBasic'
1934,2020-02-27 06:14:24.000000000,2020-02-28 20:23:08.000000000,closed,2,"sinatra: `caller_locations': wrong number of arguments (given 2, expected 0) (ArgumentError)"
1933,2020-02-26 18:56:38.000000000,2020-03-04 21:02:28.000000000,closed,1,symbol matching not quite working
1932,2020-02-26 03:16:21.000000000,1970-01-01 00:00:00.000000001,open,1,blingfire: `malloc': NotImplementedError in Fiddle
1931,2020-02-26 03:05:24.000000000,1970-01-01 00:00:00.000000001,open,2,simdjson: `padded_string': External LLVMFunction _ZN8simdjson22allocate_padded_bufferEm cannot be found
1930,2020-02-25 06:29:37.000000000,1970-01-01 00:00:00.000000001,open,0,regexp_property_values: error: no member named 'get_ctype_code_range' in 'struct rb_encoding'
1929,2020-02-25 06:22:15.000000000,1970-01-01 00:00:00.000000001,open,0,minitest + simplecov integration causes uninitialized constant Minitest::SimpleCov (NameError)
1928,2020-02-25 00:30:56.000000000,2020-03-04 21:03:15.000000000,closed,2,ruby_native_statistics: error: use of undeclared identifier 'value'
1927,2020-02-24 23:02:42.000000000,2020-03-05 22:09:38.000000000,closed,6,Too deep inlining error when running ActionPack tests (Regexp.escape builtin)
1926,2020-02-24 21:07:45.000000000,2020-08-21 21:58:54.000000000,closed,1,"yajl-ffi: dlopen(yajl, 2): image not found (UnsatisfiedLinkError)"
1925,2020-02-24 15:54:26.000000000,2020-03-27 21:36:46.000000000,closed,2,ArtiyException on C-extension
1924,2020-02-24 14:33:55.000000000,2020-02-25 16:33:13.000000000,closed,2,simdjson: ISO C++17 does not allow 'register' storage class specifier simdjson
1923,2020-02-23 20:01:25.000000000,2020-03-05 14:47:09.000000000,closed,1,wrong number of arguments on simple (?) spec
1922,2020-02-23 19:53:36.000000000,2020-03-05 01:56:15.000000000,closed,2,wrong number of arguments ( lib/truffle/digest/sha2.rb )
1921,2020-02-23 19:49:03.000000000,2020-03-05 01:34:57.000000000,closed,4,"rspec issue (Wrong number of arguments. Expected 1 or more, got 0.)"
1920,2020-02-21 15:01:33.000000000,2020-03-02 15:49:10.000000000,closed,1,Thread::Backtrace::Location#base_label is not implemented
1919,2020-02-20 21:18:03.000000000,1970-01-01 00:00:00.000000001,open,1,oga: multiple Oga::XML::PullParser specs fail
1918,2020-02-19 23:29:13.000000000,2020-03-06 20:10:47.000000000,closed,9,Performance regression in bundle install
1917,2020-02-19 01:18:28.000000000,2020-03-19 20:47:07.000000000,closed,2,google-protobuf: installation fails due to switch (VALUE)
1914,2020-02-18 05:59:45.000000000,2020-02-18 09:29:25.000000000,closed,2,mini_racer is not working
1913,2020-02-17 18:09:16.000000000,1970-01-01 00:00:00.000000001,open,3,Crash while inspecting file with Rubocop and Truffleruby head
1912,2020-02-15 16:48:25.000000000,2020-02-18 17:59:30.000000000,closed,1,multiple assignment in conditional (SyntaxError)
1911,2020-02-15 15:53:02.000000000,2020-02-17 18:33:38.000000000,closed,5,cppjieba_rb fails to install
1910,2020-02-15 00:30:54.000000000,2020-02-19 22:44:28.000000000,closed,1,implement num2short
1909,2020-02-15 00:06:05.000000000,2020-02-21 15:12:00.000000000,closed,2,Allow rescue to take null 
1908,2020-02-14 23:57:25.000000000,2020-02-19 22:47:44.000000000,closed,1,implement rb_obj_is_proc
1907,2020-02-14 17:39:48.000000000,2020-03-03 01:35:01.000000000,closed,2,actionpack: RuntimeError: Cannot convert a Ruby String with BINARY encoding containing non-US-ASCII character 229 to a Java String
1906,2020-02-13 18:11:40.000000000,1970-01-01 00:00:00.000000001,open,4,Bundler/rubygems generates a lot of exceptions
1905,2020-02-13 08:40:01.000000000,2020-05-08 21:16:25.000000000,closed,9,acts-as-taggable-on: NameError: uninitialized constant ActsAsTaggableOn::TagListType
1904,2020-02-12 09:56:58.000000000,2020-02-18 22:13:55.000000000,closed,4,io-console: no member named 'pathv' in 'struct rb_io_t'
1903,2020-02-11 18:00:41.000000000,2020-02-11 18:09:25.000000000,closed,4,How exactly I can install latest nightly builds on my local machine?
1902,2020-02-10 16:00:07.000000000,2020-07-29 23:24:43.000000000,closed,4,[interop] foreign null objects not handled correctly as falsy values
1901,2020-02-10 06:48:06.000000000,2020-02-14 23:57:17.000000000,closed,1,String#unpack('M*') doesn't omit \r\n correctly
1900,2020-02-10 00:20:40.000000000,1970-01-01 00:00:00.000000001,open,8,"mail: all in test suite fails due to ArgumentError: wrong number of arguments (given 2, expected 1) in overriding Kernel.warn"
1899,2020-02-09 22:16:50.000000000,2020-02-10 00:17:20.000000000,closed,4,`floor': wrong number of arguments
1898,2020-02-09 20:19:32.000000000,2020-02-10 16:55:11.000000000,closed,5,The Rack test suite does not pass on TruffleRuby
1897,2020-02-08 19:16:13.000000000,2020-02-11 00:05:37.000000000,closed,2,A lot of annoying warnings about instance variable @internal not initialized from truffleruby/core/io.rb 
1896,2020-02-08 13:01:09.000000000,2020-05-16 01:43:40.000000000,closed,3,"skylight: lib/mri/mkmf.rb:1299:in `find_type': wrong number of arguments (given 1, expected 2+) (ArgumentError)"
1895,2020-02-08 10:51:11.000000000,2020-06-19 19:04:02.000000000,closed,5,Code causes an exception and nothing is thrown (visibly)
1894,2020-02-07 16:55:16.000000000,2020-02-07 21:39:42.000000000,closed,7,spring: TruffleRuby doesn't have a case for the StringToNullTerminatedByteArrayNodeGen node with values of type Pathname (TypeError)
1893,2020-02-04 22:11:40.000000000,2020-02-13 18:05:30.000000000,closed,14,bundle install can consume too much memory
1892,2020-01-30 15:34:21.000000000,2020-01-30 15:59:43.000000000,closed,4,"I think `Process.spawn(..., 3 => io)` is broken in TruffleRuby."
1891,2020-01-24 02:19:47.000000000,2020-04-22 20:35:15.000000000,closed,11,numo-narray: error: no member named 'flags' in 'struct RBasic'
1889,2020-01-22 08:24:03.000000000,2020-01-23 15:03:26.000000000,closed,3,"Fix 'OpenSSL::Digest.{digest,hexdigest,base64digest} algorithm, data' "
1888,2020-01-21 23:09:38.000000000,1970-01-01 00:00:00.000000001,open,0,IO.popen specs still hang for me
1887,2020-01-21 22:02:25.000000000,2020-01-30 22:38:42.000000000,closed,6,Optimize lazy initializations 
1886,2020-01-21 19:54:05.000000000,2020-01-22 01:32:02.000000000,closed,6,Fix rb_warn and rb_warning macros
1885,2020-01-20 23:26:35.000000000,2020-01-24 11:38:24.000000000,closed,1,options.md: Fix typo: 'bet set' -> 'be set'
1884,2020-01-20 21:51:23.000000000,2020-04-23 00:47:41.000000000,closed,5,Unable to install rbtree3 0.5.0 with TruffleRuby 19.3.1
1883,2020-01-20 21:09:52.000000000,2020-01-29 21:40:07.000000000,closed,3,Rubocop fails to parse files in TruffleRuby 19.3.1
1882,2020-01-20 18:36:17.000000000,2020-02-03 20:49:22.000000000,closed,4,Unable to install rmagick 4.0.0 with TruffleRuby 19.3.1
1881,2020-01-08 03:38:21.000000000,2020-02-03 14:09:56.000000000,closed,8,[interop] Foreign objects have no `object_id` and `__id__`
