id,created_at,closed_at,state,comments,title
581,2017-10-03 04:44:15.000000000,2017-10-03 15:15:37.000000000,closed,1,Add a boundary on ClassNodes.getSuperClass
580,2017-10-02 21:11:06.000000000,2017-10-02 22:43:02.000000000,closed,0,"De-version the Docker test and other documentation, so we don't have to keep updating it"
579,2017-10-01 21:33:43.000000000,2017-10-02 00:15:04.000000000,closed,0,Note that you need to install llvm@4 when you use Homebrew
578,2017-10-01 17:25:13.000000000,2017-10-01 21:31:51.000000000,closed,0,Instructions for running on Java 9
577,2017-10-01 06:46:53.000000000,2017-10-01 17:15:52.000000000,closed,0,Instructions for running on Java 9
576,2017-10-01 00:50:50.000000000,2017-10-01 02:26:20.000000000,closed,0,Minimize C include diff
575,2017-09-29 11:37:34.000000000,2017-09-29 12:43:20.000000000,closed,0,Update algebrick version in test
574,2017-09-28 22:47:21.000000000,2017-09-29 20:17:17.000000000,closed,0,Fix bad code ranges
573,2017-09-28 17:24:40.000000000,2017-09-30 20:11:18.000000000,closed,0,Update ruby/spec
572,2017-09-28 12:41:30.000000000,2017-10-12 12:58:48.000000000,closed,4,Add `jt pr clean` command
571,2017-09-27 20:10:34.000000000,2017-10-02 17:49:10.000000000,closed,3,Optimize Array#rotate!
570,2017-09-27 15:40:33.000000000,2017-09-28 13:05:02.000000000,closed,1,Move TRUFFLERUBY_RESILIENT_GEM_HOME logic to post-boot
569,2017-09-27 01:47:43.000000000,2017-09-27 02:04:02.000000000,closed,0,Avoid a virtual call that's breaking the AOT build by directly callin…
568,2017-09-27 01:36:15.000000000,2017-09-27 15:39:45.000000000,closed,1,Move TRUFFLERUBY_RESILIENT_GEM_HOME logic to post-boot
567,2017-09-26 21:01:10.000000000,2017-09-26 21:35:39.000000000,closed,0,Misc string cleanup
566,2017-09-26 19:20:47.000000000,2017-09-27 19:57:36.000000000,closed,7,Optimize uncached dispatch
565,2017-09-26 18:49:42.000000000,2017-09-26 21:29:25.000000000,closed,0,Update Truffle and JVMCI
564,2017-09-25 21:50:28.000000000,2017-09-26 00:18:00.000000000,closed,0,Remove RopeBuffer.
563,2017-09-25 20:06:43.000000000,2017-09-26 02:25:47.000000000,closed,0,Simpler string casing methods
562,2017-09-25 19:52:17.000000000,2017-09-25 22:00:23.000000000,closed,0,Use a cached thread pool for Fibers
561,2017-09-25 19:03:29.000000000,2017-09-25 23:57:42.000000000,closed,0,Workaround for shutdown()
560,2017-09-25 14:07:10.000000000,2017-09-27 13:33:49.000000000,closed,1,Convert ci.hocon to ci.jsonnet
559,2017-09-25 00:58:42.000000000,2017-09-25 09:28:55.000000000,closed,0,Launcher fixes
558,2017-09-24 16:51:47.000000000,2017-09-24 18:50:10.000000000,closed,0,Use StandardCharsets instead of the sun.nio.cs.US_ASCII class
557,2017-09-24 16:05:25.000000000,2017-09-24 18:50:43.000000000,closed,0,Do not warn about Graal when building C extensions
556,2017-09-24 16:00:48.000000000,2017-10-04 00:49:25.000000000,closed,12,TruffleRuby with Graal does not work with Java 9
555,2017-09-24 01:21:31.000000000,2017-09-25 19:52:48.000000000,closed,2,Add rb_mod_ancestors and spec
554,2017-09-23 22:52:56.000000000,2017-09-25 21:24:01.000000000,closed,0,Simplify the 'string_byte_index' primitive.
553,2017-09-23 20:39:41.000000000,2017-09-25 00:54:24.000000000,closed,2,Implement initializeThread/disposeThread and allow to create foreign threads
552,2017-09-23 10:19:20.000000000,2017-09-26 13:20:38.000000000,closed,3,Implement $SAFE level
551,2017-09-22 08:27:25.000000000,2017-09-22 12:47:19.000000000,closed,0,Add remaining declarations to compile json gem
550,2017-09-22 05:50:07.000000000,2017-09-22 12:46:12.000000000,closed,0,Add RALLOC_N to C API
549,2017-09-22 05:13:56.000000000,2017-09-22 12:45:22.000000000,closed,0,Define RARRAY_LEN as macro
548,2017-09-22 04:43:21.000000000,2017-09-22 12:44:33.000000000,closed,0,Add dumps dir to gitignore
547,2017-09-21 17:49:33.000000000,2017-11-18 21:17:39.000000000,closed,2,Nokogiri memory management
546,2017-09-21 17:47:20.000000000,2017-10-04 18:31:27.000000000,closed,1,Nokogiri string fixes
545,2017-09-21 14:03:17.000000000,2017-09-21 15:40:25.000000000,closed,0,Add a default handler for SIGALRM showing all threads and backtraces
544,2017-09-20 15:25:22.000000000,2017-09-20 21:16:54.000000000,closed,5,Add an option to show all threads and backtraces on Ctrl+C
543,2017-09-20 15:05:47.000000000,2017-09-20 18:00:00.000000000,closed,1,Fix patch for RubyGems package.rb
542,2017-09-20 14:52:21.000000000,2017-09-21 02:36:53.000000000,closed,0,Update SVM startup numbers
541,2017-09-20 14:20:38.000000000,2017-09-26 22:24:55.000000000,closed,0,Try enabling tagged benchmarks
540,2017-09-20 07:41:25.000000000,2017-09-26 19:03:03.000000000,closed,0,Raise TypeError for type mismatch in rb_check_type
539,2017-09-19 21:03:15.000000000,2017-09-19 23:34:12.000000000,closed,0,Fix Process.setproctitle on Linux to not depend on a specific Main class or package
538,2017-09-18 20:31:14.000000000,2017-09-19 15:38:29.000000000,closed,0,Use the new darwin capabilities.
537,2017-09-18 19:28:00.000000000,2017-09-19 14:03:12.000000000,closed,0,Minor fixes
536,2017-09-17 22:43:13.000000000,2017-09-20 14:54:14.000000000,closed,4,Add patches for rspec-compiler
535,2017-09-17 22:37:25.000000000,2017-09-18 13:45:17.000000000,closed,0,Add ULL2NUM
534,2017-09-17 20:49:56.000000000,2017-09-17 21:44:37.000000000,closed,0,Make the RubyContext a PE constant when creating a Fiber
533,2017-09-17 08:35:50.000000000,2017-09-17 19:39:30.000000000,closed,0,Add PATH_SEPARATOR to RbConfig
532,2017-09-17 00:33:29.000000000,2017-09-20 14:12:10.000000000,closed,1,Add patches for mysql2
531,2017-09-16 18:43:33.000000000,2017-09-19 20:53:40.000000000,closed,0,"Implement Fiber#transfer, pass all Fiber specs and run MRI Fiber tests"
530,2017-09-16 13:52:36.000000000,2017-09-16 18:43:55.000000000,closed,1,Raise an error when a Fiber tries to resume itself
529,2017-09-16 13:18:52.000000000,2017-09-18 20:43:31.000000000,closed,0,jt install graal improvements
528,2017-09-15 23:58:18.000000000,2017-09-16 01:10:31.000000000,closed,0,Name posix().execve() appropriately
527,2017-09-15 23:33:00.000000000,2017-09-18 23:01:52.000000000,closed,0,Optimize ArrayDupNode to profile the size
526,2017-09-15 17:10:48.000000000,2017-09-15 23:42:57.000000000,closed,0,Interrupt select() and implement it fully
525,2017-09-15 15:51:38.000000000,2017-09-15 17:52:30.000000000,closed,2,Use new pointers for FDSet
524,2017-09-15 09:18:13.000000000,2017-09-16 13:14:43.000000000,closed,1,Add rb_wait_for_single_fd
523,2017-09-15 04:52:08.000000000,2017-09-15 06:02:49.000000000,closed,0,Untag passing StringValue spec
522,2017-09-14 20:31:57.000000000,2017-09-15 15:48:42.000000000,closed,0,Update rubyspec
521,2017-09-14 15:41:20.000000000,2017-09-14 16:10:32.000000000,closed,0,Fix deadlock in dispatch with splitting
520,2017-09-14 15:31:05.000000000,2017-09-14 16:10:46.000000000,closed,0,CI HOCON fixes
519,2017-09-14 07:20:39.000000000,2017-09-14 12:47:00.000000000,closed,0,Fix type conversion for Kernel#String
518,2017-09-14 05:56:23.000000000,2017-09-15 15:42:53.000000000,closed,0,Add JT command to print environment
517,2017-09-13 18:53:39.000000000,2017-09-14 16:11:03.000000000,closed,0,Make sure the whole option is shown on one line in libssl doc
516,2017-09-13 13:57:52.000000000,2017-09-13 17:45:32.000000000,closed,0,jt fixes
515,2017-09-13 12:44:30.000000000,2017-09-13 13:53:44.000000000,closed,0,JT: Save graph to file when IGV is not running
514,2017-09-13 08:32:09.000000000,2017-09-13 17:53:16.000000000,closed,0,Fix rb_Hash for spec
513,2017-09-12 20:00:47.000000000,2017-09-14 17:47:29.000000000,closed,1,Restore nil coverage
512,2017-09-12 18:08:17.000000000,2017-09-14 20:00:48.000000000,closed,0,Improve find string
511,2017-09-12 16:47:19.000000000,2017-09-14 23:21:28.000000000,closed,0,Patch rubygems vulnerability
510,2017-09-12 08:52:25.000000000,2017-09-12 17:00:03.000000000,closed,0,Fix ENCODING_GET definition
509,2017-09-12 08:06:09.000000000,2017-09-12 12:59:39.000000000,closed,0,Implement rb_str_times
508,2017-09-11 00:47:59.000000000,2017-09-11 12:43:57.000000000,closed,0,Use the same logic as in Exception#message if there is no message set
507,2017-09-10 20:41:34.000000000,2017-09-10 23:52:42.000000000,closed,0,Add rb_proc_call and spec
506,2017-09-10 15:13:13.000000000,2017-09-12 18:56:08.000000000,closed,3,Properly terminate and wait Fibers when a Thread finishes
505,2017-09-10 04:52:50.000000000,2017-09-10 12:04:05.000000000,closed,0,Implement rb_ary_rotate
504,2017-09-10 03:58:22.000000000,2017-09-10 12:03:34.000000000,closed,0,Fix rb_ary_new_capa
503,2017-09-09 23:12:06.000000000,2017-09-10 12:02:07.000000000,closed,0,Add rb_iter_break_value
502,2017-09-09 21:42:34.000000000,2017-09-10 12:01:14.000000000,closed,0,Untag MRI C extension test_class2name
501,2017-09-09 12:54:46.000000000,2017-09-11 16:59:02.000000000,closed,0,jt build sulong: clone and build sulong
500,2017-09-09 12:32:23.000000000,2017-09-11 17:00:34.000000000,closed,0,Improve the wording in threads documentation
499,2017-09-09 08:06:29.000000000,2017-09-10 12:00:19.000000000,closed,0,Add rb_enc_raise
498,2017-09-08 20:29:06.000000000,2017-09-10 19:33:15.000000000,closed,0,Fix set of created threads to be per language instance
497,2017-09-08 19:18:34.000000000,2017-09-08 22:32:10.000000000,closed,1,Hide C exts warnings by default
496,2017-09-08 19:07:08.000000000,2017-09-08 19:40:14.000000000,closed,0,Various fixes
495,2017-09-08 16:51:16.000000000,2017-09-08 20:37:46.000000000,closed,0,"Fix Thread::Backtrace::Location#{to_s,inspect}"
494,2017-09-08 14:11:48.000000000,2017-09-08 15:03:10.000000000,closed,0,Fix and simplify bad gem home check
493,2017-09-08 13:04:22.000000000,2017-09-08 22:32:10.000000000,closed,2,Warnings on gem install
492,2017-09-08 12:16:33.000000000,2017-09-08 15:02:51.000000000,closed,0,Fix Darwin native launcher
491,2017-09-08 04:00:29.000000000,2017-09-08 15:02:50.000000000,closed,5,Cannot run `ruby` with chruby
490,2017-09-08 02:23:53.000000000,2017-09-08 10:55:34.000000000,closed,0,Don't prevent running jt.rb with TruffleRuby.
489,2017-09-07 14:39:10.000000000,2017-09-15 17:39:46.000000000,closed,1,Changes to launcher (and related code) to support new AOT RubyLauncher
488,2017-09-07 00:41:03.000000000,2017-09-08 17:22:22.000000000,closed,0,Print the exception if the default interrupt handler can't be restored when we have failed to interrupt a thread
487,2017-09-06 18:51:00.000000000,2017-10-04 17:32:42.000000000,closed,1,Nokogiri fixes
486,2017-09-05 14:05:58.000000000,2017-09-05 14:44:33.000000000,closed,0,Update Truffle
485,2017-09-04 16:25:12.000000000,2017-09-04 20:04:40.000000000,closed,4,Updated Ruby folder location in docs.
484,2017-09-04 14:03:45.000000000,2017-09-04 22:55:27.000000000,closed,0,Fixes to thread messages
483,2017-09-04 13:47:02.000000000,2017-09-04 22:55:38.000000000,closed,0,Example and workaround for the problem of Qnil not being a constant value
482,2017-09-04 13:41:52.000000000,2017-09-04 22:03:43.000000000,closed,0,LLVM 3.9 works
481,2017-09-01 07:09:54.000000000,2017-09-03 04:33:21.000000000,closed,0,Re-enable MRI and JRuby benchmarks.
480,2017-08-31 07:36:28.000000000,2017-09-30 20:35:05.000000000,closed,19,Use MRI C ext headers
479,2017-08-31 02:06:01.000000000,2017-08-31 02:07:19.000000000,closed,0,Add a missing boundary.
478,2017-08-31 01:19:23.000000000,2017-08-31 03:02:03.000000000,closed,0,Handle potential null in fiber debug info
477,2017-08-31 01:05:30.000000000,2017-08-31 14:57:15.000000000,closed,0,Update on spec completeness
476,2017-08-31 00:17:43.000000000,2017-08-31 01:30:54.000000000,closed,4,Tidy some thing in specs
475,2017-08-30 21:14:25.000000000,2017-08-30 21:34:18.000000000,closed,0,Threading API fixes
474,2017-08-30 18:22:05.000000000,2017-08-30 20:21:30.000000000,closed,0,Alternative support for the threading API
473,2017-08-30 15:46:38.000000000,2017-08-30 18:31:46.000000000,closed,0,Thread tools
472,2017-08-29 18:03:00.000000000,2017-08-30 18:31:14.000000000,closed,2,Updated Ruby managers installation instructions.
471,2017-08-28 17:04:51.000000000,2017-08-30 19:52:43.000000000,closed,0,Threading API
470,2017-08-28 00:56:26.000000000,2017-08-28 23:55:11.000000000,closed,0,More info on C extension compatibility problems
469,2017-08-25 21:00:55.000000000,2017-08-25 22:25:02.000000000,closed,0,Upgrade JVMCI from 8u121-jvmci-0.30 to 8u141-jvmci-0.33.
468,2017-08-25 08:08:42.000000000,2017-08-25 16:43:36.000000000,closed,0,Reenable the PSD benchmarks on the SVM.
467,2017-08-25 05:21:39.000000000,2017-08-25 16:43:25.000000000,closed,0,Fix issue whereby the server benchmarks were ignoring AOT flags and e…
466,2017-08-25 04:14:31.000000000,2017-08-28 19:59:00.000000000,closed,0,Try to warn when LLVM isn't available
465,2017-08-25 03:32:56.000000000,2017-08-26 12:37:57.000000000,closed,1,Further clarify LLVM and other dependencies
464,2017-08-24 23:41:01.000000000,2017-08-27 20:46:18.000000000,closed,0,Update MRI C Ext orginization for require relative fix
463,2017-08-24 22:45:54.000000000,2017-08-24 23:58:22.000000000,closed,0,Increase SVM CI time to account for increased build time.
462,2017-08-23 14:15:46.000000000,2017-08-23 18:09:55.000000000,closed,0,Remove redundant ST declarations
461,2017-08-23 03:44:41.000000000,2017-08-24 00:56:23.000000000,closed,0,Updates to run more MRI cext tests
460,2017-08-23 02:47:52.000000000,2017-08-23 03:45:19.000000000,closed,0,0.27 catchup
459,2017-08-21 18:26:18.000000000,2017-08-21 19:54:09.000000000,closed,0,New implementation of the interop meta-object
458,2017-08-20 22:55:49.000000000,2017-08-21 14:53:53.000000000,closed,0,Make DispatchHeadNode abstract
457,2017-08-20 22:21:17.000000000,2017-08-20 22:54:49.000000000,closed,0,Rename interop #send to #__send__
456,2017-08-20 17:59:56.000000000,2017-08-20 18:35:50.000000000,closed,0,Fix RubySL::Socket::Foreign.ip_to_bytes in rubysl-socket
455,2017-08-20 15:30:00.000000000,2017-08-20 21:31:05.000000000,closed,0,Splat foreign arrays
454,2017-08-20 02:13:49.000000000,2017-08-22 12:16:09.000000000,closed,0,Add MRI C Extension tests
453,2017-08-19 17:04:52.000000000,2017-08-21 18:28:51.000000000,closed,0,Simplify and minimize HTTPS patches
452,2017-08-19 16:17:36.000000000,2017-08-19 18:36:38.000000000,closed,8,TruffleFatalException: couldn't load the post-boot code
451,2017-08-19 03:44:54.000000000,2017-08-19 17:21:49.000000000,closed,0,"Add getifaddrs, freeifaddr, sendmsg, recvmsg"
450,2017-08-19 01:06:52.000000000,2017-08-19 17:20:39.000000000,closed,2,Simplify launcher search code for truffle jars
449,2017-08-19 00:45:36.000000000,2017-08-19 17:18:41.000000000,closed,0,Fix jt install graal
448,2017-08-18 22:45:39.000000000,2017-08-18 23:54:41.000000000,closed,0,Update bench excludes
447,2017-08-18 22:09:09.000000000,2017-08-19 01:08:13.000000000,closed,0,Add num2ulong specialization for long
446,2017-08-18 21:53:22.000000000,2017-08-18 23:14:14.000000000,closed,0,Update rb_hash_dup to function
445,2017-08-18 20:49:51.000000000,2017-08-18 23:13:40.000000000,closed,0,Alias $CHILD_STATUS to $?
444,2017-08-18 19:34:15.000000000,2017-08-18 20:38:06.000000000,closed,0,Migrate to the new Darwin infrastructure
443,2017-08-18 19:27:32.000000000,2017-08-18 19:49:50.000000000,closed,0,"Add a test for installing, compiling and running Puma with a rack app"
442,2017-08-18 12:05:02.000000000,2017-08-18 15:35:14.000000000,closed,0,Fix and improve Truffle::Debug.*ast* methods
441,2017-08-18 09:41:05.000000000,2017-08-18 19:25:07.000000000,closed,3,Add Puma C extension patches
440,2017-08-17 19:18:05.000000000,2017-08-17 22:37:55.000000000,closed,0,Misc string improvements
439,2017-08-17 15:31:02.000000000,2017-08-17 19:34:19.000000000,closed,0,Do not use a core-load-path for time metrics
438,2017-08-17 13:59:04.000000000,2017-08-17 15:19:33.000000000,closed,0,Do not deploy if it was already deployed
437,2017-08-16 20:33:55.000000000,2017-08-16 21:25:46.000000000,closed,0,Workaround for Darwin tests
436,2017-08-16 14:19:17.000000000,2017-08-16 17:34:12.000000000,closed,0,Implement the NEW message
435,2017-08-16 08:55:02.000000000,2017-08-16 19:43:41.000000000,closed,5,Fix RB_WAITFD_IN macro comment
434,2017-08-16 02:19:37.000000000,2017-08-16 19:42:58.000000000,closed,4,Fix -v option behavior
433,2017-08-16 02:02:16.000000000,2017-08-17 13:04:22.000000000,closed,2,Add more AOT metrics & benchmarks.
432,2017-08-15 22:08:09.000000000,2017-08-16 01:00:27.000000000,closed,0,Unify our and JNR's pointer
431,2017-08-15 18:28:37.000000000,2017-08-17 02:51:23.000000000,closed,3,Add a script to create a minimal pre-built distribution of TruffleRuby
430,2017-08-14 19:51:01.000000000,2017-08-15 00:54:07.000000000,closed,2,Explicitly disable TRUFFLERUBY_RESILIENT_GEM_HOME when setting GEM_HOME
429,2017-08-14 19:19:05.000000000,2017-08-14 19:50:46.000000000,closed,0,Move Darwin tests to the new Darwin infrastructure
428,2017-08-14 17:41:02.000000000,2017-08-14 19:38:35.000000000,closed,0,Use RuboCop from the gem test pack
427,2017-08-14 14:59:36.000000000,2017-08-14 17:14:43.000000000,closed,0,Use an absolute path for the gem-test-pack
426,2017-08-14 11:54:04.000000000,2017-08-17 00:10:13.000000000,closed,4,Can't run rails tests
425,2017-08-14 11:37:43.000000000,2017-08-16 12:50:15.000000000,closed,2,More user friendly jt test ecosystem
424,2017-08-13 20:52:42.000000000,2017-08-14 01:52:48.000000000,closed,0,Warn if rubocop isn't installed
423,2017-08-13 16:05:37.000000000,2017-08-14 16:06:38.000000000,closed,2,Updates versions in Docker and fix locale setup
422,2017-08-11 23:00:18.000000000,2017-08-12 00:41:03.000000000,closed,0,Interop fixes based on the integration test suite
421,2017-08-11 18:13:00.000000000,2017-08-15 20:25:36.000000000,closed,2,Lazy core nodes
420,2017-08-11 06:15:18.000000000,2017-08-16 20:18:10.000000000,closed,1,Add if space lint for ruby.c
419,2017-08-11 06:01:26.000000000,2017-08-11 15:01:59.000000000,closed,0,Stub rb_bug
418,2017-08-10 23:14:10.000000000,2017-08-11 01:20:25.000000000,closed,0,Add back in a removed workaround for ReferenceQueue#remove not working in AOT.
417,2017-08-10 18:58:21.000000000,2017-08-10 20:18:12.000000000,closed,1,Run mx sforceimports on jt build
416,2017-08-10 17:50:17.000000000,2017-08-10 20:08:54.000000000,closed,1,Make Ruby strings unbox to Java strings
415,2017-08-10 14:36:11.000000000,2017-08-10 16:16:41.000000000,closed,0,Use the terminology 'native' rather than 'AOT' and bake the GraalVM version into the native image
414,2017-08-10 14:05:47.000000000,2017-08-10 16:15:58.000000000,closed,0,Update Truffle
413,2017-08-10 08:43:00.000000000,2017-08-16 19:44:07.000000000,closed,0,Add NUM2LL
412,2017-08-10 08:04:13.000000000,2017-08-10 13:05:50.000000000,closed,0,Add RbConfig optflags
411,2017-08-10 06:13:39.000000000,2017-08-17 02:51:07.000000000,closed,3,"Patch C ext for ""not an integer constant"" error"
410,2017-08-10 06:02:51.000000000,2017-08-10 06:16:49.000000000,closed,3,TruffleRuby is installing Sinatra 1.4.8 instead of 2.0.0
409,2017-08-10 00:54:57.000000000,2017-08-10 19:05:10.000000000,closed,3,GraalSDK integration tests and work to support them
408,2017-08-09 23:43:31.000000000,2017-08-10 01:04:23.000000000,closed,0,Remove unused imports
407,2017-08-09 20:28:13.000000000,2017-08-09 23:12:28.000000000,closed,4,Add a custom wrapper node for instrumentation of RescueNodes.
406,2017-08-09 17:25:03.000000000,2017-08-09 19:09:49.000000000,closed,6,Truffle::Interop.object_literal
405,2017-08-08 23:38:18.000000000,2017-08-09 00:31:31.000000000,closed,0,Remove the unused MallocFree
404,2017-08-08 22:56:05.000000000,2017-08-08 22:57:43.000000000,closed,2,Remove the unused MallocFree
403,2017-08-08 18:23:59.000000000,2017-08-09 23:29:39.000000000,closed,2,Check warnings in CI with ECJ
402,2017-08-08 17:26:13.000000000,2017-08-10 15:06:30.000000000,closed,3,Lazily load RubyGems
401,2017-08-08 17:17:28.000000000,2017-08-08 22:59:06.000000000,closed,1,No trailing spaces in options generator
400,2017-08-08 17:02:48.000000000,2017-08-08 23:21:30.000000000,closed,1,Localise log boundary methods to preserve log source information
399,2017-08-08 16:35:52.000000000,2017-08-09 01:11:09.000000000,closed,0,Better time metrics
398,2017-08-08 16:13:14.000000000,2017-08-09 01:18:42.000000000,closed,0,Simplify time zone formatting
397,2017-08-08 15:49:30.000000000,2017-08-08 21:48:10.000000000,closed,0,Remove the dependency on Pathname in patching
396,2017-08-08 14:34:37.000000000,2017-08-08 17:10:21.000000000,closed,0,Unsafe allocation PE bug is fixed
395,2017-08-07 23:18:48.000000000,2017-08-08 00:37:18.000000000,closed,1,Second attempt at generalising Java backtrace spec
394,2017-08-07 19:42:10.000000000,2017-08-07 21:03:36.000000000,closed,2,Generalise Java exception message specs
393,2017-08-07 19:39:51.000000000,2017-08-07 23:40:26.000000000,closed,0,C-ext fixes
392,2017-08-07 18:43:25.000000000,2017-08-07 19:58:22.000000000,closed,0,Comment on why we have these barriers on Unsafe methods
391,2017-08-07 17:52:38.000000000,2017-08-07 18:23:09.000000000,closed,0,Barriers on alloc and free due to a PE bug
390,2017-08-07 16:35:15.000000000,2017-08-08 00:41:41.000000000,closed,0,Logic to automatically find Graal if it's built as a sibling
389,2017-08-07 16:31:03.000000000,2017-08-07 18:51:05.000000000,closed,1,Add option to decode portion of rope to java.lang.String without creating a SubstringRope.
388,2017-08-07 16:09:16.000000000,2017-08-07 23:56:50.000000000,closed,7,Give up on Travis
387,2017-08-07 15:43:53.000000000,2017-08-07 16:18:23.000000000,closed,4,Move automatic OPENSSL_PREFIX into extconfs
386,2017-08-07 15:29:51.000000000,2017-08-07 16:02:06.000000000,closed,0,Remove transition warning for --sulong flag
385,2017-08-07 03:08:36.000000000,2017-08-09 20:04:47.000000000,closed,3,Add st
384,2017-08-07 02:49:42.000000000,2017-08-07 13:14:02.000000000,closed,2,Add rb_gc_unregister_address
383,2017-08-06 23:17:05.000000000,2017-08-09 13:23:23.000000000,closed,2,Add rb_range_beg_len
382,2017-08-05 16:56:52.000000000,2017-08-07 21:03:40.000000000,closed,0,"Automatically download mx, so it is easier to build TruffleRuby"
381,2017-08-05 09:12:03.000000000,2017-08-05 13:09:48.000000000,closed,0,Stub rb_wait_for_single_fd
380,2017-08-05 09:06:58.000000000,2017-08-05 21:56:43.000000000,closed,4,Add lib directory argument to linker
379,2017-08-05 05:17:23.000000000,2017-08-05 13:08:59.000000000,closed,0,Add rb_proc_arity
378,2017-08-05 02:13:27.000000000,2017-08-05 22:16:19.000000000,closed,0,Parse without RubyContext
377,2017-08-04 21:48:35.000000000,2017-08-04 22:41:20.000000000,closed,0,A few C extension fixes
376,2017-08-04 20:19:21.000000000,2017-08-04 20:50:46.000000000,closed,0,clarify a few installation and test details
375,2017-08-04 16:08:56.000000000,2017-08-05 02:31:08.000000000,closed,4,Performance optimizations for my Array#to_proc
374,2017-08-04 12:18:08.000000000,2017-08-04 14:55:01.000000000,closed,1,Disable binary suites on Travis
373,2017-08-04 08:45:57.000000000,2017-08-05 13:06:48.000000000,closed,0,Add rb_tainted_str_new2
372,2017-08-04 08:25:10.000000000,2017-08-05 13:07:41.000000000,closed,0,Add rb_gc and spec
371,2017-08-03 22:02:35.000000000,2017-08-04 18:04:22.000000000,closed,1,FFI fixes
370,2017-08-03 18:12:30.000000000,2017-08-04 12:11:06.000000000,closed,0,Run lint in CI
369,2017-08-03 17:31:22.000000000,2017-08-04 19:37:03.000000000,closed,0,Refine when we turn #name= into a WRITE
368,2017-08-03 17:19:18.000000000,2017-08-04 18:06:25.000000000,closed,3,Always translate exception at the top-level
367,2017-08-03 16:00:37.000000000,2017-08-04 12:36:20.000000000,closed,1,Try to figure out why downloads fail on Travis
366,2017-08-03 15:08:42.000000000,2017-08-07 20:40:06.000000000,closed,1,Launcher refactoring
365,2017-08-03 04:29:45.000000000,2017-08-03 17:27:06.000000000,closed,1,New pointers using Unsafe
364,2017-08-03 00:58:54.000000000,2017-08-03 04:27:47.000000000,closed,0,Finalization service
363,2017-08-02 17:57:04.000000000,2017-08-03 07:27:18.000000000,closed,0,Transcoder improvements
362,2017-08-02 15:56:04.000000000,2017-08-04 18:04:12.000000000,closed,0,Update Truffle
361,2017-08-02 15:29:07.000000000,2017-08-02 16:52:54.000000000,closed,0,C extensions conversions fixes
360,2017-08-02 15:13:04.000000000,2017-08-02 16:44:12.000000000,closed,0,Mention LP64
359,2017-08-02 09:11:20.000000000,2017-08-02 12:24:53.000000000,closed,0,Add rb_tainted_str_new to C API
358,2017-08-02 05:58:01.000000000,2017-08-04 18:04:39.000000000,closed,1,Update RbConfig TRY_LINK to try to link using mock truffle c impl
357,2017-08-01 20:48:28.000000000,2017-08-02 21:53:08.000000000,closed,1,Thread-safety fixes
356,2017-08-01 19:50:13.000000000,2017-08-02 15:29:47.000000000,closed,0,"JT: Expand GRAAL_HOME, etc relative to the repo root if the paths are relative"
355,2017-08-01 16:24:28.000000000,2017-08-01 17:20:15.000000000,closed,0,Fix Eclipse warnings
354,2017-08-01 15:16:10.000000000,2017-08-01 16:18:41.000000000,closed,0,Remove no longer needed -da flag in the launcher
353,2017-08-01 12:44:15.000000000,2017-08-01 14:14:59.000000000,closed,0,Add a few missing boundaries
352,2017-07-31 22:34:08.000000000,2017-08-01 14:14:46.000000000,closed,0,Cleanup rubinius primitives
351,2017-07-31 20:59:48.000000000,2017-08-01 17:17:29.000000000,closed,0,SVM finalisers
350,2017-07-31 20:41:34.000000000,2017-08-01 15:10:34.000000000,closed,0,Update Truffle
349,2017-07-31 16:56:22.000000000,2017-08-01 02:16:35.000000000,closed,1,String creation cleanup
348,2017-07-31 00:50:01.000000000,2017-07-31 01:37:17.000000000,closed,0,Remove old and unused tools
347,2017-07-30 23:40:03.000000000,2017-07-31 13:35:09.000000000,closed,0,Add syslog C extension
346,2017-07-30 21:12:27.000000000,2017-07-31 00:59:40.000000000,closed,1,Fix typo in README
345,2017-07-30 15:45:11.000000000,2017-07-30 17:52:37.000000000,closed,0,Update for 0.26 release
