id,created_at,closed_at,state,comments,title
1267,2018-03-31 01:44:21.000000000,2018-03-31 02:50:53.000000000,closed,1,A couple of fixes to our Dockerfiles
1266,2018-03-29 23:41:10.000000000,2018-04-05 01:21:55.000000000,closed,0,Do not use launcher code in language
1265,2018-03-29 06:16:33.000000000,2018-03-29 18:25:16.000000000,closed,1,Fix make-native-distribution.sh
1264,2018-03-28 15:15:54.000000000,2018-03-28 22:07:02.000000000,closed,1,Only include the known launchers in truffleruby-bin and TRUFFLERUBY-ZIP
1263,2018-03-28 01:06:12.000000000,2018-03-28 12:27:09.000000000,closed,3,Add option to run finalizers on exit and fix synchronization
1262,2018-03-27 23:25:43.000000000,2018-03-28 12:24:41.000000000,closed,1,"Run ""jt test fast --native :truffle"" to catch slow native specs in Truffle"
1261,2018-03-27 22:56:03.000000000,2018-03-28 12:52:12.000000000,closed,0,Update documentation to include tools in MX_BINARY_SUITES
1260,2018-03-27 21:55:12.000000000,2018-03-27 23:24:21.000000000,closed,0,Add slow tags for the pre-init spec when running on native
1259,2018-03-27 18:01:40.000000000,2018-04-05 11:32:26.000000000,closed,2,Deduplicate option documentation
1258,2018-03-27 17:34:08.000000000,2018-04-03 00:51:54.000000000,closed,0,Remove dependency on tools from suite.py
1257,2018-03-27 16:41:45.000000000,2018-03-27 18:50:49.000000000,closed,1,Depend on tools only with distDependencies
1256,2018-03-27 13:58:16.000000000,2018-03-28 01:44:18.000000000,closed,0,Lower the MaxRuntimeCompileMethods limit
1255,2018-03-27 13:18:03.000000000,2018-03-29 11:36:04.000000000,closed,2,Deduplicate suite.py
1254,2018-03-27 13:16:46.000000000,2018-04-04 09:49:16.000000000,closed,2,jt build native add --tools and cleanup
1253,2018-03-27 11:13:35.000000000,2018-03-27 21:43:45.000000000,closed,1,Test h[:k] &&= :value
1252,2018-03-27 04:34:01.000000000,2018-03-27 12:59:44.000000000,closed,0,Update the entry point for `jt build native`.
1251,2018-03-27 03:15:56.000000000,2018-03-28 01:50:02.000000000,closed,0,TCK fix
1250,2018-03-27 02:12:12.000000000,2018-03-27 04:13:03.000000000,closed,3,Finalisation fix
1249,2018-03-27 00:56:25.000000000,2018-03-27 21:43:31.000000000,closed,2,Update specs
1248,2018-03-27 00:27:15.000000000,2018-03-27 01:44:22.000000000,closed,0,Upgrade graal
1247,2018-03-27 00:16:38.000000000,2018-03-27 02:33:51.000000000,closed,0,Re-use existing node
1246,2018-03-27 00:10:04.000000000,2018-03-27 01:38:17.000000000,closed,0,Fix typo
1245,2018-03-27 00:06:37.000000000,2018-03-27 02:21:15.000000000,closed,1,Polyglot fixes
1244,2018-03-26 18:43:44.000000000,2018-05-03 12:52:35.000000000,closed,3,Fix array strategy generalization for IntToObject case.
1243,2018-03-26 15:53:20.000000000,2018-03-26 16:46:55.000000000,closed,0,Update arguments to build an image with native-image
1242,2018-03-26 15:30:34.000000000,2018-03-27 02:21:28.000000000,closed,0,Update docs on single-threaded option
1241,2018-03-26 04:33:26.000000000,2018-03-26 13:31:53.000000000,closed,0,Adapt to new polyglot.h
1240,2018-03-25 01:02:44.000000000,2018-03-26 00:40:42.000000000,closed,0,New Polyglot API
1239,2018-03-23 17:26:50.000000000,2018-03-23 21:18:07.000000000,closed,0,Support --disable-gems with context pre-initialization
1238,2018-03-23 15:51:24.000000000,2018-03-23 17:41:57.000000000,closed,1,Update truffle version.
1237,2018-03-22 18:29:01.000000000,2018-03-22 19:33:26.000000000,closed,0,Explicitly set the main class for native builds with Sulong.
1236,2018-03-22 02:37:11.000000000,2018-03-23 16:49:58.000000000,closed,0,Reset the TZ unchanged assumption in patchContext()
1235,2018-03-21 23:13:06.000000000,2018-03-21 23:49:22.000000000,closed,0,Update command options for latest native-image changes.
1234,2018-03-21 00:04:48.000000000,2018-03-21 04:32:34.000000000,closed,0,Support Java 10
1233,2018-03-20 21:03:10.000000000,2018-03-20 22:56:23.000000000,closed,1,"Revert ""Revert Dir.glob improvements due to issue with filename case-insensitivity on macOS."""
1232,2018-03-20 17:57:50.000000000,2018-03-20 18:41:56.000000000,closed,0,Revert Dir.glob improvements due to issue with filename case-insensitivity on macOS.
1231,2018-03-19 23:06:13.000000000,2018-03-20 21:01:25.000000000,closed,0,Add MRI and C ext. tests for Darwin in CI.
1230,2018-03-19 20:17:34.000000000,2018-03-19 22:05:01.000000000,closed,0,Remove a primitive that's no longer used.
1229,2018-03-19 20:05:58.000000000,2018-03-21 20:26:05.000000000,closed,2,Always handle `--version`
1228,2018-03-19 19:00:18.000000000,2018-03-19 20:14:42.000000000,closed,0,Update Sulong
1227,2018-03-19 18:30:19.000000000,2018-03-19 19:48:06.000000000,closed,0,Llvm bitcode version
1226,2018-03-19 16:38:07.000000000,2018-03-19 18:44:06.000000000,closed,0,Document tested LLVM versions
1225,2018-03-19 15:52:51.000000000,2018-03-26 17:06:12.000000000,closed,2,Update bundler patches to 1.16.x
1224,2018-03-19 15:02:27.000000000,2018-03-19 15:47:01.000000000,closed,0,"Move jtt to test dir, so it's not distributed any more"
1223,2018-03-19 14:44:41.000000000,2018-03-19 15:27:47.000000000,closed,0,Remove last forgotten bundler patch
1222,2018-03-18 22:43:35.000000000,2018-03-19 01:10:45.000000000,closed,0,Document licenses for patches
1221,2018-03-18 21:40:03.000000000,2018-03-19 17:15:39.000000000,closed,0,Include JRuby update in change log
1220,2018-03-18 17:09:19.000000000,2018-03-19 15:21:33.000000000,closed,0,Print SyntaxError only once
1219,2018-03-18 07:33:52.000000000,2018-03-24 00:01:45.000000000,closed,16,Interop changes for READ and WRITE
1218,2018-03-18 06:26:09.000000000,2018-03-18 22:26:33.000000000,closed,0, Use the new Sulong function lookup interface
1217,2018-03-17 23:59:52.000000000,2018-03-18 02:08:32.000000000,closed,0,Fixes after Truffle update
1216,2018-03-17 03:29:26.000000000,2018-03-19 19:46:49.000000000,closed,7,Remove vendored jcodings code since it's no longer necessary for AOT.
1215,2018-03-17 01:23:12.000000000,2018-03-18 02:14:46.000000000,closed,3,Added Nashorn-style Java interop API
1214,2018-03-16 21:53:15.000000000,2018-03-17 01:46:43.000000000,closed,2,Upgrade joni and jcodings
1213,2018-03-16 16:03:12.000000000,2018-03-16 18:08:02.000000000,closed,0,Typography of the change log
1212,2018-03-16 16:00:14.000000000,2018-03-16 18:39:55.000000000,closed,2,Update Truffle
1211,2018-03-16 11:37:40.000000000,2018-03-16 19:46:39.000000000,closed,0,Add --native default change to changelog
1210,2018-03-16 04:47:06.000000000,2018-03-16 17:24:29.000000000,closed,0,Port lexer and parser code from JRuby 9.1.13.0.
1209,2018-03-15 23:50:37.000000000,2018-03-17 00:47:07.000000000,closed,4,Update MRI to version 2.3.6
1208,2018-03-15 23:26:48.000000000,2018-03-16 00:44:47.000000000,closed,1,Use --native by default
1207,2018-03-15 21:27:01.000000000,2018-03-16 00:58:43.000000000,closed,0,Add array shared storage note to change log.
1206,2018-03-15 19:20:12.000000000,2018-03-16 00:58:14.000000000,closed,2,Restructure our cext patching code
1205,2018-03-15 18:52:55.000000000,2018-03-15 20:28:25.000000000,closed,0,Automatically copy the SULONG_LIBS under the Ruby home on build
1204,2018-03-15 18:07:52.000000000,2018-03-15 19:04:35.000000000,closed,0,Update copyright year in RUBY_COPYRIGHT constant.
1203,2018-03-15 14:31:36.000000000,2018-03-15 15:58:14.000000000,closed,0,Always fetch llvm with mx fetch-languages
1202,2018-03-15 13:53:42.000000000,2018-03-15 15:56:59.000000000,closed,0,jvm_args improvements
1201,2018-03-14 22:40:10.000000000,2018-03-15 02:56:57.000000000,closed,0,JT: reuse build_truffleruby in check_dsl_usage
1200,2018-03-14 21:22:13.000000000,2018-03-14 22:15:35.000000000,closed,0,"Fix removed variable in ""jt build"""
1199,2018-03-14 15:12:05.000000000,2018-03-14 19:07:02.000000000,closed,3,Use llvm-linker to combine library bitcode files.
1198,2018-03-14 14:50:57.000000000,2018-03-14 16:53:51.000000000,closed,0,Remove Solaris testing in CI
1197,2018-03-14 03:57:15.000000000,2018-03-15 02:21:28.000000000,closed,0,Clean up string primitives
1196,2018-03-14 01:54:38.000000000,2018-05-05 22:22:16.000000000,closed,6,Multi-threaded Access Error with Interop and IO
1195,2018-03-13 19:59:31.000000000,2018-03-15 18:04:53.000000000,closed,0,Interop documentation typo
1194,2018-03-13 18:17:26.000000000,2018-03-13 19:37:52.000000000,closed,0,Fix launcher_spec tags
1193,2018-03-13 17:59:56.000000000,2018-03-14 13:51:50.000000000,closed,0,Add script to make a native distribution
1192,2018-03-13 15:04:48.000000000,2018-03-13 15:55:23.000000000,closed,0,Workaround for failing PE test.
1191,2018-03-12 20:37:20.000000000,2018-03-14 21:23:45.000000000,closed,0,Store the classpath and Java properties at build time from mx to use in the Bash launcher
1190,2018-03-12 15:16:32.000000000,2018-03-28 12:56:12.000000000,closed,8,No extra spacing around assignment
1189,2018-03-11 21:41:47.000000000,2018-03-13 01:29:28.000000000,closed,1,gem executables and tests
1188,2018-03-11 14:36:43.000000000,2018-03-12 13:31:55.000000000,closed,0,Improve backtrace tests and make them work with GraalVM
1187,2018-03-10 21:33:45.000000000,2018-03-12 16:07:11.000000000,closed,0,Dir.glob improvements
1186,2018-03-10 03:07:36.000000000,2018-03-12 16:33:43.000000000,closed,4,Depend on Sulong in suite.py
1185,2018-03-09 17:52:17.000000000,2018-03-13 19:33:33.000000000,closed,0,Footprint optimizations
1184,2018-03-09 17:14:59.000000000,2018-03-09 19:53:00.000000000,closed,0,Some cleanups in CI definitions
1183,2018-03-08 14:05:26.000000000,2018-03-09 01:02:02.000000000,closed,5,CI cleanup
1182,2018-03-08 04:01:50.000000000,2018-03-08 14:38:00.000000000,closed,0,Move Truffle::Ropes.debug_print to Truffle::Debug.print
1181,2018-03-08 01:54:19.000000000,2018-03-08 03:34:04.000000000,closed,0,Optimize Array#hash for primitive arrays
1180,2018-03-08 01:11:52.000000000,2018-03-08 19:52:57.000000000,closed,3,Instrumentation api update
1179,2018-03-07 22:41:25.000000000,2018-03-14 14:04:39.000000000,closed,3,Run MRI zlib tests in the C ext downstream gate
1178,2018-03-07 22:12:00.000000000,2018-03-12 23:48:53.000000000,closed,0,Speed up gem operations
1177,2018-03-07 19:32:32.000000000,2018-03-08 01:33:48.000000000,closed,1,Handle different $VERBOSE levels with context pre-initialization
1176,2018-03-06 22:00:39.000000000,2018-03-07 17:03:18.000000000,closed,0,Add an option to not reuse the pre-initialized context
1175,2018-03-06 21:51:34.000000000,2018-03-07 17:03:05.000000000,closed,0,Rename the property used for the pre-initialization home for clarity
1174,2018-03-06 02:10:34.000000000,2018-03-06 19:24:18.000000000,closed,0,Fix full memory barrier on the SVM
1173,2018-03-06 02:01:12.000000000,2018-03-06 16:19:38.000000000,closed,2,Remove old and unsupported --profile option to jt ruby
1172,2018-03-06 00:59:34.000000000,2018-03-06 01:24:59.000000000,closed,0,Add slow tags
1171,2018-03-05 18:47:47.000000000,1970-01-01 00:00:00.000000001,open,5,NullPointerException in ExceptionOperations.getFormatter
1170,2018-03-04 20:15:23.000000000,2018-03-04 21:17:35.000000000,closed,0,Update specs
1169,2018-03-04 19:24:28.000000000,2018-03-04 21:17:16.000000000,closed,0,Make it clear Java interop does not work on SVM currently
1168,2018-03-04 02:34:58.000000000,2018-03-05 15:06:47.000000000,closed,2,Improve launcher specs
1167,2018-03-03 17:45:15.000000000,2018-03-04 19:18:04.000000000,closed,0,Clarify what is setting the process title
1166,2018-03-03 07:51:43.000000000,2018-03-03 17:00:38.000000000,closed,0,Fix readme typo
1165,2018-03-03 03:57:06.000000000,2018-03-03 05:59:08.000000000,closed,0,Improve Docker tests
1164,2018-03-03 01:40:34.000000000,2018-03-12 19:50:23.000000000,closed,0,Enable array shared storage
1163,2018-03-02 21:58:03.000000000,2018-03-05 18:43:41.000000000,closed,6,"Load patching, lazy-rubygems and did_you_mean during context pre-initialization"
1162,2018-03-02 05:47:26.000000000,2018-03-04 17:47:48.000000000,closed,0,Move the document on JRuby-compatible Java interop to the docs directory
1161,2018-03-01 23:03:35.000000000,2018-03-02 17:19:25.000000000,closed,1,Do not use LazyRubyNode for global variables
1160,2018-03-01 21:44:44.000000000,2018-03-02 14:02:31.000000000,closed,0,Remove unavailable SourceIndex
1159,2018-03-01 21:04:33.000000000,2018-03-01 21:45:38.000000000,closed,2,Do not provide Source of an unavailable SourceSection.
1158,2018-03-01 20:16:40.000000000,2018-03-02 06:05:50.000000000,closed,2,Make the Ruby base version number a centralised constant so it doesn't appear scatted through our code
1157,2018-02-28 20:28:04.000000000,2018-03-01 14:10:30.000000000,closed,0,Context pre-initialization is now in GraalVM
1156,2018-02-28 04:03:46.000000000,2018-02-28 14:46:02.000000000,closed,0,Fix mailing list link
1155,2018-02-28 03:49:25.000000000,2018-02-28 22:56:56.000000000,closed,2,Resolve Source.getName() lazily
1154,2018-02-28 02:20:06.000000000,2018-02-28 19:57:07.000000000,closed,0,Clean ParserCache and extract a static method in SourceLoader
1153,2018-02-28 01:23:28.000000000,2018-02-28 02:20:46.000000000,closed,0,Update specs
1152,2018-02-28 01:08:22.000000000,2018-02-28 02:47:22.000000000,closed,0,Add missing CHANGELOG entries for the 0.32 release.
1151,2018-02-27 19:59:26.000000000,2018-03-02 18:43:30.000000000,closed,1,Immutable empty array strategy
1150,2018-02-27 15:52:41.000000000,2018-02-27 16:24:05.000000000,closed,0,Single-threaded as an option
1149,2018-02-27 04:55:58.000000000,2018-02-27 22:10:30.000000000,closed,3,Tidy up the change log
1148,2018-02-27 03:10:34.000000000,2018-02-27 04:52:19.000000000,closed,2,Embedded
1147,2018-02-27 02:57:50.000000000,2018-02-27 03:02:21.000000000,closed,0,Merge embedded configuration
1146,2018-02-27 01:46:28.000000000,2018-02-27 03:02:52.000000000,closed,1,Merge the embedded PR (#1139) in master
1145,2018-02-26 21:47:12.000000000,2018-02-27 22:11:11.000000000,closed,1,Fix the random seed with context pre-initialization
1144,2018-02-26 19:58:07.000000000,2018-02-26 22:23:51.000000000,closed,0,Remove extra VirtualFrame argument in regexp_search_region
1143,2018-02-26 19:54:53.000000000,2018-02-27 03:55:32.000000000,closed,0,LazyRubyNode improvements
1142,2018-02-26 18:54:18.000000000,2018-02-26 20:15:31.000000000,closed,0,Update microbenchmarks excludes to reflect the rename
1141,2018-02-26 17:57:21.000000000,2018-03-07 18:37:25.000000000,closed,2,Document the process for release branches
1140,2018-02-26 07:56:40.000000000,2018-02-26 20:16:02.000000000,closed,1,Fix a couple typos
1139,2018-02-26 05:17:49.000000000,2018-02-26 22:39:54.000000000,closed,1,Embedded configuration
1138,2018-02-26 00:30:27.000000000,2018-02-27 18:14:55.000000000,closed,1,Interop fixes
1137,2018-02-24 03:06:37.000000000,2018-02-27 17:06:01.000000000,closed,0,Fix TODO in GetTimeZoneNode
1136,2018-02-23 20:07:36.000000000,2018-02-27 16:12:35.000000000,closed,2,New array strategy for fast duplication of whole or part of array.
1135,2018-02-23 18:21:37.000000000,2018-02-23 19:05:45.000000000,closed,0,Rename micro bench files
1134,2018-02-23 16:48:05.000000000,2018-03-27 03:50:49.000000000,closed,14,Remove Main and tidy up
1133,2018-02-22 21:23:23.000000000,2018-02-22 23:54:42.000000000,closed,0,Increase the timelimit for AsciiDoctor benchmarks
1132,2018-02-22 19:53:32.000000000,2018-02-23 16:11:00.000000000,closed,0,Instrument regexp compilation and usage.
1131,2018-02-22 18:34:15.000000000,2018-02-23 18:37:25.000000000,closed,0,Array store tidy up
1130,2018-02-22 01:00:30.000000000,2018-02-22 18:30:00.000000000,closed,0,Improve the WeakValueCache and remove extra locking
1129,2018-02-21 00:40:59.000000000,2018-02-21 20:07:19.000000000,closed,1,Reduce IO string allocations
1128,2018-02-20 22:40:13.000000000,2018-02-22 00:58:34.000000000,closed,0,Rope cache cleanup
1127,2018-02-20 14:50:02.000000000,2018-02-20 19:05:34.000000000,closed,0,RUBY_DESCRIPTION should have architecture followed by operating system
1126,2018-02-20 03:01:00.000000000,2018-02-20 20:32:00.000000000,closed,2,Do not show a LazyStackTrace cause as it is an implementation detail
1125,2018-02-20 02:39:50.000000000,2018-02-20 19:05:51.000000000,closed,0,Use Source#getName() instead of Source#getPath()
1124,2018-02-20 01:42:19.000000000,2018-02-20 02:16:43.000000000,closed,2,gem install fails with java.io.IOException: Error while trying to parse null
1123,2018-02-19 21:57:27.000000000,2018-02-19 22:49:46.000000000,closed,0,Use SoftReference for the j.l.String to Symbol cache in SymbolTable
1122,2018-02-17 01:12:08.000000000,2018-02-17 04:37:56.000000000,closed,5,Disallow native ropes from being used in cached tables.
1121,2018-02-16 22:49:24.000000000,2018-02-17 01:04:42.000000000,closed,0,Small fixes
1120,2018-02-16 22:35:22.000000000,2018-02-20 03:31:12.000000000,closed,0,Test context pre-initialization in CI and build SVM images with a pre-initialized context
1119,2018-02-16 21:14:17.000000000,2018-02-16 21:43:48.000000000,closed,0,Cleanup frozen strings
1118,2018-02-16 20:38:27.000000000,2018-02-16 22:39:40.000000000,closed,0,Cleanup SymbolTable
1117,2018-02-16 14:53:43.000000000,2018-02-16 15:51:41.000000000,closed,0,Fix replacement of random hexa characters for the C ext backtraces test
1116,2018-02-16 00:00:16.000000000,2018-02-16 18:19:08.000000000,closed,1, Remove remaining openssl patching code 
1115,2018-02-15 21:56:45.000000000,2018-02-16 04:33:44.000000000,closed,0,Use optional arguments instead of keyword arguments for Truffle::POSIX.attach_function
1114,2018-02-15 21:18:40.000000000,2018-02-15 22:01:35.000000000,closed,0,Simplify transcoding and remove Encoding::TranscodingMap
1113,2018-02-15 21:05:40.000000000,2018-02-19 20:15:47.000000000,closed,1,Process --(native|jvm)* options in TRUFFLERUBYOPT
1112,2018-02-15 19:55:25.000000000,2018-02-15 22:01:05.000000000,closed,0,Switch Hash allocations to use build()
1111,2018-02-15 17:56:45.000000000,2018-02-15 19:14:46.000000000,closed,0,Pre-initialization fixes
1110,2018-02-15 05:04:09.000000000,2018-02-15 20:07:51.000000000,closed,0,Remove mirrors
1109,2018-02-14 21:29:47.000000000,2018-02-15 23:20:18.000000000,closed,2,Document workarounds
1108,2018-02-14 03:36:14.000000000,2018-02-14 16:31:19.000000000,closed,1,Encoding fixes and cleanup
1107,2018-02-13 22:48:06.000000000,2018-02-14 02:37:20.000000000,closed,2,Cleanup the Ruby code for Encoding
1106,2018-02-13 21:23:17.000000000,2018-02-13 22:58:50.000000000,closed,0,Update to latest Truffle
1105,2018-02-13 20:06:33.000000000,2018-02-13 21:33:29.000000000,closed,0,Fix truffle fixtures namespace
1104,2018-02-13 15:01:01.000000000,2018-02-13 20:06:03.000000000,closed,2,Fix foreign write to convert to a Ruby name before calling Ruby's obj[name] = value
1103,2018-02-13 03:44:33.000000000,2018-02-13 04:14:29.000000000,closed,0,"Use imports in BodyTranslator, there is no contention anymore"
1102,2018-02-11 22:15:54.000000000,2018-02-12 01:54:20.000000000,closed,0,Fix the optimized Hash lookup by index to not call eql? twice
1101,2018-02-11 20:58:31.000000000,2018-02-14 16:32:18.000000000,closed,3,Start a change log
1100,2018-02-11 06:32:42.000000000,2018-05-05 22:22:50.000000000,closed,4,Timezone incorrect when using --native switch
1099,2018-02-10 18:28:07.000000000,2018-02-11 20:35:33.000000000,closed,0,Move RubyLauncher to our repository
1098,2018-02-10 03:04:05.000000000,2018-02-13 02:59:16.000000000,closed,0,Add support for the 'REMOVE' interop message.
1097,2018-02-09 03:44:25.000000000,2018-02-10 02:37:53.000000000,closed,0,Fixes to compile msgpack
1096,2018-02-09 01:01:45.000000000,2018-02-09 01:48:54.000000000,closed,0,Upgrade Graal to get a bug fix for build Substrate VM images when binary suite isn't available.
1095,2018-02-08 23:52:47.000000000,2018-02-15 18:58:38.000000000,closed,4,Array builder tidy up
1094,2018-02-08 23:47:26.000000000,2018-02-09 01:49:27.000000000,closed,0,Update Dockerfiles building LLVM to only build support for the host system's architecture
1093,2018-02-08 23:43:57.000000000,2018-02-09 01:50:08.000000000,closed,0,Rename main to launch
1092,2018-02-08 19:13:04.000000000,2018-02-08 20:43:29.000000000,closed,0,Simplify SourceLoader.loadResource()
1091,2018-02-08 17:27:21.000000000,2018-02-08 19:45:52.000000000,closed,0,Simplify RubyBaseNode#getContext()
1090,2018-02-08 17:22:00.000000000,2018-02-08 19:45:38.000000000,closed,0,Improve documentation about testing
1089,2018-02-08 15:53:45.000000000,2018-02-08 17:15:46.000000000,closed,0,Cleanup the test definitions in CI
1088,2018-02-08 10:15:14.000000000,1970-01-01 00:00:00.000000001,open,11,Requiring rugged gem causes segfault
1087,2018-02-08 07:07:49.000000000,2018-07-26 18:09:31.000000000,closed,6,Error building patron
1086,2018-02-08 04:09:23.000000000,2018-02-19 22:14:56.000000000,closed,0,Improvements for zlib documentation and testing
1085,2018-02-07 21:39:22.000000000,2018-02-08 15:07:59.000000000,closed,0,Fix chunky benchmarks
1084,2018-02-07 19:08:17.000000000,2018-02-07 20:51:13.000000000,closed,0,Faster java string conversion
1083,2018-02-07 18:44:40.000000000,2018-02-07 20:12:40.000000000,closed,0,Fix the time metrics
1082,2018-02-07 17:46:32.000000000,2018-02-07 18:16:26.000000000,closed,0,Tag launchers specs failing on SVM
1081,2018-02-07 06:47:27.000000000,2018-02-07 18:33:20.000000000,closed,0,Provide faster Ruby String -> Java String conversion for ASCII-only strings.
1080,2018-02-06 21:08:40.000000000,2018-02-07 03:08:02.000000000,closed,0,Fixes for pre-initialization
1079,2018-02-06 02:06:55.000000000,2018-04-25 13:14:08.000000000,closed,9,Require semantics not the same as MRI
1078,2018-02-06 01:42:49.000000000,1970-01-01 00:00:00.000000001,open,2,Performance of the Kiba ETL benchmarks is low
1077,2018-02-06 00:28:18.000000000,2018-02-06 21:04:42.000000000,closed,2,Improved string pointers
1076,2018-02-05 19:50:17.000000000,2018-02-07 02:06:36.000000000,closed,0,Make executables resilient when symlinked
1075,2018-02-05 17:54:08.000000000,2018-02-05 18:35:23.000000000,closed,0,Follow the fix in Sulong for the error message for an exception during a native callback
1074,2018-02-04 19:10:02.000000000,2018-02-04 20:16:45.000000000,closed,0,We do run RubyGems now
1073,2018-02-04 16:34:30.000000000,2018-02-04 20:25:33.000000000,closed,0,Document the extra -XstartOnFirstThread for Optcarrot on macOS
1072,2018-02-04 15:34:43.000000000,2020-04-29 18:22:44.000000000,closed,7,CSV.read 2x slower than MRI
1071,2018-02-04 04:44:31.000000000,2018-02-06 00:09:07.000000000,closed,2,Document support for Oracle Linux
1070,2018-02-04 00:22:14.000000000,2018-07-16 20:32:32.000000000,closed,7,Error while running rvm mount
1069,2018-02-03 23:40:26.000000000,2018-02-04 00:42:21.000000000,closed,0,Recompute runtime Ruby home for pre-initialized context
1068,2018-02-03 21:43:52.000000000,2018-02-05 18:50:37.000000000,closed,2,Use rbenv shell rather than global
1067,2018-02-03 21:25:31.000000000,2018-02-03 21:57:50.000000000,closed,0,Improve MetaObject
1066,2018-02-03 21:01:56.000000000,2018-02-03 23:45:21.000000000,closed,0,Reorder README and small improvements
1065,2018-02-03 17:31:58.000000000,2018-02-03 18:34:18.000000000,closed,0,Lower MaxRuntimeCompileMethods to catch smaller increases
1064,2018-02-03 16:30:22.000000000,2018-02-03 18:55:56.000000000,closed,0,Update instructions to run Optcarrot
1063,2018-02-03 07:37:56.000000000,2018-02-04 04:45:19.000000000,closed,9,Unable to use optcarrot
1062,2018-02-03 06:49:49.000000000,2018-07-13 18:19:07.000000000,closed,23,"Support installing with ruby-build, ruby-install, RVM"
1061,2018-02-03 06:47:10.000000000,2018-02-03 20:42:50.000000000,closed,0,More documentation and tests for Ruby version managers
1060,2018-02-03 04:23:44.000000000,2018-02-03 19:48:27.000000000,closed,0,Documentation improvements
1059,2018-02-03 01:50:16.000000000,2018-02-03 02:05:46.000000000,closed,2,8
1058,2018-02-02 22:52:46.000000000,2018-02-04 03:13:05.000000000,closed,4,Better C backtraces
1057,2018-02-02 18:55:39.000000000,2018-02-03 03:59:18.000000000,closed,1,Simplify find_string operations
1056,2018-02-02 18:33:40.000000000,2018-02-02 20:39:37.000000000,closed,0,Backtrace fixes
1055,2018-02-02 18:09:52.000000000,2018-02-02 20:59:57.000000000,closed,0,Reduce substring rope creation in lexer
1054,2018-02-02 01:34:03.000000000,2018-02-06 02:07:59.000000000,closed,20,A first naïve look at TruffleRuby
1053,2018-02-02 01:26:56.000000000,2018-02-03 16:16:06.000000000,closed,1,Update to latest Truffle
1052,2018-02-02 01:13:55.000000000,2018-02-02 02:10:34.000000000,closed,0,Document TRUFFLERUBY_RESILIENT_GEM_HOME
1051,2018-02-01 23:15:06.000000000,2018-02-02 16:27:35.000000000,closed,1,Convert tests to the new Polyglot API
1050,2018-02-01 21:12:44.000000000,2018-02-03 06:48:45.000000000,closed,4,rbenv support?
1049,2018-02-01 20:29:16.000000000,2018-02-02 16:28:48.000000000,closed,0,Update documentation that used to refer to PolyglotEngine
1048,2018-02-01 20:24:20.000000000,2020-05-07 20:22:08.000000000,closed,4,Possible finalizer error in openssl
1047,2018-02-01 20:01:57.000000000,2018-02-02 16:38:43.000000000,closed,0,Remove our samples
1046,2018-02-01 17:58:41.000000000,2018-02-01 18:34:35.000000000,closed,0,Untag MRI tests
1045,2018-02-01 00:36:16.000000000,2018-02-05 18:51:41.000000000,closed,1,Add a fast `String#find_string' implementation for single byte lookups in CR_VALID strings.
1044,2018-01-31 23:45:32.000000000,2018-02-01 01:23:27.000000000,closed,0,Fix race in Truffle::POSIX.attach_function_eagerly
1043,2018-01-31 22:10:43.000000000,2018-02-01 01:23:27.000000000,closed,3,Possible socket interop issue on _getaddrinfo
1042,2018-01-31 21:11:09.000000000,2018-02-01 20:06:29.000000000,closed,5,Context pre-initialization (first steps)
1041,2018-01-31 19:47:04.000000000,2018-07-26 18:18:10.000000000,closed,4,ArgumentError backtrace to not point to the correct line
1040,2018-01-31 19:24:16.000000000,2018-02-01 17:03:59.000000000,closed,3,[MatchData] inspect to handle named captures
