id,created_at,closed_at,state,comments,title
1357,2017-12-02 06:16:33.000000000,2017-12-03 12:29:58.000000000,closed,2,"Getting error after executing a mutation -> ""code"": 4011, “message”: “Something unexpected happened in an Action: ’Query does not pass validation."
1356,2017-12-02 04:57:38.000000000,2018-01-23 21:32:37.000000000,closed,0,Adding a template to a project with multiple type files merges all types into one file
1355,2017-12-01 22:18:10.000000000,2018-01-23 21:32:32.000000000,closed,0,graphcool playground exits with code 1
1354,2017-12-01 21:06:54.000000000,2017-12-08 15:32:51.000000000,closed,2,Couple of documentation fixes
1353,2017-12-01 20:26:49.000000000,2017-12-01 22:44:59.000000000,closed,2,Cassandra Database backend support
1352,2017-12-01 18:49:24.000000000,2017-12-01 19:18:40.000000000,closed,0,[WIP] Bulk Data Import Endpoint
1351,2017-12-01 18:36:46.000000000,2018-07-07 16:59:55.000000000,closed,1,variables validation for subscriptions
1350,2017-12-01 15:42:55.000000000,2018-03-22 20:36:40.000000000,closed,23,Deployment guides
1349,2017-12-01 15:23:52.000000000,1970-01-01 00:00:00.000000001,open,27,Atomic operations
1348,2017-11-30 21:40:30.000000000,2018-01-23 21:32:27.000000000,closed,0, ENOTFOUND error with invoke-local
1347,2017-11-30 18:56:49.000000000,2017-11-30 19:20:15.000000000,closed,0,Graphql database client api
1346,2017-11-30 00:25:45.000000000,2017-11-30 00:27:40.000000000,closed,1,Define the model layer's validation rules while defining the schema
1345,2017-11-29 22:08:11.000000000,2018-01-23 21:32:21.000000000,closed,0,Variables for [Json!]! values are not correctly validated
1344,2017-11-29 17:50:58.000000000,2017-12-08 15:31:53.000000000,closed,1,fix bad mutation example
1343,2017-11-28 22:12:08.000000000,2018-01-23 21:32:16.000000000,closed,0,Old endpoint still active intermittently when updating service alias
1342,2017-11-28 16:41:38.000000000,2018-01-23 21:32:11.000000000,closed,1,Directive to change root field plural form and case sensitivity
1341,2017-11-28 15:40:50.000000000,2017-12-20 23:05:58.000000000,closed,9,Prisma: Generated type names
1340,2017-11-28 15:36:19.000000000,2018-01-02 02:10:15.000000000,closed,2,Prisma 1.0 - API
1339,2017-11-28 14:22:51.000000000,2017-11-28 14:26:20.000000000,closed,1,Graphql database client api
1338,2017-11-28 14:19:25.000000000,2018-01-23 21:32:05.000000000,closed,1,Permission Queries aren't exported correctly
1337,2017-11-28 06:05:48.000000000,2018-01-22 21:59:54.000000000,closed,2,Types not updating on new deployment
1336,2017-11-28 00:48:03.000000000,2017-12-08 15:30:27.000000000,closed,2,Update Command docs to remove export reference
1335,2017-11-28 00:39:16.000000000,2017-12-08 15:30:27.000000000,closed,3,"cli error ""graphcool export is not a graphcool command"""
1334,2017-11-27 22:19:28.000000000,2018-01-23 21:32:00.000000000,closed,1,Unclear error message when changing a relation field to a scalar field
1332,2017-11-27 21:10:20.000000000,2018-01-23 21:31:55.000000000,closed,3,graphcool reset does not work for local targets
1331,2017-11-27 20:02:32.000000000,2017-11-28 14:24:14.000000000,closed,6,There are issues with the new service definition
1330,2017-11-27 19:44:16.000000000,2018-01-22 15:26:47.000000000,closed,14,Prisma 1.0: New CLI commands layout
1329,2017-11-27 19:26:36.000000000,2018-01-02 02:10:34.000000000,closed,2,Deployment targets should be service name instead of generated service ID
1328,2017-11-27 18:09:56.000000000,2018-01-09 04:54:36.000000000,closed,23,Graphcool 1.0: New `graphcool.yml` format 
1327,2017-11-27 04:52:24.000000000,2018-03-29 14:03:02.000000000,closed,5,REST API Wrapper example has broken Relay API
1326,2017-11-26 22:25:03.000000000,2017-12-08 15:29:42.000000000,closed,2,fix(docs): GenerateRootToken should be GenerateNodeToken
1325,2017-11-25 22:58:46.000000000,2017-11-27 15:20:28.000000000,closed,0,Database Docs
1324,2017-11-25 05:25:00.000000000,2018-08-09 12:50:58.000000000,closed,4,Kubernetes example with current Graphcool Framework
1323,2017-11-24 22:33:30.000000000,2017-11-27 06:21:16.000000000,closed,4,GC CLI not bundling & Playground timing out
1322,2017-11-23 16:47:33.000000000,2018-01-23 21:31:49.000000000,closed,0,DataBrowser search input should allow double quoted strings for IDs. 
1321,2017-11-23 16:46:44.000000000,2018-01-23 21:31:44.000000000,closed,0,A field with the name 'xyz' already exists
1320,2017-11-23 15:53:31.000000000,2018-01-23 21:31:39.000000000,closed,3,Pusher template pushNotification function invocation causes error
1319,2017-11-23 04:57:42.000000000,2018-01-23 21:31:33.000000000,closed,2,Hot reloading for functions resolvers' local development
1318,2017-11-22 22:23:36.000000000,2018-01-16 19:28:51.000000000,closed,7,[WIP] Prisma
1317,2017-11-22 06:30:21.000000000,2017-12-01 01:36:21.000000000,closed,2,Unreadable MySQL Database Table Relation
1316,2017-11-22 00:19:22.000000000,2018-01-23 21:31:28.000000000,closed,0,Informational middle panel in permissions tab
1314,2017-11-21 21:05:25.000000000,2018-06-22 16:04:06.000000000,closed,2,GraphQL API Gateway reference example
1313,2017-11-21 19:59:25.000000000,1970-01-01 00:00:00.000000001,open,1,New filter field structure
1312,2017-11-21 16:26:32.000000000,1970-01-01 00:00:00.000000001,open,42,Group By and Aggregated Values
1311,2017-11-21 16:21:28.000000000,2017-11-21 16:22:24.000000000,closed,1,`types` field in graphcool.yml should accept list of strings
1310,2017-11-21 12:21:06.000000000,2017-11-21 21:14:39.000000000,closed,2,"Relay Modern fragments only work, when the prop name is the same as the field name"
1309,2017-11-21 10:24:31.000000000,2017-11-22 09:06:15.000000000,closed,4,how to open console on local deployment
1308,2017-11-21 05:35:46.000000000,2018-01-23 21:31:17.000000000,closed,1,Nested Mutation operationAfter create hook
1307,2017-11-21 04:42:37.000000000,2018-01-23 21:31:11.000000000,closed,2,Mutations with ~21kB strings cause 504 Cloudfront error
1306,2017-11-21 00:32:57.000000000,2018-01-23 21:31:06.000000000,closed,0,Big JSON fields don't trigger hook functions
1305,2017-11-20 23:29:36.000000000,2017-12-04 14:28:49.000000000,closed,13,Can't test permission queries anywhere
1304,2017-11-20 22:34:35.000000000,2017-12-19 15:43:44.000000000,closed,6,Unable to add credentials for Algolia integration from the console (legacy project)
1303,2017-11-20 22:31:32.000000000,2018-01-22 20:35:05.000000000,closed,2,Problem with Graphcool website on Netlify
1302,2017-11-20 18:18:00.000000000,2018-01-23 21:30:59.000000000,closed,0,Update Example screenshot
1301,2017-11-20 18:00:06.000000000,2017-11-24 14:50:34.000000000,closed,0,Dependency Injection Rework
1300,2017-11-20 02:38:05.000000000,1970-01-01 00:00:00.000000001,open,47,Improving performance with Indexes
1299,2017-11-19 02:11:07.000000000,2017-12-23 01:59:47.000000000,closed,4,Data Import and Export
1298,2017-11-19 02:02:28.000000000,2017-11-21 16:17:49.000000000,closed,2,Update doc to be Apollo Client 2.0 compliant.
1297,2017-11-18 20:02:28.000000000,2018-01-23 21:30:54.000000000,closed,1,Improve working with local logs
1296,2017-11-18 19:09:49.000000000,2017-11-21 11:03:57.000000000,closed,2,Add belongsTo & other relationship filters
1295,2017-11-18 13:09:32.000000000,2018-01-23 21:30:49.000000000,closed,2,File upload fails with status 500 and empty response when not all required fields defined
1294,2017-11-18 05:45:13.000000000,2017-12-08 15:26:18.000000000,closed,2,fix example which can't work on authenticate react tutorial
1293,2017-11-18 01:04:20.000000000,2018-01-23 21:30:43.000000000,closed,1,Support other languages for resolvers
1292,2017-11-17 23:22:57.000000000,2017-11-18 01:44:14.000000000,closed,4,Strange behavior with required/non-required fields
1291,2017-11-17 23:01:40.000000000,2017-11-17 23:53:24.000000000,closed,2,Port already used
1290,2017-11-17 16:28:37.000000000,2017-12-19 19:52:50.000000000,closed,2,NO RESOURCE FOUND
1289,2017-11-17 06:01:20.000000000,2017-12-08 15:25:19.000000000,closed,2,fix typo
1288,2017-11-17 04:24:37.000000000,2018-01-23 21:30:38.000000000,closed,4,Combined Nested Create/Nested Connect mutation losing existing node associations
1287,2017-11-17 00:37:35.000000000,2018-01-23 21:30:33.000000000,closed,0,Legacy functions still in use after migrating a project
1286,2017-11-16 19:17:17.000000000,2018-01-17 22:11:14.000000000,closed,0,Troubleshoot guide for local setup
1285,2017-11-16 18:29:27.000000000,2018-01-23 21:30:27.000000000,closed,8,Workflow for working with local and shared targets in a team
1284,2017-11-16 12:23:22.000000000,2018-01-23 21:30:22.000000000,closed,0,Alphabetize the right panel of Types in the console
1283,2017-11-15 21:28:17.000000000,2017-11-16 15:37:05.000000000,closed,1,Update 01-Overview.md
1282,2017-11-15 19:23:58.000000000,2017-11-15 19:50:50.000000000,closed,0,Attempted fix for InMemoryQueueTestKit
1281,2017-11-15 15:29:32.000000000,2017-12-19 15:44:01.000000000,closed,10,Disabling algolia integration
1280,2017-11-15 03:55:40.000000000,2018-01-02 02:19:12.000000000,closed,22,Improved API for nested mutations
1279,2017-11-14 22:36:46.000000000,1970-01-01 00:00:00.000000001,open,7,Support filtering on aggregated values
1278,2017-11-14 21:29:45.000000000,1970-01-01 00:00:00.000000001,open,27,"Set and modify id, createdAt, updatedAt in Create and Update mutations"
1277,2017-11-14 20:21:01.000000000,2017-12-19 12:41:27.000000000,closed,1,Feature request - line number
1276,2017-11-14 20:14:05.000000000,2017-11-14 20:26:20.000000000,closed,2,Error on simple create mutation
1275,2017-11-14 20:05:29.000000000,1970-01-01 00:00:00.000000001,open,32,Better support for scalar lists
1274,2017-11-14 19:56:17.000000000,2018-01-23 21:30:11.000000000,closed,5,Changing a scalar to a relation field results in None.get
1273,2017-11-14 19:35:11.000000000,2018-01-23 21:30:06.000000000,closed,3,Deploy does not deploy field name changes
1272,2017-11-14 16:22:53.000000000,1970-01-01 00:00:00.000000001,open,10,Add scalar field type `TIME`
1271,2017-11-14 15:49:30.000000000,2018-01-23 21:30:00.000000000,closed,0,`gc local up` doesn't create .graphcoolrc file on CircleCI
1270,2017-11-14 14:53:21.000000000,2018-01-23 21:29:55.000000000,closed,10,gc login doesn't work on CircleCI
1269,2017-11-14 07:02:42.000000000,2017-11-14 14:30:14.000000000,closed,1,Invalid OR condition in permissions example
1268,2017-11-14 05:57:56.000000000,2018-01-23 21:29:49.000000000,closed,0,opt:target not working when deploying to default target
1267,2017-11-14 01:50:31.000000000,2018-01-02 02:21:36.000000000,closed,10,Reference existing node by any unique field
1266,2017-11-13 23:10:25.000000000,2018-01-19 15:23:31.000000000,closed,3,[WIP] Detect invalid directives in the schema
1265,2017-11-13 19:50:32.000000000,2017-12-12 22:02:31.000000000,closed,11,Unable to use graphcool out of the box with local deployment
1264,2017-11-13 14:49:31.000000000,2017-11-24 14:49:17.000000000,closed,0,[WIP] Change Dependency Injection
1263,2017-11-13 14:41:40.000000000,1970-01-01 00:00:00.000000001,open,44,Database migrations
1262,2017-11-13 02:30:21.000000000,2018-03-01 18:52:13.000000000,closed,14,Cascading Deletes
1261,2017-11-12 22:22:31.000000000,2017-12-03 21:31:39.000000000,closed,1,Terminology update: Rename service (definition) to database (definition)
1260,2017-11-12 21:49:21.000000000,2018-01-19 14:45:21.000000000,closed,1,Improve messages from root-token
1259,2017-11-12 19:47:44.000000000,2018-01-23 21:29:44.000000000,closed,1,Incorrect outcome with `after` and non-unique `orderBy` values
1258,2017-11-12 14:53:54.000000000,2017-11-13 16:11:41.000000000,closed,4,"Windows 10 stuck in ""Waiting for Graphcool to initialize. This can take several minutes... /"""
1257,2017-11-12 10:07:43.000000000,2018-01-19 14:44:50.000000000,closed,2,[WIP] Add proxy support to CLI
1256,2017-11-12 07:47:31.000000000,2018-01-23 21:29:39.000000000,closed,0,Unify cluster behavior in CLI
1255,2017-11-12 07:40:37.000000000,2018-01-23 21:29:33.000000000,closed,0,Define authentication logic for `gc list`
1254,2017-11-12 07:32:03.000000000,2017-11-15 14:40:24.000000000,closed,1,No online authorization required for local cluster commands
1253,2017-11-12 06:31:37.000000000,2018-01-23 21:29:28.000000000,closed,0,Add command to manage clusters to CLI
1252,2017-11-12 06:27:21.000000000,2018-01-19 14:43:55.000000000,closed,1,List all local clusters on interactive deploy
1251,2017-11-12 05:17:41.000000000,2018-01-23 21:28:50.000000000,closed,1,Can't see function log output in cli
1250,2017-11-12 03:47:36.000000000,2017-11-15 14:31:50.000000000,closed,0,Remove temp folder after add-template
1249,2017-11-12 02:10:27.000000000,2018-01-23 21:28:45.000000000,closed,0,"`graphcool add-template` only merges dependencies, not devDependencies from package.json"
1248,2017-11-12 01:59:56.000000000,2018-01-19 14:42:28.000000000,closed,1,[WIP] Added validation for event payload
1247,2017-11-11 21:45:36.000000000,2017-12-08 15:23:46.000000000,closed,2,docs/auth: Remove --token flag
1246,2017-11-11 02:54:38.000000000,2017-11-11 02:59:56.000000000,closed,2,Feature request: `graphcool deploy` without updating functions
1245,2017-11-11 02:32:04.000000000,2018-01-23 21:28:38.000000000,closed,1,Update Database FAQs
1244,2017-11-11 01:19:00.000000000,2017-11-11 01:21:09.000000000,closed,1,`graphcool diff` does not work
1243,2017-11-11 00:56:41.000000000,2017-11-25 00:38:24.000000000,closed,0,[WIP] Upgraded schema to draft-06
1242,2017-11-11 00:17:03.000000000,2018-01-23 21:28:31.000000000,closed,0,Add `graphcool invoke` command to CLI
1241,2017-11-11 00:12:00.000000000,1970-01-01 00:00:00.000000001,open,1,docker swarm service deploy
1240,2017-11-11 00:06:35.000000000,2018-06-27 16:01:10.000000000,closed,0,Create JSON schema for event payload and add validation for `graphcool invoke-local`
1239,2017-11-10 18:12:21.000000000,2017-12-01 21:09:09.000000000,closed,0,Scaldi Refactoring
1238,2017-11-10 17:51:09.000000000,2017-11-27 01:36:21.000000000,closed,0,Speed up relay tests
1237,2017-11-10 16:02:47.000000000,1970-01-01 00:00:00.000000001,open,10,Declarative support for multi-field unique constraints
1236,2017-11-10 05:16:38.000000000,2018-01-23 21:28:24.000000000,closed,6,Framework debugging
1235,2017-11-10 04:28:19.000000000,2017-11-11 00:33:54.000000000,closed,7,"When invoking resolver using CLI, event.context is undefined"
1234,2017-11-09 23:24:21.000000000,2017-11-15 18:13:37.000000000,closed,0,Outdated docs links
1233,2017-11-09 23:19:06.000000000,2017-11-10 14:25:37.000000000,closed,0,Outdated docs links
1232,2017-11-09 23:13:05.000000000,2018-01-23 21:28:19.000000000,closed,3,"Ignore hidden folders when packaging (.git, .vscode etc.)"
1231,2017-11-09 23:08:36.000000000,2018-01-23 21:28:13.000000000,closed,7,None.get issue
1230,2017-11-09 18:41:17.000000000,2018-05-24 18:00:38.000000000,closed,15,Support existing MySQL Databases
1229,2017-11-09 18:32:54.000000000,2018-03-02 14:56:32.000000000,closed,2,Could not create serverless function for 'loggedInUser' - ONLY with --dry-run
1228,2017-11-09 16:16:48.000000000,1970-01-01 00:00:00.000000001,open,21,Expose user-defined directives in API schema
1227,2017-11-09 15:55:57.000000000,2017-11-10 14:53:55.000000000,closed,7,Fix Windows deployment paths
1226,2017-11-09 14:32:22.000000000,2017-11-10 05:15:01.000000000,closed,2,import _ from 'lodash' undefined
1225,2017-11-09 11:42:16.000000000,2018-01-23 21:28:01.000000000,closed,3,'No valid session' error when deploying with automate ci
1224,2017-11-09 09:19:27.000000000,2018-01-23 21:27:55.000000000,closed,0,Local cluster defined on different machine causes error instead of warning
1223,2017-11-09 09:17:42.000000000,2018-01-23 21:27:49.000000000,closed,0,Can't run `graphcool help` when cluster not found
1222,2017-11-09 07:32:14.000000000,2017-11-10 14:36:08.000000000,closed,3,Fix #1220
1221,2017-11-09 07:28:48.000000000,2018-01-23 21:27:44.000000000,closed,0,Unhandled error message when clusterSecret is wrong for local cluster
1220,2017-11-09 07:14:39.000000000,2017-11-09 14:20:12.000000000,closed,1,IP address may not be localhost
1219,2017-11-09 07:12:45.000000000,2018-01-19 14:40:35.000000000,closed,3,Warn for any existing files on init
1218,2017-11-09 06:24:52.000000000,2017-11-09 06:32:21.000000000,closed,1,Compile node_modules automatically
1217,2017-11-09 05:07:54.000000000,2017-11-09 14:26:44.000000000,closed,0,Fix typos in resolvers documentation
1216,2017-11-09 04:13:48.000000000,2017-11-09 14:28:00.000000000,closed,1,Fix error in Function Overview document
1215,2017-11-09 02:53:25.000000000,2018-01-23 21:27:39.000000000,closed,1,All CLI commands with `--target` parameter always warn when cluster not found
1214,2017-11-09 02:44:35.000000000,2017-11-15 18:14:55.000000000,closed,0,Updated protocol for local subscriptions endpoint
1213,2017-11-09 02:32:09.000000000,2017-11-10 14:31:11.000000000,closed,0,Added guard for delete local similar to console local
1212,2017-11-09 02:30:31.000000000,2018-01-19 14:39:40.000000000,closed,3,Added target env var to all commands
1211,2017-11-08 23:04:51.000000000,2018-01-23 21:27:33.000000000,closed,2,GRAPHCOOL_TARGET environment variable is not used as target in some CLI commands
1210,2017-11-08 19:54:55.000000000,2017-11-10 15:02:15.000000000,closed,0,Deleting a Model Used in a Relation
1209,2017-11-08 18:59:52.000000000,1970-01-01 00:00:00.000000001,open,4,Add tracing information
1208,2017-11-08 18:31:15.000000000,2017-11-08 19:37:13.000000000,closed,0,add metrics for sql mutactions and queries
1207,2017-11-08 13:13:50.000000000,2018-08-09 12:52:07.000000000,closed,2,Add documentation to run the server on dev mode
1206,2017-11-08 09:12:24.000000000,2018-01-23 21:27:26.000000000,closed,2,Easily change name of project after it's created
1205,2017-11-08 07:21:27.000000000,1970-01-01 00:00:00.000000001,open,5,Live Query support
1204,2017-11-08 01:38:48.000000000,2017-11-08 13:54:44.000000000,closed,1,Fixed one typo
1203,2017-11-08 00:47:00.000000000,2018-01-23 21:27:21.000000000,closed,2,Separate environment variables per function
1202,2017-11-07 23:12:52.000000000,2018-01-23 21:27:15.000000000,closed,0,Playground in browser doesn't support subscriptions for non-EU projects
1201,2017-11-07 23:09:30.000000000,2017-11-08 16:11:14.000000000,closed,0,Single server initialization fixes
1200,2017-11-07 23:08:01.000000000,2017-11-08 20:01:52.000000000,closed,0,[WIP] Return file path instead of file content in PermissionQuery not found message.
1199,2017-11-07 21:47:47.000000000,2017-11-07 21:56:16.000000000,closed,3,Authenticating doesn't work on Ubuntu Subsystem for Windows
1198,2017-11-07 21:36:45.000000000,2017-11-07 22:03:38.000000000,closed,5,Option to ignore certain files for bundling / deploying
1197,2017-11-07 21:18:51.000000000,2017-11-08 14:19:43.000000000,closed,1,Error 
1196,2017-11-07 20:44:38.000000000,2017-11-09 02:33:36.000000000,closed,5,`graphcool local up` hangs after upgrading docker images
1195,2017-11-07 20:43:00.000000000,2018-01-23 21:27:07.000000000,closed,1,`graphcool local up` upgrades docker images without asking
1194,2017-11-07 20:05:18.000000000,2017-11-07 21:00:46.000000000,closed,8,Docker error when running graphcool local up
1193,2017-11-07 19:09:22.000000000,2017-11-07 20:13:57.000000000,closed,0,Fix HTTP resolvers
1192,2017-11-07 15:02:34.000000000,2017-11-07 15:04:08.000000000,closed,1,Typo in tutorial DOCs fixed
1191,2017-11-07 14:57:44.000000000,2018-01-23 21:27:01.000000000,closed,2,Deploying root tokens with a too long name results in internal server error
1190,2017-11-07 14:47:24.000000000,2017-11-07 18:24:37.000000000,closed,1,update instructions for dry run
1188,2017-11-07 02:33:22.000000000,2017-11-07 14:38:45.000000000,closed,1,Subscription queries only support single field
1187,2017-11-06 23:02:02.000000000,1970-01-01 00:00:00.000000001,open,6,Extra endpoint with mock data
1186,2017-11-06 22:57:15.000000000,2017-11-10 22:12:59.000000000,closed,0,Explain additional step in migration flow from legacy projects
1185,2017-11-06 22:48:33.000000000,2018-01-23 21:26:56.000000000,closed,0,Document all characteristics of the Framework function runtime
1184,2017-11-06 22:40:56.000000000,2018-01-23 21:26:50.000000000,closed,1,Renaming a model used in a relation to a different case returns an incomprehensible error
1183,2017-11-06 21:28:47.000000000,2019-09-16 18:50:34.000000000,closed,15,Add Full-text search support
1182,2017-11-06 20:17:49.000000000,2017-11-09 21:17:43.000000000,closed,1,Add type to invalid name error message.
1181,2017-11-06 20:14:42.000000000,2018-05-24 17:59:07.000000000,closed,10,Database seeding
1180,2017-11-06 20:03:31.000000000,2017-11-08 16:11:38.000000000,closed,0,Fix flaky request pipeline behaviour
1179,2017-11-06 19:36:55.000000000,2017-11-13 17:44:52.000000000,closed,0,Rabbit-backed tests to in-memory-backed tests
1178,2017-11-06 19:06:43.000000000,2018-01-23 21:26:45.000000000,closed,0,Finish migration of former FAQ articles
1177,2017-11-06 18:36:18.000000000,2017-12-15 20:04:35.000000000,closed,3,Rename directive @isUnique to @unique
1176,2017-11-06 18:31:13.000000000,2017-11-06 18:31:20.000000000,closed,0,remove tail shortcut
1175,2017-11-06 17:48:50.000000000,2017-11-06 19:31:27.000000000,closed,0,Fix Field With Id Not Found
1174,2017-11-06 15:47:10.000000000,2017-11-06 17:28:46.000000000,closed,0,Lazify single server deps
1173,2017-11-06 15:25:26.000000000,2017-11-06 19:16:08.000000000,closed,0,Allow shortcut for webhook url definition if no headers are present
1172,2017-11-06 15:00:03.000000000,2017-11-10 14:38:06.000000000,closed,0,update playground html snippet
1171,2017-11-06 12:27:37.000000000,2018-01-23 21:26:40.000000000,closed,5,Problems when changing the cardinality of a relationship
1170,2017-11-06 09:22:47.000000000,2018-01-23 21:26:34.000000000,closed,0,Environment variables not passed to webhooks
1169,2017-11-06 08:57:01.000000000,2017-11-15 18:14:55.000000000,closed,0,Incorrect subscription endpoint in function context for local cluster
1168,2017-11-06 08:54:51.000000000,2018-01-23 21:26:28.000000000,closed,0,Support passing hostname when deploying
1167,2017-11-05 17:59:54.000000000,2018-01-18 11:12:27.000000000,closed,4,Fix full example signup error caused by no name provided
1166,2017-11-05 14:29:13.000000000,2017-12-19 19:47:22.000000000,closed,3,Bug cannot return non null for non-nullable type
1165,2017-11-05 00:04:31.000000000,2017-11-06 15:00:36.000000000,closed,1,Update 04-Subscriptions.md to use updated filter terminology
1164,2017-11-04 19:55:01.000000000,2018-01-23 21:26:22.000000000,closed,0,_typesMeta filter should have a count filter
1163,2017-11-04 19:48:45.000000000,2018-01-23 21:26:17.000000000,closed,1,Alternative solution for filtering by relations
1162,2017-11-04 09:00:58.000000000,2018-01-23 21:26:12.000000000,closed,0,graphcool deploy --watch not work
1161,2017-11-04 03:59:03.000000000,2017-11-05 15:05:10.000000000,closed,1,Better error message when omitting required type for createdAt/updateAt
1160,2017-11-04 03:37:08.000000000,2018-01-22 15:21:04.000000000,closed,25,Embedded types
1159,2017-11-04 03:17:23.000000000,2017-11-04 04:08:04.000000000,closed,0,Unify bindings for rabbits
1158,2017-11-04 02:46:34.000000000,2018-01-23 21:26:06.000000000,closed,2,Update email-password template in permissions example
1157,2017-11-04 00:18:46.000000000,2017-11-04 00:34:06.000000000,closed,0,Adjust message bus bindings for prod
1156,2017-11-04 00:07:21.000000000,2017-11-06 15:37:13.000000000,closed,1,Reserved word in a field of the model
1155,2017-11-03 22:47:20.000000000,2017-11-04 04:37:45.000000000,closed,0,SimpleHttpClient cleanup
1154,2017-11-03 21:59:59.000000000,2017-12-08 18:01:45.000000000,closed,3,Heavy logging results in Internal Server Error
1153,2017-11-03 21:48:23.000000000,2017-11-10 14:29:41.000000000,closed,2,"allow function to return anything, even nothing in local mode"
1152,2017-11-03 21:37:28.000000000,2018-01-22 19:50:42.000000000,closed,4,"Intermittent ""io.netty.channel.ChannelException"" when deploying"
1151,2017-11-03 21:23:00.000000000,2017-11-03 21:48:45.000000000,closed,4,"""SyntaxError: Unexpected token {"" in legacy function"
1150,2017-11-03 20:53:45.000000000,2017-11-03 22:28:11.000000000,closed,2,Function fired by create subscription having trouble referencing created node in subsequent API call
1149,2017-11-03 20:38:53.000000000,2017-11-03 21:21:27.000000000,closed,0,Change Buildkite pipeline behaviour
1148,2017-11-03 20:31:24.000000000,2018-01-18 15:10:24.000000000,closed,4,Explain wildcard permissions in reference
1147,2017-11-03 19:57:59.000000000,2017-11-03 20:01:00.000000000,closed,2,Access Relay API in built-in Console Playground
1146,2017-11-03 19:02:38.000000000,2018-01-22 20:51:34.000000000,closed,0,Add section to reference docs (Data Modelling) about which features are not supported:
1145,2017-11-03 17:59:58.000000000,2018-01-23 21:26:01.000000000,closed,2,Can't create record with required relation in data browser
1144,2017-11-03 17:50:32.000000000,2017-11-08 21:41:58.000000000,closed,0,Refactor tests
1143,2017-11-03 17:46:17.000000000,2017-11-03 18:27:47.000000000,closed,0,Make ramdisk script executable
1142,2017-11-03 17:40:46.000000000,2018-01-22 19:49:38.000000000,closed,0,System types and fields are not described accurately
1141,2017-11-03 17:39:04.000000000,2017-11-03 17:43:37.000000000,closed,1,Fix link in Schema Mapping reference
1140,2017-11-03 17:17:39.000000000,2017-11-03 18:13:11.000000000,closed,1,Fix links in Data Modelling reference
1139,2017-11-03 14:04:47.000000000,2018-06-27 16:00:35.000000000,closed,0,"When initial deploy contains issues, service is still created"
1138,2017-11-03 13:49:36.000000000,2017-11-03 17:25:24.000000000,closed,0,Introduce specific error if resolver definition contains unnecessary brackets
