id,created_at,closed_at,state,comments,title
2460,2018-05-18 05:06:16.000000000,1970-01-01 00:00:00.000000001,open,4,SQLite connector
2459,2018-05-18 03:43:28.000000000,2018-06-04 20:16:48.000000000,closed,1,Upsert creates nodes without using connect field
2458,2018-05-18 00:05:56.000000000,1970-01-01 00:00:00.000000001,open,1,Informix Connector
2457,2018-05-17 22:02:43.000000000,2018-06-20 20:16:00.000000000,closed,4,Nested `where` fails with PostgresSQL
2456,2018-05-17 19:42:35.000000000,2018-05-18 13:02:47.000000000,closed,1,Unable to Modify Workspace Settings
2455,2018-05-17 18:15:38.000000000,2018-07-05 13:34:05.000000000,closed,2,Querying root `node` returns an incorrect type name
2454,2018-05-17 17:46:18.000000000,2019-02-13 13:37:42.000000000,closed,2,fix typo
2453,2018-05-17 17:23:08.000000000,1970-01-01 00:00:00.000000001,open,2,add deprecation warning for disableAuth
2452,2018-05-17 17:10:35.000000000,2019-02-13 13:37:27.000000000,closed,2,fix typo
2451,2018-05-17 16:33:53.000000000,1970-01-01 00:00:00.000000001,open,5,Support for Vitess
2450,2018-05-17 15:47:16.000000000,2018-05-18 21:36:59.000000000,closed,3,Fix links to graphql-binding docs
2449,2018-05-17 06:38:05.000000000,2019-02-13 13:36:52.000000000,closed,3,Add missing file to graphql-yoga project tree
2448,2018-05-17 02:19:35.000000000,2018-06-29 22:46:41.000000000,closed,2,blog.prisma.io doesn't redirect to prisma.io/blog
2447,2018-05-17 01:38:28.000000000,2018-07-05 13:35:00.000000000,closed,3,Create postgres data with PK as UUID
2446,2018-05-16 17:34:55.000000000,2018-05-17 15:56:51.000000000,closed,1,[WIP] Rework schema inferrer
2445,2018-05-16 16:22:05.000000000,2018-05-16 16:41:40.000000000,closed,1,Update some social links
2444,2018-05-16 15:53:53.000000000,2018-07-05 13:36:06.000000000,closed,5,Pagination ERROR
2443,2018-05-16 12:16:12.000000000,2018-05-16 12:26:21.000000000,closed,1,Remove --project from post-hook command
2442,2018-05-15 23:17:32.000000000,1970-01-01 00:00:00.000000001,open,1,Google BigQuery connector
2441,2018-05-15 22:05:25.000000000,2018-05-15 23:15:59.000000000,closed,2,fix typo
2440,2018-05-15 20:23:37.000000000,2018-05-22 20:54:12.000000000,closed,2,Update 01-Build-a-GraphQL-Server-with-Prisma.md
2439,2018-05-15 20:03:32.000000000,2018-05-17 13:33:33.000000000,closed,0,remove assumption for name of id column
2438,2018-05-15 18:56:31.000000000,2018-06-04 20:19:15.000000000,closed,1,Relation with no back-reference failing on deploy
2437,2018-05-15 18:35:02.000000000,2018-06-26 17:49:54.000000000,closed,14,Problems with Travis + Prisma ^1.7.x
2436,2018-05-15 18:31:27.000000000,2018-06-01 17:35:42.000000000,closed,6,Problem with graphql codegen
2435,2018-05-15 16:31:01.000000000,2018-09-28 14:09:05.000000000,closed,2,fix file name for subscription example
2434,2018-05-15 16:01:22.000000000,2019-02-13 13:36:29.000000000,closed,2,Update 01-MySQL.md
2433,2018-05-15 15:44:01.000000000,1970-01-01 00:00:00.000000001,open,1,A new constraint for migration
2432,2018-05-15 15:24:40.000000000,2018-05-18 13:13:41.000000000,closed,10,Subscriptions are not working
2431,2018-05-15 13:37:28.000000000,2018-06-04 12:06:10.000000000,closed,5,Prisma examples - phase 2
2430,2018-05-15 12:40:05.000000000,2018-05-15 13:11:13.000000000,closed,0,Add test cases 
2429,2018-05-15 10:29:52.000000000,2018-05-26 14:58:45.000000000,closed,3,Alias fields return null from the application schema
2428,2018-05-15 05:29:37.000000000,2019-02-13 13:36:11.000000000,closed,3,corrected step numbers in react tutorial
2427,2018-05-15 02:34:20.000000000,2018-07-07 12:59:52.000000000,closed,2,Better documentation for Relay support
2426,2018-05-15 00:59:28.000000000,2018-08-31 11:30:03.000000000,closed,10,Updating unique strings to null seems to result in an internal server error
2425,2018-05-14 22:42:52.000000000,2018-05-14 22:58:28.000000000,closed,0,"Update the diagram, add some hearts"
2424,2018-05-14 21:50:06.000000000,2018-05-14 21:53:52.000000000,closed,0,Update Prisma logo
2423,2018-05-14 20:16:18.000000000,2018-05-14 21:13:32.000000000,closed,0,cleanup directives for passive postgres
2422,2018-05-14 18:39:01.000000000,2018-05-15 01:50:49.000000000,closed,1,Prisma examples
2421,2018-05-14 16:13:57.000000000,2018-05-14 16:15:10.000000000,closed,3,Small doc fixes
2420,2018-05-14 14:57:25.000000000,2018-05-14 15:35:25.000000000,closed,1,1.8.3 fixes
2419,2018-05-14 13:39:07.000000000,2018-05-16 18:51:37.000000000,closed,8,Prisma deploy 'Ask timed out on [Actor[akka://single-server/user/$m#1622560585]] after [300000 ms]'
2418,2018-05-14 13:11:37.000000000,2018-05-14 15:57:32.000000000,closed,1,bring back ignored tests
2417,2018-05-14 12:05:32.000000000,2018-05-14 13:43:20.000000000,closed,0,Do not reject unique constraint due to multiple null values
2416,2018-05-14 09:56:36.000000000,2018-05-24 19:23:54.000000000,closed,2,need an example of using prisma v1.8 to connect to one existed database
2415,2018-05-14 09:04:51.000000000,2018-05-15 04:02:13.000000000,closed,4,@unique directive for the user-defined type breaks the server
2414,2018-05-14 00:55:13.000000000,2018-05-24 19:19:01.000000000,closed,5,Prisma Restart Loop
2413,2018-05-14 00:48:02.000000000,2018-08-16 19:07:20.000000000,closed,4,"prisma init should not ask for existing schema when choosing ""no existing data"""
2412,2018-05-14 00:10:27.000000000,1970-01-01 00:00:00.000000001,open,3,Support SQL views
2411,2018-05-13 20:34:34.000000000,2018-05-14 19:53:31.000000000,closed,1,Airbnb Example Seeding does not work
2410,2018-05-13 19:26:20.000000000,2018-05-13 19:31:07.000000000,closed,1,Change Postgres connector to catch PSQL exceptions
2409,2018-05-13 18:34:59.000000000,2018-05-13 19:39:09.000000000,closed,1,Check that the defaultValue on enum fields is a proper enum value
2408,2018-05-13 15:47:05.000000000,2018-05-13 16:33:45.000000000,closed,0,Make sure to use the Postgres Profile in the Postgres Connector
2407,2018-05-13 04:41:37.000000000,2018-07-21 00:06:58.000000000,closed,4,Specified schema in cli not picked up
2406,2018-05-12 23:23:35.000000000,2018-07-07 14:00:00.000000000,closed,8,Prisma init doesn't seem to work?
2405,2018-05-12 21:24:18.000000000,2018-05-13 12:14:31.000000000,closed,2,Prisma deploy to local cluster error
2403,2018-05-12 11:36:05.000000000,2018-05-13 14:17:04.000000000,closed,2,Make prismagraphql/prisma image Dockerfile public
2402,2018-05-11 22:13:45.000000000,2018-08-31 11:29:56.000000000,closed,7,Postgres: schema name ignored during prisma init
2401,2018-05-11 17:50:03.000000000,2018-05-11 17:53:30.000000000,closed,0,remove --b flag from init command's usage string
2400,2018-05-11 17:42:03.000000000,2018-05-12 16:03:57.000000000,closed,22,prisma deploy times out
2399,2018-05-11 15:55:33.000000000,2018-05-11 19:22:38.000000000,closed,3,Issue with Prisma binding
2398,2018-05-11 14:16:43.000000000,2018-06-27 17:49:46.000000000,closed,7,Latest releases 1.8.1 and 1.8.2 not available on NPM
2397,2018-05-11 04:17:58.000000000,2018-05-14 21:07:36.000000000,closed,6,Unable to deploy new service to cluster for Prisma
2396,2018-05-10 22:53:36.000000000,2018-05-13 16:33:45.000000000,closed,4,Unable to deploy using postgres connector
2395,2018-05-10 13:34:49.000000000,2018-05-13 01:22:45.000000000,closed,2,"""Project not found"" when seeding on deploy or running prisma seed"
2394,2018-05-10 12:31:29.000000000,2018-06-19 18:45:08.000000000,closed,10,Unable to connect to remote Postgres DB with ssl=true
2393,2018-05-10 06:12:38.000000000,2018-05-10 11:06:21.000000000,closed,1,Update CONTRIBUTING.md
2392,2018-05-09 18:56:22.000000000,2018-05-14 12:36:19.000000000,closed,1,Enable more tests to use inline relations
2391,2018-05-09 17:48:00.000000000,2018-05-09 18:49:44.000000000,closed,0,Reintroduce /cluster for backwards compatibility
2390,2018-05-09 17:12:48.000000000,2018-06-13 12:48:45.000000000,closed,3,"""Workspace dev does not exist"" when deleting service from demo server"
2389,2018-05-09 16:15:03.000000000,2018-05-14 12:20:26.000000000,closed,0,Add testing and fixes for Deploy edge cases
2388,2018-05-09 14:00:38.000000000,2018-05-09 16:56:47.000000000,closed,2,"Project ""Not Found"" and ""found"" alternatively in Playground"
2387,2018-05-09 13:35:37.000000000,2018-07-07 15:00:03.000000000,closed,2,Example for environment variable usage in prisma.yml
2386,2018-05-09 13:21:47.000000000,2018-07-07 15:00:05.000000000,closed,3,Postgres introspection of pluralised column names results in pluralised types and double pluralised relations [1.8 ]
2385,2018-05-09 13:18:37.000000000,2018-05-09 16:33:45.000000000,closed,1,Enable passive tests
2384,2018-05-09 12:41:13.000000000,2018-06-04 20:20:43.000000000,closed,2,not able to run prisma deploy after upgrading to v1.8 with aws fargate mysql cluster
2383,2018-05-09 02:28:40.000000000,2018-07-07 15:00:04.000000000,closed,2,"error with v1.8 with postgres connector: `database ""prisma"" already exists`"
2382,2018-05-08 23:29:26.000000000,2018-05-09 01:37:18.000000000,closed,1,Update 03-Upgrade-to-1.8.md
2381,2018-05-08 21:54:55.000000000,2018-05-08 21:58:02.000000000,closed,2,Update 02-MySQL.md
2380,2018-05-08 19:48:50.000000000,2019-01-01 15:16:06.000000000,closed,13,"Document ""Bind for 0.0.0.0:4466 failed: port is already allocated"" error + solution"
2379,2018-05-08 19:23:22.000000000,2018-06-27 17:10:41.000000000,closed,7,Can't deploy services with names starting with a digit
2378,2018-05-08 18:45:21.000000000,2018-05-08 19:09:24.000000000,closed,1,CLI: post-deploy hooks doesn't show errors
2377,2018-05-08 16:49:32.000000000,1970-01-01 00:00:00.000000001,open,15,Limitations when connecting an existing Postgres database
2376,2018-05-08 14:01:13.000000000,2018-06-05 20:15:57.000000000,closed,0,Introduce a retry period when deploying to wait for a newly booted Prisma server
2375,2018-05-08 13:48:12.000000000,2018-05-10 19:43:05.000000000,closed,0,CLI: Use volume for databases in generated docker-compose
2374,2018-05-08 13:00:37.000000000,2018-05-08 13:07:28.000000000,closed,0,Backwards compatible clusterInfo
2373,2018-05-08 11:38:13.000000000,1970-01-01 00:00:00.000000001,open,3,CLI should offer a hint to remove @rename after Deploy
2372,2018-05-08 10:52:40.000000000,2018-11-21 21:19:13.000000000,closed,5,Cannot import large scale of lists data
2371,2018-05-07 20:15:17.000000000,2018-05-08 19:05:08.000000000,closed,1,Detect when setting a unique constraint is not possible
2370,2018-05-07 19:48:35.000000000,2018-05-08 13:03:27.000000000,closed,1,enable passive postgres tests
2369,2018-05-07 17:49:07.000000000,2018-05-16 13:14:21.000000000,closed,1,Bring the CLI readme up to date with Prisma readme
2368,2018-05-07 17:45:55.000000000,2018-05-07 17:50:20.000000000,closed,0,Make raise_exception function schema specific
2367,2018-05-07 15:23:25.000000000,2018-05-07 15:24:28.000000000,closed,0,Update introspection sdl
2366,2018-05-07 15:13:00.000000000,2018-05-07 17:19:12.000000000,closed,0,server configuration: `migrations` should default to true
2365,2018-05-07 14:25:13.000000000,2018-05-07 15:22:03.000000000,closed,2,docs: sync docker-compose.yml example in docker/upgrade guide to 1.7
2364,2018-05-07 10:23:36.000000000,2018-06-27 17:46:35.000000000,closed,2,prisma deploy should extract docker-compose.yml to assist 1.7 migration
2363,2018-05-07 03:35:53.000000000,2018-11-05 17:23:43.000000000,closed,8,Slow Performance of Connection Aggregate Queries
2362,2018-05-06 19:46:18.000000000,2018-06-05 21:20:41.000000000,closed,3,Errors from post deployment hooks are swallowed and execution continues
2361,2018-05-06 17:14:00.000000000,2018-07-07 13:59:59.000000000,closed,1,Delete mutations trigger update subscriptions when using variables
2360,2018-05-06 15:45:31.000000000,2018-05-07 15:08:04.000000000,closed,1,Passive deploy connector
2359,2018-05-05 18:44:02.000000000,2018-05-06 14:05:13.000000000,closed,1,Fixes for Postgres Connector
2358,2018-05-05 16:56:02.000000000,2018-10-16 16:03:00.000000000,closed,4,You are able to add fields of type ID
2357,2018-05-05 16:15:59.000000000,2018-07-07 15:00:01.000000000,closed,1,Document ~/.prisma/config.yml in upgrade guide to 1.7.x
2356,2018-05-05 16:15:17.000000000,2018-08-14 19:24:57.000000000,closed,2,Don't read cluster information from ~/.prisma/config.yml anymore
2355,2018-05-05 16:11:58.000000000,2018-07-17 11:06:45.000000000,closed,2,"""Cluster undefined does not exist"" when deploying pre 1.7.x prisma.yml with unknown cluster"
2354,2018-05-05 16:01:17.000000000,2018-07-06 17:46:02.000000000,closed,4,"""prisma deploy -n"" does not migrate pre 1.7.x prisma.yml file"
2353,2018-05-05 15:31:17.000000000,2018-05-05 15:56:15.000000000,closed,0,Update 01-Overview.md - Fix Typo
2352,2018-05-05 13:25:34.000000000,2018-05-06 12:41:29.000000000,closed,0,fix typo
2351,2018-05-05 08:08:10.000000000,2018-05-07 17:50:19.000000000,closed,16,PSQLException function raise_exception(character varying) does not exist
2350,2018-05-05 02:42:04.000000000,2018-05-05 13:18:42.000000000,closed,2,Update 02-YAML-Structure.md
2349,2018-05-04 21:40:44.000000000,2018-07-05 13:57:11.000000000,closed,2,sbt build error 
2348,2018-05-04 20:06:49.000000000,2019-01-19 13:36:44.000000000,closed,1,Support database introspection for all databases
2347,2018-05-04 19:03:31.000000000,1970-01-01 00:00:00.000000001,open,9,Also return relational data in delete mutations
2346,2018-05-04 18:26:45.000000000,2018-07-07 14:59:59.000000000,closed,1,Idea: Formalise a database structure representation (DSR)
2345,2018-05-04 17:58:02.000000000,1970-01-01 00:00:00.000000001,open,4,Support database migrations for existing databases
2344,2018-05-04 17:48:01.000000000,2018-05-07 17:22:53.000000000,closed,0,rename Prisma database configuration value `active` to `migrations`
2343,2018-05-04 16:15:50.000000000,2018-05-07 13:02:40.000000000,closed,3,Local cluster does not start after upgrade to 1.7
2342,2018-05-04 12:26:41.000000000,2018-07-07 13:59:52.000000000,closed,11,prisma deploy --force flag seems to have no effect
2341,2018-05-04 07:01:27.000000000,2018-05-04 11:52:06.000000000,closed,3,where can I find the changelog of different versions?
2340,2018-05-04 06:46:59.000000000,2018-05-05 19:36:38.000000000,closed,3,Use endpoint as url if exists.
2339,2018-05-04 06:20:01.000000000,2018-05-05 19:36:38.000000000,closed,2,playground always goto http://localhost:4466/undefined/dev 
2338,2018-05-04 06:12:17.000000000,2018-05-04 11:49:27.000000000,closed,2,Update the cli CONTRIBUTING.md
2337,2018-05-03 21:17:56.000000000,2018-05-07 16:55:44.000000000,closed,1,[WIP] Passive Postgres Connector
2336,2018-05-03 20:54:56.000000000,2018-06-27 17:37:12.000000000,closed,3,Add flag that adds .graphqlconfig.yml for prisma init
2335,2018-05-03 20:50:50.000000000,2018-07-06 17:43:19.000000000,closed,2,""".graphqlconfig"" file is not available in the provided config directory"
2334,2018-05-03 20:10:23.000000000,2018-05-06 12:40:03.000000000,closed,3,Add validations and extra warnings to deploy when updating relations
2333,2018-05-03 19:52:29.000000000,2018-10-02 12:41:30.000000000,closed,11,Subscriptions with updatedFields_contains filter are not triggered
2332,2018-05-03 17:29:17.000000000,2018-11-18 16:00:09.000000000,closed,3,"""Deadlock found when trying to get lock"" for deleteMany mutations"
2331,2018-05-03 15:04:50.000000000,1970-01-01 00:00:00.000000001,open,0,configuration option to expose management API on separate port
2330,2018-05-03 13:27:00.000000000,2018-05-03 15:51:46.000000000,closed,1,Connect to an external Mysql database with prisma 1.7
2329,2018-05-03 13:03:40.000000000,2018-05-06 12:29:35.000000000,closed,0,Validate that all enums have unique names
2328,2018-05-03 12:58:44.000000000,2018-05-03 21:18:10.000000000,closed,1,[WIP] Passive Postgres Connector
2327,2018-05-03 12:31:15.000000000,1970-01-01 00:00:00.000000001,open,3,Fire subscription events for batch mutations
2326,2018-05-03 12:23:33.000000000,2018-07-07 14:59:58.000000000,closed,1,"""TypeError ... is not a legal HTTP header value"" on prisma init"
2325,2018-05-03 12:00:00.000000000,2018-06-11 11:19:35.000000000,closed,3,Prisma 1.7.4 delete broken
2324,2018-05-02 23:00:37.000000000,2018-05-03 12:31:56.000000000,closed,3,Subscription not firing on where condition change
2323,2018-05-02 20:35:44.000000000,2019-05-06 14:38:48.000000000,closed,27,Use sensible migration values for existing nodes when adding required fields
2322,2018-05-02 18:38:08.000000000,2018-05-09 21:44:58.000000000,closed,2,Prisma Data Export & Import Issue
2321,2018-05-02 13:37:14.000000000,2018-05-06 12:28:18.000000000,closed,1,Prisma logging changes
2320,2018-05-02 13:30:48.000000000,2018-05-02 15:23:12.000000000,closed,0,19 - Incoming
2319,2018-05-02 04:59:34.000000000,2018-05-02 12:12:56.000000000,closed,1,orderBy should be an array of OrderByInput enums
2318,2018-05-01 02:13:36.000000000,2018-05-06 14:07:37.000000000,closed,2,Update Upsert Docs re Nested Mutation Functionality
2317,2018-05-01 01:57:58.000000000,2018-05-01 12:37:21.000000000,closed,1,[1.7.3] The provided query doesn't include any known model name
2316,2018-04-30 21:58:33.000000000,2018-04-30 22:37:02.000000000,closed,2,Authentication token is invalid: Token can't be decoded: Expected token [null] to be composed of 2 or 3 parts separated by dots.
2315,2018-04-30 20:22:20.000000000,1970-01-01 00:00:00.000000001,open,7,Initializing Prisma + Database at once might result in undefined behaviour
2314,2018-04-30 19:49:20.000000000,2018-08-19 13:32:19.000000000,closed,1,Outdated resources (docs & tutorials)
2313,2018-04-30 19:40:30.000000000,2019-01-10 00:15:28.000000000,closed,2,`prisma list` should show all services (connected servers + cloud)
2312,2018-04-30 18:59:28.000000000,2018-08-08 13:05:58.000000000,closed,5,Document docker/docker-compose workflows for deprecated local commands
2311,2018-04-30 16:36:34.000000000,2018-04-30 17:23:34.000000000,closed,1,Add documentation about post deployment hooks
2310,2018-04-30 15:56:27.000000000,2018-05-15 03:46:37.000000000,closed,10,"""prisma login --key __MY_TOKEN__"" still needs a browser"
2309,2018-04-30 14:34:55.000000000,2018-08-12 06:07:11.000000000,closed,5,Unable to delete service
2308,2018-04-30 12:59:04.000000000,2019-01-23 17:35:56.000000000,closed,12,handle node 6 gracefully
2307,2018-04-29 21:11:06.000000000,2018-11-01 17:27:40.000000000,closed,3,Remove nested relation operations from the Schema for Upsert
2306,2018-04-29 16:53:33.000000000,2019-04-17 17:13:02.000000000,closed,10,Ability to disable hooks for an environment
2305,2018-04-29 16:28:14.000000000,2018-04-30 22:35:14.000000000,closed,3,"Prisma creates an assumption about what's ""local"""
2304,2018-04-29 15:10:25.000000000,2018-05-06 12:43:16.000000000,closed,2,[doc] correct managementApiSecret placing
2303,2018-04-29 14:27:20.000000000,2018-06-11 11:20:03.000000000,closed,2,Prisma delete requires authentication to Prisma cloud
2302,2018-04-29 09:54:38.000000000,2018-04-30 20:35:53.000000000,closed,5,Document alternative to prisma local nuke for 1.7
2301,2018-04-29 01:05:08.000000000,2018-05-04 11:28:30.000000000,closed,1,After Upgrade to 1.7.2 Prisma Deploy Fail
2300,2018-04-28 15:44:29.000000000,2018-05-24 18:57:00.000000000,closed,3,best way to add 1 on a update mutaion
2299,2018-04-28 01:44:01.000000000,2018-04-30 18:04:26.000000000,closed,1,Cluster Deploy mutation reset project secret (1.6)
2298,2018-04-27 21:25:43.000000000,2018-07-20 08:30:14.000000000,closed,4,Postgres: Could not send Query(connection dead) from Psequel
2297,2018-04-27 16:33:05.000000000,2018-04-30 20:39:44.000000000,closed,10,How do we get generated files I.e prisma.graphql & prisma.ts - post 1.7
2296,2018-04-27 15:10:26.000000000,2018-07-07 13:59:58.000000000,closed,2,"Subscription where clause still not working, it seems."
2295,2018-04-27 13:27:50.000000000,1970-01-01 00:00:00.000000001,open,2,Use environment variable for `managementApiSecret`
2294,2018-04-27 12:58:35.000000000,2018-06-19 13:34:54.000000000,closed,4,`prisma init --help` shows outdated info
2293,2018-04-27 01:50:27.000000000,2018-06-27 14:47:53.000000000,closed,3,Issues configuring AWS Fargate with Prisma 1.7.1
2292,2018-04-26 22:54:14.000000000,2018-05-06 12:47:49.000000000,closed,0,add reference to invalid prisma.yml solution
2291,2018-04-26 22:31:10.000000000,2018-04-26 22:52:07.000000000,closed,0,Fix quoting for db users and passwords across connectors
2290,2018-04-26 22:17:45.000000000,2018-04-26 22:52:07.000000000,closed,0,DB passwords with some special chars causes server crash
2289,2018-04-26 16:32:44.000000000,2018-05-01 13:31:08.000000000,closed,9,"It is impossible to produce ""prisma deploy"" on your server"
2288,2018-04-26 16:31:24.000000000,2018-07-07 14:59:52.000000000,closed,1,Explain difference between different secrets
2287,2018-04-26 15:38:06.000000000,2018-06-27 17:13:19.000000000,closed,7,"""Syntax Error: Expected Name, found }"" for graphql prepare with project setup"
2286,2018-04-26 15:35:35.000000000,1970-01-01 00:00:00.000000001,open,0,Deploy without local Prisma configuration file
2285,2018-04-26 15:30:14.000000000,2018-06-29 12:25:44.000000000,closed,1,`db persistance` key value blank?
2284,2018-04-26 15:24:49.000000000,2018-04-27 16:15:56.000000000,closed,1,schema download doesn't always works
2283,2018-04-26 15:17:44.000000000,2018-04-26 16:23:49.000000000,closed,5,Require authentication on Prisma server
2282,2018-04-26 14:49:34.000000000,2018-04-26 15:09:23.000000000,closed,1,Grammar line 245
2281,2018-04-26 14:40:50.000000000,2018-04-26 15:56:24.000000000,closed,1,rookie friendly edit
2280,2018-04-26 13:08:49.000000000,2018-08-08 12:56:58.000000000,closed,3,"Document requirements to ""id"" field for data import"
2279,2018-04-26 12:55:36.000000000,2018-04-26 12:57:34.000000000,closed,1,add general upgrade notes
2278,2018-04-26 11:43:31.000000000,2018-07-07 14:59:56.000000000,closed,13,Having issues setting up graphql playground for 1.7.1
2277,2018-04-26 08:34:58.000000000,2018-04-26 18:36:23.000000000,closed,7,Subscriptions with where filter don't work
2276,2018-04-26 05:58:24.000000000,2018-04-26 12:35:34.000000000,closed,7,prisma init boilerplate seem not working
2275,2018-04-25 23:35:28.000000000,2018-05-13 16:08:23.000000000,closed,1,updatedAt field is not updated
2274,2018-04-25 21:56:58.000000000,2018-04-25 21:57:51.000000000,closed,1,Unable to update private cluster to v1.7.1
2273,2018-04-25 21:53:35.000000000,2018-06-11 11:20:15.000000000,closed,16,Could not connect to cluster `local` if `~/.prisma/config.yml` does not exist or is empty
2272,2018-04-25 21:26:48.000000000,2018-04-27 16:00:48.000000000,closed,0,PostgreSQL connector fixes & cleanup
2271,2018-04-25 21:04:53.000000000,2018-07-17 11:04:45.000000000,closed,5,Unable to deploy when using `managementApiSecret`
2270,2018-04-25 20:37:21.000000000,2018-04-27 16:00:48.000000000,closed,1,Postgres connector can't connect with non-default user
2269,2018-04-25 20:10:28.000000000,2018-06-05 20:15:57.000000000,closed,1,"Add --env-file parameter to ""prisma seed"""
2268,2018-04-25 19:35:26.000000000,2018-04-26 16:43:35.000000000,closed,17,"How to pass a valid token to ""graphql get-schema""?"
2267,2018-04-25 18:20:05.000000000,2018-05-02 17:13:52.000000000,closed,7,Prisma deploy don't show error when token is invalid.
2266,2018-04-25 18:07:51.000000000,2018-04-25 18:44:19.000000000,closed,4,PRISMA_MANAGEMENT_API_SECRET not working at 1.7
2265,2018-04-25 17:36:17.000000000,2018-04-25 17:57:04.000000000,closed,0,try to use tmpfs on ci
2264,2018-04-25 16:36:13.000000000,2018-04-26 13:15:26.000000000,closed,3,Can't change default port for server
2263,2018-04-25 15:55:05.000000000,2018-05-03 12:43:16.000000000,closed,11,docker-compose.yml Reserved character '@' is not allowed outside quotes
2262,2018-04-25 15:36:07.000000000,1970-01-01 00:00:00.000000001,open,2,.env Variable Expansion
2261,2018-04-25 13:32:53.000000000,1970-01-01 00:00:00.000000001,open,1,update wording
2260,2018-04-25 12:52:49.000000000,2018-05-22 13:15:17.000000000,closed,2,add tags to ignore some tests for specific connectors
2259,2018-04-25 12:46:41.000000000,2018-04-25 15:02:17.000000000,closed,5,Cannot bootstrap a simple project
2258,2018-04-25 12:45:29.000000000,2018-06-05 20:15:57.000000000,closed,0,"Running ""prisma account"" when not logged in should not open browser to authenticate"
2257,2018-04-25 07:14:09.000000000,2018-04-25 11:31:00.000000000,closed,2,[Docs] Fix to PRISMA_CONFIG environment at docker-compose.yml example
2256,2018-04-25 05:10:36.000000000,2018-07-02 18:14:02.000000000,closed,6,Prompt for database name when connecting to existing DB
2255,2018-04-25 01:03:56.000000000,2018-04-25 12:15:24.000000000,closed,5,docker-compose.yml invalid type for upgrade to 1.7
2254,2018-04-24 22:01:47.000000000,2018-05-07 15:50:22.000000000,closed,1,Rename internal database to prisma
2253,2018-04-24 18:19:45.000000000,2018-04-24 18:47:17.000000000,closed,1,Prisma telemetry
2252,2018-04-24 18:16:13.000000000,1970-01-01 00:00:00.000000001,open,1,.env Variable Expansion
2251,2018-04-24 14:49:33.000000000,2018-05-07 15:51:28.000000000,closed,0,Rename cluster to management
2250,2018-04-24 03:23:01.000000000,2018-04-25 21:40:38.000000000,closed,7,Server Side Subscription webhook to localhost
2249,2018-04-23 17:58:04.000000000,2018-12-02 13:30:50.000000000,closed,4,Connecting two nodes that are already connected should be allowed for required relations
2248,2018-04-22 14:03:55.000000000,2018-04-23 15:25:11.000000000,closed,1,How can disable `createdAt` and `updatedAt` in Prisma?
2247,2018-04-21 12:17:34.000000000,2018-04-23 15:22:36.000000000,closed,5,A particular mutation between User Type and a custom type returns internal server error
2246,2018-04-21 02:28:28.000000000,2018-04-26 16:44:51.000000000,closed,3,Upgrading Prisma from 1.1.3 to latest (1.6.3) - Best Practices
