id,created_at,closed_at,state,comments,title
5363,2020-08-31 12:52:06.000000000,2020-08-31 14:22:35.000000000,closed,1,Visual glitch in Edit entry
5362,2020-08-31 12:46:01.000000000,1970-01-01 00:00:00.000000001,open,1,Missing string at Transifex
5361,2020-08-31 12:11:37.000000000,1970-01-01 00:00:00.000000001,open,0,Set default size of Auto-Type selection dialogue
5360,2020-08-31 11:04:31.000000000,1970-01-01 00:00:00.000000001,open,0,Various minor improvements for man page
5359,2020-08-30 18:58:16.000000000,2020-08-30 22:11:56.000000000,closed,4,Minimize to Tray on Fedora 32
5358,2020-08-30 11:57:50.000000000,2020-08-30 14:46:10.000000000,closed,1,visualize preview
5357,2020-08-30 10:02:13.000000000,2020-08-30 14:46:53.000000000,closed,1,Delete the password from the clipboard
5356,2020-08-29 16:52:09.000000000,1970-01-01 00:00:00.000000001,open,2,The Database Open Dialog should use the window flag QT::Dialog
5355,2020-08-29 08:30:17.000000000,1970-01-01 00:00:00.000000001,open,0,DBus interface name does not match XML definition file
5354,2020-08-28 17:38:32.000000000,2020-08-28 20:33:50.000000000,closed,0,almhzri@icloud.com
5353,2020-08-28 14:41:37.000000000,2020-08-29 01:10:56.000000000,closed,2,KeepassXC-related process are not terminated upon exiting the application [Windows 10 2004 / KeepassXC 2.6.1]
5352,2020-08-28 14:24:00.000000000,1970-01-01 00:00:00.000000001,open,1,"Fourth tray icon type, ""Monochrome (automatic)"""
5351,2020-08-28 14:15:08.000000000,2020-08-28 14:21:06.000000000,closed,8,2.6.0 & 2.6.1: browser extension does not find entry
5350,2020-08-28 01:21:07.000000000,1970-01-01 00:00:00.000000001,open,0,[2.6.1] -WITH_XC_UPDATECHECK=OFF does not prevent KXC from asking user to check for updates
5349,2020-08-27 21:39:59.000000000,1970-01-01 00:00:00.000000001,open,4,App theme does not change properly with system theme
5348,2020-08-27 20:15:52.000000000,1970-01-01 00:00:00.000000001,open,0,Program crashes when left open with a locked DB [Windows / keepassxc 2.6.1]
5347,2020-08-27 15:53:13.000000000,1970-01-01 00:00:00.000000001,open,8, Transparent login screen & symbol bar [macOS 10.13.6 / KeepassXC 2.6.1]
5346,2020-08-27 04:05:20.000000000,1970-01-01 00:00:00.000000001,open,0,Improve CSV export and import capability
5345,2020-08-26 20:48:15.000000000,2020-08-26 21:00:09.000000000,closed,1,TOTP information lost exporting a database to CSV
5344,2020-08-26 19:02:41.000000000,1970-01-01 00:00:00.000000001,open,0,"Fix AutoOpen IfDevice matching, again"
5343,2020-08-26 18:19:01.000000000,1970-01-01 00:00:00.000000001,open,0,Add health status to entry view columns
5342,2020-08-26 17:41:53.000000000,2020-08-27 02:39:51.000000000,closed,2,AutoOpen of additional databases does not work any more
5341,2020-08-26 07:42:12.000000000,1970-01-01 00:00:00.000000001,open,1,Fix opening opvault on macos
5340,2020-08-26 02:31:30.000000000,1970-01-01 00:00:00.000000001,open,0,Use selected settings in password generator on load
5339,2020-08-26 00:29:54.000000000,2020-08-26 00:47:19.000000000,closed,2,"Indentation of the ""user name"" text field"
5338,2020-08-25 18:45:38.000000000,1970-01-01 00:00:00.000000001,open,14,Yubikey stopped working with latest upgrade
5337,2020-08-25 16:35:14.000000000,1970-01-01 00:00:00.000000001,open,1,"Open database using Apple Watch ""double tap"" confirmation feature on MacOS"
5336,2020-08-25 02:51:11.000000000,1970-01-01 00:00:00.000000001,open,1,Generated password doesn't include characters from advanced settings until they're interacted with
5335,2020-08-25 02:39:47.000000000,1970-01-01 00:00:00.000000001,open,1,Add the ability to change accent color
5334,2020-08-25 01:13:08.000000000,1970-01-01 00:00:00.000000001,open,0,Auto-Type - Notify User which part of sequence is invalid
5333,2020-08-25 01:07:43.000000000,1970-01-01 00:00:00.000000001,open,0,Auto-Type - Missing Auto-Type code: {C:Comment}
5332,2020-08-24 23:57:47.000000000,2020-08-25 00:09:39.000000000,closed,1,"release 2.6 significantly increased row height in listing of entries, increasing need/extent of (vertical) scrolling"
5331,2020-08-24 21:48:30.000000000,2020-08-24 22:08:38.000000000,closed,2,"More efficient space usage on the toolbar when in ""text under icon"" mode"
5330,2020-08-24 21:04:48.000000000,2020-08-24 21:28:40.000000000,closed,1,Health Check - Option to Show All Entries?
5329,2020-08-24 20:26:26.000000000,2020-08-24 20:48:34.000000000,closed,5,HIBP database report sorting by Password Exposed column is not logical
5328,2020-08-24 16:06:54.000000000,1970-01-01 00:00:00.000000001,open,4, osx 10.15.6 “KeePassXC.app is damaged and can’t be opened. KeePassXC-2.6.1
5327,2020-08-23 20:25:32.000000000,1970-01-01 00:00:00.000000001,open,1,Fix Paperclip and Totp columns not saving state
5326,2020-08-23 19:21:12.000000000,2020-08-23 20:31:32.000000000,closed,2,Obsolete translation set
5325,2020-08-23 15:07:47.000000000,1970-01-01 00:00:00.000000001,open,19,Move local config away from ~/.cache on Linux
5324,2020-08-23 10:39:36.000000000,2020-08-23 15:19:00.000000000,closed,0,Problem when opening an entry
5323,2020-08-23 04:23:25.000000000,2020-08-23 05:07:42.000000000,closed,5,Breadcrumbs delimiter should be something other than `🮁`
5322,2020-08-23 04:10:25.000000000,1970-01-01 00:00:00.000000001,open,1,Tab icons turn black after focus (dark theme)
5321,2020-08-23 03:39:03.000000000,1970-01-01 00:00:00.000000001,open,3,inconsistent text alignment
5320,2020-08-23 01:34:34.000000000,2020-08-23 01:43:13.000000000,closed,2,toggling password generator 'advanced' mode off sometimes does not shink dialog size
5319,2020-08-22 21:19:21.000000000,1970-01-01 00:00:00.000000001,open,9,Program errors and crashes[v2.6.0&2.6.1]
5318,2020-08-22 18:50:23.000000000,2020-08-22 19:25:43.000000000,closed,3,Database Reports - Title sort order
5317,2020-08-22 18:30:38.000000000,1970-01-01 00:00:00.000000001,open,6,Column preferences are not saved
5316,2020-08-22 15:47:08.000000000,1970-01-01 00:00:00.000000001,open,5,Fix Best-Matching ..again
5315,2020-08-22 14:42:46.000000000,2020-08-22 15:15:33.000000000,closed,1,Password Generator - Unable increase the password size more than 128 characters
5314,2020-08-22 13:24:53.000000000,2020-08-22 15:13:54.000000000,closed,3, It seems not possible to a values from the clipboard with (e.g.) ^v or with another autotype action code - make it possible
5313,2020-08-22 12:48:59.000000000,1970-01-01 00:00:00.000000001,open,6,Local config data is cleared when ~/.cache mounted on tempfs
5312,2020-08-22 11:58:38.000000000,2020-08-22 15:12:09.000000000,closed,1,XML import in gui
5311,2020-08-22 11:55:37.000000000,1970-01-01 00:00:00.000000001,open,0,keepassxc-cli import does not have keyfile option
5310,2020-08-22 06:39:17.000000000,2020-08-22 07:14:34.000000000,closed,3,Create KeePassXC Android
5309,2020-08-22 06:19:02.000000000,2020-08-22 07:14:15.000000000,closed,3,Display the counters for the group and all entries in the main view
5308,2020-08-22 05:59:41.000000000,2020-08-22 16:10:45.000000000,closed,3,Save the search settings + add more search settings
5307,2020-08-21 23:28:03.000000000,1970-01-01 00:00:00.000000001,open,0,User Interface Icons with Text - macOS
5306,2020-08-21 20:20:33.000000000,1970-01-01 00:00:00.000000001,open,6,Is it possible to have a single entry for multple TLD ?
5305,2020-08-21 12:29:25.000000000,2020-08-21 14:39:48.000000000,closed,4,Secret Service Integration broke login on Archlinux
5304,2020-08-21 07:02:41.000000000,2020-08-21 14:18:42.000000000,closed,5,Dark theme has white bits in Settings
5303,2020-08-20 20:11:04.000000000,2020-08-20 20:53:48.000000000,closed,1,Username entries are suddendly hidden behind ••••••
5302,2020-08-20 19:36:47.000000000,2020-08-21 04:42:09.000000000,closed,1,Allow hiding folder and password entry icons
5301,2020-08-20 19:25:04.000000000,2020-08-21 01:16:03.000000000,closed,5,Allow using old icon set
5300,2020-08-20 19:19:33.000000000,1970-01-01 00:00:00.000000001,open,16,Scrollbar shows up in middle of edit/details screens
5299,2020-08-20 17:53:23.000000000,1970-01-01 00:00:00.000000001,open,35,2.6.1: browser does not find entry
5298,2020-08-20 17:52:24.000000000,2020-08-20 19:20:24.000000000,closed,1,Safari browser integration
5297,2020-08-20 17:43:46.000000000,1970-01-01 00:00:00.000000001,open,10,keepasshttp attribute migration shows up every time I open db
5296,2020-08-20 15:43:07.000000000,1970-01-01 00:00:00.000000001,open,2,Unable to select hidden files in OS system file open dialogs
5295,2020-08-20 15:19:24.000000000,1970-01-01 00:00:00.000000001,open,6,System pop-up dialogs for file manipulation are getting randomly closed on their own
5294,2020-08-20 12:26:14.000000000,2020-08-31 07:17:20.000000000,closed,0,Add note for macOS Keyboard shortcuts
5293,2020-08-19 14:10:35.000000000,2020-08-19 16:49:37.000000000,closed,2,Strange line on Edit Screen
5292,2020-08-19 13:41:56.000000000,2020-08-19 16:55:35.000000000,closed,7,How do i export TOTP codes from KeePassXC?
5291,2020-08-18 23:54:07.000000000,2020-08-19 01:30:02.000000000,closed,1,Crash after downloading favicon
5290,2020-08-18 22:27:33.000000000,1970-01-01 00:00:00.000000001,open,0,Data loss when database file changes without Yubikey available 
5289,2020-08-18 18:08:24.000000000,2020-08-19 15:32:56.000000000,closed,1,Opera browser
5288,2020-08-18 15:56:25.000000000,2020-08-23 21:33:35.000000000,closed,4,-WITH_XC_UPDATECHECK=OFF should completely remove check for updates feature
5287,2020-08-18 12:22:20.000000000,1970-01-01 00:00:00.000000001,open,1,Request passwords from locked database with secret service
5286,2020-08-18 09:25:49.000000000,2020-08-21 06:39:23.000000000,closed,5,KeePassXC - Version 2.6.0 sometimes hangs on db unlock
5285,2020-08-18 06:49:13.000000000,2020-08-18 07:39:50.000000000,closed,0,内存不能为read
5284,2020-08-17 23:04:47.000000000,1970-01-01 00:00:00.000000001,open,4,Data loss when using syncthing
5283,2020-08-17 14:38:14.000000000,2020-08-30 16:06:23.000000000,closed,1,Add show/hide expired entries on global AutoType
5282,2020-08-17 10:17:00.000000000,2020-08-17 10:28:46.000000000,closed,4,Allow any file as keyfile
5281,2020-08-17 03:33:37.000000000,2020-08-17 05:51:22.000000000,closed,1,Many icons are not showing up
5280,2020-08-17 00:02:12.000000000,2020-08-17 00:13:27.000000000,closed,1,Please take away this flatness from the UI
5279,2020-08-16 23:09:21.000000000,1970-01-01 00:00:00.000000001,open,0,Secret service crash when searching with null baseGroup
5278,2020-08-16 12:34:45.000000000,2020-08-17 14:17:59.000000000,closed,0,Add command for retrieving the current TOTP
5277,2020-08-16 05:17:55.000000000,2020-08-16 07:08:37.000000000,closed,1,Otp not working 2.6.0
5276,2020-08-15 22:48:27.000000000,1970-01-01 00:00:00.000000001,open,0,WIP: Describe HTML export/paper backups in the user manual
5275,2020-08-15 20:41:10.000000000,2020-08-15 21:49:15.000000000,closed,4,"[CLI] edit command can't move items around the hierarchy, and doesn't fail loudly when given a leading slash"
5274,2020-08-15 16:28:12.000000000,1970-01-01 00:00:00.000000001,open,1,Flash of entries in locked database when returning to an auto-locked database
5273,2020-08-15 13:46:52.000000000,1970-01-01 00:00:00.000000001,open,4,Add a command line option which set search query
5272,2020-08-15 11:58:02.000000000,2020-08-15 15:19:31.000000000,closed,1,Side By Side UI Layout
5271,2020-08-15 01:00:50.000000000,2020-08-15 01:20:41.000000000,closed,1,Add varying typing delay with auto type 
5270,2020-08-14 23:14:26.000000000,1970-01-01 00:00:00.000000001,open,7,Pop-up switches focus to KeepassXC app (only since update to 2.6)
5269,2020-08-14 11:33:21.000000000,2020-08-14 12:45:22.000000000,closed,1,Codesmell: qpa/qplatformnativeinterface.h - you  really need qplatformnativeinterface?
5268,2020-08-14 10:49:28.000000000,2020-08-14 14:35:19.000000000,closed,2,Yubikey not detected if Slot 1 is empty / not configured 
5267,2020-08-14 06:37:33.000000000,2020-08-19 22:25:19.000000000,closed,0,Improve button hover effect for checked buttons
5266,2020-08-14 06:36:34.000000000,2020-08-17 06:40:59.000000000,closed,0,Fix excessive memory usage by icons
5265,2020-08-13 23:28:58.000000000,2020-08-14 01:58:52.000000000,closed,1,Toolbar icons not displayed
5264,2020-08-13 19:54:18.000000000,2020-08-13 20:23:01.000000000,closed,2,"Add keyboard shortcut to search through all database, typing entry title"
5263,2020-08-13 13:23:49.000000000,1970-01-01 00:00:00.000000001,open,1,Username dropdown not listing all options
5262,2020-08-13 09:49:25.000000000,1970-01-01 00:00:00.000000001,open,4,Moving groups between databases can cause data loss
5261,2020-08-12 18:01:35.000000000,1970-01-01 00:00:00.000000001,open,1,HTML Export: Don't waste horizontal space
5260,2020-08-12 14:28:17.000000000,1970-01-01 00:00:00.000000001,open,3,Exlude sites with special params
5259,2020-08-12 09:24:50.000000000,2020-08-12 14:19:36.000000000,closed,0,Keepassxc auto backup
5258,2020-08-12 09:19:28.000000000,2020-08-12 14:19:31.000000000,closed,1,Keepassxc doesn't remember certain closed windows or no option to disable it
5257,2020-08-12 09:08:46.000000000,2020-08-13 08:15:04.000000000,closed,2,[Linux] Unable to open databases from partitions
5256,2020-08-12 03:24:32.000000000,1970-01-01 00:00:00.000000001,open,3,Ergonomics: Don't ask when removing an empty URL
5255,2020-08-11 21:03:43.000000000,1970-01-01 00:00:00.000000001,open,3,Auto-Reload database on change should not be default
5254,2020-08-11 18:33:04.000000000,2020-08-11 20:04:21.000000000,closed,5,Backport 2.6 browser extension requirements to 2.4.4
5253,2020-08-11 17:46:47.000000000,1970-01-01 00:00:00.000000001,open,12,No Database Connection Microsoft Edge KeepassXC extension
5252,2020-08-10 23:11:32.000000000,2020-08-11 00:00:17.000000000,closed,1,[Suggestion] Ability to make the preview area smaller than currently possible
5251,2020-08-10 10:44:08.000000000,2020-08-10 14:22:52.000000000,closed,1,"Auto-Type can show a search window for database when it ""Couldn't find an entry that matches the window title"" ?"
5250,2020-08-10 10:25:52.000000000,2020-08-11 00:00:30.000000000,closed,1,Strange UI issue on Linux AppImage
5249,2020-08-10 06:15:23.000000000,2020-08-10 06:42:55.000000000,closed,3,Empty Key Not Allowed
5248,2020-08-10 04:39:36.000000000,2020-08-11 00:00:44.000000000,closed,1,Notes going blank randomly (not reproducible)
5247,2020-08-09 08:26:17.000000000,1970-01-01 00:00:00.000000001,open,2,Feature/toggle groups panel option
5246,2020-08-09 02:21:34.000000000,2020-08-09 02:35:19.000000000,closed,1,Display error in cinnamon 
5245,2020-08-08 19:18:15.000000000,1970-01-01 00:00:00.000000001,open,2,Crash when passing a wildcard to some CLI commands on Windows
5244,2020-08-08 18:26:55.000000000,2020-08-08 20:17:45.000000000,closed,2,Dark title bar on Windows when in dark mode
5243,2020-08-07 22:50:45.000000000,1970-01-01 00:00:00.000000001,open,6,Please allow adjusting screen width and removing group window pain
5242,2020-08-07 15:52:16.000000000,2020-08-08 21:09:45.000000000,closed,10,Problems Saving And Closing KeePass File
5241,2020-08-07 11:31:51.000000000,1970-01-01 00:00:00.000000001,open,0,Regularly the application becomes unusable. Mouse pointer moves arbitrarily
5240,2020-08-07 11:04:10.000000000,2020-08-20 01:59:46.000000000,closed,2,Extreme memory usage
5239,2020-08-07 08:11:01.000000000,2020-08-07 14:23:03.000000000,closed,0,Installation failure
5238,2020-08-06 22:03:52.000000000,1970-01-01 00:00:00.000000001,open,13,Credentials not returned when unconnected database is in focus
5237,2020-08-07 02:33:39.000000000,1970-01-01 00:00:00.000000001,open,2,Add 'delete entry without confirm' functionality
5236,2020-08-07 01:17:49.000000000,1970-01-01 00:00:00.000000001,open,2,Allow the three main partitions to be displayed as Side by Side
5235,2020-08-06 19:37:02.000000000,2020-08-07 01:13:27.000000000,closed,4,Interface icons are not displayed
5234,2020-08-06 19:36:27.000000000,2020-08-07 00:51:48.000000000,closed,1,Favicon Crash with automatically save enabled
5232,2020-08-06 13:50:53.000000000,1970-01-01 00:00:00.000000001,open,1,Delete entry without confirmation: Config option
5231,2020-08-06 01:00:38.000000000,1970-01-01 00:00:00.000000001,open,3,garbled icon in add / edit screen
5230,2020-08-05 16:34:55.000000000,1970-01-01 00:00:00.000000001,open,2,Wrong mouse position when working with multiple monitors
5229,2020-08-05 05:17:47.000000000,2020-08-05 06:40:43.000000000,closed,1,"KeePassXC 2.6.0 forgets the ""Hide Passwords"" setting each time it's started"
5228,2020-08-04 23:25:54.000000000,2020-08-08 22:10:29.000000000,closed,0,"Update ""Open Auto-Type help webpage"" URL"
5227,2020-08-04 22:52:31.000000000,2020-08-07 06:10:47.000000000,closed,8,Fix clipped labels when Light/Dark theme is used
5226,2020-08-04 15:21:04.000000000,1970-01-01 00:00:00.000000001,open,6,Onlykey not detected with Snap and Appimage
5225,2020-08-04 13:42:49.000000000,1970-01-01 00:00:00.000000001,open,3,Allow relative path for external SSH keys
5224,2020-08-04 13:03:01.000000000,2020-08-04 14:22:36.000000000,closed,3,KeepassXC 2.6.0 requests for 'Screen Recording' permission on MacOS Mojave
5223,2020-08-04 08:06:03.000000000,2020-08-04 14:18:48.000000000,closed,8,"Add the possibility to add a second panel and compact panel, for Notes"
5221,2020-08-04 00:15:41.000000000,2020-08-04 20:05:50.000000000,closed,3,Change the default word separator in the passphrase generator to something different than space
5220,2020-08-03 23:43:36.000000000,1970-01-01 00:00:00.000000001,open,2,Add a password quality check for the database password
5219,2020-08-03 15:09:50.000000000,2020-08-03 15:11:06.000000000,closed,0,load ssh keys with right-click menu or toolbar button
5218,2020-08-03 14:58:43.000000000,2020-08-03 19:09:03.000000000,closed,1,Program crashes after auto-downloading Icon(s)
5217,2020-08-03 11:00:04.000000000,2020-08-04 03:27:44.000000000,closed,7,Auto-type Settings for Groups [UX]
5216,2020-08-02 23:36:10.000000000,1970-01-01 00:00:00.000000001,open,1,Lock entries against unintentional changes
5215,2020-08-02 18:18:28.000000000,2020-08-02 18:38:56.000000000,closed,1,"Bug? - Only navigating the group tree results in ""Database was modified. Save changes?"" dialog"
5214,2020-08-02 17:08:56.000000000,2020-08-07 14:24:34.000000000,closed,2,Only display domain name in browser access confirm dialog
5213,2020-08-02 11:55:39.000000000,2020-08-02 15:12:57.000000000,closed,1,Mint 20 - display problem
5212,2020-08-02 02:51:59.000000000,1970-01-01 00:00:00.000000001,open,6,CLI: Add context to commands to simplify database tracking
5211,2020-08-02 02:40:34.000000000,2020-08-02 03:10:09.000000000,closed,1,"macOS: ""Toggle Password"" ⌘H keyboard shortcut doesn't work"
5210,2020-08-02 02:02:09.000000000,2020-08-08 23:40:02.000000000,closed,0,Fixup saving non-data changes on database lock
5209,2020-08-02 00:47:02.000000000,1970-01-01 00:00:00.000000001,open,1,Path translation breaks recent database list
5208,2020-08-01 12:09:29.000000000,2020-08-01 15:19:43.000000000,closed,4,Missed translations in v2.6.0
5207,2020-07-31 23:48:46.000000000,2020-08-01 06:22:42.000000000,closed,3,Attachments aren't included in XML exports
5206,2020-07-31 15:07:22.000000000,2020-07-31 20:09:40.000000000,closed,5,Generator: Maximum password length limited to 128 chars (in Version 2.6.0) instead of 999 (in Version 2.3.*)
5205,2020-07-31 12:55:39.000000000,2020-08-01 19:35:02.000000000,closed,1,"When open file from Finder, the file doesn't open"
5204,2020-07-31 12:52:51.000000000,1970-01-01 00:00:00.000000001,open,3,Make it possible to Copy/Cut/Paste entries
5203,2020-07-31 03:49:05.000000000,2020-07-31 03:54:46.000000000,closed,4,Build wiki page missing qrencode dependency
5202,2020-07-30 20:26:13.000000000,1970-01-01 00:00:00.000000001,open,1,Interface for Secure Notes
5200,2020-07-30 12:28:53.000000000,2020-07-30 12:32:46.000000000,closed,1,Palette support is disabled. Blank Icons
5199,2020-07-30 09:16:18.000000000,1970-01-01 00:00:00.000000001,open,2,KeePassXC Freezes On closing in Linux Mint 20.0
5198,2020-07-30 01:43:01.000000000,2020-07-30 01:45:42.000000000,closed,1,detect textarea as input field
5197,2020-07-29 22:59:01.000000000,2020-08-08 22:10:50.000000000,closed,4,"Fix ""Search Results"" banner improperly themed"
5196,2020-07-29 22:11:35.000000000,1970-01-01 00:00:00.000000001,open,4,"[Bug] KeePassXC CLI errors, when used with network path for database file"
5195,2020-07-29 18:44:33.000000000,2020-07-29 18:52:44.000000000,closed,1,Bug layout keepassxc
5194,2020-07-29 17:30:38.000000000,1970-01-01 00:00:00.000000001,open,0,`keepassxc --version` activates KeePassXC window
5193,2020-07-29 16:07:45.000000000,2020-07-29 17:35:36.000000000,closed,1,KeepassXC memorize previous database when this setting is set to not
5192,2020-07-29 00:37:34.000000000,2020-07-29 01:30:08.000000000,closed,1,Version 2.6.0 is not available in Fedora 32 repository.
5191,2020-07-28 21:46:29.000000000,2020-07-30 15:22:30.000000000,closed,0,Switch to classic if theme set to auto and high contast mode is on
5190,2020-07-28 20:17:35.000000000,1970-01-01 00:00:00.000000001,open,0,keepassxc-cli: history of previous commands
5189,2020-07-28 19:51:43.000000000,1970-01-01 00:00:00.000000001,open,2,Add support for browser integration when using `keepassxc-cli open`
5188,2020-07-28 17:35:30.000000000,2020-07-28 20:02:23.000000000,closed,1,Password Score in Database Health Check sorted alphabetically
5187,2020-07-28 16:44:06.000000000,2020-07-28 16:48:34.000000000,closed,1,FR: Toolbar minimize button
5186,2020-07-28 08:32:12.000000000,2020-07-28 08:34:57.000000000,closed,2,SLowing firefox / freezing Google
5185,2020-07-28 06:06:29.000000000,2020-07-28 14:25:21.000000000,closed,0,Correct scaling on Linux and other minor fixes
5184,2020-07-28 01:32:28.000000000,2020-07-28 13:32:18.000000000,closed,0,Clear clipboard on database lock
5183,2020-07-27 20:23:40.000000000,2020-07-28 06:36:19.000000000,closed,4,Provide visual feedback when icons are clicked
5182,2020-07-27 18:32:28.000000000,2020-07-27 19:31:38.000000000,closed,3,"Regression: keepassxc 2.6.0 from flatpak fails for URLs starting with ""cmd://"""
5181,2020-07-27 18:06:14.000000000,2020-07-27 18:18:31.000000000,closed,1,Feature suggestion
5180,2020-07-27 16:41:44.000000000,2020-07-27 19:31:10.000000000,closed,8,checksum matching
5179,2020-07-27 12:34:05.000000000,2020-07-27 12:59:50.000000000,closed,2,flatpak broke start-up script
5178,2020-07-27 10:51:58.000000000,2020-07-27 18:19:26.000000000,closed,1,Make password policy local to an entry
5177,2020-07-27 02:09:04.000000000,1970-01-01 00:00:00.000000001,open,4,Hidden from Gnome alt-tab selector after launch
5176,2020-07-26 18:22:02.000000000,1970-01-01 00:00:00.000000001,open,3,"Fatal: ""Error while reading the database: Duplicate custom attribute found"""
5175,2020-07-26 18:02:31.000000000,1970-01-01 00:00:00.000000001,open,1,Writing the database failed: File exists
5174,2020-07-26 08:14:20.000000000,2020-07-26 15:01:59.000000000,closed,1,2.6.0 Cannot disable Load previously open databases on startup
5173,2020-07-26 02:38:15.000000000,2020-07-26 03:49:55.000000000,closed,1,XFCE4 + v 2.6.0 layout broken
5172,2020-07-25 16:26:10.000000000,2020-07-25 17:03:01.000000000,closed,2,[GNUPG:] KEYEXPIRED
5171,2020-07-25 12:41:33.000000000,2020-07-25 18:01:29.000000000,closed,2,"A script in the extension ""KeePassSC -Browser"" is causing Firefox to slow down."
5170,2020-07-25 03:04:32.000000000,1970-01-01 00:00:00.000000001,open,1,Fresh AppImage of 2.6.1 which work on RHEL7
5169,2020-07-25 02:27:46.000000000,1970-01-01 00:00:00.000000001,open,5,freshly built AppImage of 2.6.1 doesn't find the proper libgcrypt binary.
5168,2020-07-25 00:13:00.000000000,2020-07-25 00:21:20.000000000,closed,3,"No ""Repeat"" password field in entry"
5167,2020-07-24 22:17:02.000000000,1970-01-01 00:00:00.000000001,open,5,Unable to find 'trusty' in KPXC PPA
5166,2020-07-24 19:35:37.000000000,1970-01-01 00:00:00.000000001,open,2,[CLI] static deinitialization order 'fiasco' results in SEGFAULT
5165,2020-07-24 17:50:35.000000000,2020-08-07 06:28:39.000000000,closed,3,Keyboard shortcuts
5164,2020-07-24 17:50:01.000000000,2020-08-03 05:18:25.000000000,closed,11,Settings toolbar labels are clipped with Light/Dark theme
5162,2020-07-24 10:18:52.000000000,1970-01-01 00:00:00.000000001,open,1,"When the system boots, two instances of the program are launched"
5161,2020-07-24 08:29:43.000000000,2020-07-25 09:56:41.000000000,closed,3,Computer immediately suspends upon wake if keepassxc is open.
5160,2020-07-24 01:34:32.000000000,2020-08-03 06:42:09.000000000,closed,1,"2.6.0 crash due to ""Namespace CODESIGNING"" on macOS 10.15.5"
5159,2020-07-24 01:31:58.000000000,2020-08-03 05:19:48.000000000,closed,1,KeePassXC: Windows - Application Error
5158,2020-07-23 14:40:08.000000000,2020-07-23 16:20:12.000000000,closed,1,MacOS – KeePassXC Unexpectedly Quit
5157,2020-07-22 21:04:33.000000000,1970-01-01 00:00:00.000000001,open,1,QWayland: Clone entry dialog causes intermittent crash
5156,2020-07-22 20:57:46.000000000,2020-07-22 21:00:57.000000000,closed,1,Error in nixutils compilation from v2.6.X due to missing additional dependency (qtbase5-private-dev)
5155,2020-07-22 14:02:55.000000000,2020-07-22 14:38:58.000000000,closed,1,Wrong unlock database input fields and button labels sizes on elementaryOS HERA
5154,2020-07-22 13:55:21.000000000,2020-07-22 14:40:12.000000000,closed,1,Icons still small in HDPi on elementary OS HERA
5153,2020-07-22 12:17:32.000000000,1970-01-01 00:00:00.000000001,open,4,Feature request : Pinned items
5152,2020-07-22 11:50:40.000000000,2020-07-22 16:21:01.000000000,closed,5,"Auto-Type ""window association"" does not work properly with Steam"
