id,created_at,closed_at,state,comments,title
1325,2017-12-26 19:49:17.000000000,2017-12-27 05:28:12.000000000,closed,8,Refactor key file generation to produce random byte stream instead of XML
1324,2017-12-26 18:44:29.000000000,2017-12-27 01:18:53.000000000,closed,11,keepassxc 2.2.2 stopped starting
1323,2017-12-26 17:50:55.000000000,2017-12-26 20:28:45.000000000,closed,0,Replace Travis build icon with TeamCity build icon
1322,2017-12-26 06:27:18.000000000,2017-12-26 17:05:15.000000000,closed,0,Add TeamCity integration
1321,2017-12-25 21:51:30.000000000,2018-06-08 11:57:03.000000000,closed,5,Add an option to unlock database with kwallet
1320,2017-12-25 21:13:44.000000000,2017-12-26 17:24:59.000000000,closed,0,Correct regression to ssh-agent from entry attachment refactor
1319,2017-12-25 18:46:15.000000000,2017-12-26 01:24:35.000000000,closed,0,Correct encoding ambiguity in CSV Parser unicode test
1318,2017-12-25 18:19:45.000000000,2017-12-25 18:57:56.000000000,closed,1,Duplicate icon in GNOME 3 dash
1317,2017-12-24 17:03:51.000000000,2019-04-28 22:33:48.000000000,closed,15,Redesign database search
1316,2017-12-23 13:41:10.000000000,2017-12-23 20:28:58.000000000,closed,0,Fix font size of URL label in the preview panel
1315,2017-12-22 20:38:50.000000000,2017-12-22 23:36:09.000000000,closed,3,Merge request message
1314,2017-12-22 13:26:57.000000000,1970-01-01 00:00:00.000000001,open,7,Ability to select multiple entries and edit
1313,2017-12-22 09:43:12.000000000,2018-03-31 15:54:44.000000000,closed,3,Grey out Apply button once clicked by user
1312,2017-12-22 09:32:22.000000000,1970-01-01 00:00:00.000000001,open,1,Ability to discard changes while database is open
1311,2017-12-22 02:13:14.000000000,2019-07-10 05:44:40.000000000,closed,13,"Browser integration failing on Win7 x64, reason unknown"
1310,2017-12-21 00:10:29.000000000,2017-12-21 04:08:19.000000000,closed,1,Add \n in merge request message.
1309,2017-12-20 15:51:14.000000000,2018-03-03 04:02:09.000000000,closed,1,"KeePassXC installed as snap, prevent laptop from going to sleep, when you close the lid"
1308,2017-12-20 13:40:25.000000000,2017-12-20 13:47:52.000000000,closed,1,Fix use of cmake_minimum_required
1307,2017-12-20 04:30:47.000000000,2017-12-24 18:56:42.000000000,closed,5,Fix missing qtbase translations
1306,2017-12-19 20:26:14.000000000,2019-07-10 05:44:26.000000000,closed,0,macOS - Global Auto Type Breaks If Keys Held Down
1305,2017-12-19 14:52:17.000000000,2018-01-21 19:34:19.000000000,closed,39,Improve and extend entry view table
1304,2017-12-19 13:59:17.000000000,2017-12-22 02:53:04.000000000,closed,5,Mixed Languages Presented in Various Dialogues
1303,2017-12-19 10:14:53.000000000,2017-12-19 13:09:58.000000000,closed,0,Updated snapcraft build file
1302,2017-12-18 18:31:38.000000000,2017-12-18 19:41:12.000000000,closed,5,autotype tab back
1301,2017-12-18 11:16:57.000000000,2017-12-22 02:58:13.000000000,closed,1,Update building instructions
1300,2017-12-18 08:07:44.000000000,2017-12-22 03:03:37.000000000,closed,7,[Question] How do I create a new group parallel to 'General'?
1299,2017-12-17 14:58:26.000000000,2019-07-10 05:43:43.000000000,closed,3,The main window dosn't keep the window position on the screen
1298,2017-12-17 01:58:17.000000000,2017-12-25 18:12:16.000000000,closed,14,Improve entry attachments view
1297,2017-12-16 20:12:17.000000000,2019-04-26 15:33:16.000000000,closed,9,cli: add ability provide password non-interactively
1296,2017-12-16 16:46:55.000000000,2017-12-16 19:54:09.000000000,closed,2,Different size of the icons in Ubuntu 16.04
1295,2017-12-16 06:16:48.000000000,2019-07-10 06:39:48.000000000,closed,2,Gmail autofill choosing wrong links/fields
1294,2017-12-16 04:20:42.000000000,2019-05-26 00:44:45.000000000,closed,7,"macos - when I keep multiple databases open, tab order changes sometimes when I close then reopen application"
1293,2017-12-15 20:59:57.000000000,1970-01-01 00:00:00.000000001,open,5,Wrong keyboard layout under Wayland
1292,2017-12-15 20:41:55.000000000,2017-12-19 13:09:58.000000000,closed,7,Snap Regression: v28 text does not render
1291,2017-12-15 19:53:54.000000000,2019-07-10 06:19:11.000000000,closed,19,Add more color neutral icon set for KDE Plasma 5
1290,2017-12-15 16:42:13.000000000,2018-06-05 17:08:54.000000000,closed,3,Widen searches to include additional attributes
1289,2017-12-15 15:13:14.000000000,2017-12-17 05:14:39.000000000,closed,9,cli: show: add --attributes flag
1288,2017-12-15 14:22:00.000000000,2019-07-10 06:40:35.000000000,closed,3,Trayicon not working with Ubuntu 14.04 trusty (works with 16.04)
1287,2017-12-15 14:16:16.000000000,2017-12-22 02:54:21.000000000,closed,1,Pushing the Power-Button from the computer closes the window but doesn't quit the program with Ubuntu 14.04 trusty (works with 16.04)
1286,2017-12-15 14:05:54.000000000,2017-12-15 16:44:31.000000000,closed,1,Hotkeys not working if the toolbar isn't visible with Ubuntu 14.04 trusty (works with 16.04)
1285,2017-12-15 12:39:41.000000000,2017-12-15 16:40:04.000000000,closed,1,Power-Button from the computer shotdown the system immediately
1284,2017-12-15 06:19:57.000000000,2019-01-31 21:26:36.000000000,closed,5,Override the default keepassxc.ini when starting keepassxc.
1283,2017-12-14 23:04:49.000000000,2017-12-15 03:04:59.000000000,closed,1,Feature Request: Show statistics about the database
1282,2017-12-14 22:03:32.000000000,2017-12-15 13:11:17.000000000,closed,2,Snap: Cursor does not respect scaling factor
1281,2017-12-14 21:28:20.000000000,2017-12-15 06:22:59.000000000,closed,0,Removing password output from Estimate.
1280,2017-12-14 21:00:20.000000000,2017-12-17 20:44:13.000000000,closed,8,keepassxc-cli show: resolve references in output
1279,2017-12-14 16:33:07.000000000,2017-12-14 22:42:49.000000000,closed,7,[BUG] [2.2.4] Mac Version Download package contains wrong build
1278,2017-12-14 03:07:31.000000000,2017-12-14 03:29:31.000000000,closed,1,Add Quick Unlock Feature
1277,2017-12-14 03:05:26.000000000,2017-12-15 14:03:53.000000000,closed,4,Separate code and GPG signing and add support for macOS codesign to release-tool
1276,2017-12-13 17:35:06.000000000,2017-12-13 22:45:24.000000000,closed,0,Backport critical AppImage deployment fix
1275,2017-12-13 15:57:54.000000000,2017-12-25 19:23:35.000000000,closed,12,Useless (huge) notification when importing passwords/saving database
1274,2017-12-13 14:54:00.000000000,1970-01-01 00:00:00.000000001,open,7,Option for opening databases read-only by default
1273,2017-12-13 03:29:27.000000000,2017-12-13 03:44:03.000000000,closed,0,Fixed typo in XML tag
1272,2017-12-13 03:07:57.000000000,2017-12-13 22:48:15.000000000,closed,2,org.keepassxc.appdata.xml contains invalid XML
1271,2017-12-13 02:46:53.000000000,2018-09-04 00:41:03.000000000,closed,20,Debian Stretch and missing text on snap version
1270,2017-12-13 02:37:00.000000000,2017-12-13 02:50:43.000000000,closed,5,Version 2.2.3 is a Pre-release ?
1269,2017-12-11 08:22:09.000000000,2017-12-17 20:44:13.000000000,closed,2,Cloned entries: Refs should be lower case. Breaks autotype/keepasshttp
1268,2017-12-10 21:20:41.000000000,2019-07-10 05:43:22.000000000,closed,1,Keepassxc whit amdgpu-pro 17.40 libdrm_amdgpu.so crash
1267,2017-12-10 21:18:24.000000000,2019-07-10 07:09:24.000000000,closed,11,"Security issues, when using the OS' keyring"
1266,2017-12-10 01:59:02.000000000,2017-12-10 03:10:53.000000000,closed,1,There is no support to enter unicode characters in keepassxc (linux)
1265,2017-12-09 02:26:37.000000000,2017-12-09 03:10:28.000000000,closed,5,Three Authentication Fields
1264,2017-12-09 02:13:34.000000000,2017-12-09 03:17:44.000000000,closed,1,"""Build and Install"" link in README.md is broken"
1263,2017-12-09 00:53:33.000000000,2017-12-09 02:28:43.000000000,closed,8,No option for favicon download
1262,2017-12-08 22:22:34.000000000,2017-12-19 16:40:54.000000000,closed,6,"Failed to open connection to ""session"" message bus:"
1261,2017-12-08 19:05:51.000000000,2017-12-09 02:29:36.000000000,closed,1,Enable translations for 'Extended ASCII' button
1260,2017-12-08 19:02:57.000000000,2017-12-17 20:44:13.000000000,closed,9,keepassxc-cli show gives reference string not value
1259,2017-12-08 08:44:10.000000000,2019-01-17 18:58:19.000000000,closed,4,Auto-open code needs to be in separate function
1258,2017-12-07 13:21:59.000000000,2018-01-03 20:03:18.000000000,closed,12,Pass command line filenames to already running instance
1257,2017-12-07 00:43:54.000000000,2019-07-10 05:55:47.000000000,closed,7,Interest in integration with OnlyKey
1256,2017-12-06 20:37:19.000000000,2017-12-06 20:39:47.000000000,closed,1,dmg file's Signature for release 2.2.2 seems not valid
1255,2017-12-06 17:59:11.000000000,2018-05-31 06:17:37.000000000,closed,13,Downloaded favicons are wrong
1254,2017-12-06 07:56:52.000000000,2018-05-24 11:43:09.000000000,closed,23,Crashing upon search
1253,2017-12-05 22:53:47.000000000,2017-12-06 02:03:56.000000000,closed,0,Resize message-close to 16x16 pixels
1252,2017-12-05 22:42:52.000000000,2017-12-06 21:10:27.000000000,closed,0,Quit the password generator with ESC key
1251,2017-12-05 15:10:02.000000000,2017-12-12 07:20:16.000000000,closed,1,"share/icons/application/16x16/actions/message-close.png is 22x22, not 16x16"
1250,2017-12-03 23:09:43.000000000,2017-12-04 19:46:24.000000000,closed,0,Rename EntropyMeter -> Estimate
1249,2017-12-03 17:28:00.000000000,2017-12-05 21:32:44.000000000,closed,4,Adds listener for Gnome specific screensaver activation
1248,2017-12-01 20:31:16.000000000,2018-06-11 02:17:26.000000000,closed,10,New feature: hexadecimal password generator
1247,2017-12-01 06:18:16.000000000,2017-12-16 20:42:13.000000000,closed,4,SSH Agent shows error on any entry with attachments
1246,2017-12-01 06:08:10.000000000,2017-12-01 06:13:32.000000000,closed,4,Verifying Windows Package
1245,2017-12-01 00:38:59.000000000,2018-09-26 01:26:30.000000000,closed,17,Support {PICKCHARS} feature
1244,2017-11-30 23:50:54.000000000,2019-04-18 13:07:59.000000000,closed,4,allow KeePassHTTP connection on all opened databases (tabs)
1243,2017-11-30 20:27:36.000000000,2017-11-30 20:28:17.000000000,closed,1,Authentication via TouchID
1242,2017-11-30 09:42:25.000000000,2018-01-31 02:03:18.000000000,closed,11,Add support for snapshot vs release builds
1241,2017-11-30 01:11:17.000000000,2018-09-11 05:49:56.000000000,closed,3,Add a shortcut to minimize to tray
1240,2017-11-29 19:42:04.000000000,2017-11-29 22:34:45.000000000,closed,6,Database already opened
1239,2017-11-29 05:45:21.000000000,2019-07-10 05:42:59.000000000,closed,0,Edit entry is also View Entry; missing search and highlight function
1238,2017-11-28 23:16:31.000000000,2018-01-03 16:36:50.000000000,closed,6,FTBFS with sshagent
1237,2017-11-28 14:33:08.000000000,2019-07-10 05:43:09.000000000,closed,2,The input method intercepts auto-input
1236,2017-11-28 04:50:07.000000000,2018-01-28 20:52:19.000000000,closed,0,L10n bug for WelcomeWidget
1235,2017-11-28 00:45:25.000000000,2017-11-28 02:48:04.000000000,closed,0,Treat warning as errors
1234,2017-11-27 13:32:59.000000000,2018-04-03 06:21:13.000000000,closed,20,Request confirmation to discard unsaved changes ( #1181)
1233,2017-11-27 12:29:25.000000000,2017-11-27 17:02:47.000000000,closed,1,Add column for entries: last modify date / creation date
1232,2017-11-27 05:31:52.000000000,2017-11-27 06:31:40.000000000,closed,0,Remove empty context menu from toolbar
1231,2017-11-27 04:38:03.000000000,2018-01-05 06:55:10.000000000,closed,8,Remove lock file and cleanup file handling
1230,2017-11-27 02:12:09.000000000,2018-01-14 03:45:09.000000000,closed,3,New Feature: KDBX4
1229,2017-11-26 21:12:55.000000000,2017-11-26 21:53:17.000000000,closed,0,Use Consolas on Windows for PasswordEdit
1228,2017-11-26 17:56:48.000000000,2017-11-26 22:18:35.000000000,closed,6,Add AppImage update information
1227,2017-11-26 08:41:43.000000000,2017-11-27 02:36:46.000000000,closed,3,Create docs directory and QUICKSTART.md instructions; editorial pass …
1226,2017-11-26 03:49:25.000000000,2017-11-26 21:53:38.000000000,closed,2,"Windows font: Can't distinguish ""1"" (one) and ""l"" (lower-case L)"
1225,2017-11-25 14:35:41.000000000,2017-11-25 20:19:47.000000000,closed,0,Add missing crypto init to OpenSSHKey test
1224,2017-11-25 14:25:58.000000000,2017-12-16 16:36:55.000000000,closed,16,SSH Agent: Split private key selection
1223,2017-11-25 07:03:28.000000000,2017-12-16 18:05:05.000000000,closed,12,"CSV import from LastPass failing, reason unknown"
1222,2017-11-24 17:51:31.000000000,2019-07-10 06:39:34.000000000,closed,3,Generate Usernames & Memorizeable Passwords
1221,2017-11-24 13:18:22.000000000,2017-11-24 19:56:26.000000000,closed,2,CLI can't be automated easily?
1220,2017-11-24 08:48:24.000000000,2017-11-24 15:50:44.000000000,closed,2,Add StartupWMClass field in .desktop file
1219,2017-11-23 22:59:30.000000000,2017-11-24 01:32:57.000000000,closed,0,Prevent database corruption when locked
1218,2017-11-23 20:58:37.000000000,2020-05-06 12:44:54.000000000,closed,5,Add setting to start on login
1217,2017-11-23 19:13:11.000000000,2017-11-23 21:04:42.000000000,closed,4,Docs: Trouble using KeePassXC with Dropbox
1216,2017-11-23 12:59:44.000000000,2019-05-31 03:50:21.000000000,closed,12,MacOS: Auto-Type when database locked causes main window to steal focus
1215,2017-11-23 05:22:57.000000000,2020-05-15 04:19:57.000000000,closed,17,"Yubikey remains ""open"" after use preventing other applications to use it"
1214,2017-11-23 04:05:54.000000000,2017-11-23 18:25:36.000000000,closed,4,Ctl-U stopped working for newbie [Solved]
1213,2017-11-23 02:21:34.000000000,2017-11-28 03:36:10.000000000,closed,9,memory leaks fixes in non-gui tests
1212,2017-11-22 17:18:23.000000000,2019-07-10 05:42:50.000000000,closed,4,Detection of directory `.git` fails with source archive
1211,2017-11-22 01:58:02.000000000,2017-12-17 20:44:13.000000000,closed,1,KeePassHTTP should resolve reference to username
1210,2017-11-21 20:33:42.000000000,1970-01-01 00:00:00.000000001,open,11,GPG encrypted keyfiles
1209,2017-11-21 06:18:43.000000000,2018-01-14 03:15:27.000000000,closed,10,Refactor continuous integration setup
1208,2017-11-21 05:57:29.000000000,2018-01-14 04:49:17.000000000,closed,4,[Feature Request] CSV import with created and modifed dates
1207,2017-11-21 05:29:12.000000000,2017-11-21 05:39:13.000000000,closed,0,Rename QTotp class name to Totp
1206,2017-11-20 23:25:05.000000000,2017-11-21 05:21:37.000000000,closed,13,Add initial Steam TOTP support
1205,2017-11-20 22:45:42.000000000,2017-11-20 22:54:19.000000000,closed,3,Fix startup delay
1204,2017-11-20 11:33:23.000000000,2017-11-20 17:59:45.000000000,closed,0,Focus database unlock dialog on macOS
1203,2017-11-20 11:10:45.000000000,2017-11-20 12:39:49.000000000,closed,1,Update Italian translation
1202,2017-11-20 09:06:41.000000000,2017-11-21 00:35:29.000000000,closed,0,Improve macOS pasteboard handling
1201,2017-11-20 00:07:37.000000000,2018-02-25 00:03:36.000000000,closed,4,[Feature Request] Run script on clipboard clearing
1200,2017-11-19 22:47:18.000000000,2017-12-16 16:36:55.000000000,closed,1,SSH Agent: How to use/store private keys is not obvious
1199,2017-11-19 22:35:28.000000000,2019-03-20 09:28:02.000000000,closed,2,SSH Agent: Closing a database tab does not trigger remove-on-lock
1198,2017-11-19 22:00:38.000000000,2018-02-13 08:07:49.000000000,closed,3,SSH Agent: Error about unsupported (old) key format is ambiguous
1197,2017-11-19 21:57:17.000000000,2018-01-31 02:03:18.000000000,closed,1,Alert users when using Debug builds
1196,2017-11-19 18:21:47.000000000,2020-02-23 19:19:35.000000000,closed,0,SSH Agent: Global enable/disable requires a restart
1195,2017-11-19 14:30:04.000000000,2018-02-27 18:19:29.000000000,closed,34,Suddenly unable to use ico images
1194,2017-11-18 19:53:41.000000000,2019-04-11 15:56:08.000000000,closed,4,UI sluggish on macOS
1193,2017-11-18 17:11:11.000000000,2017-11-19 17:07:43.000000000,closed,7,Add an 'e-mail' field in entries' menu
1192,2017-11-18 14:03:03.000000000,2017-11-18 15:09:00.000000000,closed,1,MacOS: no focus on Keepassxc window after pressing global auto-type shortcut
1191,2017-11-17 23:04:23.000000000,2018-04-02 17:52:06.000000000,closed,27,Code formatting
1190,2017-11-17 19:08:57.000000000,2017-11-17 19:10:55.000000000,closed,1,KeePassXC inhibits Plasma logout
1189,2017-11-17 03:06:26.000000000,2017-11-17 03:29:32.000000000,closed,5,How to uninstall on Ubuntu?
1188,2017-11-16 20:14:49.000000000,2017-11-24 03:35:23.000000000,closed,1,Forget keyfile path by honoring settings
1187,2017-11-16 05:03:52.000000000,2018-03-07 08:11:31.000000000,closed,6,"""Permission denied"" when trying to open read only password database"
1186,2017-11-15 20:33:01.000000000,2017-11-15 22:34:47.000000000,closed,3,I think without bottom filed that shows notes/comments it's useless
1185,2017-11-15 16:27:47.000000000,1970-01-01 00:00:00.000000001,open,54,--pw-stdin doesn't work on Windows
1184,2017-11-15 16:10:43.000000000,2017-11-15 17:08:25.000000000,closed,8,KeePassXC for Windows XP (feature request)
1183,2017-11-14 18:36:34.000000000,2017-11-15 01:21:50.000000000,closed,9,Please have all devs sign release key
1182,2017-11-14 16:22:50.000000000,2017-11-18 13:25:54.000000000,closed,2,Segmentation fault running 2.2.2 AppImage
1181,2017-11-14 14:59:25.000000000,2018-03-31 15:54:44.000000000,closed,15,Unsaved changes in the entry view silently get discarded if escape is pressed
1180,2017-11-13 02:55:11.000000000,2017-11-13 03:21:08.000000000,closed,3,multiple key slots (multiple master passwords)
1179,2017-11-13 00:41:55.000000000,2017-11-27 02:04:36.000000000,closed,17,Refactor and add support classes for KDBX 4
1178,2017-11-13 00:40:13.000000000,2017-12-01 00:10:03.000000000,closed,13,Implement search for reference placeholder based on fields other than ID
1177,2017-11-10 13:00:20.000000000,2018-02-24 23:55:47.000000000,closed,1,Redesign of Custom Fields (Suggestion)
1176,2017-11-09 16:43:11.000000000,2017-11-17 15:38:52.000000000,closed,3,Security issues with KeepassXC
1175,2017-11-09 14:23:25.000000000,2018-07-15 01:03:50.000000000,closed,4,"Allow closing window, but keeping the application running without tray icon"
1174,2017-11-07 22:48:03.000000000,2018-01-03 17:26:46.000000000,closed,5,Add warning on long Auto Type sequences
1173,2017-11-07 12:13:03.000000000,2019-07-10 05:42:16.000000000,closed,2,chromeIPass keeps getting disconnected
1172,2017-11-07 00:51:03.000000000,2017-11-07 01:08:28.000000000,closed,1,KeepassXC gpg verification with sig file output question
1171,2017-11-06 13:10:16.000000000,2017-11-06 16:00:39.000000000,closed,0,COPYING: remove a duplicated entry
1170,2017-11-06 11:22:49.000000000,2017-11-17 23:34:33.000000000,closed,2,Refactor base32 implementation
1169,2017-11-06 09:46:20.000000000,2018-02-06 06:30:15.000000000,closed,15,Remove qhttp; replace with curl and qhttpengine
1168,2017-11-05 21:46:47.000000000,2018-04-02 17:52:06.000000000,closed,5,Code formatting
1167,2017-11-04 23:30:42.000000000,2018-10-19 22:42:50.000000000,closed,44,QR Code generator
1166,2017-11-04 21:07:00.000000000,2017-11-12 19:33:54.000000000,closed,4,Fix TOTP Segfault in DetailsWidget #1156
1165,2017-11-04 00:28:06.000000000,2017-11-22 03:17:27.000000000,closed,2,Merge : Synchronising groups.
1164,2017-11-02 22:25:03.000000000,2017-11-03 15:13:07.000000000,closed,0,"Add test for DB creation, re-use ChnageMasterKeyWidget instance in CsvImportWizard"
1163,2017-11-02 15:36:28.000000000,2017-11-11 00:34:20.000000000,closed,2,Corrections on french translation
1162,2017-11-02 01:09:47.000000000,1970-01-01 00:00:00.000000001,open,13,Provide a visual indication for entries that contain unsaved changes [$5]
1161,2017-11-01 23:04:51.000000000,2019-07-10 05:42:27.000000000,closed,2,Login mainform auto-close on complete
1160,2017-11-01 22:00:33.000000000,2017-11-01 23:22:05.000000000,closed,3,passphrase could be a backdoor for yubikey or multiple yubikeys can be used
1159,2017-11-01 19:48:36.000000000,2018-01-29 01:19:16.000000000,closed,0,Auto backup database on save
1158,2017-11-01 04:33:36.000000000,2017-11-02 22:56:02.000000000,closed,2,Preview panel crops group icon if larger than 16x16
1157,2017-10-31 20:22:51.000000000,2017-11-26 22:24:04.000000000,closed,18,Can't automatically update the AppImage with AppImageUpdate
1156,2017-10-31 04:14:56.000000000,2017-11-12 19:33:57.000000000,closed,4,Segmentation fault opening database
1155,2017-10-30 22:06:21.000000000,2017-10-30 22:26:49.000000000,closed,1,HaveIBeenPwned Support?
1154,2017-10-30 20:50:55.000000000,2017-12-27 21:00:06.000000000,closed,5,Add dark tray icon parameter to settings.
1153,2017-10-30 19:03:10.000000000,2017-12-22 17:26:27.000000000,closed,16,Build MSI packages
1152,2017-10-30 14:46:32.000000000,1970-01-01 00:00:00.000000001,open,0,Allow reviewing changes before/after merging
1151,2017-10-30 13:31:05.000000000,2017-11-24 03:35:23.000000000,closed,36,Key file last position is remembered after session lock
1150,2017-10-30 00:42:36.000000000,2018-01-07 06:54:58.000000000,closed,7,"Add autotype settings to group and allow to use ""window associations"" in entry from parent groups."
1149,2017-10-29 20:15:34.000000000,2017-10-30 23:48:38.000000000,closed,2,Not so much an issue...
1148,2017-10-29 16:38:54.000000000,2018-05-10 01:05:38.000000000,closed,8,Provide MSI-based installer on Windows
1147,2017-10-29 15:23:14.000000000,2017-10-31 01:08:12.000000000,closed,8,Setting 'Minimize window at application startup' don't work as expected 
1146,2017-10-29 13:35:15.000000000,2017-10-31 02:36:10.000000000,closed,2,Save the geometry of main window only if the window is visible
1145,2017-10-28 22:59:40.000000000,2017-10-28 23:48:45.000000000,closed,6,Prevent crash with empty database
1144,2017-10-28 22:18:04.000000000,2017-12-05 02:51:14.000000000,closed,3,Add WMClass to the desktop file to have proper linking to the desktop file
1143,2017-10-28 21:34:17.000000000,2017-10-28 23:48:45.000000000,closed,5,Crash when creating a new database
1142,2017-10-28 21:10:04.000000000,2017-11-02 22:56:02.000000000,closed,12,Allow to change the height of the preview panel (fix #1135)
1141,2017-10-28 17:26:02.000000000,2017-11-07 00:27:15.000000000,closed,0,Fix apply button not saving new entries
1140,2017-10-28 03:58:59.000000000,2017-10-31 01:10:07.000000000,closed,13,Donate - how?
1139,2017-10-28 00:54:00.000000000,2017-11-12 20:55:08.000000000,closed,4,Add support for working with multiple entry attachments at once
1138,2017-10-28 00:12:41.000000000,2019-07-10 05:42:37.000000000,closed,2,Mainform UI
1137,2017-10-27 20:40:37.000000000,2017-12-01 00:10:03.000000000,closed,20,"Partial password may be leaked if it contains ""{"" and ""}"""
1136,2017-10-27 18:27:15.000000000,2019-07-10 05:42:08.000000000,closed,1,OTP auxillary file for Android NFC use?
1135,2017-10-27 11:23:33.000000000,2017-11-02 22:56:02.000000000,closed,8,GUI & layout issue in the preview panel
1134,2017-10-27 00:18:22.000000000,2017-10-28 16:42:18.000000000,closed,3,keepassxc.ini not included in 2.2.2 portable release
1133,2017-10-26 20:42:46.000000000,2017-11-22 07:56:57.000000000,closed,4,New entry is not saved when clicking Apply
1132,2017-10-26 16:45:09.000000000,2017-11-08 22:04:36.000000000,closed,8,Fix id and appdata validation failures (#1131)
1131,2017-10-26 16:27:13.000000000,2017-11-08 22:04:36.000000000,closed,3,Invalid Application ID and other AppStream Appdata Issues
1130,2017-10-26 14:49:11.000000000,2018-02-24 23:42:19.000000000,closed,11,Customise tray icon?
1129,2017-10-26 11:03:45.000000000,2019-07-10 06:39:05.000000000,closed,0,Search UI should allow us to find an entry within the results
1128,2017-10-25 23:02:51.000000000,2018-02-25 00:03:01.000000000,closed,1,[Feature Request] Form Fill
1127,2017-10-25 22:54:12.000000000,2017-10-25 22:54:38.000000000,closed,1,[Feature Request]
1126,2017-10-25 22:53:44.000000000,2018-02-25 00:01:20.000000000,closed,1,[Feature Request] Expand Tray Icon functionality - Search and History items
1125,2017-10-25 22:48:45.000000000,2018-02-25 00:00:39.000000000,closed,5,[Feature Request] expediate search method
1124,2017-10-25 18:54:52.000000000,2017-10-26 15:25:17.000000000,closed,1,Make notes hidden by default
1123,2017-10-25 15:08:08.000000000,2017-10-25 15:25:18.000000000,closed,1,Feature Request: Automatically focus search box in GUI
1122,2017-10-25 14:05:22.000000000,2017-10-25 15:57:35.000000000,closed,1,Regression AppImage KeePassXC-2.2.2-2-x86_64 no desktop integration
1121,2017-10-25 14:01:09.000000000,2017-10-25 14:35:41.000000000,closed,11,Provide Ubuntu/Debian/PPA Repository
1120,2017-10-25 11:22:59.000000000,2017-10-25 22:39:01.000000000,closed,2,[feature]
1119,2017-10-25 05:43:21.000000000,2017-10-25 18:45:52.000000000,closed,0,Disable reload prompt when db is locked
1118,2017-10-25 03:37:56.000000000,2017-11-21 00:35:28.000000000,closed,4,"Copy and Pasting Password into MatLab Installer gives ""wrong password"" error"
1117,2017-10-25 00:29:55.000000000,2017-11-22 08:23:36.000000000,closed,3,Some special characters does not work
1116,2017-10-24 21:31:13.000000000,2017-10-24 22:56:01.000000000,closed,2,Remove view menu and disable save button
1115,2017-10-24 18:53:20.000000000,2017-10-24 19:58:28.000000000,closed,0,Move build system back to Trusty (with fixes)
1114,2017-10-24 12:51:17.000000000,2017-10-24 20:00:54.000000000,closed,9,AppImage 2.2.2 is looking for libsystemd.so
1113,2017-10-24 06:33:20.000000000,2017-12-07 01:16:52.000000000,closed,10,AirDropping database can cause database corruption
1112,2017-10-23 21:35:19.000000000,2018-05-28 11:09:56.000000000,closed,6,KeepassXC - HTTP: does not respect the BestMatchOnly setting
1111,2017-10-23 20:24:57.000000000,2017-10-23 23:25:14.000000000,closed,6,Downloads page - what links work for Linux Mint 17.x and ubuntu 14.04?
