id,created_at,closed_at,state,comments,title
4083,2020-01-04 01:32:41.000000000,1970-01-01 00:00:00.000000001,open,0,"""Entry updated successfully"" shows up even when you don't change anything"
4082,2020-01-03 21:56:08.000000000,1970-01-01 00:00:00.000000001,open,2,Block auto-saving when performing multiple changes in a row
4081,2020-01-03 15:13:46.000000000,2020-01-03 19:12:53.000000000,closed,2,unable to copy user and password
4080,2020-01-03 08:04:00.000000000,2020-05-13 05:31:57.000000000,closed,6,Add direct option to Hide Window To System Tray When Closed
4079,2020-01-03 05:38:04.000000000,2020-05-22 20:15:38.000000000,closed,64,Not exiting on close of main window
4078,2020-01-03 01:13:28.000000000,2020-01-03 01:54:05.000000000,closed,1,On some Websites ALL Database entrys are shown
4077,2020-01-03 00:33:28.000000000,2020-05-17 01:41:11.000000000,closed,8,Merge from database overwrites Browser Integration Stored Keys in Database settings
4076,2020-01-02 15:23:54.000000000,2020-01-02 17:34:59.000000000,closed,2,'Failed to open key file: No such file or directory' error with file available
4075,2019-12-31 22:52:02.000000000,2020-01-04 04:08:26.000000000,closed,0,Last round of fixes for 2.5.2
4074,2019-12-30 09:53:58.000000000,2020-01-02 18:05:13.000000000,closed,3,FdoSecrets: only emit completed signal when the action actually finishes
4073,2019-12-30 07:49:33.000000000,1970-01-01 00:00:00.000000001,open,2,Native Linux notifications instead of tray icon notifications
4072,2019-12-29 23:31:00.000000000,2019-12-30 03:23:30.000000000,closed,1,QR code for wifi keys
4071,2019-12-29 18:19:12.000000000,2020-05-29 18:38:35.000000000,closed,60,Replace or augment existing database icons
4070,2019-12-29 10:32:50.000000000,1970-01-01 00:00:00.000000001,open,5,Deleting (moving to bin) an entry should produce an atime or mtime change
4069,2019-12-29 06:44:18.000000000,2020-05-14 23:17:32.000000000,closed,11,Unable to select 1password .opvault file for import
4067,2019-12-28 15:26:42.000000000,2019-12-28 17:56:53.000000000,closed,4,Please support Tor Browser and onion addresses
4066,2019-12-27 19:33:33.000000000,2020-01-11 23:00:16.000000000,closed,58,Convert all application icons to Material Design
4065,2019-12-27 17:04:11.000000000,2020-05-15 04:19:57.000000000,closed,15,Yubikey is not detected if already plugged
4064,2019-12-27 12:09:22.000000000,2019-12-28 01:06:51.000000000,closed,3,GPG integration
4063,2019-12-27 01:23:36.000000000,2020-01-28 03:55:36.000000000,closed,33,Enable browser-like DbTab experience (Alt + Nums)
4062,2019-12-26 22:21:45.000000000,2019-12-28 04:06:47.000000000,closed,4,"""Hide passwords"" option on main view keeps getting reset to show passwords"
4061,2019-12-26 17:20:44.000000000,2019-12-26 17:30:12.000000000,closed,1,Uninstalling when compiled
4060,2019-12-26 10:32:20.000000000,2020-06-04 18:03:42.000000000,closed,10,TOTP secrets not saved if set up from within entry
4059,2019-12-26 10:28:21.000000000,2020-05-30 18:42:51.000000000,closed,1,Clicking in the empty space of the groups section causes position in group to be reset
4058,2019-12-24 20:57:53.000000000,2019-12-24 21:09:41.000000000,closed,1,Crash on closing changed entry
4057,2019-12-23 23:05:12.000000000,1970-01-01 00:00:00.000000001,open,12,Shutdown blocked on MacOS 10.14
4056,2019-12-23 19:44:31.000000000,2020-07-10 02:29:25.000000000,closed,5,Improve SSH Agent Documentation
4055,2019-12-23 17:03:24.000000000,1970-01-01 00:00:00.000000001,open,9,Expand Donate page with Open Collective
4054,2019-12-23 14:03:20.000000000,2019-12-23 14:10:41.000000000,closed,2,Dark theme
4053,2019-12-22 21:03:18.000000000,2019-12-24 19:58:54.000000000,closed,7,global autotype - option to select the wanted item to use in case several items will match the matching conditions
4052,2019-12-22 20:43:47.000000000,2020-04-19 03:34:07.000000000,closed,7,KeePassXC Browser Chrome - enable autotype usage
4051,2019-12-22 19:06:40.000000000,2019-12-22 21:04:23.000000000,closed,3,"""merge from database"" without asking the password every time "
4050,2019-12-22 18:56:14.000000000,2019-12-24 21:35:41.000000000,closed,7,Error while reading the database: Unable to decompress binary
4049,2019-12-22 06:25:13.000000000,2019-12-23 08:22:23.000000000,closed,8,keepassxc-cli export should direct password prompt to /dev/stderr
4048,2019-12-21 03:38:58.000000000,1970-01-01 00:00:00.000000001,open,8,GPG Plugin
4047,2019-12-20 19:21:10.000000000,2020-07-15 02:28:20.000000000,closed,14,URL-Exact-Match didnt work in 2.5.2
4046,2019-12-20 11:52:31.000000000,2019-12-20 16:36:17.000000000,closed,1,"""Agent connection failed"" message on start and ""Add to agent"""
4045,2019-12-20 10:39:00.000000000,2019-12-22 03:43:31.000000000,closed,2,Segfault at 0 ip ... error 4 in keepassxc | Frequent Crashes
4044,2019-12-19 19:37:26.000000000,1970-01-01 00:00:00.000000001,open,2,Support CJK input in AppImage
4043,2019-12-19 15:56:36.000000000,2019-12-19 16:06:15.000000000,closed,3,Program-crash without saving after second time to apply a change in an entry (apply button)
4042,2019-12-19 15:40:25.000000000,2019-12-21 22:37:23.000000000,closed,8,"last opened entry should open automatically, when the program is restarted. "
4041,2019-12-19 14:22:51.000000000,2020-01-20 18:02:37.000000000,closed,6,"Removing Hardware Key protection (YubiKey) from database results in ""invalid credential"" error"
4040,2019-12-19 08:42:27.000000000,2019-12-19 18:15:08.000000000,closed,3,"When exporting a database to CSV, export all fields"
4039,2019-12-19 06:50:17.000000000,2020-04-19 03:44:18.000000000,closed,8,"KeePassXC Hangs: ""keepassxc has stopped responding"""
4038,2019-12-19 03:55:47.000000000,2020-03-07 18:29:54.000000000,closed,1,Display Current Database Path/name
4037,2019-12-18 05:51:39.000000000,2019-12-18 08:40:15.000000000,closed,1,Lock database after inactivity is not working with popup windows
4036,2019-12-18 02:44:16.000000000,2020-01-02 18:04:44.000000000,closed,1,FdoSecrets: fix searching of entries with special characters in attributes
4034,2019-12-17 21:21:32.000000000,2019-12-17 22:34:23.000000000,closed,1,import of csv file crashes
4033,2019-12-17 17:32:29.000000000,2019-12-21 08:17:31.000000000,closed,0,Remove extra check for additional URLs
4032,2019-12-17 17:10:58.000000000,2019-12-17 17:31:11.000000000,closed,1,Please compile the 2.5x package for Debian.
4031,2019-12-17 04:03:28.000000000,2019-12-22 15:28:00.000000000,closed,3,"Additional URLs potentially not found by the browser integration, if the first additional URL is deleted"
4030,2019-12-17 01:40:48.000000000,2019-12-17 03:18:28.000000000,closed,3,Application crash when performing multiple updates to a OneDrive synced database
4029,2019-12-16 21:40:50.000000000,1970-01-01 00:00:00.000000001,open,2,Improve inline autocomplete experience including disabling it
4028,2019-12-16 19:31:53.000000000,2020-01-19 18:44:28.000000000,closed,6,"Statisics shows problems, but does not show where"
4027,2019-12-16 18:30:06.000000000,1970-01-01 00:00:00.000000001,open,14,password generator - several requests
4026,2019-12-16 13:57:18.000000000,2019-12-22 03:26:42.000000000,closed,2,Move FeatureSummary include to top of CMakeLists
4025,2019-12-16 12:58:24.000000000,2019-12-23 00:02:15.000000000,closed,4,"[PRE-RELEASE] MacOS snapshot only runable on 10.15, not earlier versions"
4024,2019-12-16 12:48:57.000000000,2019-12-16 13:22:22.000000000,closed,11,Issues with compiling from source
4023,2019-12-16 03:37:20.000000000,2019-12-16 09:06:49.000000000,closed,13,Auto-Type does not find Firefox window using IP addresses
4022,2019-12-16 00:07:39.000000000,2019-12-16 00:38:45.000000000,closed,1,Windows 10 arm64 release
4021,2019-12-15 20:15:15.000000000,2019-12-15 21:04:14.000000000,closed,1,URL match bug
4020,2019-12-15 04:11:57.000000000,2020-05-23 19:30:32.000000000,closed,2,SSH Agent settings added to entry when not needed
4019,2019-12-15 03:01:10.000000000,2019-12-15 03:45:41.000000000,closed,1,Crash After Adding Custom Icon
4018,2019-12-15 01:47:45.000000000,2019-12-15 03:47:14.000000000,closed,1,Ability to unlock database by providing HMAC secret in the event a hardware key is lost
4017,2019-12-14 23:31:20.000000000,2019-12-15 17:51:26.000000000,closed,2,Autotype doesn't work after update
4016,2019-12-14 14:48:13.000000000,2019-12-14 19:06:51.000000000,closed,5,Merge loses unsaved changes when file on disk is changed
4015,2019-12-13 21:12:43.000000000,2019-12-13 21:14:55.000000000,closed,1,File dialog boxes disappear a few seconds when a database is open.
4014,2019-12-13 18:10:13.000000000,2019-12-13 18:23:54.000000000,closed,1,Browser Addons wants access to wrong passwords
4013,2019-12-13 13:59:22.000000000,2020-03-29 04:40:34.000000000,closed,3,Support hmac-secret capable hardware tokens
4012,2019-12-13 13:23:16.000000000,2019-12-16 03:09:21.000000000,closed,3,Support alternative password that erases the database
4011,2019-12-13 01:08:39.000000000,2019-12-13 01:46:42.000000000,closed,1,Segfaulting when importing csv
4010,2019-12-12 06:49:11.000000000,2019-12-12 06:58:16.000000000,closed,1,Keypass buggy with last versions of IOS
4009,2019-12-12 03:40:16.000000000,2019-12-28 04:47:25.000000000,closed,6,Cumulative updates to secret service integration
4008,2019-12-12 02:59:52.000000000,2019-12-28 09:20:46.000000000,closed,2,Secret Service Integration: fix all exposed entries are returned if search with empty terms
4007,2019-12-11 12:30:20.000000000,2019-12-20 09:29:35.000000000,closed,1,Load ssh key into agent from entry contextual menu
4006,2019-12-11 10:15:56.000000000,2019-12-13 16:11:03.000000000,closed,8,GUI test failed - Child aborted***Exception
4005,2019-12-11 04:31:45.000000000,2019-12-11 04:33:16.000000000,closed,4,"Windows 10 ""memory could not be read error"" 2.5.1"
4004,2019-12-10 20:36:39.000000000,2019-12-28 05:43:43.000000000,closed,4,KeepassXC not providing Freedesktop.Secrets after lock/unlock of database.
4003,2019-12-10 19:41:54.000000000,2019-12-10 19:55:21.000000000,closed,2,keepassxc browser integration breaks after upodate to FF71
4002,2019-12-10 19:08:52.000000000,2019-12-12 05:36:15.000000000,closed,2,Freedesktop.Secrets support for oauth2
4001,2019-12-10 18:54:43.000000000,2019-12-10 19:26:30.000000000,closed,2,Selected unlocking password: CTRL+Backspace jumps to front instead of removing typed characters
4000,2019-12-10 14:57:10.000000000,2019-12-29 16:52:52.000000000,closed,5,Cannot save/save as when open for several weeks
3999,2019-12-10 03:29:05.000000000,2020-01-04 19:18:12.000000000,closed,0,OPVault importer uses legacy attribute for TOTP secrets
3998,2019-12-10 01:44:34.000000000,1970-01-01 00:00:00.000000001,open,12,Add a browser integration tab in folders
3997,2019-12-10 00:25:40.000000000,2019-12-10 01:34:59.000000000,closed,1,Auto Type option doesn't do anything.
3996,2019-12-09 19:22:30.000000000,2019-12-09 19:46:05.000000000,closed,1,Latest firefox update (firefox-71.0-8.npgo) appears to disable key KeePassXC functions
3995,2019-12-09 15:55:01.000000000,2019-12-09 16:31:08.000000000,closed,1,On Fedora with Firefox service does not go really any more
3994,2019-12-09 02:08:14.000000000,2020-07-05 17:07:01.000000000,closed,4,Add option to ignore external database modifications
3993,2019-12-08 21:06:13.000000000,2020-02-01 19:30:13.000000000,closed,27,Password Health Check
3992,2019-12-08 20:50:29.000000000,1970-01-01 00:00:00.000000001,open,8,"Secret service not finding Username field, other issues"
3991,2019-12-08 19:55:50.000000000,2019-12-15 07:26:14.000000000,closed,2,Correct multiple issues with database saving
3989,2019-12-08 19:18:35.000000000,2019-12-08 20:11:22.000000000,closed,4,Autotype Inputs Incorrect
3988,2019-12-08 17:11:50.000000000,2019-12-08 18:08:59.000000000,closed,3,Support 58 char TOTP seeds
3987,2019-12-08 05:53:59.000000000,2019-12-08 08:51:13.000000000,closed,1,Have search function include additional text fields in search [enhancement]
3986,2019-12-07 23:38:26.000000000,2020-01-21 02:15:41.000000000,closed,1,Bug fix: Never show recycled items in statistics
3985,2019-12-07 22:58:08.000000000,2019-12-08 00:41:29.000000000,closed,2,Database write issues when database is on an automounted device
3984,2019-12-07 01:38:30.000000000,2019-12-07 08:03:34.000000000,closed,2,Are there any updates for Fedora 31?
3983,2019-12-06 19:16:38.000000000,2019-12-06 20:09:53.000000000,closed,7,Remove icon (single and bulk)
3982,2019-12-06 03:18:08.000000000,2019-12-06 03:37:43.000000000,closed,1,Allow Longer TOTP Secret Keys
3981,2019-12-06 01:09:49.000000000,1970-01-01 00:00:00.000000001,open,9,Dedicated URL field takes precedence over additional URLs when using multiple Databases
3980,2019-12-05 20:36:12.000000000,2019-12-05 20:58:21.000000000,closed,3,Database specific lock-timeouts
3979,2019-12-05 14:49:10.000000000,1970-01-01 00:00:00.000000001,open,0,Option to minimize to tray when manually locking database
3978,2019-12-05 11:05:42.000000000,2020-04-19 03:45:31.000000000,closed,9,Keepasssxc -  Login DataBase Fields are all mixed up.
3977,2019-12-05 09:48:33.000000000,2020-01-30 21:31:32.000000000,closed,12,Downloading favicon fails even though favicon exists on websites
3976,2019-12-04 23:56:13.000000000,2020-01-03 17:37:14.000000000,closed,3,Neo2 Layer 3 does not work in version 2.3.4 on macOS Mojave (QT BUG)
3975,2019-12-04 21:32:02.000000000,2019-12-06 20:11:27.000000000,closed,1,TOTP randomly doesn't work on multiple sites
3973,2019-12-04 15:41:41.000000000,1970-01-01 00:00:00.000000001,open,1,Attempt to reduce size of Windows deployment
3972,2019-12-04 14:42:52.000000000,2019-12-08 23:13:05.000000000,closed,4,Can't auto type when child window have title(Tencent TIM can't autotype password)
3971,2019-12-04 03:41:17.000000000,2019-12-04 09:16:47.000000000,closed,1,Spanish update
3970,2019-12-03 20:32:17.000000000,2019-12-19 18:05:53.000000000,closed,35,Yubikeys not recognized anymore (Mojave 10.14.6)
3969,2019-12-03 18:18:29.000000000,2020-05-30 18:54:44.000000000,closed,1,Root directory always selected after unlocking db
3968,2019-12-03 16:41:40.000000000,2020-01-28 21:14:52.000000000,closed,1,"OnlyKey not typing password into KeePasXC window, unless re-plugged in"
3967,2019-12-03 15:51:27.000000000,2020-01-09 18:21:24.000000000,closed,8,Pasting Notes in entry with CTRL + SHIFT + V crashes app
3966,2019-12-03 15:03:07.000000000,2019-12-03 16:45:22.000000000,closed,3,Password are shown and username are hidden
3965,2019-12-03 02:18:43.000000000,2019-12-03 03:22:38.000000000,closed,1,Inserting Password or Username only Hotkey-definition 
3964,2019-12-02 14:45:22.000000000,2019-12-02 16:02:55.000000000,closed,1,[Feature Request] Domain synonym
3963,2019-12-02 01:58:05.000000000,1970-01-01 00:00:00.000000001,open,0,View count of entries in each Group
3962,2019-12-02 00:55:58.000000000,2019-12-02 02:12:03.000000000,closed,3,Right click menu missing Add new entry to when in non-empty group
3961,2019-12-01 19:08:01.000000000,2019-12-22 03:39:52.000000000,closed,1,Fix keyfile from/to parameter collision
3960,2019-12-01 19:01:42.000000000,2019-12-01 19:30:19.000000000,closed,1,v2.5.1 for Mac constantly crashing on saving action
3959,2019-12-01 18:39:36.000000000,2019-12-01 18:54:08.000000000,closed,3,macOS: Keepassxc settings stay always in dark mode 
3958,2019-12-01 15:15:28.000000000,2019-12-08 20:26:19.000000000,closed,4,Currently there seems no way to update one passwords for several entries
3957,2019-12-01 15:13:27.000000000,1970-01-01 00:00:00.000000001,open,1,Add option to merge groups by name instead of UUID
3956,2019-12-01 14:43:03.000000000,2019-12-09 23:14:51.000000000,closed,4,Copy & Paste issues on Fedora 31
3955,2019-11-30 22:27:50.000000000,2020-01-08 02:16:59.000000000,closed,15,GNOME Evolution is unable to store/retrieve some passwords using Secret Service Integration
3954,2019-11-30 21:18:16.000000000,1970-01-01 00:00:00.000000001,open,11,The window immediately freezes on Fedora 31 
3953,2019-11-30 04:01:41.000000000,2020-01-02 18:07:51.000000000,closed,3,Save and restore command history for interactive CLI mode.
3952,2019-11-30 03:42:12.000000000,2019-12-21 20:09:23.000000000,closed,3,Fix crash upon exiting interactive mode if there is no current database.
3951,2019-11-30 02:36:06.000000000,2020-08-04 07:09:08.000000000,closed,0,Browser extension offers non-existent update on Ubuntu ARM platforms
3950,2019-11-29 03:23:59.000000000,2019-11-29 17:26:42.000000000,closed,11,"display bug, "
3949,2019-11-29 02:35:51.000000000,2019-11-29 03:14:40.000000000,closed,1,KeepassXC 2.5.1 Import of Chrome password CSV not including the URL in new database.
3948,2019-11-29 00:50:19.000000000,2019-11-29 01:38:39.000000000,closed,2,KeyPassXC 2.5.1 issues with MiniKeyPass 1.7.2
3947,2019-11-28 22:48:49.000000000,2020-01-31 01:46:48.000000000,closed,9,Add --username option to Clip command.
3946,2019-11-28 17:18:51.000000000,2019-12-21 19:25:58.000000000,closed,0,Partial fix for building on Mac OS X < 10.12
3945,2019-11-28 15:55:59.000000000,2020-05-30 19:02:13.000000000,closed,11,"Secret Service Integration not working: ""Another secret service is running"""
3944,2019-11-28 14:12:14.000000000,1970-01-01 00:00:00.000000001,open,0,Minimize instead of app exit prevents macOS restart
3943,2019-11-28 13:50:28.000000000,2019-12-29 19:02:56.000000000,closed,2,get segfault with --pw-stdin and MinimizeToTray=true
3942,2019-11-28 00:15:19.000000000,2019-11-28 02:17:54.000000000,closed,10,KeePassXC Keeps Crashing - Mac OS / Catalina
3941,2019-11-27 17:20:28.000000000,2019-12-15 10:11:25.000000000,closed,5,Merge popup randomly appears when kdbx file is on network share
3940,2019-11-27 15:24:29.000000000,2020-04-08 20:52:13.000000000,closed,3,Default the expiry date to today / add the preset
3939,2019-11-27 12:44:45.000000000,2020-01-23 15:08:50.000000000,closed,14,TOTP seems broken on ppc64le
3938,2019-11-27 08:08:31.000000000,2019-11-27 08:41:14.000000000,closed,9,KeepassXC crashes at start
3937,2019-11-27 08:01:42.000000000,2019-11-27 08:24:09.000000000,closed,1,Crashes when idling and quitting
3936,2019-11-27 07:16:20.000000000,2019-11-27 08:26:15.000000000,closed,2,Unable to drag passwords between folders on Linux
3935,2019-11-27 03:35:39.000000000,2019-11-27 06:19:02.000000000,closed,1,[Suggestion]I want to use the Bluetooth feature on my phone/watch to lock/unlock my password database.
3934,2019-11-26 20:26:54.000000000,2019-11-27 08:36:15.000000000,closed,5,CLI: provide password via environment variable
3933,2019-11-26 18:27:25.000000000,2019-12-15 10:11:24.000000000,closed,46,KeepassXC (Linux) crashing on Apply/OK/Cancel
3932,2019-11-26 14:49:07.000000000,2019-11-27 08:36:42.000000000,closed,1,2.5.1 on macports - compilation failure on macOS 10.11
3931,2019-11-26 02:48:06.000000000,2020-01-04 19:18:12.000000000,closed,0,AutoOpen only works if password is not empty
3930,2019-11-25 04:53:58.000000000,2019-11-25 19:48:57.000000000,closed,4,Cannot drag and drop entries between groups on Wayland (Fedora 31)
3929,2019-11-25 02:20:06.000000000,2020-04-29 00:03:42.000000000,closed,3,"Ability to export search results to CSV, HTML, etc"
3928,2019-11-24 22:55:23.000000000,2019-11-25 02:52:42.000000000,closed,4,MacOS keybindings are incorrect in recent commit
3927,2019-11-24 21:13:09.000000000,2019-12-22 03:28:28.000000000,closed,3,Add option to use entry only for HTTP Basic Auth
3926,2019-11-24 12:56:27.000000000,2019-11-24 13:26:51.000000000,closed,1,Move browser integration access key management from the DB level to the group level
3925,2019-11-24 12:49:40.000000000,2020-06-07 09:02:08.000000000,closed,1,Add HttpAuth flag
3924,2019-11-24 12:46:58.000000000,1970-01-01 00:00:00.000000001,open,0,Better design for SkipAutoSubmission
3923,2019-11-24 03:50:38.000000000,2019-11-24 04:08:44.000000000,closed,1,RFE: Historical password tracking / database
3922,2019-11-24 03:43:11.000000000,2019-12-21 19:25:18.000000000,closed,5,Fix memory leaks (mostly) in tests
3921,2019-11-23 22:03:48.000000000,2020-01-30 06:51:54.000000000,closed,9,Wrap XML data into QString to fix encoding
3920,2019-11-23 21:39:05.000000000,2019-11-23 21:49:38.000000000,closed,2,Spanish translation vocabulary changed
3919,2019-11-23 20:45:38.000000000,2019-11-29 18:36:17.000000000,closed,0,INSTALL.md: fix broken wiki link
3918,2019-11-23 20:29:51.000000000,2020-02-02 18:46:59.000000000,closed,0,Code Style: Fixes for minor issues found by static analysis
3917,2019-11-23 18:32:04.000000000,2019-11-23 19:57:00.000000000,closed,0,Fix typos in various .md files
3916,2019-11-23 06:40:59.000000000,1970-01-01 00:00:00.000000001,open,1,Icons are tiny and fonts are tiny and unreadable on regular laptop screen
3915,2019-11-23 01:18:44.000000000,2019-11-23 01:54:10.000000000,closed,1,Font Management
3914,2019-11-23 00:02:01.000000000,2019-11-29 18:37:21.000000000,closed,0,FdoSecrets: handle the exposed group being moved to recycle bin
3913,2019-11-22 23:40:23.000000000,1970-01-01 00:00:00.000000001,open,8,Search does not return results from Group Notes field
3912,2019-11-22 16:58:58.000000000,2019-12-21 19:22:17.000000000,closed,7,Show UI warning for invalid URL's
3911,2019-11-22 14:31:32.000000000,2019-12-10 16:11:09.000000000,closed,27," ""Toggle window"" hides window when minimized instead of showing"
3910,2019-11-22 03:17:22.000000000,2019-11-23 19:50:23.000000000,closed,1,HTML encode url in ElidedLabel
3909,2019-11-22 02:34:52.000000000,2019-11-23 02:53:17.000000000,closed,4,Use the full domain name when retrieving site icons.
3908,2019-11-21 23:35:48.000000000,2019-11-21 23:51:19.000000000,closed,1,"Password Variable for login. I have 3 medical same password, 3 veterans and Links with more  one logon screens. "
3907,2019-11-21 23:23:01.000000000,2019-11-21 23:51:45.000000000,closed,1,Speed control for auto type.  Some sites do not like fast entries
3906,2019-11-21 22:12:10.000000000,2019-12-15 08:25:01.000000000,closed,4,Database export timeout is too short
3905,2019-11-21 15:57:16.000000000,2019-12-15 10:11:24.000000000,closed,6,Clear-text password displayed in url of entry preview pane
3904,2019-11-21 15:55:33.000000000,2019-11-23 20:05:37.000000000,closed,2,Monospace Notes and passwords are too small on macOS
3903,2019-11-20 17:39:49.000000000,2019-11-20 19:48:52.000000000,closed,1,KeePassXC 2.5.1 return all credentials for same domain instead of best matching credentials
3902,2019-11-20 11:11:13.000000000,2019-11-20 12:56:48.000000000,closed,2,Brower-plugin: Specific URL will matches everything in the database
3901,2019-11-20 03:41:24.000000000,2020-05-21 22:13:20.000000000,closed,3,Add DB_DIR placeholder for autoopen urls
3900,2019-11-19 19:52:58.000000000,2020-01-30 06:51:54.000000000,closed,3,Bad encoding in XML export
3899,2019-11-19 05:09:33.000000000,2019-11-23 19:53:09.000000000,closed,1,Fix start minimized to tray for unix...
3898,2019-11-19 03:26:53.000000000,2019-11-23 20:04:13.000000000,closed,2,Right click behavior on macOS
3897,2019-11-18 17:16:43.000000000,2019-12-28 06:26:38.000000000,closed,6,Update INSTALL.md to include xvfb testing instructions
3896,2019-11-18 14:25:24.000000000,2019-11-20 17:30:16.000000000,closed,10,Extend KeePassXC to use vault as a storage backend
3895,2019-11-18 05:20:14.000000000,2020-05-11 01:23:55.000000000,closed,4,Selection of the path for Keeshare causes application hang
3894,2019-11-18 03:24:33.000000000,2019-11-18 04:33:51.000000000,closed,2,[2.3.1] Database is read only
3893,2019-11-18 01:43:09.000000000,2020-03-10 07:08:44.000000000,closed,6,Ignore focus when checking toolbar state
3892,2019-11-18 00:35:38.000000000,2019-11-23 18:14:00.000000000,closed,0,Correctly initialize standalone PW generator mode
3891,2019-11-17 19:30:58.000000000,2019-11-17 19:47:36.000000000,closed,1," Option ""Safely save database files"" changes the creation date of the keepass file"
3890,2019-11-17 18:58:44.000000000,2019-12-10 09:25:07.000000000,closed,8,Frequest Crashes (Editing/Icon Download)
3889,2019-11-17 18:06:07.000000000,2019-11-23 18:15:19.000000000,closed,2,Release database before exiting CLI interactive mode
3888,2019-11-17 16:51:00.000000000,2019-11-17 17:23:10.000000000,closed,1,KeeShare live synchronize issues
3887,2019-11-17 14:45:06.000000000,2019-12-28 04:15:21.000000000,closed,4,[2.5.1] Crash when clicking different tab while database is decrypting
3886,2019-11-17 14:36:02.000000000,1970-01-01 00:00:00.000000001,open,0,Yubikey support when starting keepassxc with pw-stdin
3885,2019-11-17 13:23:07.000000000,2019-11-23 19:56:40.000000000,closed,3,Disable DB open form while loading DB
3884,2019-11-17 12:13:31.000000000,2019-11-18 04:36:22.000000000,closed,4,KeepassXC blocking yubikey static password input (Ubuntu 19.10)
3883,2019-11-17 11:57:26.000000000,2019-11-18 09:24:49.000000000,closed,3,Could not open keepassxc database if it's on veracrypt volume (Ubuntu 19.10)
3882,2019-11-17 09:06:15.000000000,1970-01-01 00:00:00.000000001,open,0,Copying password from the auto-type popup does not follow references
3881,2019-11-17 06:42:36.000000000,2019-11-17 21:08:38.000000000,closed,2,date of last modified entries in db 
3880,2019-11-17 03:51:19.000000000,2019-11-23 18:15:19.000000000,closed,0,Crash when quitting interactive mode
3879,2019-11-17 02:38:19.000000000,2019-11-23 18:15:59.000000000,closed,0,Only show warning about snap browsers on Linux
3878,2019-11-17 02:25:56.000000000,2019-11-17 03:24:43.000000000,closed,2,Question: No -Auto-type UI when only one account?
3877,2019-11-17 00:15:20.000000000,2019-11-23 20:07:40.000000000,closed,3,Add ability to hide a protected attribute after reveal
3876,2019-11-16 22:43:26.000000000,2020-03-10 07:35:56.000000000,closed,1,Allow defining additional characters for the password generator
3875,2019-11-16 19:24:26.000000000,2020-04-11 21:01:45.000000000,closed,4,Yubikey static password keepassxc stores shift key modifer 
