id,created_at,closed_at,state,comments,title
2805,2019-03-20 04:10:48.000000000,2019-04-15 22:16:50.000000000,closed,2,Improve resilience against memory attacks
2804,2019-03-19 23:28:17.000000000,2019-03-20 00:15:07.000000000,closed,2,Repair with 'Challenge Response' does not work
2803,2019-03-19 17:21:05.000000000,1970-01-01 00:00:00.000000001,open,3,macOS: Opening a database should use ${LastDir} not Finder default
2802,2019-03-19 01:15:12.000000000,2019-03-19 22:46:31.000000000,closed,4,Final PR for 2.4.0
2801,2019-03-18 19:00:54.000000000,2019-03-19 17:10:09.000000000,closed,5,Entry Display Garbled for One User of Same Database
2800,2019-03-18 13:08:07.000000000,2019-03-18 17:10:19.000000000,closed,3,change shortcut to close windows instead of database on macOS-Version
2799,2019-03-18 04:23:20.000000000,2019-11-12 01:28:27.000000000,closed,7,KeeShare should respect relative paths
2798,2019-03-18 04:21:36.000000000,1970-01-01 00:00:00.000000001,open,12,Recycle Bin is Imported using KeeShare
2797,2019-03-18 02:00:48.000000000,2019-03-19 16:15:47.000000000,closed,6,Pam module to auto-unlock default db with login password
2796,2019-03-17 22:19:17.000000000,2019-07-10 07:11:10.000000000,closed,7,Support extra Places from KIO in KDialog
2795,2019-03-17 18:48:20.000000000,2019-03-18 02:28:57.000000000,closed,0,Remediate errors in various favicon fetch scenarios (#2779)
2794,2019-03-17 16:12:08.000000000,2019-03-17 17:42:06.000000000,closed,2,AutoOpen with remote files
2793,2019-03-16 20:04:01.000000000,2019-07-10 06:25:38.000000000,closed,12,Minimizes to tray only once on copying to clipboard
2792,2019-03-15 19:36:34.000000000,2020-04-19 03:52:05.000000000,closed,5,Cannot open files through KDE Google Drive
2791,2019-03-15 09:37:34.000000000,2019-03-24 18:15:36.000000000,closed,3,Developer VM for KeePassXC
2790,2019-03-14 13:01:03.000000000,2019-03-18 04:13:46.000000000,closed,1,Allow creating new groups with Browser Integration
2789,2019-03-12 21:08:14.000000000,2019-03-12 21:10:28.000000000,closed,5,Add OpenPGP / assymetric encryption support
2788,2019-03-12 18:39:17.000000000,2019-11-02 06:01:12.000000000,closed,2,Access control dialog does not show the submitUrl
2787,2019-03-12 06:46:33.000000000,1970-01-01 00:00:00.000000001,open,4,QObject::startTimer message when run in console
2786,2019-03-12 05:28:22.000000000,1970-01-01 00:00:00.000000001,open,2,Option to close KeePassXC instead of locking the DB
2784,2019-03-11 16:22:52.000000000,2019-03-26 12:55:19.000000000,closed,5,PPA builds for Ubuntu 19.04 Disco Dingo
2783,2019-03-11 15:47:47.000000000,2019-03-18 23:58:05.000000000,closed,7,KeepassXC: Prove the authenticity of the downloaded file
2782,2019-03-10 19:21:18.000000000,2019-03-11 01:44:09.000000000,closed,5,Diceware passphrase words in other languages than english
2781,2019-03-10 19:07:35.000000000,2019-03-10 19:11:18.000000000,closed,1,Shortcuts in Windows 10 aren't shown in the right-clic menu
2780,2019-03-10 15:13:30.000000000,2019-07-10 05:19:44.000000000,closed,2,Database has null bytes after setting up chrome integration
2779,2019-03-10 13:40:37.000000000,2019-03-24 18:09:00.000000000,closed,14,Using google as fallback for getting an icon causes memory leak in gnome 3 wayland
2778,2019-03-10 05:14:59.000000000,2019-03-12 06:16:32.000000000,closed,7,touch screen use causes application hang
2777,2019-03-10 01:35:17.000000000,2019-03-10 04:12:02.000000000,closed,1,accounts.firefox.com Not working
2776,2019-03-09 21:16:49.000000000,2019-03-09 21:28:43.000000000,closed,1,More granular control over passwords
2775,2019-03-09 05:07:44.000000000,2019-03-13 00:02:20.000000000,closed,3,Cannot open a database that uses a keyfile
2774,2019-03-08 19:00:28.000000000,2019-03-21 01:23:11.000000000,closed,6,src/cli/CMakeLists.txt: Don't call mandb
2773,2019-03-08 16:57:59.000000000,2019-03-25 12:50:51.000000000,closed,3,[PRE-RELEASE] Opening database via dbus doesn't unlock already open DB
2772,2019-03-08 16:36:48.000000000,2019-03-08 17:11:27.000000000,closed,4,Automatic password changes
2771,2019-03-07 23:56:23.000000000,2019-03-08 03:58:15.000000000,closed,1,[PRE-RELEASE] The about dialog can be resized and maximized
2770,2019-03-07 22:16:39.000000000,2019-03-25 00:42:53.000000000,closed,13,KeePassXC 2.4.0beta2 cannot open database with Legacy Key File
2768,2019-03-06 11:18:21.000000000,2019-06-19 17:36:11.000000000,closed,29,[PRE-RELEASE] Basic auth with chrome plugin not working and stall the browser
2767,2019-03-06 06:13:08.000000000,2019-03-06 13:42:20.000000000,closed,2,Random Password length
2766,2019-03-06 01:20:38.000000000,2019-11-06 23:09:55.000000000,closed,2,Gracefully handle known error messages in SSH-Agent
2765,2019-03-05 19:30:22.000000000,2019-10-16 09:59:51.000000000,closed,7,KeePassXC Browser 1.3.2 connect button doesn't work.
2764,2019-03-05 13:44:06.000000000,1970-01-01 00:00:00.000000001,open,5,Add '--lock' option to keepassxc executable
2763,2019-03-04 14:27:01.000000000,2019-03-07 06:46:13.000000000,closed,0,Small fixes for Browser Integration
2762,2019-03-04 01:20:22.000000000,2019-03-06 00:59:45.000000000,closed,3,SSH Agent: Agent protocol error: prompt constraints are not supported
2761,2019-03-02 19:35:24.000000000,2019-03-22 22:09:57.000000000,closed,7,[pre-release] KeeShare options don't show certificate panel
2760,2019-03-02 03:51:33.000000000,2019-04-06 08:58:19.000000000,closed,32,All passwords corrupted
2759,2019-03-02 01:37:30.000000000,2020-08-04 02:21:39.000000000,closed,7,Add button to keep database temporarily unlocked
2758,2019-03-01 18:01:44.000000000,2019-03-01 19:19:12.000000000,closed,0,Add missing colon to SettingsWidgetKeeShare.ui
2757,2019-03-01 13:44:46.000000000,1970-01-01 00:00:00.000000001,open,0,Quick navigation to shared group
2756,2019-02-28 22:43:48.000000000,2019-02-28 23:07:23.000000000,closed,1,"No ""Use OpenSSH for Windows"" checkbox on Windows"
2755,2019-02-28 21:33:51.000000000,1970-01-01 00:00:00.000000001,open,1,Autotype doesn't work in Connectwise Control
2754,2019-02-28 20:12:52.000000000,2019-06-29 05:55:21.000000000,closed,3,Support for OnlyKey
2753,2019-02-28 17:28:58.000000000,1970-01-01 00:00:00.000000001,open,2,Lock database on suspend/hibernate only (not on screen lock)
2752,2019-02-28 07:21:29.000000000,2019-03-07 06:45:20.000000000,closed,0,fix(YubiKey): call `yk_release` on errors
2751,2019-02-28 05:49:07.000000000,2019-03-07 19:31:02.000000000,closed,19,"""Agent refused this identity"" on Windows 10 Pro with v2.3.4 installed using chocolatey"
2750,2019-02-27 22:28:21.000000000,2019-02-28 04:35:19.000000000,closed,7,"Windows  - Default Path Options for ""Open existing database"" "
2749,2019-02-27 19:47:25.000000000,2019-06-30 02:34:50.000000000,closed,8,Error loading/saving password generator settings with special character types
2748,2019-02-27 18:47:03.000000000,1970-01-01 00:00:00.000000001,open,2,Splitted KeeShare references
2747,2019-02-27 18:35:48.000000000,1970-01-01 00:00:00.000000001,open,17,Improved KeeShare share configuration
2746,2019-02-27 18:06:32.000000000,2019-03-16 06:39:47.000000000,closed,3,Hotfix/2657 prevent share overwrite
2745,2019-02-26 22:55:49.000000000,2019-03-26 21:46:21.000000000,closed,5,[PRE-RELEASE] KeePassXC Snapshot (Feb 15) does not support macOS 10.13
2744,2019-02-26 20:25:11.000000000,2019-02-26 20:45:32.000000000,closed,7,Cloud integration with master keepass file
2743,2019-02-26 17:41:14.000000000,2019-02-26 17:42:54.000000000,closed,3,Key file remembered after close
2742,2019-02-26 15:01:48.000000000,2019-03-07 20:57:14.000000000,closed,2,Add share indication label in group view
2741,2019-02-26 04:32:12.000000000,1970-01-01 00:00:00.000000001,open,25,Allow picking specific Monospace font
2740,2019-02-26 03:30:31.000000000,2019-11-14 17:45:12.000000000,closed,9,"[PRE-RELEASE] In macOS dark mode, tab display colors are wrong (2.4.0-beta2)"
2739,2019-02-25 22:12:28.000000000,2019-03-07 06:40:43.000000000,closed,0,Add clear functionality to group share settings
2738,2019-02-25 22:09:37.000000000,2019-03-07 06:40:28.000000000,closed,0,Improve messages and fix issue in ShareObserver
2736,2019-02-25 02:22:00.000000000,2019-02-25 02:57:04.000000000,closed,1,Flatpaked KeePassXC doesn't add SSH key to agent.
2735,2019-02-25 01:16:45.000000000,2019-07-10 05:38:58.000000000,closed,1,"Keepassxc doesn't send ""ENTER"""
2734,2019-02-24 17:59:19.000000000,1970-01-01 00:00:00.000000001,open,14,Crash on getting a favicon on a connection reset
2733,2019-02-24 00:27:53.000000000,2019-03-24 18:13:50.000000000,closed,4,Add button to open Custom Auto-type sequence documentation
2732,2019-02-23 06:42:54.000000000,2019-03-20 03:26:41.000000000,closed,0,Improve resilience against memory attacks
2731,2019-02-23 03:34:00.000000000,2019-02-26 04:09:56.000000000,closed,0,More 2.4.0 Code Improvements
2730,2019-02-22 04:06:26.000000000,2019-02-22 04:29:08.000000000,closed,1,No KeeShare in OSX
2729,2019-02-21 23:15:56.000000000,2020-04-18 16:44:23.000000000,closed,9,Export from Keepass1 .kdb database segfaults
2728,2019-02-21 15:08:51.000000000,2019-06-19 06:06:51.000000000,closed,7,Password generation option for Add and Edit (CLI)
2727,2019-02-21 11:51:05.000000000,2019-07-10 07:12:50.000000000,closed,1,Not able to type in password field when restoring KeepassXC from tray
2726,2019-02-21 11:15:39.000000000,2019-05-12 20:35:44.000000000,closed,32,[RFC] Implement Freedesktop.org Secret Storage spec server side API
2724,2019-02-21 09:45:18.000000000,2020-08-04 02:26:15.000000000,closed,9,Clipboard vulnerability; replace everywhere by Drag & Drop
2723,2019-02-21 07:10:50.000000000,2019-02-24 17:38:50.000000000,closed,0,fix(NativeMessagingBase): always close epoll/kqueue file descriptor
2722,2019-02-21 06:21:32.000000000,2019-02-21 06:30:43.000000000,closed,0,Minimize and close the application in the Systray
2721,2019-02-21 05:39:33.000000000,2019-03-09 20:48:32.000000000,closed,11,`timerfd` file descriptors leak
2720,2019-02-21 04:14:48.000000000,2019-03-20 03:24:19.000000000,closed,13,TouchID not working (in 2.4.0 Beta 2)
2719,2019-02-20 19:06:50.000000000,2020-07-13 22:14:32.000000000,closed,8,Minimize again after autotype
2718,2019-02-20 14:08:58.000000000,2019-02-22 03:39:20.000000000,closed,26,SecurityEvaluators (ise) vulnerabilities of Password managers
2717,2019-02-20 03:24:27.000000000,2019-07-10 07:13:02.000000000,closed,2,"KeePassXC flashes on screen, then disappears when being opened after minimized"
2716,2019-02-19 23:59:22.000000000,2019-04-04 17:51:33.000000000,closed,3,Weird context menu position
2715,2019-02-19 23:19:24.000000000,2019-03-20 14:04:42.000000000,closed,3,Browser plugin URL matching should match https by default
2714,2019-02-19 06:33:02.000000000,2019-03-24 16:35:34.000000000,closed,0,Adding debug info to CLI.
2713,2019-02-18 23:33:59.000000000,2019-04-11 18:22:02.000000000,closed,0,"Language setting requires you to restart the program, but doesn't tell you so"
2712,2019-02-18 17:33:33.000000000,2019-02-18 17:35:49.000000000,closed,2,Keyboard Shortcut for 'Cycle through opened tabs'
2711,2019-02-18 15:45:11.000000000,2019-02-18 21:21:03.000000000,closed,0,"Prevent unnecessary key transformations, resolves #2704"
2710,2019-02-18 00:53:24.000000000,2019-05-31 06:04:37.000000000,closed,6,Add YubiKey support on CLI.
2709,2019-02-17 01:03:17.000000000,2019-02-18 18:26:57.000000000,closed,0,Code quality updates for 2.4.0
2708,2019-02-17 00:39:26.000000000,2019-03-24 17:23:28.000000000,closed,4,Adding --no-password option to CLI
2707,2019-02-16 18:40:16.000000000,2019-06-25 23:37:41.000000000,closed,10,Add support for Offline HIBP password checker
2706,2019-02-16 00:35:54.000000000,2019-03-20 14:05:06.000000000,closed,11,Auto-update keepassxc-proxy path in org.keepassxc.keepassxc_browser.json
2705,2019-02-15 13:49:43.000000000,2019-02-15 14:04:33.000000000,closed,1,keepassxc cli ls (LS) doesn't work with key file.
2704,2019-02-14 04:23:32.000000000,2019-03-14 01:52:48.000000000,closed,3,YubiKey must press button twice in New Database Wizard
2703,2019-02-14 00:10:13.000000000,2019-11-01 05:41:07.000000000,closed,1,Group manipulation commands for CLI
2702,2019-02-13 22:49:43.000000000,2019-02-14 00:10:47.000000000,closed,3,Enable use of HiDPI pixmaps by QT
2701,2019-02-13 21:54:47.000000000,2019-02-13 23:26:41.000000000,closed,1,Verification failure?
2700,2019-02-13 14:45:32.000000000,2019-02-13 16:37:36.000000000,closed,1,"Building for windows OS, not just on windows OS"
2699,2019-02-13 04:34:08.000000000,2019-03-20 03:24:19.000000000,closed,0,[PRE-RELEASE] Shutdown application when receiving close message
2698,2019-02-13 03:22:20.000000000,2019-02-13 23:24:55.000000000,closed,1,Refactoring database extraction
2697,2019-02-13 01:51:14.000000000,2019-03-18 07:16:57.000000000,closed,0,[PRE-RELEASE] Shutdown keepassxc-proxy when receiving close message
2696,2019-02-12 18:17:40.000000000,2019-03-24 17:31:55.000000000,closed,2,Add Haiku support
2695,2019-02-12 08:03:58.000000000,2019-02-15 18:56:30.000000000,closed,0,Fix quiet option for Merge (CLI)
2694,2019-02-12 04:33:37.000000000,2019-04-06 08:45:11.000000000,closed,1,Improve message dialog when locking database
2693,2019-02-12 01:04:09.000000000,2019-02-13 23:28:05.000000000,closed,12,Cannot convert KDBX 4 to KDBX 3.1 or KeePassXC 2.4.0 beta seems to auto convert to KDBX 4
2692,2019-02-11 18:21:11.000000000,2019-06-01 00:18:11.000000000,closed,48,KeePassXC stops shutdown on some Linux distributions
2691,2019-02-11 07:24:34.000000000,2019-03-18 04:43:05.000000000,closed,2,"Search Results Disappear, but preview remains on screen"
2690,2019-02-10 22:16:13.000000000,2019-02-11 04:38:35.000000000,closed,2,Search by group name
2689,2019-02-10 20:22:16.000000000,1970-01-01 00:00:00.000000001,open,13,Allow keyboard shortcut customization in settings
2688,2019-02-10 00:24:21.000000000,2019-11-02 06:03:36.000000000,closed,3,Priority for logins on the same domain for filling passwords
2687,2019-02-09 06:36:22.000000000,1970-01-01 00:00:00.000000001,open,1,Search results without Backups
2686,2019-02-08 04:23:13.000000000,2019-02-11 19:54:56.000000000,closed,2,Crash on Right-click in System Tray
2685,2019-02-07 07:55:38.000000000,2019-02-10 20:11:04.000000000,closed,12,Document steps to reauthorize MacOS accessibility control for auto type
2684,2019-02-06 03:00:09.000000000,2019-03-20 03:24:19.000000000,closed,1,[PRE-RELEASE] KeePassXC fails to resolve the entry reference if the referenced entry is in a different group
2683,2019-02-05 21:17:39.000000000,2019-02-15 18:56:12.000000000,closed,0,Updated contributors in about dialog
2682,2019-02-05 15:05:39.000000000,2019-02-05 16:46:38.000000000,closed,3,Easy and efficent way using / unlocking a password-and-key secured database
2681,2019-02-04 19:58:36.000000000,2019-02-04 20:48:10.000000000,closed,3,How to generate key file?
2680,2019-02-04 19:56:21.000000000,2019-02-04 20:50:51.000000000,closed,4,Does changing the master-password change the keyfile also?
2679,2019-02-04 13:51:12.000000000,2019-02-05 20:36:28.000000000,closed,2,"Implement sync feature with other password managers: KWallet, Gnome Keyring, etc"
2678,2019-02-04 13:46:26.000000000,2019-02-04 16:55:19.000000000,closed,1,invalid keyobard layout used when auto-typing
2677,2019-02-04 05:34:46.000000000,2019-02-04 15:39:28.000000000,closed,2,"Two password boxes, simultaneously"
2676,2019-02-03 21:46:43.000000000,2019-02-15 19:01:30.000000000,closed,0,TouchID not working (in 2.4.0 Beta 1)
2675,2019-02-03 15:56:25.000000000,2019-10-16 09:58:09.000000000,closed,3,Search in all opened databases breaks if one database is locked
2674,2019-02-03 00:28:20.000000000,2019-02-15 19:01:30.000000000,closed,4,[PRE-RELEASE] Crash when opening database with corrupt favicons
2673,2019-02-02 13:11:18.000000000,2019-02-02 13:26:38.000000000,closed,1,Fetch 2FA code through the browser extension
2672,2019-02-02 08:45:23.000000000,1970-01-01 00:00:00.000000001,open,4,CMD + W doesn't close window
2671,2019-02-02 03:52:35.000000000,2019-02-15 19:01:30.000000000,closed,3,[PRE-RELEASE] TOTP no longer works with OTP settings from Keepass
2670,2019-02-02 00:00:11.000000000,2019-02-02 03:03:28.000000000,closed,4,Fix group signals
2669,2019-02-01 16:52:49.000000000,2019-02-02 01:28:03.000000000,closed,1,Add progressbar for clipboard cleaning
2668,2019-02-01 16:27:27.000000000,2019-07-10 06:18:41.000000000,closed,3,Bring main window to front when reopening database from browser extension
2667,2019-02-01 03:57:23.000000000,2019-02-06 02:09:18.000000000,closed,2,Various minor fixes for 2.4.0
2666,2019-01-31 21:26:02.000000000,2020-08-03 06:27:14.000000000,closed,1,"Add an ""include"" directive to keepassxc.ini"
2665,2019-01-31 15:46:37.000000000,1970-01-01 00:00:00.000000001,open,10,"Disable ""Perform Autotype"" button by default."
2664,2019-01-31 14:56:20.000000000,2019-02-07 05:10:36.000000000,closed,2,expiration notifications
2663,2019-01-31 04:48:44.000000000,2019-01-31 12:28:32.000000000,closed,2,"Crash for no apparent reason, timers cannot have negative intervals"
2662,2019-01-31 04:03:51.000000000,2019-01-31 05:43:16.000000000,closed,4,Use password *or* key file
2661,2019-01-30 21:18:14.000000000,2019-01-31 05:44:09.000000000,closed,1,Auto-type doesn't insert @-symbol in spotify(linux)
2660,2019-01-30 18:40:52.000000000,1970-01-01 00:00:00.000000001,open,10,Separate lock for browser plugin
2659,2019-01-30 02:24:33.000000000,2019-01-31 05:45:41.000000000,closed,0,Cleanup CMakeFiles and revert Dockerfile changes
2658,2019-01-29 09:09:27.000000000,1970-01-01 00:00:00.000000001,open,3,"KeeShare should allow for ""temporary"" import"
2657,2019-01-29 09:03:32.000000000,2019-03-18 04:23:54.000000000,closed,11,KeeShare Consolidated Issues
2656,2019-01-27 16:17:37.000000000,2019-02-25 02:55:58.000000000,closed,7,KeePassXC-Browser in flatpaked Firefox doesn't connect to flatpaked KeePassXC
2655,2019-01-27 14:31:00.000000000,2019-03-20 14:05:35.000000000,closed,0,Browser extension(s) disconnect if Recycle Bin is created or deleted
2654,2019-01-27 09:37:59.000000000,2020-01-11 06:01:50.000000000,closed,25, Build fails on windows
2653,2019-01-27 09:16:10.000000000,2020-06-04 18:35:37.000000000,closed,9,Minimize on startup setting is broken on macOS
2652,2019-01-26 21:40:03.000000000,2019-11-12 01:31:18.000000000,closed,20,High idle CPU usage
2651,2019-01-26 11:05:08.000000000,1970-01-01 00:00:00.000000001,open,8,Close database based on last access time
2650,2019-01-26 03:10:42.000000000,2019-01-26 03:25:08.000000000,closed,1,Feature Request / bug report: is it really the case that . .
2649,2019-01-26 01:37:48.000000000,2019-01-26 01:48:49.000000000,closed,1,"Import only from format kb *1*, when KeePass proper has trouble exporting in that format?"
2648,2019-01-25 18:10:05.000000000,2019-01-30 19:11:51.000000000,closed,5,Update checking feature
2647,2019-01-25 00:55:21.000000000,2019-03-21 04:36:18.000000000,closed,0,Change wording on KeePassXC-Browser upgrade dialog in 2.4.0
2646,2019-01-24 21:24:12.000000000,2019-05-17 22:44:44.000000000,closed,5,Protect settings with password
2645,2019-01-24 21:13:45.000000000,1970-01-01 00:00:00.000000001,open,0,"Add ""Cancel"" button to unlock dialog to halt database unlock"
2644,2019-01-24 18:27:06.000000000,2019-01-24 23:52:45.000000000,closed,5,Unlock database command/shortcut
2643,2019-01-24 15:37:05.000000000,2019-03-07 06:45:20.000000000,closed,1,"""Too many open files"" error when unlocking"
2642,2019-01-24 04:35:24.000000000,2019-05-31 02:03:02.000000000,closed,13,Database does not lock on switching user in macOS
2641,2019-01-24 03:00:47.000000000,2019-01-24 03:13:10.000000000,closed,9,Stop Closing Issues
2640,2019-01-24 01:48:00.000000000,2019-01-24 02:24:19.000000000,closed,1,Unity is not XFCE or Gnome or KDE
2639,2019-01-24 01:23:50.000000000,2019-04-11 15:54:03.000000000,closed,8,Larger Icons
2638,2019-01-23 19:21:02.000000000,1970-01-01 00:00:00.000000001,open,6,Tree view for multiple databases
2637,2019-01-23 12:46:00.000000000,2019-01-30 19:48:22.000000000,closed,2,Select group when adding credentials from browser extension
2636,2019-01-22 18:37:49.000000000,1970-01-01 00:00:00.000000001,open,5,Optionally disable stream ciphers CHACHA20/SALSA20
2635,2019-01-22 05:07:35.000000000,2019-01-29 08:39:21.000000000,closed,0,Prevent use of wayland theme on Linux
2634,2019-01-22 04:21:33.000000000,2019-03-27 06:21:56.000000000,closed,1,"Rework ""Remember Last Database"" settings"
2633,2019-01-22 03:36:29.000000000,1970-01-01 00:00:00.000000001,open,0,Auto-type does not allow references in syntax
2632,2019-01-21 23:49:36.000000000,2019-01-22 00:23:06.000000000,closed,3,No Systray on Kde Neon 5.14
2631,2019-01-21 14:46:23.000000000,2019-01-23 22:59:55.000000000,closed,12,Plugin for KeePass 2 to use KeePassXC Browser
2630,2019-01-21 13:22:22.000000000,2019-04-11 18:22:02.000000000,closed,12,"[2.4.0] ""copy password"" shortcut does not work after searcing"
2629,2019-01-21 03:50:05.000000000,2019-01-22 00:24:30.000000000,closed,0,CLI: fix missing check for correct credentials
2628,2019-01-21 01:09:00.000000000,1970-01-01 00:00:00.000000001,open,3,Add ability to customize password profiles for each database
2627,2019-01-20 23:54:15.000000000,2019-01-21 03:56:40.000000000,closed,4,Insert customised text
2626,2019-01-20 23:50:10.000000000,2019-01-21 03:57:27.000000000,closed,1,Suggestion: password strength indication for each entry
2625,2019-01-20 22:52:34.000000000,2019-01-21 03:59:06.000000000,closed,1,database doesn't close after timeout if a keepassxc-browser confirmation dialog is open
2624,2019-01-20 19:54:54.000000000,2019-01-29 08:39:00.000000000,closed,4,Performed project-wide code formatting using clang-format
2623,2019-01-20 18:15:33.000000000,2019-01-29 08:39:02.000000000,closed,4,Enforce code formatting
2622,2019-01-20 18:01:09.000000000,2019-01-25 08:45:31.000000000,closed,2,Clearer default error messages
2621,2019-01-20 09:40:21.000000000,1970-01-01 00:00:00.000000001,open,2,Show overall history of changes for entries
2620,2019-01-20 01:02:19.000000000,2019-01-20 09:47:02.000000000,closed,1,[Feature Request] Export password attributes
2619,2019-01-19 23:01:53.000000000,1970-01-01 00:00:00.000000001,open,7,Support macOS keychain 
2618,2019-01-19 12:51:29.000000000,2019-01-20 09:48:42.000000000,closed,4,[Feature Request] Separate timeout for browser integration
2617,2019-01-19 10:57:24.000000000,2019-01-29 08:46:43.000000000,closed,4,Refactoring of Dockerfile for Space Optimization
2616,2019-01-18 21:46:56.000000000,2019-07-10 06:18:13.000000000,closed,1,Creating mirrored entries from opposing groups
2615,2019-01-18 18:00:19.000000000,2019-01-20 02:59:40.000000000,closed,6,After new key generation: Wrong key or database file is corrupt.
2614,2019-01-18 15:52:50.000000000,1970-01-01 00:00:00.000000001,open,8,Add ability to show hashed password
2613,2019-01-18 01:44:39.000000000,2019-01-18 06:33:14.000000000,closed,1,Search with Command+F not working - how about rearrange icons
2612,2019-01-17 18:31:08.000000000,1970-01-01 00:00:00.000000001,open,1,Default expiration setting
2611,2019-01-17 17:26:48.000000000,2019-01-17 19:03:05.000000000,closed,0,Issue #1597 needs  to be re-opened
2610,2019-01-17 12:38:02.000000000,2019-01-30 20:26:38.000000000,closed,2,Performance fixes
2609,2019-01-17 01:05:37.000000000,2019-03-21 04:36:17.000000000,closed,1,New database creation does not permit creating Yubikey-only protected database
2608,2019-01-16 19:49:23.000000000,2019-02-15 19:01:29.000000000,closed,2,YubiKey selection broken in New Database Wizard
2607,2019-01-16 03:22:25.000000000,2019-01-20 10:00:51.000000000,closed,1,Ability to link entries
2606,2019-01-15 20:17:57.000000000,2019-03-04 21:21:48.000000000,closed,11,"Linux, ssh-agent: ""sign_and_send_pubkey: signing failed: agent refused operation"""
2605,2019-01-15 20:14:15.000000000,2019-02-07 01:13:01.000000000,closed,8,"Yubikey dependency is required, even for building with -DWITH_XC_YUBIKEY=OFF"
2604,2019-01-15 18:43:19.000000000,2019-01-25 17:20:39.000000000,closed,7,"""Automatically save after every change"" not working in 2.4.0. KeepassXC asks for saving changes when locking or shutting down workstation, although automatic save is enabled"
2603,2019-01-15 16:26:37.000000000,1970-01-01 00:00:00.000000001,open,5,Auto-Type key modifiers not implemented
2602,2019-01-15 11:13:32.000000000,2019-01-20 10:01:48.000000000,closed,5,[Feature request] Multiple passwords within a site
2601,2019-01-15 09:27:06.000000000,2019-01-25 17:20:40.000000000,closed,0,Fix crash when canceling save of new database
2600,2019-01-14 17:36:06.000000000,1970-01-01 00:00:00.000000001,open,5,Display warning when text cannot be copied to clipboard
2599,2019-01-14 12:33:26.000000000,2019-01-25 00:49:37.000000000,closed,20,[Linux] Crash when applying/OK edit to entry
2598,2019-01-14 05:07:34.000000000,2019-03-23 20:04:56.000000000,closed,5,Reattach tray icon to system tray
2597,2019-01-13 22:29:58.000000000,2019-01-14 05:39:51.000000000,closed,5,No option to change global autotype-sequence
2596,2019-01-10 20:41:22.000000000,2019-01-29 08:40:12.000000000,closed,2,Allow for KDF seeds between 8 and 32 bytes
2595,2019-01-10 20:22:09.000000000,1970-01-01 00:00:00.000000001,open,0,Desktop notification when retrieving credentials using browser integration
2594,2019-01-10 05:46:09.000000000,2019-04-03 03:07:59.000000000,closed,6,Unable to open database in Snapshot build
2593,2019-01-09 21:37:30.000000000,2019-01-11 13:26:52.000000000,closed,0,Give visual feedback while starting
2592,2019-01-09 04:25:52.000000000,2019-01-19 19:58:00.000000000,closed,1,unable to open a database from a previous version
2591,2019-01-09 04:05:59.000000000,2019-01-11 13:47:16.000000000,closed,3,[Feature] .appx file for windows
2590,2019-01-08 01:52:33.000000000,1970-01-01 00:00:00.000000001,open,2,Minimize main window after opening database
