id,created_at,closed_at,state,comments,title
38,2017-06-06 14:03:12.000000000,1970-01-01 00:00:00.000000001,open,3,Saving the resulted images one by one 
37,2017-06-05 01:54:11.000000000,1970-01-01 00:00:00.000000001,open,4,Data augmentation not working on all my dataset
36,2017-06-02 15:35:58.000000000,1970-01-01 00:00:00.000000001,open,2,Other type of augmentation : add vertical and horizontal lines to image based sequence 
35,2017-05-25 17:51:40.000000000,1970-01-01 00:00:00.000000001,open,13,"Rotation, which changes shape"
34,2017-05-21 04:55:54.000000000,2017-05-22 16:20:32.000000000,closed,2,How to save every sample in 'examples_grid.jpg' into separate image?
33,2017-05-21 04:18:20.000000000,2017-05-21 04:33:54.000000000,closed,1,May you add the script to generate 'examples_grid.jpg' image?
32,2017-05-11 05:41:04.000000000,2017-05-15 05:21:20.000000000,closed,2,The augmentation is too slow!
31,2017-04-29 14:25:00.000000000,2017-04-30 17:15:38.000000000,closed,5,Random Crop Position of a Fixed Size
30,2017-04-10 20:10:49.000000000,2017-04-13 08:53:24.000000000,closed,2,Import imgaug error
29,2017-04-07 17:49:03.000000000,2017-04-07 18:44:47.000000000,closed,1,Add augumenter to select colorspace: InColorspace
28,2017-04-05 00:08:55.000000000,1970-01-01 00:00:00.000000001,open,7,Getting black image!
27,2017-04-01 22:05:19.000000000,2017-04-05 22:04:27.000000000,closed,4,Image Translation
26,2017-04-01 15:43:57.000000000,2017-04-02 15:53:56.000000000,closed,3,"What is the functionality of ""seq.to_deterministic()""?"
25,2017-03-29 01:58:16.000000000,1970-01-01 00:00:00.000000001,open,9,setup.py does not recognize opencv2 of Anaconda
24,2017-03-27 14:07:27.000000000,1970-01-01 00:00:00.000000001,open,1,"Support ""edge"" mode for rotation padding"
23,2017-03-25 23:37:23.000000000,2017-03-26 17:00:18.000000000,closed,1,Add channels arg for Multiply augmenter
22,2017-03-23 05:57:49.000000000,2017-03-26 17:05:56.000000000,closed,1,Publish on PyPi?
21,2017-03-22 13:28:45.000000000,2017-03-26 17:08:17.000000000,closed,2,Affine operations result in a cropped image or black margins
20,2017-03-20 16:42:52.000000000,2017-03-26 17:06:16.000000000,closed,4,"grid = seq.draw_grid(image, cols=8, rows=8)"
19,2017-03-13 14:28:12.000000000,2017-03-26 16:59:18.000000000,closed,4,Add capability of transformaing non uint8 images
18,2017-03-13 11:01:22.000000000,2017-03-26 17:08:05.000000000,closed,3,"Understanding of Function ""Sometimes()"""
17,2017-03-06 20:02:19.000000000,2017-03-08 17:38:50.000000000,closed,3,Specify image channels to add values
16,2017-03-06 19:04:55.000000000,2017-03-08 17:38:50.000000000,closed,0,How to add values only for specified image channels?
15,2017-03-06 17:19:28.000000000,1970-01-01 00:00:00.000000001,open,5,Augment Keypoints not always correct
14,2017-03-02 18:38:28.000000000,2017-03-07 19:36:28.000000000,closed,2,AttributeError: 'module' object has no attribute 'ALL'
13,2017-03-02 18:06:30.000000000,2017-03-07 19:37:39.000000000,closed,2,ImportError: cannot import name augmenters
12,2017-01-03 00:29:32.000000000,2017-03-26 17:07:41.000000000,closed,3,Install Script is a success
11,2016-12-26 18:10:41.000000000,1970-01-01 00:00:00.000000001,open,3,loading augmenters in python scripts vs in jupyter notebooks
10,2016-12-24 12:15:14.000000000,2016-12-24 20:48:05.000000000,closed,4,Can't do a Quick View of Sequential Aug similar to Readme
9,2016-12-16 23:37:06.000000000,2016-12-18 00:46:41.000000000,closed,2,Added Documentation wherever possible
8,2016-12-16 21:36:33.000000000,2016-12-19 18:44:25.000000000,closed,2,"What is the ""parents"" parameter?"
7,2016-12-16 00:25:15.000000000,2016-12-16 23:38:33.000000000,closed,2,Help: Can you review the filters learned by my algorithm?
6,2016-12-14 00:23:39.000000000,2016-12-15 23:43:51.000000000,closed,2,ZCA whitening and Related Questions.
5,2016-12-11 17:26:10.000000000,2016-12-11 23:34:25.000000000,closed,5,Changes : Review documentation style
4,2016-12-11 15:49:53.000000000,2016-12-11 18:16:20.000000000,closed,2,Explanation of Affine Transforms
3,2016-12-10 21:34:31.000000000,2016-12-10 21:46:52.000000000,closed,9,Cant load augmenters
2,2016-12-04 13:12:04.000000000,2016-12-25 22:58:15.000000000,closed,11,How to Install??
1,2016-09-26 23:03:26.000000000,2016-11-24 17:54:25.000000000,closed,1,cval as parameter to __init__
