id,created_at,closed_at,state,comments,title
1332,2018-10-04 09:30:02.000000000,2019-01-22 11:27:50.000000000,closed,12,email task fails in 6.4.0 after upgrading from 6.2.1
1331,2018-10-03 21:37:01.000000000,2018-10-03 22:49:29.000000000,closed,0,small archetype upgrade fixes
1330,2018-10-03 17:18:46.000000000,1970-01-01 00:00:00.000000001,open,1,DB scripts not updated?
1329,2018-10-03 17:17:38.000000000,2018-10-03 17:24:58.000000000,closed,0,Add ability to set / change the name of a case instance
1328,2018-10-03 17:02:49.000000000,2018-10-03 22:49:58.000000000,closed,0,Some minor clean-ups
1327,2018-10-03 15:45:53.000000000,2018-10-03 22:52:34.000000000,closed,0,Ensure that expected exceptions in tests are thrown by the object und…
1326,2018-10-03 14:13:22.000000000,2018-10-04 09:51:18.000000000,closed,0,flowable-engine: fix some raw types and unchecked compiler warnings
1325,2018-10-03 12:54:54.000000000,2018-10-03 22:52:48.000000000,closed,0,flowable-ui-task: use java mail version from root pom
1324,2018-10-02 23:38:16.000000000,2018-10-03 20:49:25.000000000,closed,3,Issue deploying flowable-admin module
1323,2018-10-02 18:59:55.000000000,2018-10-03 22:53:55.000000000,closed,5,Adding support to query tasks with formKey
1322,2018-10-02 14:04:37.000000000,1970-01-01 00:00:00.000000001,open,7,Flowable Task does not support Camel task
1321,2018-09-29 02:37:28.000000000,2018-10-18 11:33:30.000000000,closed,0,Fix documentation property for LDAP initialization user
1320,2018-09-28 14:20:51.000000000,2018-09-29 10:32:20.000000000,closed,0,"Remove double ""the the"""
1319,2018-09-28 14:01:13.000000000,2018-09-28 14:02:07.000000000,closed,0,Correct the link to the JavaDoc
1318,2018-09-27 03:40:35.000000000,2018-09-27 10:50:20.000000000,closed,1,modify ui-task-app zh-CN.json to Support Chinese language 
1317,2018-09-26 21:39:34.000000000,2018-09-27 16:50:08.000000000,closed,0,Update xercesImpl to version 2.12.0
1316,2018-09-26 13:22:29.000000000,2018-09-26 14:14:48.000000000,closed,1,BPMN stencilset changed to add the category attribute to the UserTask
1315,2018-09-26 12:22:15.000000000,2018-09-26 13:38:33.000000000,closed,0,1314: fixing cmmn without tenant id queries
1314,2018-09-26 12:17:05.000000000,2018-09-26 13:41:11.000000000,closed,1,cmmn withoutTenatId queries return whole list of objects 
1313,2018-09-26 11:48:15.000000000,1970-01-01 00:00:00.000000001,open,2,"flowable-task: while in task, clicking on process jumps to wrong process if too many processes are active"
1312,2018-09-25 23:16:14.000000000,2018-09-26 09:26:32.000000000,closed,0,Update mockito to version 2.22.0
1311,2018-09-25 21:26:09.000000000,2018-09-26 09:25:58.000000000,closed,0,maven-compiler-plugin
1310,2018-09-25 09:33:16.000000000,2018-09-28 09:36:21.000000000,closed,8,The sequenceFlow name in modler does not display bug
1309,2018-09-24 14:33:28.000000000,2018-09-24 16:00:02.000000000,closed,2,HistoricIdentityLinkEntity createTime not set
1308,2018-09-24 11:00:30.000000000,2018-09-24 12:36:33.000000000,closed,0,Jupiter custom configuration resources form Form and Process engines
1307,2018-09-23 19:54:22.000000000,2018-09-23 20:30:14.000000000,closed,0,CMMN and DMN JUnit Jupiter support
1306,2018-09-23 11:07:10.000000000,2018-09-24 12:35:51.000000000,closed,0,Update commons-lang3 version to 3.8.1
1305,2018-09-22 23:38:37.000000000,2018-09-23 13:36:11.000000000,closed,0,Add documentation for how to use the Process and Form engines with JUnit Jupiter
1304,2018-09-21 16:15:56.000000000,2018-09-21 17:21:39.000000000,closed,0,Fix. Check history level before sync during processInstanceMigration
1303,2018-09-20 23:18:40.000000000,2018-09-21 12:12:37.000000000,closed,1,Bug fix change state multi instance executions ordering in ChangeState Api
1302,2018-09-20 14:22:20.000000000,1970-01-01 00:00:00.000000001,open,0,Flowable Admin - App Engine - Only First 10 Process Definitions Viewable 
1301,2018-09-20 14:06:30.000000000,2018-09-20 15:00:36.000000000,closed,0,Process instance migration V1
1300,2018-09-20 12:19:44.000000000,2018-10-01 19:34:06.000000000,closed,2,No mapping found for HTTP request with URI [/flowable-task/cmmn-api/management/jobs/
1299,2018-09-20 00:27:26.000000000,2018-09-20 15:20:22.000000000,closed,0,Update Swagger Annotations and Swagger Models to version 1.5.21
1298,2018-09-20 00:15:37.000000000,2018-09-20 15:00:57.000000000,closed,0,Update Jackson version to 2.9.7
1297,2018-09-19 15:37:45.000000000,1970-01-01 00:00:00.000000001,open,4,"VariableInstance.getValue() fails with the NPE for variables of ""serialized"" type"
1296,2018-09-19 01:23:20.000000000,2018-09-20 15:20:05.000000000,closed,2,Add property autoStoreVariables to BPMN modeler (resolves #1289)
1295,2018-09-18 12:53:34.000000000,2018-09-18 13:50:12.000000000,closed,1,IntermediateCatchEventActivityBehavior generates incorrect SQL
1294,2018-09-18 12:19:38.000000000,2018-09-18 23:28:03.000000000,closed,2,Add Chinese language support
1293,2018-09-17 19:34:12.000000000,2018-09-17 22:38:16.000000000,closed,0,Send only user delta over JDBC when updating an user
1292,2018-09-15 16:09:34.000000000,2018-09-16 10:42:30.000000000,closed,1,"Update Spring Framework to version 5.0.9.RELEASE, Spring Security to …"
1291,2018-09-15 15:58:02.000000000,2018-09-16 10:45:21.000000000,closed,0,Disallow Travis build failures on Java 10.
1290,2018-09-15 15:00:40.000000000,2018-09-16 10:46:47.000000000,closed,1,Increase timeouts for a lot of asynchronous tests from 5 to 7 seconds make b…
1289,2018-09-15 13:34:54.000000000,2018-09-20 15:20:07.000000000,closed,1,Property 'autoStoreVariables' used by script task is mising in Flowable Modeler
1288,2018-09-15 08:49:06.000000000,2018-09-22 22:58:11.000000000,closed,3,flowable-image-generator: task names missing (box too small?)
1287,2018-09-15 06:09:10.000000000,2018-09-15 06:09:27.000000000,closed,0,Cmmn improve
1286,2018-09-14 14:42:09.000000000,2018-10-30 11:36:23.000000000,closed,8,JavaScript not supported by flowable-task running in Docker container
1285,2018-09-14 12:54:55.000000000,2018-09-15 07:31:53.000000000,closed,0,flowable-image-generator: task names missing (box too small?)
1284,2018-09-14 08:55:24.000000000,2018-09-14 23:25:15.000000000,closed,1,Add execution in exception message when condition returns null or non-boolean
1283,2018-09-14 05:34:59.000000000,2018-09-14 08:43:02.000000000,closed,0,Add sequenceFlowId in exception message when condition returns null or non-boolean
1282,2018-09-13 07:43:35.000000000,2018-09-13 09:01:08.000000000,closed,0,JuelExpression Can not use custom delegateInterceptor
1281,2018-09-13 05:22:59.000000000,2018-09-13 07:35:34.000000000,closed,0,JuelExpression Can not use custom delegateInterceptor
1280,2018-09-12 18:00:23.000000000,1970-01-01 00:00:00.000000001,open,2,DelegateExecution::getCurrentActivityId returns null
1279,2018-09-12 16:18:14.000000000,2018-09-14 23:24:35.000000000,closed,1,rootProcessInstanceId is null bug
1278,2018-09-12 13:06:16.000000000,2019-02-21 13:23:25.000000000,closed,0,ClassCastException in CallActivityBehavior
1277,2018-09-11 19:48:43.000000000,2020-01-19 02:53:09.000000000,closed,1,IntermediateCatchSignalEventActivityBehavior dispatches the create event using signal Id instead of signal name
1276,2018-09-11 17:04:48.000000000,2018-09-17 01:06:15.000000000,closed,6,Support JSON variables in the REST api
1275,2018-09-10 16:13:49.000000000,1970-01-01 00:00:00.000000001,open,0,Flowable-Admin: Switch to Floating Layout
1274,2018-09-10 16:04:06.000000000,2019-04-12 18:17:32.000000000,closed,1,Flowable-modeller: Display Description of BPMN Elements as Tooltips
1273,2018-09-10 09:21:17.000000000,2018-09-18 11:01:19.000000000,closed,3,java.lang.NoClassDefFoundError: org/apache/ibatis/transaction/TransactionFactory
1272,2018-09-10 06:38:05.000000000,2018-09-12 16:33:22.000000000,closed,3,modify @Primary  annotation  to @ConditionalOnMissingBean annotation
1271,2018-09-07 10:43:13.000000000,1970-01-01 00:00:00.000000001,open,2,Maven surefire rerunFailingTestsCount does not work with JUnit Jupiter
1270,2018-09-06 23:03:03.000000000,2018-09-12 16:28:43.000000000,closed,0,Remove trailing blanks of log messages
1269,2018-09-06 11:45:46.000000000,2018-09-06 13:05:10.000000000,closed,0,Support for using multiple IdGenerator beans in the Spring Context
1268,2018-09-05 13:13:07.000000000,2018-09-05 13:48:39.000000000,closed,0,Keep parent reference in historic case instance
1267,2018-09-04 12:57:12.000000000,2018-09-05 10:43:41.000000000,closed,2,ExclusiveGateway sequenceFlowOrder
1266,2018-09-04 01:35:26.000000000,2018-09-05 10:45:02.000000000,closed,0,Update JUnit to version 5.3.0
1265,2018-09-03 12:07:06.000000000,2018-12-10 19:26:37.000000000,closed,3,Start easily a case instance from a process instance
1264,2018-09-02 22:35:22.000000000,2018-09-07 11:43:59.000000000,closed,1,Flowable Engine : DMN - Expression rules with decimal numbers are not matched correctly
1263,2018-09-01 00:11:32.000000000,2018-09-05 13:50:52.000000000,closed,3,fix HTML anchor
1262,2018-09-01 00:00:28.000000000,2018-09-05 10:44:14.000000000,closed,0,fix formatting
1261,2018-08-31 14:23:27.000000000,2018-09-05 10:44:40.000000000,closed,0, Add static PaginateListUtil and ListProcessor for performing the processing of the results for the REST endpoints
1260,2018-08-31 00:52:25.000000000,2018-08-31 19:12:38.000000000,closed,0,flowable-ui-modeler-logic: Model.xml: Fix tentantId column name (fixe…
1259,2018-08-31 00:47:52.000000000,2018-08-31 19:10:48.000000000,closed,0,Update CXF version to 3.2.6
1258,2018-08-31 00:43:15.000000000,2018-08-31 19:10:34.000000000,closed,0,Update Liquibase to version 3.6.2
1257,2018-08-31 00:39:11.000000000,2018-08-31 19:12:57.000000000,closed,0,Update JavaMail to version 1.6.2
1256,2018-08-30 15:55:35.000000000,2018-09-22 16:27:48.000000000,closed,2,Compensation Throwing Event for Service Task  - Documentation or Implementation Bug?
1255,2018-08-30 01:14:42.000000000,2018-08-30 10:40:05.000000000,closed,0,Dots in idm admin user and password properties in docker compose config file
1254,2018-08-30 01:13:54.000000000,2018-08-30 10:33:02.000000000,closed,1,Update docker compose config files.
1253,2018-08-29 21:55:35.000000000,2018-08-29 22:28:17.000000000,closed,6, Flowable IDM saves passwords in plain text 
1252,2018-08-29 14:07:43.000000000,2018-08-31 19:12:41.000000000,closed,0,modeler mybaties xml file bug
1251,2018-08-29 12:54:07.000000000,2018-08-29 22:28:32.000000000,closed,1,doc update
1250,2018-08-28 01:17:37.000000000,2018-08-29 11:14:52.000000000,closed,2,Fix verbose test logging to console...
1249,2018-08-28 00:57:45.000000000,2019-02-14 18:28:11.000000000,closed,13,Java 11
1248,2018-08-27 23:57:53.000000000,2018-08-28 01:22:39.000000000,closed,0,Update MyBatis to version 3.4.6 and MyBatis-Spring to version 1.3.2
1247,2018-08-27 23:27:02.000000000,2018-09-27 16:57:02.000000000,closed,0,Update Groovy to version 2.5.2
1246,2018-08-27 10:29:26.000000000,2018-08-28 01:21:53.000000000,closed,0,Update commons-lang3 to version 3.8
1245,2018-08-25 20:44:30.000000000,2018-08-27 10:50:53.000000000,closed,2,Migrate IDM and Form engine tests to Jupiter
1244,2018-08-24 15:26:53.000000000,2018-08-24 15:54:35.000000000,closed,1,Increase Galera database compatibility
1243,2018-08-23 19:33:33.000000000,2018-08-27 10:54:07.000000000,closed,1,Support custom header in mailtask
1242,2018-08-23 18:02:02.000000000,2018-08-23 18:06:47.000000000,closed,1,flowable-spring-boot-starter-jpa 6.3.1 doesn't exist in maven central repository
1241,2018-08-23 04:57:39.000000000,2018-08-23 11:00:20.000000000,closed,1,Add the labels to sequence flow elements in BPMN diagram overview
1240,2018-08-21 18:41:36.000000000,2018-08-23 10:48:58.000000000,closed,0,Remove contractions
1239,2018-08-20 15:38:40.000000000,2018-08-21 00:33:39.000000000,closed,1,Allow IdGenerator to be overriden via spring configuration.
1238,2018-08-20 14:11:30.000000000,2018-08-21 14:46:25.000000000,closed,2,Spelling corrections
1237,2018-08-19 20:49:17.000000000,2018-08-19 22:26:29.000000000,closed,0,Remove null check before instanceof check
1236,2018-08-19 20:36:07.000000000,2018-08-19 22:24:01.000000000,closed,0,Remove duplicate semi-colon
1235,2018-08-19 20:35:54.000000000,2018-08-19 22:24:57.000000000,closed,0,Remove duplicate depends_on
1234,2018-08-17 20:31:21.000000000,1970-01-01 00:00:00.000000001,open,6,Add CheckReturnValue to queries
1233,2018-08-17 14:48:50.000000000,2020-01-19 02:53:37.000000000,closed,4,Set release debug level to WARN not INFO
1232,2018-08-17 12:25:26.000000000,2018-09-23 20:28:59.000000000,closed,15,Fix parallel execution of CallActivity
1231,2018-08-17 02:59:24.000000000,2018-09-25 01:55:26.000000000,closed,2,Flowable-modeler. Cannot change process version 
1230,2018-08-16 20:31:02.000000000,2018-08-20 02:28:47.000000000,closed,9,flowable-rest and flowable-task not working not working with MariaDB
1229,2018-08-15 23:24:02.000000000,2018-08-17 18:07:46.000000000,closed,0,Upgrade AssertJ Core to version 3.11.0
1228,2018-08-15 20:16:47.000000000,2018-08-19 12:16:04.000000000,closed,4,Support using java.time.Duration as dueDate for timer.
1227,2018-08-15 19:21:38.000000000,2018-08-22 15:34:12.000000000,closed,4,Support for JUnit Jupiter in the flowable-engine
1226,2018-08-15 09:38:36.000000000,2018-08-15 09:39:15.000000000,closed,0,Feature/rsb 962
1225,2018-08-14 13:11:10.000000000,2018-08-16 15:18:20.000000000,closed,2,Extend event type list
1224,2018-08-14 13:06:57.000000000,2018-08-16 15:18:57.000000000,closed,1,Flowable-modeler. Incomplete list of event types
1223,2018-08-13 16:36:48.000000000,2018-08-14 11:28:58.000000000,closed,0,Enable and fix some ignored tests
1222,2018-08-13 15:40:24.000000000,2018-08-19 12:19:18.000000000,closed,3,I think flowable wants to increase the fallback function.
1221,2018-08-12 13:36:51.000000000,2018-08-13 11:13:48.000000000,closed,0,Upgrade Guava to version 26.0-jre
1220,2018-08-12 00:44:16.000000000,2018-08-13 11:13:28.000000000,closed,0,"Grammar improvement: Replace ""is not found"" with ""was not found"""
1219,2018-08-10 19:16:07.000000000,2018-08-10 19:21:59.000000000,closed,0,flowable-(cmmn-)rest: Fix typo in exception messages
1218,2018-08-10 17:22:53.000000000,1970-01-01 00:00:00.000000001,open,1,Deletion of historic processes is not flexible
1217,2018-08-10 11:58:18.000000000,2018-11-23 14:30:52.000000000,closed,8,dataObject definitions fails in xml with laneSet
1216,2018-08-10 00:47:31.000000000,2018-08-10 17:36:03.000000000,closed,0,flowable-cmmn-engine: Use groovy version from flowable-root pom
1215,2018-08-10 00:35:35.000000000,2018-08-10 17:36:57.000000000,closed,0,Update Event Listener implementation section.
1214,2018-08-09 23:55:51.000000000,2018-08-27 10:51:17.000000000,closed,9,Close database connections used by Liquibase (#950)
1213,2018-08-09 22:57:08.000000000,2018-08-13 12:22:14.000000000,closed,3,Update section 3.18.1. Event listener implementation
1212,2018-08-07 22:08:10.000000000,2018-08-10 13:56:01.000000000,closed,18,Extending modeler support for body encoding as described in https://g…
1211,2018-08-07 21:44:44.000000000,2018-08-10 13:56:01.000000000,closed,0,Support for Http request body encoding in the modeler
1210,2018-08-07 14:45:33.000000000,2018-08-13 06:55:26.000000000,closed,0,"Is there a feature like ""diagram-viewer""(in Activit) in Flowable ?"
1209,2018-08-06 15:42:59.000000000,2018-08-07 17:17:48.000000000,closed,0,Swagger for the CMMN REST API should be part of the flowable-rest documentation
1208,2018-08-04 01:38:00.000000000,2018-08-20 12:38:12.000000000,closed,1,Fix start of a process via REST API and message name.
1207,2018-08-02 15:40:47.000000000,1970-01-01 00:00:00.000000001,open,6,Flowable Task UI doesn't highlight completed sequeceflow
1206,2018-08-02 14:25:53.000000000,2018-08-03 10:31:02.000000000,closed,4,HTTP task set proxy
1205,2018-08-02 14:03:09.000000000,2018-09-17 22:33:12.000000000,closed,3,HTTP task ignore certificate validation
1204,2018-08-01 16:05:32.000000000,2018-08-01 16:44:28.000000000,closed,0,Add FlowableUserDetails interface for extending the Spring Security UserDetails
1203,2018-08-01 10:26:29.000000000,2018-08-01 10:51:43.000000000,closed,1,How to dynamically create a multi-instance task on a process！！！
1202,2018-07-31 17:02:31.000000000,2018-07-31 18:03:16.000000000,closed,0,Update to latest Spring Boot 2.0.4
1201,2018-07-28 15:37:28.000000000,2018-07-30 12:47:26.000000000,closed,0,Upgrade Mockito to version 2.20.1
1200,2018-07-28 14:45:15.000000000,2018-07-30 12:47:11.000000000,closed,0,Some small clean-ups
1199,2018-07-28 07:24:16.000000000,1970-01-01 00:00:00.000000001,open,2,Flowable App - Form Issues on starting process
1198,2018-07-28 00:57:26.000000000,2018-07-28 01:49:18.000000000,closed,1,Issues on publishing app from Modeler
1197,2018-07-27 10:16:00.000000000,2018-08-27 12:28:32.000000000,closed,10,Http Response variable name miss 
1196,2018-07-25 12:46:09.000000000,2018-08-23 11:01:15.000000000,closed,2,Can't find scripting engine for 'JavaScript'
1195,2018-07-25 06:15:23.000000000,1970-01-01 00:00:00.000000001,open,2,Repeat the import
1194,2018-07-23 19:39:07.000000000,2018-07-25 11:00:35.000000000,closed,0,"Info for Stages, Milestones and UserEventListeners on Case tab of App"
1193,2018-07-23 16:48:21.000000000,1970-01-01 00:00:00.000000001,open,0,"in flowable-ui-admin-logic, the generated url for invoke other rest api is alwayse iso8859-1,how can switch to UTF-8?"
1192,2018-07-23 14:42:35.000000000,2018-07-23 14:43:03.000000000,closed,0,yepz....
1191,2018-07-23 05:07:29.000000000,1970-01-01 00:00:00.000000001,open,5,The database upgrade folder may have some missing SQL scripts
1190,2018-07-20 20:09:52.000000000,2018-07-22 23:59:40.000000000,closed,0,Upgrade Camel to version 2.22.0
1189,2018-07-20 20:04:42.000000000,2018-07-23 11:39:34.000000000,closed,0,"Upgrade httpclient and httpmime to version 4.5.6, httpcore to version…"
1188,2018-07-20 19:59:49.000000000,2018-07-23 11:39:14.000000000,closed,0,Upgrade CXF to version 3.2.5
1187,2018-07-20 07:00:07.000000000,2018-07-20 10:49:44.000000000,closed,1,Forms design
1186,2018-07-20 06:23:07.000000000,2018-07-20 10:54:04.000000000,closed,1,ACT_DE_MODEL Missing unique index
1185,2018-07-19 19:50:52.000000000,2018-08-17 18:04:52.000000000,closed,5,Fix: Events sent when changing the state of a process.
1184,2018-07-17 16:52:32.000000000,2018-07-17 20:11:17.000000000,closed,0,Do no wrap a FlowableException into a new FlowableException
1183,2018-07-17 06:03:53.000000000,2018-07-20 10:56:44.000000000,closed,1,"Duplicated ""duedatedefinitionpackage"" in stencilset_bpmn.json"
1182,2018-07-14 14:52:26.000000000,2018-07-20 11:06:07.000000000,closed,1,Custom identity management error
1181,2018-07-14 01:04:57.000000000,2018-07-14 01:35:17.000000000,closed,0,Update ch05a-Spring-Boot.adoc
1180,2018-07-12 17:48:45.000000000,2019-03-01 12:22:31.000000000,closed,1,#1067 is sequential db column
1179,2018-07-12 15:54:04.000000000,2018-07-12 16:32:22.000000000,closed,0,Make sure the EmailServiceTaskTest can run green on all DBs
1178,2018-07-11 22:08:26.000000000,2018-07-12 18:55:01.000000000,closed,5,Help with spring beans
1177,2018-07-10 05:18:49.000000000,1970-01-01 00:00:00.000000001,open,1,how to Process Initiation Authorization in flowable 6.3.1
1176,2018-07-09 18:18:59.000000000,2018-07-12 11:35:27.000000000,closed,0,Add support for forcing a TO address when using the MailTask
1175,2018-07-09 14:31:09.000000000,2018-07-10 00:47:16.000000000,closed,0,#1169 task id generator
1174,2018-07-09 13:26:47.000000000,2018-08-19 13:16:59.000000000,closed,6,Support for using java.time.Duration as dueDate for timers
1173,2018-07-06 11:54:09.000000000,2018-07-06 22:57:28.000000000,closed,1,Fix the the problem of method enableDuplicateFiltering() sometime will be invalid.
1172,2018-07-06 05:33:18.000000000,2018-07-06 09:53:36.000000000,closed,1,About cancelActivityId
1171,2018-07-05 13:36:13.000000000,2018-07-06 09:56:18.000000000,closed,1,401 error while calling API
1170,2018-07-05 13:27:29.000000000,2018-07-26 17:51:27.000000000,closed,0,Modeler App & cmmn engine : Various fix
1169,2018-07-04 12:19:46.000000000,2018-07-09 16:26:17.000000000,closed,9,setTaskIdGenerator(new DbIdGenerator()) with H2 causes NPE
1168,2018-07-03 02:16:09.000000000,2018-07-05 13:34:16.000000000,closed,0,test cases for inclusive gateway inside multInstance subprocess
1167,2018-07-02 21:24:54.000000000,2018-07-27 13:59:51.000000000,closed,0,ChangeState testing and fixes
1166,2018-07-02 13:36:52.000000000,2018-07-02 13:37:42.000000000,closed,0,Modeler & Task Apps: Update FR translation.
1165,2018-06-29 18:46:34.000000000,2018-07-01 10:48:03.000000000,closed,0,"Remove prerequisites elements of flowable-ui-* POMs to fix ""The projec…"
1164,2018-06-29 17:25:01.000000000,2018-07-01 10:55:16.000000000,closed,1,TaskQuery taskDescriptionLike not work <flowable.version>6.3.1</flowable.version>	
1163,2018-06-29 03:13:33.000000000,2018-06-29 10:24:39.000000000,closed,4,Http request body encoding
1162,2018-06-29 01:54:38.000000000,2018-07-12 11:38:06.000000000,closed,0,rootCause mapException filtering
1161,2018-06-28 19:44:34.000000000,2018-10-03 17:14:20.000000000,closed,1,Identity link refactoring
1160,2018-06-28 19:32:45.000000000,2018-07-03 23:50:30.000000000,closed,0,Resolved Script task without scriptFormat attribute is silently skipped
1159,2018-06-28 18:30:52.000000000,2018-07-03 23:52:43.000000000,closed,0,#1067 is sequential expression
1158,2018-06-28 17:01:14.000000000,2018-06-28 17:03:00.000000000,closed,1,isSequentional type is not exported to the model
1157,2018-06-28 16:31:12.000000000,2018-07-01 10:58:05.000000000,closed,2,How to start Flowable in a Apache Karaf container
1156,2018-06-27 20:56:51.000000000,2018-06-29 01:14:41.000000000,closed,1,Feature: rootCause filtering on mapException
1155,2018-06-26 14:36:53.000000000,2018-06-28 12:25:55.000000000,closed,0,Resolved Blank Screen when using Internet Explorer 11
1154,2018-06-26 13:39:11.000000000,2018-06-28 12:27:10.000000000,closed,1,DOCS: Fixed typos in CDI documentation
1153,2018-06-26 13:24:21.000000000,2018-06-26 13:30:28.000000000,closed,0,Issue 844
1152,2018-06-26 13:14:05.000000000,2018-07-20 10:57:37.000000000,closed,5,API Start Process Error : Could not write JSON: Cannot get process model: no current command context is active; 
1151,2018-06-26 12:28:38.000000000,2018-06-29 10:21:40.000000000,closed,0,#1099 fs content storage
1150,2018-06-26 10:02:14.000000000,2018-07-01 10:50:49.000000000,closed,0,Change state within multi instance subprocesses
1149,2018-06-25 13:55:17.000000000,2018-06-25 14:20:16.000000000,closed,7,docker flowable cant login
1148,2018-06-23 07:05:41.000000000,2018-06-23 10:51:11.000000000,closed,2,How to customize extended attributes ？？
1147,2018-06-23 01:10:45.000000000,2018-06-25 11:00:12.000000000,closed,0,#756 call activity element type
1146,2018-06-22 21:50:38.000000000,2018-06-26 01:34:41.000000000,closed,0,ChangeActivityState for MultiInstance and Timer (when changing state …
1145,2018-06-20 21:24:53.000000000,2018-06-22 11:36:31.000000000,closed,0,Fix ChangeActivityState from task with timerEvent
1144,2018-06-20 17:07:35.000000000,2018-06-21 17:45:53.000000000,closed,0,add start form fetch logic for CMMN cases
1143,2018-06-20 16:14:53.000000000,2018-06-26 01:39:55.000000000,closed,1,HttpResponseHandler & HttpRequestHandler BpmnError propagation
1142,2018-06-20 08:26:07.000000000,2018-07-12 19:33:11.000000000,closed,0,Resolved FormInstanceEntity submittedBy is null?
1141,2018-06-19 12:32:19.000000000,2018-06-19 12:33:33.000000000,closed,0,Make sure Flowable Security auto configuration kicks in when the IdmIdentityService bean is present
1140,2018-06-19 00:41:10.000000000,2018-06-19 15:38:43.000000000,closed,0,AbstractFlowableHttpHandler extensionElement support
1139,2018-06-18 20:01:12.000000000,2018-06-26 15:33:23.000000000,closed,0,Fixed - FormInstanceEntity submittedBy is null?
1138,2018-06-18 19:51:02.000000000,2018-08-13 13:06:41.000000000,closed,3,Enhancement: Allow local variables to be set on executions via ChangeActivityStateBuilder
1137,2018-06-18 18:51:46.000000000,2018-06-18 20:04:47.000000000,closed,1,Resolved FormInstanceEntity submittedBy is null? #995  
1136,2018-06-17 15:55:03.000000000,2018-06-19 15:39:07.000000000,closed,0,Use correct sourceType for the process-definitions-location-suffixes
1135,2018-06-17 01:09:56.000000000,2018-06-19 15:39:30.000000000,closed,0,"Replace ""the the"" with ""the"""
1134,2018-06-16 16:25:38.000000000,2018-06-19 15:39:41.000000000,closed,0,Upgrade mockito to version 2.19.0
1133,2018-06-16 16:24:07.000000000,2018-07-12 11:39:04.000000000,closed,0,Upgrade maven-surefire-plugin to version 2.22.0
1132,2018-06-16 12:49:21.000000000,1970-01-01 00:00:00.000000001,open,0,Spring Boot /actuator/configprops does not work
1131,2018-06-15 16:25:51.000000000,2018-06-15 17:00:17.000000000,closed,0,Upgrade Spring Boot to 2.0.3
1130,2018-06-13 22:59:59.000000000,2018-06-14 01:42:13.000000000,closed,0,Update xercesImpl to version 2.11.0
1129,2018-06-13 22:47:07.000000000,2018-06-14 01:42:29.000000000,closed,0,Use NumberUtils#isCreatable instead of deprecated method NumberUtils#…
1128,2018-06-13 12:04:37.000000000,1970-01-01 00:00:00.000000001,open,0,Spring boot starter database schema migration user
1127,2018-06-13 05:56:30.000000000,2018-06-13 09:49:53.000000000,closed,1,Flowable and Activiti
1126,2018-06-12 23:12:33.000000000,2018-06-14 01:43:36.000000000,closed,0,Replace usages of deprecated method IOUtils#closeQuietly with try-wit…
1125,2018-06-12 19:01:19.000000000,2018-06-12 23:07:54.000000000,closed,0,Move FlowableForbiddenException to engine-common-api module
1124,2018-06-12 18:45:54.000000000,2018-06-15 11:32:59.000000000,closed,0,Implemented support for in and out parameters on Process Task in CMMN.
