id,created_at,closed_at,state,comments,title
852,2016-05-28 11:45:34.000000000,2016-06-01 02:10:05.000000000,closed,2,README: Destroy container before fatal
851,2016-05-28 10:41:16.000000000,2016-06-02 00:20:54.000000000,closed,2,Update man pages to refect the latest cli change
850,2016-05-28 07:35:03.000000000,2016-07-21 17:54:37.000000000,closed,3,Fix help message for memory-swap
849,2016-05-28 01:48:59.000000000,2016-05-28 10:01:15.000000000,closed,3,checkpoint: add the empty-ns option
848,2016-05-27 07:01:55.000000000,2016-05-27 14:24:09.000000000,closed,4,pullapprove: use the right team
847,2016-05-27 02:33:13.000000000,2016-05-27 05:00:32.000000000,closed,6,Add PullApprove support
846,2016-05-27 02:28:16.000000000,2016-06-13 17:24:42.000000000,closed,3,Fix broken libcontainer readme
845,2016-05-26 23:38:50.000000000,2016-10-22 00:47:17.000000000,closed,45,Add support for copying up directories into tmpfs when a tmpfs is mounted over them
844,2016-05-25 06:55:01.000000000,2016-05-25 20:19:10.000000000,closed,2,Unify log setting's error output
843,2016-05-25 06:51:33.000000000,2016-05-28 10:10:43.000000000,closed,2,Update manuals
842,2016-05-25 01:55:51.000000000,2016-05-25 08:49:07.000000000,closed,4,godeps: update seccomp to 60c9953736798c4a04e90d0f3da2f933d44fd4c4
841,2016-05-24 17:59:16.000000000,2016-08-03 10:23:02.000000000,closed,21,sysconfig_notcgo does not implement GetLongBit
840,2016-05-24 16:44:34.000000000,2016-05-25 15:30:06.000000000,closed,11,libcontainer not building.
839,2016-05-23 21:11:18.000000000,2016-05-23 21:11:42.000000000,closed,0,Adding kernelTCP in update command
838,2016-05-23 21:08:14.000000000,2016-05-23 21:09:34.000000000,closed,0,Adding kernelTCP in update  format
837,2016-05-22 16:41:33.000000000,2016-05-28 10:07:41.000000000,closed,4,Integration framework cleanup
836,2016-05-22 16:35:10.000000000,2016-05-23 06:25:45.000000000,closed,2,*: correctly chown() consoles
835,2016-05-20 15:09:06.000000000,2016-05-21 05:46:14.000000000,closed,1,Fix outdated comment for loadSpec
834,2016-05-20 14:07:22.000000000,2016-05-23 05:36:50.000000000,closed,2,Fix argument typo in Makefile to enable commit output
833,2016-05-20 08:32:45.000000000,2016-05-20 11:23:05.000000000,closed,1,Fix some spelling typo in manual
832,2016-05-20 00:33:51.000000000,2016-05-20 00:42:26.000000000,closed,1,libcontainer: Fix Running Comment
831,2016-05-19 23:29:29.000000000,2016-05-25 20:38:10.000000000,closed,0,rlimit with nproc soft not having effect
830,2016-05-18 21:16:02.000000000,2016-05-19 19:00:36.000000000,closed,2,Updated description in SPEC
829,2016-05-18 14:23:50.000000000,2017-10-29 18:46:26.000000000,closed,16,Memory swap comment update
828,2016-05-17 16:16:01.000000000,2016-05-24 20:58:10.000000000,closed,3,Fix update kernel memory test
827,2016-05-17 03:06:31.000000000,2016-06-03 21:38:03.000000000,closed,39,Implement create and start
826,2016-05-16 16:20:14.000000000,2016-05-19 03:42:30.000000000,closed,2,Add check_config.sh for runc
825,2016-05-16 13:27:05.000000000,2016-05-17 09:04:25.000000000,closed,4,Add comments for error cases in status functions
824,2016-05-14 18:43:00.000000000,2016-05-17 04:26:33.000000000,closed,2,Update nsenter README
823,2016-05-13 20:41:00.000000000,2016-05-17 04:15:52.000000000,closed,4,Fix GetLongBit() returns value when _SC_LONG_BIT is not available
822,2016-05-13 17:01:50.000000000,2016-05-17 04:18:17.000000000,closed,3,Updating runc man page
821,2016-05-13 14:44:00.000000000,2016-05-16 20:38:46.000000000,closed,4,libcontainer: nsenter: nsexec.c: fix warnings
820,2016-05-12 19:24:11.000000000,2016-08-23 22:21:19.000000000,closed,4,Handling destroy of container
819,2016-05-12 19:12:45.000000000,2016-05-19 03:42:30.000000000,closed,0,[Feature request] Script - minimum requirements checker (like docker check-config.sh)
818,2016-05-12 07:57:29.000000000,2016-06-12 15:44:45.000000000,closed,4,"""too many links"" error in kernel 2.6.32, stage ""create session key"""
817,2016-05-11 17:55:07.000000000,2016-05-25 23:37:08.000000000,closed,7,Add bash completion support
816,2016-05-11 17:26:11.000000000,2016-05-11 22:41:50.000000000,closed,3,"Revert ""Need to make sure labels applied to /dev"""
815,2016-05-11 13:43:06.000000000,2016-08-26 05:43:50.000000000,closed,4,Updated the libcontainer interface comments
814,2016-05-11 11:51:36.000000000,2016-12-08 03:37:19.000000000,closed,16,Console path resolution is done in host mount namespace
813,2016-05-10 19:03:39.000000000,2016-05-11 12:31:47.000000000,closed,6,Adding kernel mem tcp for update command
812,2016-05-10 15:55:31.000000000,2016-05-17 06:32:19.000000000,closed,9,integration: fix cgroup parsing
811,2016-05-10 14:51:08.000000000,2016-05-10 19:04:00.000000000,closed,1,Adding kernel mem tcp for update command
810,2016-05-10 06:22:00.000000000,2016-05-21 07:46:59.000000000,closed,2,Update cli package
809,2016-05-09 16:07:50.000000000,2016-05-10 06:17:10.000000000,closed,2,Add man page and fix typo for update command
808,2016-05-09 15:41:55.000000000,2020-03-04 06:22:54.000000000,closed,16,Add support to send signal to any processes of the container
807,2016-05-08 18:28:22.000000000,2016-10-01 17:15:59.000000000,closed,11,validator: ensure user doesn't try to mount /sys without userns
806,2016-05-06 17:15:26.000000000,2016-10-31 06:38:44.000000000,closed,2,Executing runc as a SCHED_RR process fails
805,2016-05-05 18:04:24.000000000,2016-05-10 03:21:48.000000000,closed,2,Running containers in an unattached mode
804,2016-05-05 17:29:47.000000000,2016-05-06 02:28:24.000000000,closed,2,Updating error condition in applying apparmor profile
803,2016-05-05 17:01:46.000000000,2016-05-06 01:34:12.000000000,closed,2,Typo: fix a typo in setupRootfs
802,2016-05-05 13:50:10.000000000,2016-06-21 19:36:43.000000000,closed,3,How runC should treat supplementary groups?
801,2016-05-04 18:41:59.000000000,2016-06-02 00:18:39.000000000,closed,5,runc and systemd slice (--systemd-cgroup flag)
800,2016-05-04 03:06:12.000000000,2016-05-06 01:11:59.000000000,closed,4,Change OCF to OCI in help string and man page.
799,2016-05-03 17:00:08.000000000,1970-01-01 00:00:00.000000001,open,13,Cannot create user namespaced container without network namespaces
798,2016-05-02 18:16:12.000000000,1970-01-01 00:00:00.000000001,open,6,runC depends on devices cgroup to find mountpoints
797,2016-05-01 05:16:23.000000000,2016-10-28 10:59:54.000000000,closed,12,"Behavior of ""runc list"""
796,2016-04-30 14:37:36.000000000,2016-05-02 20:50:26.000000000,closed,3,Need to make sure labels applied to /dev
795,2016-04-29 19:45:33.000000000,2016-04-29 20:08:51.000000000,closed,1,Correct outdated URL
794,2016-04-29 19:38:26.000000000,2016-04-29 20:08:51.000000000,closed,0,Outdated documentation for cgroups
793,2016-04-29 16:04:24.000000000,2016-04-30 02:19:28.000000000,closed,5,Use '=' instead of ':' separator on labels
792,2016-04-29 10:46:27.000000000,1970-01-01 00:00:00.000000001,open,4,Issue with default bridge networking
791,2016-04-29 00:59:08.000000000,2016-04-29 02:14:15.000000000,closed,2,Add localintegration to the make ci
790,2016-04-29 00:40:53.000000000,2016-05-09 10:01:18.000000000,closed,10,Runc update cgroup kmem limit
789,2016-04-27 19:25:32.000000000,2016-04-28 04:08:16.000000000,closed,2,"If possible, apply seccomp rules immediately before exec"
788,2016-04-27 09:43:57.000000000,2016-08-27 06:57:17.000000000,closed,2,ps command with UNIX format
787,2016-04-27 03:54:15.000000000,2016-04-27 19:48:40.000000000,closed,3,Setting RLIMIT_STACK in config.json inside rlimits crashed the container during startup
786,2016-04-26 15:03:45.000000000,2016-04-26 23:07:53.000000000,closed,4,Fix integration test for events
785,2016-04-26 13:24:48.000000000,2016-04-26 20:31:15.000000000,closed,4,Remove sniffTest
784,2016-04-26 13:15:19.000000000,2016-10-08 02:23:04.000000000,closed,8,Add integration test for ps command
783,2016-04-26 12:37:53.000000000,2016-05-06 04:26:47.000000000,closed,11,Use full test suite on make test
782,2016-04-26 12:02:59.000000000,2016-04-27 03:08:38.000000000,closed,3,Change specs to runtime-spec in integration test
781,2016-04-26 08:07:06.000000000,2017-02-10 12:10:37.000000000,closed,14,Add support for cgroup namespaces
780,2016-04-26 03:17:33.000000000,2016-04-26 13:16:53.000000000,closed,2,Improve stats output format for stability 
779,2016-04-26 02:21:42.000000000,2016-04-26 05:34:27.000000000,closed,2,Add json format to ps command
778,2016-04-26 01:20:35.000000000,2016-04-26 01:28:22.000000000,closed,1,Bump to v0.1.1 for selinux mount label fix
777,2016-04-25 04:46:49.000000000,2016-04-25 06:09:30.000000000,closed,2,libcontainer: specconv: fix nil dereference in resource setup
776,2016-04-24 20:16:35.000000000,2016-04-25 05:56:37.000000000,closed,2,Updating README for runc path
775,2016-04-24 14:13:07.000000000,2016-04-24 14:28:49.000000000,closed,1,Help: Using libcontainer
774,2016-04-23 17:36:26.000000000,2017-03-27 22:58:04.000000000,closed,76,Rootless Containers
773,2016-04-23 02:32:21.000000000,2016-04-23 04:09:26.000000000,closed,3,Bump up spec and add support for mount label
772,2016-04-22 13:46:33.000000000,2016-04-23 01:47:16.000000000,closed,1,Updating kcore in validator test
771,2016-04-22 13:33:59.000000000,2016-04-27 20:58:27.000000000,closed,2,userns + netns = operation not permitted
770,2016-04-22 12:30:01.000000000,2017-03-07 12:55:24.000000000,closed,2,Add signal mapping to man page
769,2016-04-21 21:47:04.000000000,2016-08-12 11:33:44.000000000,closed,16,userns doesn't work on ubuntu-xenial
768,2016-04-21 18:53:09.000000000,2016-04-25 21:51:58.000000000,closed,4,Not showing up the events for destroyed container
767,2016-04-21 16:44:53.000000000,2016-04-26 01:51:43.000000000,closed,7,Add ps command
766,2016-04-21 13:22:22.000000000,2016-04-23 02:51:46.000000000,closed,4,Add target man in Makefile
765,2016-04-21 10:00:08.000000000,2016-04-21 20:53:30.000000000,closed,5,Add infomation about ocitools in runc spec
764,2016-04-20 11:09:04.000000000,2016-04-21 09:47:10.000000000,closed,11,Add option to generate userns enabled spec
763,2016-04-19 20:57:23.000000000,2016-04-19 21:36:00.000000000,closed,7,Allow mounting cgroups as read-only when user namespace is configured
762,2016-04-19 13:00:25.000000000,2016-04-20 02:29:13.000000000,closed,2,nsexec: fix build against musl libc
761,2016-04-19 11:40:53.000000000,2016-04-20 02:29:13.000000000,closed,7,build fails with musl libc
760,2016-04-19 01:57:26.000000000,2016-05-25 04:36:18.000000000,closed,5,move libcontainer/SPEC.md into runtime-spec project?
759,2016-04-18 22:39:31.000000000,2016-04-19 05:52:43.000000000,closed,2,Add cause to error messages
758,2016-04-17 13:19:21.000000000,2016-04-20 03:16:41.000000000,closed,1,Update the comment for container pause
757,2016-04-16 13:13:52.000000000,2016-04-18 05:59:48.000000000,closed,2,Typo in SPEC.md
756,2016-04-16 01:11:04.000000000,2016-04-16 07:39:59.000000000,closed,3,Docker package building fails with make install's change to copy runc to sbin
755,2016-04-15 16:12:54.000000000,2016-04-15 16:17:24.000000000,closed,0,Adding destroyed condition for container statistics
754,2016-04-14 17:57:11.000000000,2016-04-14 18:18:30.000000000,closed,9,Skip flag parsing when executing commands
753,2016-04-14 17:26:33.000000000,2016-04-15 05:30:30.000000000,closed,2,updating man page for start option
752,2016-04-14 16:46:28.000000000,2016-11-21 07:20:19.000000000,closed,13,runc exec command parsing
751,2016-04-14 03:29:17.000000000,2016-04-20 03:16:09.000000000,closed,8,Add -q to list to print only container IDs
750,2016-04-13 23:40:14.000000000,2016-04-14 00:38:22.000000000,closed,3,Switch from mixed jessie/testing to jessie+backports for libseccomp
749,2016-04-13 21:59:33.000000000,2016-04-14 23:18:39.000000000,closed,10,Fix OCI reference in README
748,2016-04-13 18:56:13.000000000,2016-04-14 01:13:23.000000000,closed,6,README.md: simplify Docker image example
747,2016-04-13 03:16:50.000000000,2016-04-13 04:29:35.000000000,closed,4,Get runc to build clean on Solaris
746,2016-04-13 00:37:18.000000000,2016-04-13 01:34:16.000000000,closed,4,Update to version 0.1.0
745,2016-04-12 12:14:37.000000000,2016-04-13 00:33:00.000000000,closed,2,Fix trivial style errors reported by `go vet` and `golint`
744,2016-04-12 12:12:15.000000000,2016-04-12 21:05:47.000000000,closed,1,Fix problem when swap memory unsupported
743,2016-04-12 08:58:36.000000000,2016-04-13 12:01:41.000000000,closed,6,compile runc-0.0.8 fails on fedora 21 mipsel
742,2016-04-11 21:22:17.000000000,2016-04-11 22:16:36.000000000,closed,7,Fix setupDev logic in rootfs_linux.go
741,2016-04-11 21:01:30.000000000,2016-06-02 03:33:35.000000000,closed,3,/proc/sys read-only
740,2016-04-10 21:29:44.000000000,2016-04-22 07:09:27.000000000,closed,11,Fixing index out of range during exec of container
739,2016-04-10 17:15:56.000000000,2016-04-12 20:21:24.000000000,closed,4,Add unit tests for the utils package
738,2016-04-09 19:49:07.000000000,2016-04-20 03:17:42.000000000,closed,3,Makefile fixes
737,2016-04-09 03:36:44.000000000,2016-04-09 03:46:11.000000000,closed,2,Fix broken build due to missing import
736,2016-04-09 03:26:32.000000000,2016-04-11 21:58:05.000000000,closed,3,Fix for runc failing when rootfs has a trailing slash
735,2016-04-09 01:16:31.000000000,2016-04-09 01:37:53.000000000,closed,2,Synchronize writes to mcs map
734,2016-04-08 22:03:29.000000000,2016-04-09 01:34:58.000000000,closed,4,Report hook output on error
733,2016-04-08 21:41:21.000000000,2016-04-09 01:34:58.000000000,closed,1,runc does not report failures happening in pre/post-hook
732,2016-04-08 09:07:14.000000000,2016-04-11 22:16:36.000000000,closed,7,Fix setupDev logic in rootfs_linux.go
731,2016-04-08 07:56:11.000000000,2016-06-01 05:23:29.000000000,closed,26,don't relabel mqueue with user ns  and make selinux and user ns can be used at the same time
730,2016-04-08 00:36:10.000000000,2016-04-09 09:25:11.000000000,closed,3,Add label.GetFileLabel interface
729,2016-04-07 20:39:21.000000000,2016-04-07 21:29:49.000000000,closed,2,Fix the build by removing go get for vet
728,2016-04-07 17:47:51.000000000,2017-03-04 00:39:47.000000000,closed,13,Use Go's new standard vendoring in 1.6+
727,2016-04-07 03:51:04.000000000,2016-04-08 22:19:38.000000000,closed,13,Increase keyring quota automatically once it is reached
726,2016-04-07 00:28:23.000000000,2016-06-02 03:46:39.000000000,closed,4,Unable to create more than 200 containers by default
725,2016-04-06 23:01:09.000000000,2017-10-26 17:27:05.000000000,closed,15,Use SELinux mount label if SELinux is enabled on host
724,2016-04-06 21:08:35.000000000,2016-04-12 01:59:14.000000000,closed,2,HookState adhears to OCI
723,2016-04-06 18:11:49.000000000,2016-04-06 20:32:34.000000000,closed,1,Typo on Readme file.
722,2016-04-06 17:57:25.000000000,2016-04-07 10:37:51.000000000,closed,2,Updating README with container signal interaction
721,2016-04-04 20:44:34.000000000,2016-04-04 21:36:52.000000000,closed,2,Fixing rlimit sigpending value
720,2016-04-04 16:24:02.000000000,2016-04-12 16:28:19.000000000,closed,10,Adding message for seccomp syscall failure
719,2016-04-03 19:25:17.000000000,2016-04-04 04:56:04.000000000,closed,2,Vol mounted overlayfs directory in is invisible to container
718,2016-04-02 18:20:38.000000000,2016-04-06 20:34:33.000000000,closed,7,Add unit tests for validate.Validator
717,2016-04-02 16:02:55.000000000,2016-04-12 06:43:16.000000000,closed,9,Add unit tests for configs.Hooks
716,2016-04-02 00:06:09.000000000,2016-04-04 22:58:06.000000000,closed,3,Bump spec for masked and readonly paths
715,2016-04-01 18:09:50.000000000,2017-01-11 03:46:19.000000000,closed,4,rootfs shared mount propagation broken
714,2016-04-01 12:31:58.000000000,2016-10-31 06:36:53.000000000,closed,5,canonicalize bundle path before starting container
713,2016-04-01 00:42:29.000000000,2016-04-08 23:04:29.000000000,closed,1,runc returns 0 even if the entrypoint command was failed due to seccomp
712,2016-03-31 01:48:55.000000000,2016-03-31 13:02:02.000000000,closed,2,Fixup incorrect package name in a comment
711,2016-03-31 00:16:48.000000000,2016-03-31 02:35:06.000000000,closed,4,Return a more meaningful error when namespaces are disabled
710,2016-03-30 22:14:26.000000000,2016-03-31 00:57:24.000000000,closed,2,Add --no-pivot option for containers on ramdisk
709,2016-03-30 16:59:25.000000000,2016-04-06 21:44:00.000000000,closed,4,terminal not usable after detach container
708,2016-03-30 15:53:44.000000000,2016-03-31 00:52:26.000000000,closed,7,libcontainer: user: always treat numeric ids numerically
707,2016-03-30 03:46:25.000000000,2016-05-27 00:48:07.000000000,closed,24,Add support for copying up directories into tmpfs when a tmpfs is mounted over them
706,2016-03-29 21:55:15.000000000,2016-03-30 06:33:05.000000000,closed,2,Bump spec and implement hook timeout
705,2016-03-29 13:08:51.000000000,2016-03-30 18:41:05.000000000,closed,17,cannot suid root when run as non-root
704,2016-03-29 02:36:09.000000000,2016-08-24 20:28:23.000000000,closed,2,Add an ability to build runc without criu
703,2016-03-29 00:30:16.000000000,2016-03-30 06:39:07.000000000,closed,2,Remove container root dir from an aborted start
702,2016-03-28 16:25:18.000000000,2016-04-12 23:12:08.000000000,closed,4,Makefile: install to /usr/local/sbin
701,2016-03-27 15:43:12.000000000,1970-01-01 00:00:00.000000001,open,6,make criu a separate build tag
700,2016-03-27 08:54:30.000000000,2016-03-29 03:47:26.000000000,closed,5,Fix hanging tests when run without root
699,2016-03-27 08:45:09.000000000,2016-03-28 03:27:52.000000000,closed,1,Fix typo
698,2016-03-26 19:34:49.000000000,2016-03-28 20:28:28.000000000,closed,2,Use %v for map structure format
697,2016-03-26 09:21:53.000000000,2016-03-29 06:22:31.000000000,closed,4,bind mount a path from root filesystem inside a running container
696,2016-03-26 06:48:09.000000000,2016-03-26 08:24:12.000000000,closed,1,Fix libcontainer README.md example config
695,2016-03-26 04:16:59.000000000,2016-03-31 00:52:26.000000000,closed,9,Numeric user id passed as user name if user name is numeric in /etc/passwd
694,2016-03-26 03:42:49.000000000,1970-01-01 00:00:00.000000001,open,2,please squash man pages
693,2016-03-26 03:39:45.000000000,2016-04-12 23:12:08.000000000,closed,4,man section mismatch
692,2016-03-26 03:26:10.000000000,2016-03-29 03:47:26.000000000,closed,4,0.0.9: Hanging test `libcontainer/nsenter/nsenter_test.go`
691,2016-03-26 01:22:09.000000000,2016-03-26 04:45:26.000000000,closed,2,Remove log from seccomp package
690,2016-03-26 00:36:29.000000000,2016-03-26 04:43:22.000000000,closed,4,Move lockthread to package level
689,2016-03-25 20:41:10.000000000,2016-03-26 02:39:41.000000000,closed,4,"0.0.9 FTBFS with Golang 1.6: ""unknown cli.Command field 'ArgsUsage' in struct literal"""
688,2016-03-25 20:23:48.000000000,2016-03-26 04:44:58.000000000,closed,2,Export CreateLibcontainerConfig
687,2016-03-25 19:17:27.000000000,2016-03-26 05:10:10.000000000,closed,2,Set rlimits using prlimit in parent
686,2016-03-25 10:11:35.000000000,2016-03-28 20:36:06.000000000,closed,5,Refactor nsexec.c and add some comments
685,2016-03-25 07:12:58.000000000,2016-03-25 14:18:29.000000000,closed,2,fix typos
684,2016-03-25 05:18:23.000000000,2016-03-26 04:43:22.000000000,closed,5,Cap Set Apply EPERM on ARM systems
683,2016-03-25 00:54:17.000000000,2016-03-29 20:30:43.000000000,closed,3,Only perform mount labelling when necessary
682,2016-03-24 21:44:28.000000000,2016-03-24 22:18:51.000000000,closed,5,Dont cleanPath for systemd cgroup paths.
681,2016-03-23 22:28:51.000000000,2016-03-24 01:15:27.000000000,closed,3,Add stop command
680,2016-03-23 18:32:37.000000000,2016-03-26 05:10:10.000000000,closed,1,Raising rlimits higher than current hard limit fails in unprivileged containers
679,2016-03-23 18:07:57.000000000,2016-04-24 20:24:26.000000000,closed,23,Adding selinux check during container start
678,2016-03-23 04:02:28.000000000,2016-03-23 20:36:05.000000000,closed,14,runc stats command?
677,2016-03-23 02:45:19.000000000,2016-03-23 20:52:58.000000000,closed,6,Show proper error from init process panic
676,2016-03-22 21:50:56.000000000,2016-04-05 01:21:48.000000000,closed,1,Expand support for container id naming
675,2016-03-22 19:41:51.000000000,2016-05-25 21:35:08.000000000,closed,19,Allow + in container ID
674,2016-03-22 19:27:30.000000000,2016-03-22 19:28:15.000000000,closed,1,Allow + in container ID 
673,2016-03-22 18:35:01.000000000,2016-03-23 01:16:33.000000000,closed,4,fixing typo in device access error
672,2016-03-22 18:30:24.000000000,2016-04-18 05:15:38.000000000,closed,10,handling error for userns
671,2016-03-22 16:22:31.000000000,2016-03-29 16:09:45.000000000,closed,2,Changing the error type for max id length
670,2016-03-22 15:53:40.000000000,2016-03-22 20:15:45.000000000,closed,2,Fixing sniffTest for container state dir
669,2016-03-22 02:52:11.000000000,2016-03-22 05:45:13.000000000,closed,3,Fix the kmem TCP test
668,2016-03-22 02:34:59.000000000,2016-03-22 20:42:34.000000000,closed,10,Set oom_score_adj before we send the config to avoid race
667,2016-03-21 23:55:14.000000000,2016-03-24 03:14:03.000000000,closed,7,Add support for enabling systemd cgroups 
666,2016-03-21 14:31:52.000000000,2016-03-21 14:33:09.000000000,closed,0,specs: fix typo
665,2016-03-20 15:04:20.000000000,2016-03-22 01:51:10.000000000,closed,2,libcontainer: cgroups: add support for kmem.tcp limits
664,2016-03-19 23:02:16.000000000,2016-03-20 21:23:53.000000000,closed,1,fix pids events for max
663,2016-03-19 21:59:42.000000000,2016-03-22 02:08:32.000000000,closed,17,"pids.max cgroup return ""max"", runc events broken on master"
662,2016-03-19 00:51:11.000000000,2016-03-22 03:11:35.000000000,closed,9,Exec fails randomly
661,2016-03-18 22:56:54.000000000,2016-03-21 05:16:13.000000000,closed,2,adds detail to runc start and spec help text
660,2016-03-18 13:18:56.000000000,2016-04-26 20:38:01.000000000,closed,2,corrects sniffTest behavior
659,2016-03-18 11:53:58.000000000,2016-04-23 02:29:57.000000000,closed,11,adds client api integration tests for runc using bash w/bats
658,2016-03-18 11:09:48.000000000,2016-03-18 20:38:17.000000000,closed,1,Fix help info of init command
657,2016-03-18 09:22:55.000000000,2016-03-22 19:19:43.000000000,closed,4,Allow + in container id
656,2016-03-18 09:04:38.000000000,2016-03-18 09:06:40.000000000,closed,1,Allow + in container id
655,2016-03-18 02:13:54.000000000,2016-03-18 03:15:30.000000000,closed,1,Sync on the pid file to ensure the write is persisted
654,2016-03-18 00:32:34.000000000,2019-10-23 18:05:10.000000000,closed,37,support cgroup v2 (unified hierarchy)
653,2016-03-18 00:28:25.000000000,2016-03-18 03:50:45.000000000,closed,8,remove deadcode
652,2016-03-18 00:18:01.000000000,2016-03-18 01:44:30.000000000,closed,3,Create pid-file atomically
651,2016-03-17 22:04:47.000000000,2016-03-22 04:53:49.000000000,closed,12,Add more information in the error messages when writing to a file
650,2016-03-17 21:26:55.000000000,2016-03-21 05:41:56.000000000,closed,6,Export user and group lookup errors as variables.
649,2016-03-17 18:56:00.000000000,2017-03-04 00:42:39.000000000,closed,4,Add Vagrantfile
648,2016-03-15 23:18:21.000000000,2016-03-17 01:44:02.000000000,closed,6,Set Delegate to true for cgroups transient units
647,2016-03-15 07:05:35.000000000,2016-03-18 20:38:56.000000000,closed,8,Fixing valid-id in regex
646,2016-03-15 02:50:50.000000000,2016-03-17 20:51:59.000000000,closed,11,Destroy container along with processes before stdio
645,2016-03-14 20:38:30.000000000,2016-03-22 03:12:34.000000000,closed,3,Overriding the default args parameter in the spec
644,2016-03-14 10:45:32.000000000,2016-03-22 01:55:20.000000000,closed,12,libcontainer: cgroups: deal with unlimited case for pids.max
643,2016-03-14 07:01:50.000000000,2016-03-14 23:49:48.000000000,closed,3,Add make uninstall command
642,2016-03-14 00:22:44.000000000,2017-03-06 13:36:21.000000000,closed,4,Installation without sudo access
641,2016-03-13 16:39:15.000000000,2016-03-13 18:31:05.000000000,closed,1,Unable to sudo in the container
640,2016-03-13 07:17:28.000000000,2016-03-14 08:25:45.000000000,closed,2,libcontainer: cgroups: add pids.max to PidsStats
639,2016-03-13 07:02:49.000000000,2016-03-14 08:24:46.000000000,closed,2,Changing from logrus to fatal in list
638,2016-03-12 11:21:12.000000000,2016-03-14 22:55:12.000000000,closed,2,Fix encoding gid mappings
637,2016-03-12 06:10:14.000000000,2016-03-15 22:05:10.000000000,closed,2,Ensure logs are flushed
636,2016-03-12 02:50:04.000000000,2016-03-12 07:02:13.000000000,closed,9,Add gitcommit to runc builds
635,2016-03-11 22:56:49.000000000,2016-03-18 20:38:56.000000000,closed,2,Valid IDs
634,2016-03-11 11:24:30.000000000,2016-03-11 22:45:39.000000000,closed,4,Clear groups after entering userns
633,2016-03-11 03:40:35.000000000,2016-03-11 05:42:46.000000000,closed,2,Bump spec v0.4
632,2016-03-10 18:46:26.000000000,2016-03-11 02:14:50.000000000,closed,7,nsexec: don't use CLONE_PARENT and CLONE_NEWPID together
631,2016-03-10 11:56:19.000000000,2016-04-24 09:30:54.000000000,closed,0,Running a container becomes slower when a large number of containers are alive
630,2016-03-10 06:57:26.000000000,2016-03-11 03:42:30.000000000,closed,5,"Revert ""Return proper exit code for exec errors"""
629,2016-03-10 01:22:59.000000000,2016-03-10 21:45:07.000000000,closed,4,Need to unshare(CLONE_NEWIPC) before mounting mqueue fs.
628,2016-03-10 00:08:54.000000000,2016-03-10 05:01:44.000000000,closed,2,Improve error handling in runc
627,2016-03-09 12:26:29.000000000,2016-03-09 20:05:30.000000000,closed,2,Killing a non-existing container produces a stacktrace
626,2016-03-09 12:23:24.000000000,2016-03-09 20:05:52.000000000,closed,1,Better description of runc kill
625,2016-03-09 12:18:08.000000000,2016-03-09 20:06:47.000000000,closed,2,Die on starting as a non-root
