id,created_at,closed_at,state,comments,title
2241,2019-07-05 17:55:09.000000000,2019-07-10 19:08:18.000000000,closed,0,Process @MapsId annotation for orm.xml generation 
2240,2019-07-05 12:20:46.000000000,2019-07-11 15:58:44.000000000,closed,2,Fix DataGrid vulnerability
2239,2019-07-04 15:38:45.000000000,2019-08-01 16:40:32.000000000,closed,0,"""New window"" and ""User menu"" icons are displayed outside the vertical menu if user substitution list is filled "
2238,2019-07-03 18:24:55.000000000,2019-07-08 20:17:11.000000000,closed,0,RichTextArea that is placed in Accordion doesn't display entity attribute value when a screen is loaded
2237,2019-07-03 16:58:50.000000000,1970-01-01 00:00:00.000000001,open,0,Introduce fluent builder for groovy scripts
2236,2019-07-03 16:15:34.000000000,2019-08-13 15:19:04.000000000,closed,0,Introduce fluent builder for EmailInfo
2235,2019-07-03 11:17:27.000000000,2019-07-22 14:49:45.000000000,closed,3,Ability to setup custom format for Decimal dynamic attributes
2234,2019-07-02 18:08:02.000000000,2019-07-03 11:45:43.000000000,closed,0,Ability to define own UiControllerDependencyInjector
2233,2019-07-02 15:52:24.000000000,2019-12-17 18:20:30.000000000,closed,1,Introduce more concise way to define queries
2232,2019-07-02 13:16:46.000000000,2019-07-04 14:15:50.000000000,closed,1,Set httpOnly cookies by default
2231,2019-07-01 15:42:11.000000000,2019-07-15 15:54:58.000000000,closed,0,Ability to override UI infrastructural classes
2230,2019-06-30 14:51:18.000000000,1970-01-01 00:00:00.000000001,open,1,Highlight the component in case if ValidationError has been created for it
2229,2019-06-28 18:12:48.000000000,2019-08-05 16:12:19.000000000,closed,0,Filter should indicate that the current conditions are applied
2228,2019-06-28 14:58:56.000000000,2019-12-24 16:02:11.000000000,closed,2,Message keys in bean validation annotations don't support some cases
2227,2019-06-28 12:12:47.000000000,2019-06-28 12:20:53.000000000,closed,0,getReference method accepting Id
2226,2019-06-27 16:40:53.000000000,2019-07-02 17:24:18.000000000,closed,1,The platform incorrectly closes the screen after using the Close all and Close other commands
2225,2019-06-27 15:27:21.000000000,2020-01-06 12:31:48.000000000,closed,2,Ability to declare view right in the screen descriptor
2224,2019-06-27 15:20:51.000000000,2019-07-03 16:02:02.000000000,closed,6,Table does not consider caption property as property path
2223,2019-06-27 10:11:30.000000000,2019-06-27 16:41:26.000000000,closed,0,"""Full-Text search"" checkbox is visible in generic filter even if the entity is not indexed for FTS"
2222,2019-06-26 17:46:19.000000000,2019-07-03 17:01:12.000000000,closed,0,Empty search criteria in FTS mode in generic filter should display all records
2221,2019-06-26 16:48:12.000000000,2019-06-27 14:54:29.000000000,closed,0,The 'showOptionDialog' method ignores HTML MessageType
2220,2019-06-26 15:30:32.000000000,1970-01-01 00:00:00.000000001,open,0,Add user activity check before substitution
2219,2019-06-26 15:26:56.000000000,1970-01-01 00:00:00.000000001,open,1,Add user activity check before substitution
2218,2019-06-26 14:56:30.000000000,2019-10-17 18:02:33.000000000,closed,1,Browser should contain edited instance after Save and then Cancel in editor
2217,2019-06-26 13:33:23.000000000,2019-07-03 18:35:10.000000000,closed,1,Custom filter conditions don't work
2216,2019-06-26 11:12:43.000000000,2019-06-26 15:46:20.000000000,closed,0,"NULL text is written to the generic filter condition component when ""Clear values"" command is invoked"
2215,2019-06-25 15:10:01.000000000,2019-07-11 15:04:13.000000000,closed,1,AmazonS3FileStorage doesn't work if bucket name contains dots
2214,2019-06-25 12:19:59.000000000,2019-07-01 12:12:42.000000000,closed,1,Default screen can be closed after manually opening it from the menu
2213,2019-06-25 11:18:38.000000000,2019-08-12 11:26:13.000000000,closed,1,Put files into storage on DataContext commit
2212,2019-06-25 10:25:33.000000000,2019-07-31 14:54:33.000000000,closed,0,Add InputParameter of Enum type in Input Dialog builder
2211,2019-06-25 03:54:50.000000000,2019-07-31 12:31:12.000000000,closed,1,Wrong ordering in database commit causes failure when committing entity containing inherited entity attribute
2210,2019-06-24 19:12:38.000000000,2019-11-08 20:03:51.000000000,closed,2,When trying to save an entity with a relation to another not persisted entity it leads to the wrong exception in terms of CUBA
2209,2019-06-24 14:50:18.000000000,2019-07-19 13:53:58.000000000,closed,1,Related entities table aligned on right in the dialog mode
2208,2019-06-23 13:10:18.000000000,2019-07-24 17:57:05.000000000,closed,0,The StandardEditor.commit method doesn't show a notification in case of success
2207,2019-06-21 19:09:41.000000000,2019-06-25 13:20:19.000000000,closed,0,Copy button in System Information dialog doesn't work
2206,2019-06-21 15:40:54.000000000,2019-06-24 16:43:34.000000000,closed,1,Enter key is ignored by RichTextArea if there is a DataGrid on a screen
2205,2019-06-21 12:13:14.000000000,2019-08-13 12:56:08.000000000,closed,2,Images with the same name are not displayed correctly
2204,2019-06-20 13:30:00.000000000,1970-01-01 00:00:00.000000001,open,0,Add the ability to collapse and expand SplitPanel
2203,2019-06-19 15:43:59.000000000,2019-07-10 19:09:11.000000000,closed,1,Repaint Filter layout when columns count is changed at runtime
2202,2019-06-18 18:39:26.000000000,2019-11-18 13:57:11.000000000,closed,0,Implement the Slider component
2201,2019-06-18 12:31:55.000000000,2019-06-24 12:05:20.000000000,closed,0,Extra spacing appears if ContextHelp is added for Form fields when the captions are on top
2200,2019-06-17 20:20:36.000000000,2019-06-26 17:25:35.000000000,closed,3,Invalid encoding of URI containing Cyrillic characters
2199,2019-06-17 12:54:21.000000000,2019-06-17 13:42:28.000000000,closed,1,NPE when trying to create or edit roles
2198,2019-06-17 12:22:25.000000000,2019-06-21 15:38:30.000000000,closed,1,DataGrid ENTER key is not directed to the correct instance
2197,2019-06-17 11:26:25.000000000,1970-01-01 00:00:00.000000001,open,0,Automatically resolve custom datatype for an attribute
2196,2019-06-17 07:35:49.000000000,1970-01-01 00:00:00.000000001,open,0,Presentations functionality for DataGrid
2195,2019-06-14 15:23:08.000000000,2019-06-25 11:17:35.000000000,closed,1,Cells with decimal type have an incorrect format in Excel
2194,2019-06-13 17:57:13.000000000,2019-06-14 12:03:32.000000000,closed,0,Filter drop-down list for entities is cleared after operation сhanging  from `=` to `in` then backwards
2193,2019-06-13 14:59:41.000000000,2019-06-14 12:02:53.000000000,closed,2,Update Jetty to 9.3.27.v20190418 for Uber JAR
2192,2019-06-13 13:03:59.000000000,2019-06-13 16:28:21.000000000,closed,0,Error while clicking RowCount
2191,2019-06-13 11:31:35.000000000,2019-08-29 12:34:11.000000000,closed,6,Ability to specify custom values provider for the dynamic attributes
2190,2019-06-13 11:28:03.000000000,2019-08-02 19:11:49.000000000,closed,4,Dynamic attributes improvements
2189,2019-06-13 09:44:44.000000000,2019-07-04 13:09:15.000000000,closed,4,DataGrid ColumnControl overlaps sort icon when no vertical scrollbox
2188,2019-06-12 17:52:59.000000000,2019-08-08 12:12:59.000000000,closed,2,Delta translation in app destroys existing translations
2187,2019-06-12 16:26:40.000000000,2019-06-13 18:21:39.000000000,closed,0,Filter doesn't use default values from saved filter 
2186,2019-06-11 15:00:36.000000000,2019-06-13 11:02:17.000000000,closed,0,"Date validation (@Past, @Future) doesn't work with java.sql.Date"
2185,2019-06-11 14:24:13.000000000,2019-10-17 13:00:34.000000000,closed,0,Add an ability to show Table context menu without items
2184,2019-06-11 13:44:23.000000000,2019-06-14 15:11:00.000000000,closed,0,Usage of session parameters in generic Filter
2183,2019-06-10 15:54:32.000000000,2019-06-10 16:49:55.000000000,closed,0,Idea freezes
2182,2019-06-10 11:10:53.000000000,2019-06-10 11:14:14.000000000,closed,0,Fix bug to setting incorrect attribute idpSessionId
2181,2019-06-07 16:50:33.000000000,2019-07-22 17:38:35.000000000,closed,1,NPE occurs when selecting entity list param dependent on other param in Filter
2180,2019-06-06 20:13:16.000000000,2019-06-11 15:14:41.000000000,closed,0,Use protected modifiers for fields in ScheduledTaskEditor
2179,2019-06-06 17:27:25.000000000,2019-07-12 17:54:49.000000000,closed,1,The error “Java Heap Space” occurs while opening scheduled task editor
2178,2019-06-06 17:04:32.000000000,2019-08-01 12:04:02.000000000,closed,0,DataManager return first entity if id is null
2177,2019-06-06 14:11:16.000000000,2019-11-07 19:55:05.000000000,closed,0,Show file name button when value binding connected
2176,2019-06-05 14:59:19.000000000,2019-08-14 18:53:22.000000000,closed,1,Null values of new instances are not merged to parent data context
2175,2019-06-04 19:41:59.000000000,2019-06-06 12:29:52.000000000,closed,1,Label disappeared when fields are moved between forms
2174,2019-06-04 19:28:44.000000000,2019-06-28 17:51:17.000000000,closed,4,StyleProvider doesn't work in TreeTable hierarchical column
2173,2019-06-04 16:58:16.000000000,1970-01-01 00:00:00.000000001,open,0,Table data scrolls down when datasource refreshed
2172,2019-06-04 11:32:03.000000000,2020-02-25 19:07:35.000000000,closed,1,Design-time security
2171,2019-06-03 18:41:47.000000000,2019-06-06 16:15:37.000000000,closed,0,DevelopmentException occurs when the filter operation is set to `IsSet` and the enter parameter is No
2170,2019-06-03 18:12:26.000000000,2019-06-04 15:06:53.000000000,closed,0,Reset required flag for Field if the bound attribute it is disabled by row-level security
2169,2019-06-03 15:30:48.000000000,2019-06-03 15:48:54.000000000,closed,0,ComponentLoader.Context must provide messagesPack reference
2168,2019-06-03 11:04:54.000000000,2019-12-28 16:14:13.000000000,closed,1,Add ability to set item descriptions in Table
2167,2019-05-31 12:28:46.000000000,2019-05-31 13:57:03.000000000,closed,3,AWS S3 File Storage: extracted methods for easier extensibility
2166,2019-05-30 12:53:40.000000000,2019-06-21 14:17:34.000000000,closed,0,Allow setting the first day of week for Calendar
2164,2019-05-30 11:10:04.000000000,2019-05-30 11:17:54.000000000,closed,1,MainScreen should init the FoldersPane as AppMainWindow does
2163,2019-05-29 17:36:24.000000000,2020-02-04 10:56:39.000000000,closed,4,Rework remember me mechanism
2162,2019-05-29 15:55:20.000000000,2019-06-03 17:42:59.000000000,closed,0,Annotate some config properties with @Secret
2161,2019-05-29 12:22:34.000000000,2019-06-04 15:24:52.000000000,closed,3,Standalone UberJar applications cannot start with the front module
2160,2019-05-29 11:46:38.000000000,2019-06-06 17:55:25.000000000,closed,0,@DialogMode screen controller annotation doesn't support AUTO width
2159,2019-05-28 17:41:09.000000000,2019-05-30 12:20:40.000000000,closed,0,Table returns null in selection after filtering
2158,2019-05-28 13:48:51.000000000,2019-06-11 16:53:19.000000000,closed,0,IDP REST Integration does not work
2157,2019-05-28 12:40:28.000000000,2019-06-28 13:46:47.000000000,closed,0,DataGrid Editor breaks when switching tabs
2156,2019-05-27 21:41:13.000000000,2019-05-30 19:19:38.000000000,closed,2,Missing equals/hashCode methods in MetaClassImpl
2155,2019-05-27 16:17:33.000000000,1970-01-01 00:00:00.000000001,open,0,Support polymorphic views
2154,2019-05-27 14:47:18.000000000,2019-06-19 15:39:43.000000000,closed,0,Misaligned aggregation row in case of vertical and horizontal scrollbars
2153,2019-05-27 14:19:51.000000000,2019-06-22 14:50:33.000000000,closed,0,Add Table generated column by index
2152,2019-05-25 14:59:52.000000000,2020-01-31 16:14:08.000000000,closed,1,Allow S3 FileStorageAPI Implementation to fetch the credentials from AWS metadata service
2151,2019-05-24 18:40:22.000000000,2019-06-17 11:24:13.000000000,closed,0,Update platform jmockit dependency
2150,2019-05-24 15:13:32.000000000,2019-06-01 13:42:34.000000000,closed,2,Default screen functionality doesn't consider both declared id and screen
2149,2019-05-24 12:51:21.000000000,2019-08-05 13:47:17.000000000,closed,1,Ability to choose FileStorage implementation based on app property
2148,2019-05-24 12:43:04.000000000,2019-05-24 14:09:16.000000000,closed,3,GenericFilter should have a setting that will disable window caption changing
2147,2019-05-24 11:48:28.000000000,2019-06-03 11:57:53.000000000,closed,1,Provide an access to FilterDelegate object from within the screen code
2146,2019-05-24 10:45:23.000000000,2019-05-30 18:32:59.000000000,closed,2,Override reserved globals for Firefox 67
2145,2019-05-24 10:43:14.000000000,2019-11-18 14:09:31.000000000,closed,0,Vaadin 8.8
2144,2019-05-24 10:37:07.000000000,2019-05-24 12:30:54.000000000,closed,1,Update jackson-databind to 2.9.9
2143,2019-05-23 14:26:40.000000000,2019-05-31 14:21:45.000000000,closed,0,NPE occurs while trying to search  Scheduled Task by ID with an incorrect value
2142,2019-05-23 10:55:11.000000000,2019-06-14 16:17:46.000000000,closed,0,Aggregation results are exported as strings in Excel action
2141,2019-05-22 18:02:39.000000000,2019-05-28 16:59:47.000000000,closed,0,IllegalArgumentException is occurred when you try to sort column with dynamic attribute
2140,2019-05-22 11:31:10.000000000,1970-01-01 00:00:00.000000001,open,1,Anchor path doesn't work for defaultRedirectUrl in IDP
2139,2019-05-21 16:00:04.000000000,2019-07-30 18:06:56.000000000,closed,1,Unable to parse the value of TextField with offsetTime/offsetDateTime datatype
2138,2019-05-21 15:46:50.000000000,2019-07-08 15:07:05.000000000,closed,2,Data loading error on Table sorting leads to NPE in vaadin code
2136,2019-05-20 12:25:23.000000000,2019-06-11 10:46:34.000000000,closed,2,Links containing Russian letters in RichTextArea are broken in Firefox
2135,2019-05-20 10:59:38.000000000,2019-05-22 10:54:42.000000000,closed,0,It's impossible to disable file upload with the REST API
2134,2019-05-20 10:22:25.000000000,2019-08-30 14:53:01.000000000,closed,6,Immediate mode for Filter component
2133,2019-05-17 16:13:23.000000000,2019-07-12 18:53:01.000000000,closed,3,TextFields in DataGrid generated columns should fit into line height
2132,2019-05-17 14:34:37.000000000,2019-05-23 12:41:34.000000000,closed,0,IllegalStateException if try to create filter condition on ID property
2131,2019-05-17 12:21:30.000000000,2019-05-23 13:41:03.000000000,closed,1,The exception occurs after clicking on the open button in SuggestionPickerField in the new screens
2130,2019-05-16 17:05:26.000000000,2019-06-10 19:40:27.000000000,closed,0,DataGrid inline editor has disabled fields if it is enabled programmatically
2129,2019-05-16 12:52:10.000000000,2019-08-09 15:45:54.000000000,closed,2,EntityLog#registerCreate() fails to register a BaseDbGeneratedIdEntity
2128,2019-05-16 10:55:12.000000000,2019-07-01 16:52:36.000000000,closed,3,ExcelExporter does not consider format strings
2127,2019-05-15 21:08:03.000000000,2019-05-23 14:42:53.000000000,closed,1,GuiDevelopmentException: BulkEditor component can be used only in legacy screens based on AbstractWindow
2126,2019-05-15 16:37:45.000000000,2019-05-15 16:38:31.000000000,closed,0,Introduce EntityPersistingEvent #2119
2125,2019-05-15 15:58:37.000000000,2019-06-11 17:09:31.000000000,closed,3,"Exception report fails to be sent because of restrictions for ""From"" email header"
2124,2019-05-15 15:42:56.000000000,2019-07-01 14:55:25.000000000,closed,1,Refactor RdbmsQueryBuilder
2123,2019-05-15 15:21:33.000000000,2019-05-24 13:55:24.000000000,closed,2,Exception details are lost in JXErrorPaneExt#sendSupportEmail
2122,2019-05-15 11:23:33.000000000,2019-06-04 14:37:02.000000000,closed,0,"More details with ""The class's package must be inside of some model's root package"" error message"
2121,2019-05-14 19:31:23.000000000,2019-05-15 16:36:27.000000000,closed,0,DataContext.PostCommitEvent.getCommittedInstances() should return EntitySet
2120,2019-05-14 17:41:31.000000000,1970-01-01 00:00:00.000000001,open,0,Composable MasterDetail screen
2119,2019-05-14 12:15:36.000000000,2019-07-16 14:39:31.000000000,closed,0,Introduce EntityPersistingEvent
2118,2019-05-13 18:49:44.000000000,2019-05-23 16:08:00.000000000,closed,0,Unnecessary requests to server from filter classes
2117,2019-05-13 14:51:59.000000000,2019-08-08 11:25:38.000000000,closed,0,setItem for nested InstanceContainer doesn't lead to master property change
2116,2019-05-13 14:40:15.000000000,2019-05-15 17:59:01.000000000,closed,0,LicenseWindow cannot be opened with Denying role
2115,2019-05-13 14:29:56.000000000,2019-05-23 12:45:29.000000000,closed,0,Lack of userOriginated flag in OptionsList and OptionsGroup
2114,2019-05-13 09:48:36.000000000,2019-11-25 16:56:20.000000000,closed,1,Ability to subscribe on fragment events declaratively
2113,2019-05-08 18:47:34.000000000,2019-05-21 12:17:17.000000000,closed,0,WebImage should not use ByteArrayDataProvider just to provide input stream as Supplier
2112,2019-05-08 16:49:25.000000000,2019-05-20 17:08:19.000000000,closed,0,Unable to create a new entity in UI if it has assigned dynamic attributes and editor includes RuntimePropertiesFrame
2111,2019-05-08 15:45:56.000000000,2019-10-16 21:41:13.000000000,closed,0,Explicit localization of menu item
2110,2019-05-08 12:54:02.000000000,2019-05-20 18:57:44.000000000,closed,0,Application folder counter is not updated by timer 
2109,2019-05-07 17:38:56.000000000,2019-08-19 16:17:35.000000000,closed,0,Ability to use screen as a frame in legacy API
2108,2019-05-07 16:20:25.000000000,2019-09-04 14:27:29.000000000,closed,0,Correct type for create() method of Metadata and DataManager
2107,2019-05-07 16:19:13.000000000,2019-09-04 13:00:27.000000000,closed,3,Add type parameter to LoadContext#getId
2106,2019-05-07 10:43:45.000000000,2019-05-31 12:30:28.000000000,closed,2,The split position between app and search folders are not saved during logout
2105,2019-05-06 17:41:23.000000000,2019-05-21 09:42:24.000000000,closed,0,Unable to export application property
2104,2019-05-06 17:05:14.000000000,2019-05-21 11:52:15.000000000,closed,0,Autocompletion fails with NPE in a custom condition
2103,2019-05-06 16:49:39.000000000,2019-05-16 18:09:32.000000000,closed,0,NumberFormat of properties ignored in Entity instance names
2102,2019-05-06 15:45:04.000000000,2019-05-21 15:51:20.000000000,closed,3,Incorrect behaviour and DateTimeParseException when parsing the TextField with date datatype
2101,2019-05-06 15:06:03.000000000,2019-05-13 16:58:22.000000000,closed,0,Unable to parse the boolean value in the TextField
2100,2019-05-06 14:20:45.000000000,2019-05-22 11:41:35.000000000,closed,0,Support Runnable install methods
2099,2019-05-06 12:58:42.000000000,2019-05-17 16:39:41.000000000,closed,0,IndexOutOfBoundsException is occurred when trying to save settings for DataGrid
2098,2019-05-04 14:27:38.000000000,2019-05-07 12:08:29.000000000,closed,3,AbstractAuthenticationProvider - The expression is not a valid conditional expression 
2097,2019-05-01 09:07:10.000000000,2019-05-17 17:35:18.000000000,closed,0,Unable to create editable table and DataGrid with keyValueCollection container
2096,2019-04-30 19:29:12.000000000,2019-06-18 18:38:53.000000000,closed,3,Provide ability to change suggestion popup width for LookupField
2095,2019-04-30 09:38:15.000000000,2019-04-30 09:39:05.000000000,closed,0,Remove obsolete LicenseFrame
2094,2019-04-29 12:11:07.000000000,2019-04-29 13:28:15.000000000,closed,0,Get rid of redundant casts in administration UI screens
2093,2019-04-29 11:37:03.000000000,2019-07-31 16:50:09.000000000,closed,0,Provide used editor fields in DataGrid EditorPreCommitEvent and EditorPostCommitEvent
2092,2019-04-29 11:33:09.000000000,2019-05-20 11:45:42.000000000,closed,1,DataGrid Editor events return item instead of item Id when the getItemId() method is invoked
2091,2019-04-26 17:04:16.000000000,2019-04-26 17:10:27.000000000,closed,0,Improve JavaDoc for UI component interfaces
2089,2019-04-24 14:33:14.000000000,2019-06-26 15:16:11.000000000,closed,0,NPE when displaying collection dynamic attribute in runtimeProperties frame
2088,2019-04-24 10:56:59.000000000,2019-04-24 11:21:31.000000000,closed,0,Update Spring dependencies for 6.8-6.9 releases
2087,2019-04-23 20:05:02.000000000,2019-06-07 17:29:28.000000000,closed,0,Table connected to KeyValueCollectionContainer cannot be sorted
2086,2019-04-23 18:58:54.000000000,2019-04-23 19:02:57.000000000,closed,0,KeyValue containers do not have references to loaders
2085,2019-04-22 19:20:49.000000000,2019-05-17 15:39:07.000000000,closed,0,Incorrect item is edited in TreeDataGrid if the editor is opened programmatically
2084,2019-04-22 18:51:02.000000000,1970-01-01 00:00:00.000000001,open,1,Button captions disappear when SplitPanel overlays ButtonsPanel and screen is reopened
2083,2019-04-22 18:50:27.000000000,2019-04-25 17:30:57.000000000,closed,3,BulkEditor triggers BeanValidation rules
2082,2019-04-22 18:20:41.000000000,2019-06-17 18:21:29.000000000,closed,1,TablePresentations must not use WebPopupButton
2081,2019-04-22 17:39:30.000000000,2019-04-22 18:32:57.000000000,closed,0,EntityImportExport reads unnecessary attributes of referenced entities during the import
2080,2019-04-22 16:29:43.000000000,1970-01-01 00:00:00.000000001,open,1,Omit main screen route
2079,2019-04-22 11:37:39.000000000,2019-05-23 18:49:45.000000000,closed,0,Error in RuntimePropertiesDatasourceImpl when trying to clear the main datasource 
2078,2019-04-22 11:11:38.000000000,2019-05-21 14:15:52.000000000,closed,0,ValueChangeEvent is not fired for required OptionList
2077,2019-04-19 16:53:57.000000000,2019-04-22 18:33:11.000000000,closed,0,EntitySerializationAPI must have an option not to serialize not-persistent properties
2076,2019-04-19 16:46:38.000000000,2019-06-27 12:56:22.000000000,closed,0,Platform 6.9 depends on Atmosphere 2.2.9 but Vaadin 7.7.15 requires 2.2.13
2075,2019-04-18 11:38:50.000000000,2019-07-11 19:04:36.000000000,closed,1,Ability to disable browse's autofill for fields
2074,2019-04-17 19:25:00.000000000,2019-05-27 17:58:34.000000000,closed,0,CollectionContainer should have a sorter by default
2073,2019-04-17 11:07:45.000000000,2019-04-17 11:08:48.000000000,closed,0,Update dependencies with existing security problems for 6.10
2072,2019-04-17 10:29:13.000000000,2019-04-17 12:14:57.000000000,closed,1,REST API throws Exception java.lang.IllegalArgumentException
2070,2019-04-16 18:52:30.000000000,2019-06-25 16:52:28.000000000,closed,1,Do not expose services through HTTPInvoker when using local invocations
2069,2019-04-16 15:28:09.000000000,2019-04-16 16:29:43.000000000,closed,0,Enforce return value check for DataManager and Query
2068,2019-04-16 15:12:11.000000000,2019-05-20 10:33:53.000000000,closed,0,TokenList ignores EditableChangeNotifier editable mode
2066,2019-04-16 12:09:39.000000000,2019-07-17 11:18:54.000000000,closed,0,UnsupportedOperationException with date conditions in constraints
2065,2019-04-16 11:34:30.000000000,2019-04-16 12:28:29.000000000,closed,0,Change Constraint.group fetch type to LAZY
2064,2019-04-15 19:53:35.000000000,2019-04-15 19:55:28.000000000,closed,0,Fix errors found by static code analysis
2063,2019-04-15 17:38:00.000000000,2019-05-27 15:14:05.000000000,closed,0,Validation of UiCrossFieldChecks group on DataGrid editor commit
2062,2019-04-15 05:30:08.000000000,2019-04-15 11:39:57.000000000,closed,1,The lastItemId method of ContainerTableItems has bugs
2061,2019-04-15 05:28:16.000000000,2019-04-15 12:27:03.000000000,closed,0,Wrong method logic in ContainerTableItems lastItemId
2060,2019-04-12 18:48:15.000000000,2019-11-22 16:43:33.000000000,closed,1,Change class loading mechanism for single WAR
2059,2019-04-12 17:24:13.000000000,1970-01-01 00:00:00.000000001,open,0,Support for custom loaders
2058,2019-04-11 16:53:49.000000000,2019-05-17 13:48:30.000000000,closed,0,NPE if PickerField.OpenAction is added to a PickerField with only metaClass defined
2057,2019-04-11 16:37:45.000000000,2019-05-21 11:03:36.000000000,closed,1,Download dialog appears when a classpath resource is set for BrowserFrame
2056,2019-04-11 16:29:04.000000000,2019-05-17 15:41:48.000000000,closed,0,Argument type mismatch while updating masterRefs when OptionsGroup is used with List type
2055,2019-04-11 13:08:35.000000000,2019-07-24 18:13:26.000000000,closed,0,"Entity Inspector Editor does not save changes of ""mappedBy"" side of one-to-one relation"
2054,2019-04-11 12:51:29.000000000,2019-07-30 15:56:41.000000000,closed,1,Ability to redirect RowsCount.getCount() to custom service
2053,2019-04-11 12:32:26.000000000,1970-01-01 00:00:00.000000001,open,0,Support client-side validation for numbers-only TextField
2052,2019-04-10 19:50:44.000000000,2019-04-12 15:00:38.000000000,closed,0,DataGrid throws NPE when you try to open item inline editor
2051,2019-04-10 15:13:18.000000000,2019-04-10 18:45:35.000000000,closed,0,Front does not work from single war deployed in Tomcat
2050,2019-04-10 14:22:04.000000000,2019-06-11 12:03:24.000000000,closed,0,DataContext commit() does not return committed instances back to caller
2049,2019-04-10 12:35:02.000000000,2019-05-21 12:29:54.000000000,closed,1,Set auto width of CubaComboBox suggestion popup
2048,2019-04-10 12:30:25.000000000,2019-04-10 18:43:06.000000000,closed,1,IllegalStateException while adding a new UI permission item 
2047,2019-04-10 11:10:38.000000000,2019-04-10 11:54:55.000000000,closed,2,Unable to open entity in Studio 2018
2046,2019-04-09 22:53:10.000000000,2019-04-29 15:22:53.000000000,closed,0,Meta object protocol for UI components
2045,2019-04-09 14:30:11.000000000,2019-04-25 16:34:12.000000000,closed,0,"REST API: when a new access token is obtained using the refresh token, a 'Accept-Language' header must be read"
