id,created_at,closed_at,state,comments,title
3019,2020-08-31 16:57:57.000000000,1970-01-01 00:00:00.000000001,open,0,Unsupported field: DayOfWeek in a search filter
3018,2020-08-31 11:14:19.000000000,1970-01-01 00:00:00.000000001,open,0,Selected generated field loses focus after editing the previous field in DataGrid
3017,2020-08-31 01:06:20.000000000,1970-01-01 00:00:00.000000001,open,0,Wrong mockit expectations rules in test case
3016,2020-08-28 22:43:52.000000000,1970-01-01 00:00:00.000000001,open,0,EditorTypeExtractor fails to infer entity type in some cases #3015
3015,2020-08-28 22:39:45.000000000,1970-01-01 00:00:00.000000001,open,0,EditorTypeExtractor fails to infer entity type in some cases
3014,2020-08-27 18:58:32.000000000,2020-08-31 17:51:42.000000000,closed,1,Convert user input using the configured time zone (fixes #3013)
3013,2020-08-27 13:26:09.000000000,1970-01-01 00:00:00.000000001,open,0,After changing the value of a date (timestamp) filter the date value increments or decrements involuntarily depending on timezone differences
3012,2020-08-27 12:55:28.000000000,1970-01-01 00:00:00.000000001,open,0,Preserve file extension while generating StreamResource file name
3011,2020-08-26 21:13:26.000000000,1970-01-01 00:00:00.000000001,open,0,"Add ""date-interval-editor"" screen to system-minimal role"
3010,2020-08-25 12:32:16.000000000,1970-01-01 00:00:00.000000001,open,0,getLookupAction() returns IllegalStateException in legacy screens
3009,2020-08-24 15:15:57.000000000,1970-01-01 00:00:00.000000001,open,0,Nested collection container does not fire ItemPropertyChangeEvent in some cases
3008,2020-08-21 16:59:30.000000000,2020-08-31 15:17:53.000000000,closed,0,Ability to enter a user comment before sending an error report from the screen ExceptionDialog
3007,2020-08-20 07:56:57.000000000,2020-08-21 16:48:42.000000000,closed,2,Ability to enter a user comment before sending an error repor from the screen ExceptionDialog...
3006,2020-08-19 19:18:24.000000000,1970-01-01 00:00:00.000000001,open,0,Embedded attribute with read-only permission for the current user is editable if another embedded attribute with of the same type is set to modify permission
3005,2020-08-19 18:01:51.000000000,1970-01-01 00:00:00.000000001,open,1,loginAttemptsNumberExceeded exception shows without localization
3004,2020-08-19 18:00:26.000000000,1970-01-01 00:00:00.000000001,open,0,Exception on bulk deletion of self-referenced hard-delete entities 
3003,2020-08-18 17:12:04.000000000,1970-01-01 00:00:00.000000001,open,0,Table does not scroll to selected item in MasterDetailScreen after editing
3002,2020-08-18 15:57:35.000000000,2020-08-24 10:26:09.000000000,closed,1,Domain model description does not contain enums that are not used in entities
3001,2020-08-17 11:54:35.000000000,1970-01-01 00:00:00.000000001,open,0,Update suggestions popup position when its size changes
3000,2020-08-16 12:07:50.000000000,1970-01-01 00:00:00.000000001,open,0,"In tree components, do not show rows that have non-null parents and these parents can not be found"
2999,2020-08-13 12:19:02.000000000,1970-01-01 00:00:00.000000001,open,0,Incorrect enumeration for simpleType columnsMode in xsd
2998,2020-08-12 20:33:02.000000000,1970-01-01 00:00:00.000000001,open,1,@Composition works like association if @ManyToOne is defined with @JoinColumn
2997,2020-08-12 14:35:26.000000000,1970-01-01 00:00:00.000000001,open,1,Screen with a lot of fields loads very slowly because of slow validators loading
2996,2020-08-11 19:10:50.000000000,2020-08-28 15:45:00.000000000,closed,0,Incorrect system information for string id entity
2995,2020-08-11 00:59:16.000000000,2020-08-11 11:22:22.000000000,closed,1,* RTE when QueryStringProcessor process query with upper case (#2233) (#2460)
2994,2020-08-10 15:45:46.000000000,1970-01-01 00:00:00.000000001,open,0,Icons for textfields shows incorrectly for inline-icon stylename or when shown at the same time as contextHelp if field was wraped into a form container
2993,2020-08-10 11:17:54.000000000,1970-01-01 00:00:00.000000001,open,0,EntityPersistingEvent doesn't work while merge new entity
2992,2020-08-08 20:44:57.000000000,1970-01-01 00:00:00.000000001,open,0,Filters by time have 'minutes' resolution
2991,2020-08-07 19:58:18.000000000,1970-01-01 00:00:00.000000001,open,0,Form container is redrawn with incrasing the space between the caption and the field after the setting the icon programmatically
2990,2020-08-06 12:37:36.000000000,1970-01-01 00:00:00.000000001,open,0,Hot deploy does not work for UberJar
2989,2020-08-05 17:30:21.000000000,1970-01-01 00:00:00.000000001,open,0,«Administration - Server Log» level changes works only for web layer with multiple WARs deployment
2988,2020-08-05 17:27:08.000000000,1970-01-01 00:00:00.000000001,open,0,TransactionalDataManager.save method can return nested entities in managed state
2987,2020-08-04 13:00:17.000000000,2020-08-31 12:19:21.000000000,closed,1,IllegalArgumentException occurs after trying to set value for a filter with custom condition with param type entity
2986,2020-08-03 19:57:16.000000000,1970-01-01 00:00:00.000000001,open,0,cuba_SchedulingMBean.removeExecutionHistory does not support maxPeriod=””
2985,2020-07-31 14:44:35.000000000,1970-01-01 00:00:00.000000001,open,0,System Information screen is empty even if role allows to show information
2984,2020-07-29 17:24:45.000000000,2020-08-04 14:15:53.000000000,closed,0,Re-introduce Screen Profiler
2983,2020-07-28 16:30:38.000000000,1970-01-01 00:00:00.000000001,open,0,Search Folder doesn't restore value of UUID field
2982,2020-07-22 17:57:07.000000000,2020-07-23 14:00:40.000000000,closed,0,NPE occurs when selecting dynamic attribute as a filter condition
2981,2020-07-22 11:42:23.000000000,1970-01-01 00:00:00.000000001,open,0,Maximum opened tabs check only works for the screens opened from the main menu
2980,2020-07-21 20:18:48.000000000,1970-01-01 00:00:00.000000001,open,0,PickerOpenComposition action returns NPE if it is a composition with entity with legacy screens
2979,2020-07-21 19:28:02.000000000,1970-01-01 00:00:00.000000001,open,1,Generated columns are not hidden by the new security mechanism
2978,2020-07-21 18:03:42.000000000,1970-01-01 00:00:00.000000001,open,0,NotificationFacet - remove PREFORMATTED from list of contentMode options
2977,2020-07-21 17:30:34.000000000,1970-01-01 00:00:00.000000001,open,1,"Notification facet - position ""DEFAULT"" is not in XSD"
2976,2020-07-21 17:17:14.000000000,1970-01-01 00:00:00.000000001,open,0,"Facets - htmlSanitizerEnabled default value in metadata should be ""true"""
2975,2020-07-19 22:14:45.000000000,2020-07-23 12:33:58.000000000,closed,1,Fix save of textSelection parameter in Table#saveSettings method
2974,2020-07-19 21:56:12.000000000,1970-01-01 00:00:00.000000001,open,0,Disabled textSelection parameter is not loaded in table settings
2973,2020-07-17 11:56:41.000000000,1970-01-01 00:00:00.000000001,open,1,No validation for creation new user with existing login for HSQLDB
2972,2020-07-16 12:05:13.000000000,2020-07-17 15:14:36.000000000,closed,2,SuggestionField and SuggestionPickerField does not show suggestions inside screen fragment which placed inside dialog.
2971,2020-07-16 10:51:01.000000000,2020-07-22 16:02:24.000000000,closed,0,Include key in message packs does not work correctly for a default locale that is different from default locale for CUBA
2970,2020-07-15 20:51:36.000000000,2020-07-20 11:38:45.000000000,closed,0,SuggestionField and SuggestionPickerField does not show suggestions inside screen fragment which placed inside dialog.
2969,2020-07-15 19:29:54.000000000,1970-01-01 00:00:00.000000001,open,0,Ability to send emails with multipart body
2968,2020-07-15 18:52:39.000000000,1970-01-01 00:00:00.000000001,open,0,Group table is not ungrouped after switching presentations
2967,2020-07-14 17:46:02.000000000,2020-07-16 13:26:25.000000000,closed,0,Default design-time role is deleted after trying to create a user with nonunique login name
2966,2020-07-14 17:39:41.000000000,1970-01-01 00:00:00.000000001,open,0,StackOverflowError when edit SearchFolder with parent in Entity Inspector
2965,2020-07-14 17:28:21.000000000,2020-07-21 17:31:55.000000000,closed,0,Run time custom constraints do not work
2964,2020-07-14 16:52:51.000000000,2020-07-16 16:18:16.000000000,closed,0,NPE when trying to copy user with design-time role
2963,2020-07-14 13:06:52.000000000,2020-07-20 22:40:27.000000000,closed,1,"Add ""openapi"": ""3.0"" in swagger specification of Cuba's Rest API. Postman is unable to import Cuba Platform's REST specification (both json and yaml) right now"
2962,2020-07-14 10:53:47.000000000,2020-07-23 13:38:04.000000000,closed,2,Generic FTS Table Tooltips for descendant entities are generated improperly #2960
2961,2020-07-13 18:37:58.000000000,1970-01-01 00:00:00.000000001,open,0,Problems with web anonymous session when deploying web/core separately
2960,2020-07-13 17:03:28.000000000,2020-07-23 17:59:18.000000000,closed,0,Generic FTS Table Tooltips for descendant entities are generated improperly
2959,2020-07-13 15:30:02.000000000,2020-07-21 15:58:35.000000000,closed,0,"NullPointerException in EntityInspector when ""Entity Type"" field has empty value"
2958,2020-07-13 09:45:06.000000000,2020-07-14 13:59:13.000000000,closed,0,DataGrid emptyStateMessage does not support loading resource message
2957,2020-07-12 00:31:06.000000000,2020-07-14 12:50:26.000000000,closed,4,Add multiLineCells parameter to table presentation settings
2956,2020-07-12 00:10:29.000000000,2020-07-14 12:50:38.000000000,closed,0,Add multiLineCells parameter to table presentation settings
2955,2020-07-10 16:47:30.000000000,2020-07-22 12:06:24.000000000,closed,0,Problem with conversion of Turkish 'İ' to Latin 'i' when filtering by instance name
2954,2020-07-10 14:54:42.000000000,2020-07-23 17:30:19.000000000,closed,5,"In some cases user has to use Browser's ""back"" button twice (not once as expected) to let it work"
2953,2020-07-09 15:34:05.000000000,2020-07-09 15:46:13.000000000,closed,1,Wrong loadContext class in UserSwitchLinkHandlerProcessor
2952,2020-07-09 14:49:49.000000000,1970-01-01 00:00:00.000000001,open,1,Fix for #2948 NPE thrown at UrlChangeHandler#restoreState
2951,2020-07-09 14:18:59.000000000,2020-07-21 14:09:57.000000000,closed,0,Supports environment/system variables for database parameters
2950,2020-07-09 13:24:57.000000000,2020-07-15 13:55:29.000000000,closed,0,Edited entity is not merged to the parent's screen data context
2949,2020-07-09 11:34:39.000000000,1970-01-01 00:00:00.000000001,open,1,fix forgotten cause
2948,2020-07-09 01:55:18.000000000,2020-07-17 10:56:45.000000000,closed,0,NPE after refreshing page (or opening screen link in the same tab) with BACK_ONLY urlHandlingMode
2947,2020-07-08 19:58:39.000000000,1970-01-01 00:00:00.000000001,open,1,Introduce AfterDataLoad screen controller event
2946,2020-07-08 18:44:53.000000000,2020-07-10 06:56:11.000000000,closed,0,EntityChangedEvent is not sent after implicit or explicit flush
2945,2020-07-08 17:18:35.000000000,1970-01-01 00:00:00.000000001,open,0,Not all methods of UserSession.getJoinedRole() are implemented
2944,2020-07-08 13:33:45.000000000,2020-07-22 12:58:46.000000000,closed,0,ClassCastException when invoking OpenAction in DataGrid inline editor
2943,2020-07-07 17:58:51.000000000,1970-01-01 00:00:00.000000001,open,0,User role unique index is not created on MySQL with MyISAM and utf8mb4 encoding
2942,2020-07-07 12:14:12.000000000,2020-07-13 19:31:30.000000000,closed,0,BeanLocator.getPrototype doesn't pass args object if no bean name is found
2941,2020-07-07 11:55:02.000000000,2020-07-15 16:41:25.000000000,closed,0,DbUpdaterEngine: Not informative message is logged when _MAIN_ Data Store has unaplied scripts
2940,2020-07-07 11:49:03.000000000,2020-07-07 11:53:31.000000000,closed,0,Update UI metadata JavaDoc
2939,2020-07-07 11:25:25.000000000,2020-07-14 16:49:06.000000000,closed,0,NumberFormatException when the Form's childrenCaptionWidth attribute is set AUTO
2938,2020-07-06 19:39:30.000000000,2020-07-17 18:55:48.000000000,closed,0,constraintOperationType and constraintCode for action are not working
2937,2020-07-06 15:00:42.000000000,2020-07-14 14:19:41.000000000,closed,0,Invoking of Close Others action on last tab hides tab caption and scroller does not disappear
2936,2020-07-06 13:51:14.000000000,2020-08-31 14:05:23.000000000,closed,2,MasterDetailScreen refreshes lookup fields even if they have not enough parameters set
2935,2020-07-03 18:28:08.000000000,2020-07-17 18:46:36.000000000,closed,1,If action is hidden by role permissions button bound to this action should not be displayed in the screen
2934,2020-07-03 12:10:34.000000000,1970-01-01 00:00:00.000000001,open,0,Misleading error message when migrating legacy screens to new API
2933,2020-07-03 11:23:19.000000000,2020-07-16 10:57:02.000000000,closed,0,References to filter components in paramWhere conditions are broken
2932,2020-07-03 10:44:00.000000000,2020-07-15 12:39:25.000000000,closed,1,Entity Log does not track changes of entity attributes if dynamic attributes were added
2930,2020-07-01 20:41:51.000000000,2020-07-06 10:59:32.000000000,closed,0,Backports fix for 2866
2929,2020-06-25 18:38:48.000000000,2020-07-21 17:56:40.000000000,closed,0,Button connected to primary action does not get primary style name
2928,2020-06-25 18:23:25.000000000,2020-07-16 11:19:02.000000000,closed,1,OptionsList value is not set sometimes when Many-To-Many association is used
2927,2020-06-24 08:41:49.000000000,1970-01-01 00:00:00.000000001,open,0,Scheduled task bean parameters fields are too short
2926,2020-06-23 16:07:58.000000000,2020-07-14 13:22:59.000000000,closed,0,NPE in EntityLog during commit a new entity with a field value set up via dataManager.getReference()
2925,2020-06-18 15:24:59.000000000,2020-06-22 19:21:34.000000000,closed,0,Table header is broken if columns don't fit the table width
2924,2020-06-18 14:59:12.000000000,2020-07-17 15:31:51.000000000,closed,1,Custom login exceptions always increase brute-force attempts counter
2923,2020-06-18 13:17:52.000000000,2020-07-15 11:31:53.000000000,closed,0,Exception when assigning more than one predefined role to user using Oracle datastore
2922,2020-06-17 14:27:14.000000000,2020-07-20 12:17:00.000000000,closed,0,Exception while handling external link with user if 'UserSubstitution' entity is extended
2921,2020-06-17 10:31:53.000000000,2020-07-13 12:51:00.000000000,closed,0,Update dom4j to 2.1.3
2920,2020-06-17 00:37:57.000000000,2020-06-29 17:07:41.000000000,closed,0,Screen permissions UI issues
2919,2020-06-16 15:30:53.000000000,2020-07-24 14:44:19.000000000,closed,2,IllegalArgumentException occurs after re-expanding the Search folders hierarchy tree
2918,2020-06-16 12:26:36.000000000,1970-01-01 00:00:00.000000001,open,0,Batch fetch doesn't work on relations with a composite PK on MSSQL
2916,2020-06-11 17:49:46.000000000,1970-01-01 00:00:00.000000001,open,0,Support HTML rendering items in Tree
2915,2020-06-11 11:21:21.000000000,2020-06-11 12:16:33.000000000,closed,0,UI metadata fixes for dialog facets and actions
2914,2020-06-11 09:55:17.000000000,2020-06-15 14:36:42.000000000,closed,0,Whitelist <a target> HTML attribute in HtmlSanitizer
2913,2020-06-11 09:26:27.000000000,2020-07-17 12:27:01.000000000,closed,0,Filter controlsLayoutTemplate XML attribute causes errors
2912,2020-06-09 19:33:10.000000000,2020-06-11 19:00:38.000000000,closed,1,Unfetched attribute exception in the Group Browser
2911,2020-06-09 16:21:52.000000000,2020-06-11 15:38:45.000000000,closed,0,EntityChangedEvent is not triggered for BaseIntIdentityIdEntity
2910,2020-06-08 09:59:09.000000000,2020-06-09 17:50:41.000000000,closed,0,SYS_SCHEDULED_TASK.METHOD_PARAMS column length is too small
2909,2020-06-05 17:52:00.000000000,2020-06-10 13:03:38.000000000,closed,0,Master-Details screen does not refresh after cancel editing and changes remained in the group table
2908,2020-06-05 16:14:20.000000000,2020-06-10 13:11:57.000000000,closed,0,URL routing returns exception if BaseStringIdEntity has a primary key name different than `id`
2907,2020-06-04 18:22:45.000000000,2020-07-14 15:54:56.000000000,closed,0,MainTabSheetActionHandler#findEditor method always returns null
2906,2020-06-04 13:26:12.000000000,2020-06-26 17:28:38.000000000,closed,0,Filter param does not work inside macro
2905,2020-06-04 11:28:36.000000000,1970-01-01 00:00:00.000000001,open,0,Inheritance of @UiDescriptor does not make sense
2904,2020-06-04 11:23:51.000000000,1970-01-01 00:00:00.000000001,open,1,Inheritance of @UiDescriptor does not make sense
2903,2020-05-29 18:08:08.000000000,2020-06-15 14:08:37.000000000,closed,2,NPE on Entity with Embeddable entity and joined inheritance strategy
2902,2020-05-28 13:13:01.000000000,1970-01-01 00:00:00.000000001,open,0,Update SuggestionField popup position when its size changes
2901,2020-05-28 13:12:47.000000000,2020-08-31 17:41:18.000000000,closed,0,Md5EncryptionModule password check doesn't work
2900,2020-05-28 11:24:11.000000000,2020-06-08 15:03:16.000000000,closed,1,Wrong default type token of DateField
2899,2020-05-28 10:48:30.000000000,2020-06-21 14:15:27.000000000,closed,0,CubaId is not set for some components
2898,2020-05-26 18:33:38.000000000,1970-01-01 00:00:00.000000001,open,0,Remove generatedType attribute of DataGrid.Column from layout.xsd
2897,2020-05-26 11:34:13.000000000,2020-06-02 18:58:40.000000000,closed,0,IllegalArgumentException when expanding components in the Window and GroupBox
2896,2020-05-25 15:14:19.000000000,1970-01-01 00:00:00.000000001,open,0,"Ability to invalidate screen descriptor cache, if parent descriptor is hot deployed."
2895,2020-05-25 11:58:50.000000000,1970-01-01 00:00:00.000000001,open,0,Support limit/offset in queries on SQLServer
2894,2020-05-21 17:58:25.000000000,2020-06-08 18:37:03.000000000,closed,0,Show rows drop-down list of the Filter should not display values greater than maxFetchUI
2893,2020-05-21 17:53:09.000000000,1970-01-01 00:00:00.000000001,open,0,Define show rows options for particular generic filter component
2892,2020-05-20 19:10:16.000000000,2020-06-04 16:06:11.000000000,closed,0,EntityFetcher fails if entity has transient attribute
2891,2020-05-20 15:39:36.000000000,2020-06-11 20:23:29.000000000,closed,0,[TokenList] Implement newOptionsHandler
2890,2020-05-20 13:55:47.000000000,2020-05-20 14:17:02.000000000,closed,0,UI Metadata improvements
2889,2020-05-19 13:48:32.000000000,2020-06-09 18:15:21.000000000,closed,1,NPE when user select an item while sorting in process
2888,2020-05-18 11:42:13.000000000,2020-06-11 16:35:29.000000000,closed,0,Improve usability of screen permissions UI
2887,2020-05-17 17:59:57.000000000,2020-06-03 22:53:29.000000000,closed,0,Fix include key in message packs for default locale
2886,2020-05-17 17:54:34.000000000,2020-06-04 12:25:09.000000000,closed,0,Include key in message packs works incorrectly for default locale
2885,2020-05-17 00:37:50.000000000,2020-07-15 17:21:54.000000000,closed,0,IDE inspection works incorrect for getSelectHandler method
2884,2020-05-16 12:17:12.000000000,2020-05-19 18:19:56.000000000,closed,0,"fix getting wrong caption in ""Add condition"" window from ""the browser…"
2883,2020-05-16 12:13:19.000000000,2020-06-08 19:05:32.000000000,closed,0,"get wrong property caption in ""Add condition"" window"
2882,2020-05-16 11:10:32.000000000,2020-06-05 18:28:44.000000000,closed,1,NullPointerException in ListPrintForm action
2881,2020-05-15 12:12:53.000000000,2020-06-15 12:18:09.000000000,closed,1,"textField: When the input value of the text box is greater than 1000, the split character , is converted to 2"
2880,2020-05-15 11:05:51.000000000,1970-01-01 00:00:00.000000001,open,0,Incorrect alignment of components in cells after rendering in the DataGrid
2879,2020-05-14 18:14:43.000000000,2020-07-16 15:45:37.000000000,closed,1,Сursor highlight does not turn off in Desktop in SourceCodeEditor
2878,2020-05-14 14:46:25.000000000,1970-01-01 00:00:00.000000001,open,0,WebRowsCount works incorrectly
2877,2020-05-13 12:13:14.000000000,2020-07-15 15:20:08.000000000,closed,1,Dynamic attribute editor. Wrong position of context help icon in Safari
2876,2020-05-13 10:39:41.000000000,1970-01-01 00:00:00.000000001,open,0,Implement Calendar More click listener
2875,2020-05-12 18:35:49.000000000,1970-01-01 00:00:00.000000001,open,0,Filtering by discriminator filed
2874,2020-05-12 18:33:44.000000000,2020-07-23 12:00:30.000000000,closed,4,Enter key Does not work in RichTextArea if any opened screen contains Enter shortcut
2873,2020-05-10 17:46:05.000000000,2020-05-20 15:14:47.000000000,closed,2,Cannot edit default value of a filter field if it is a reference
2872,2020-05-10 09:34:56.000000000,2020-05-15 16:56:45.000000000,closed,0,Fixed LookupScreenFacet Exception message
2871,2020-05-08 15:50:36.000000000,1970-01-01 00:00:00.000000001,open,0,Highlight currently opened screen in side menu
2870,2020-05-08 15:36:52.000000000,2020-06-09 17:11:01.000000000,closed,0,Provide API to clear side menu selection
2869,2020-05-08 11:27:08.000000000,2020-06-03 18:07:46.000000000,closed,0,Incorrect wildcard processing for entity attributes in design time roles
2868,2020-05-07 21:02:04.000000000,1970-01-01 00:00:00.000000001,open,0,Support LocalDateTime in FluentValueLoader
2867,2020-05-07 18:43:29.000000000,1970-01-01 00:00:00.000000001,open,0,UUID validation in Generic UI allows invalid version and variant numbers
2866,2020-05-07 12:56:00.000000000,2020-06-15 12:47:41.000000000,closed,0,"Incorrect query transformation if filter operator is changed from ""not in"" to ""in"" for a link attribute"
2865,2020-05-07 11:18:12.000000000,1970-01-01 00:00:00.000000001,open,0,TokenList should display keys instead of values if OptionsMap is used
2864,2020-05-06 11:32:08.000000000,1970-01-01 00:00:00.000000001,open,0,GroupTable presentation does not ungroup moved column
2863,2020-05-04 22:51:57.000000000,2020-05-06 13:10:25.000000000,closed,0,Key value loader fix
2862,2020-05-03 16:41:41.000000000,2020-05-22 12:37:01.000000000,closed,0,Fix EntityLogItem excel export
2861,2020-05-03 16:33:10.000000000,2020-06-08 20:39:35.000000000,closed,0,Excel export works incorrectly for EntityLogItem entities
2860,2020-05-03 03:30:16.000000000,1970-01-01 00:00:00.000000001,open,0,Migrate linkInvoke for the table column to idiomatic way of subscribing event 
2859,2020-04-29 14:25:56.000000000,2020-06-02 10:41:41.000000000,closed,1,Add card value to the groupBoxStylename enumeration in layout.xsd 
2858,2020-04-29 10:44:52.000000000,2020-06-03 16:03:50.000000000,closed,0,Javax date annotations clear field value if it is not valid
2857,2020-04-28 20:52:28.000000000,1970-01-01 00:00:00.000000001,open,0,Introduce ConversionErrorEvent in components
2856,2020-04-28 15:06:28.000000000,2020-05-12 17:06:31.000000000,closed,0,Icon mismatch when setting icon from enum constant
2855,2020-04-28 13:05:18.000000000,1970-01-01 00:00:00.000000001,open,0,Ability to programmatically set values for Fields as the user
2854,2020-04-27 18:20:44.000000000,1970-01-01 00:00:00.000000001,open,0,Html caption and description for Calendar events
2853,2020-04-27 14:33:13.000000000,2020-06-03 13:12:20.000000000,closed,0,Add JavaDoc for Calendar events
2852,2020-04-26 17:13:29.000000000,1970-01-01 00:00:00.000000001,open,1,Add password as input parameter in input dialog
2851,2020-04-23 16:00:57.000000000,2020-06-05 17:36:34.000000000,closed,0,The htmlSanitizerEnabled attribute does not override global cuba.web.htmlSanitizerEnabled configuration property
2850,2020-04-23 13:08:30.000000000,2020-06-02 16:55:30.000000000,closed,0,Components within TabSheet don't update their size when resizing a screen
2849,2020-04-23 04:46:58.000000000,2020-05-15 17:35:08.000000000,closed,2,Checks gridColumn for null to fix NPE when testMode = true #2848
2848,2020-04-23 04:38:38.000000000,2020-05-20 14:23:16.000000000,closed,0,NPE when hiding columns from data grids when 'cuba.testMode' is true
2847,2020-04-22 19:27:57.000000000,2020-04-23 10:41:35.000000000,closed,2,#818 - fix: find default datatype for a java class
2846,2020-04-22 19:05:37.000000000,2020-06-04 16:33:38.000000000,closed,0,"Provide clear error message instead of ""class foo.Bar cannot be cast to foo.Bar"""
2845,2020-04-22 12:25:27.000000000,1970-01-01 00:00:00.000000001,open,0,Add StudioProperty annotations to SecuredListAction
2844,2020-04-22 11:37:14.000000000,1970-01-01 00:00:00.000000001,open,0,Support milliseconds resolution for TimeField
2843,2020-04-22 11:33:29.000000000,2020-07-23 17:17:47.000000000,closed,0,"QueryTransformer.addWhere method cuts out ""treat"" operator from JPQL"
2842,2020-04-21 20:30:53.000000000,1970-01-01 00:00:00.000000001,open,0,NPE occurs with JOIN fetch type on OneToMany property
2841,2020-04-21 18:17:23.000000000,2020-05-07 13:03:30.000000000,closed,0,Entity restore doesn't work for owning side properties
2840,2020-04-21 18:07:02.000000000,2020-07-21 17:46:59.000000000,closed,2,View action button stays inactive after selecting an item in the table for composition entity
2839,2020-04-21 13:30:31.000000000,1970-01-01 00:00:00.000000001,open,0,Implement Buffered interface for ColorField
2838,2020-04-21 10:14:16.000000000,2020-05-20 16:18:26.000000000,closed,0,NPE occurs when WebComponentsHelper finds child component in the table without ButtonsPanel
2837,2020-04-20 15:55:46.000000000,2020-07-15 17:39:23.000000000,closed,1,"The ""related"" attribute in MetaProperty should trim spaces"
2836,2020-04-20 12:21:01.000000000,1970-01-01 00:00:00.000000001,open,0,Captions and icons do not display correctly inside CssLayout
2835,2020-04-20 06:24:48.000000000,2020-04-20 10:51:34.000000000,closed,8,Ubuntu 20.04 cuba 7.2.1 Hotkey (ctrl+tab)
2834,2020-04-17 16:54:39.000000000,1970-01-01 00:00:00.000000001,open,0,Minimal loglevel is WARN in unit tests executed without test-container
