id,created_at,closed_at,state,comments,title
1468,2018-10-29 14:47:08.000000000,1970-01-01 00:00:00.000000001,open,0,Unable to set permissions for Role editor for a denying role 
1467,2018-10-29 14:37:00.000000000,2018-12-10 14:25:02.000000000,closed,1,Add COPY functionality to components tree in Role editor
1466,2018-10-29 12:02:10.000000000,1970-01-01 00:00:00.000000001,open,0,Unclear error message when saving an entity without CRUD permissions
1465,2018-10-29 11:50:25.000000000,2019-01-31 17:11:58.000000000,closed,1,Optimize WidgetSet: exclude unused widgets from eager loading on client
1464,2018-10-29 10:30:21.000000000,2019-06-25 11:23:29.000000000,closed,1,Editable table selects the previously selected row on focus of a field in another row
1463,2018-10-29 10:25:11.000000000,2018-10-31 14:00:06.000000000,closed,0,Unable to import entity from JSON with BigDecimal attribute if it has percent Number Format
1462,2018-10-28 18:50:42.000000000,2018-11-02 11:58:07.000000000,closed,0,Error using host screen datasource in dynamically opened frame
1461,2018-10-28 10:38:42.000000000,2018-10-28 18:51:46.000000000,closed,0,"Auto-cast MetaClass.getJavaClass() to avoid ""unchecked cast"" warnings"
1460,2018-10-26 18:28:17.000000000,2018-10-31 13:31:00.000000000,closed,0,Impala support
1459,2018-10-26 17:29:21.000000000,2018-12-07 12:34:23.000000000,closed,0,ExcelAction does not use datatype from MetaProperty
1458,2018-10-26 16:19:46.000000000,2018-11-07 13:37:42.000000000,closed,0,The field with the required filter condition is not highlighted
1457,2018-10-26 14:08:37.000000000,2018-12-25 19:53:56.000000000,closed,1,Update jquery version
1456,2018-10-26 13:58:49.000000000,1970-01-01 00:00:00.000000001,open,1,Provide default 40x and 50x pages
1455,2018-10-26 13:54:47.000000000,2019-07-04 16:34:31.000000000,closed,2,Set session timeout in web.xml by default
1453,2018-10-26 12:52:16.000000000,2018-11-22 23:48:29.000000000,closed,1,Check for null optionCaptionProvider from OptionsField
1452,2018-10-26 12:50:45.000000000,2018-10-26 12:56:20.000000000,closed,0,EditorScreens builder accepting ListComponent
1450,2018-10-26 12:18:21.000000000,2018-11-22 17:37:52.000000000,closed,1,Implement the new Data Binding for the TokenList
1449,2018-10-25 17:04:46.000000000,2018-11-12 15:54:16.000000000,closed,1,Exception after adding available for all users search folder into folder which not available for all users
1448,2018-10-25 16:48:41.000000000,1970-01-01 00:00:00.000000001,open,0,Add debug logging to help investigate unintentional inner transaction rollbacks
1447,2018-10-25 16:08:26.000000000,2018-10-26 11:17:36.000000000,closed,1,Implement ListPrintFormAction
1446,2018-10-25 13:47:28.000000000,2018-11-13 19:11:31.000000000,closed,1,UnsupportedOperationException is invoked when you try to create Car entity from EI
1445,2018-10-25 12:47:45.000000000,2018-10-31 16:02:34.000000000,closed,2,Performance issue in ItemTrackingAction 
1444,2018-10-25 11:43:15.000000000,2019-01-28 13:49:46.000000000,closed,1,Excel action exports data from TreeDataGrid in a non-hierarchical form
1443,2018-10-25 11:15:15.000000000,2018-12-26 17:59:32.000000000,closed,0,"Remove outline from the DataGrid, TreeDataGrid and Tree"
1442,2018-10-25 10:06:19.000000000,2018-10-26 13:15:50.000000000,closed,0,Chrome autocomplete doesn't work with new login form
1441,2018-10-25 09:16:11.000000000,2018-10-26 17:10:13.000000000,closed,1,Remove test screens
1440,2018-10-24 19:20:35.000000000,2018-10-25 09:13:54.000000000,closed,0,Standard editor and lookup must load data automatically before show
1439,2018-10-24 16:06:07.000000000,2019-02-01 20:28:55.000000000,closed,2,JPQLException while using RelatedEntities for BaseDbGeneratedIdEntity attribute
1438,2018-10-24 15:57:19.000000000,2018-12-20 13:51:15.000000000,closed,2,Add ability to specify CC and BCC email addresses to EmailInfo #478
1437,2018-10-24 15:09:30.000000000,2018-11-02 12:44:21.000000000,closed,1,Make RelatedEntities work with the new data binding API
1436,2018-10-24 13:58:25.000000000,1970-01-01 00:00:00.000000001,open,2,"When searching using a filter with ""OR group"", only results that satisfy all (not just any) conditions in OR group are returned"
1435,2018-10-24 12:04:12.000000000,2018-10-25 09:14:35.000000000,closed,0,Send PropertyChangedEvent for equal collections if they are different instances
1434,2018-10-23 19:57:28.000000000,2019-01-09 13:39:14.000000000,closed,2,Implement BulkEditAction for the new Screens API
1433,2018-10-23 17:06:41.000000000,2018-10-29 15:43:21.000000000,closed,0,"Show ""isAbc"" config interface methods on Application Properties screen"
1432,2018-10-23 17:01:03.000000000,1970-01-01 00:00:00.000000001,open,0,Ability to override the logic of determining resulting permissions
1431,2018-10-23 16:19:27.000000000,2019-08-01 15:08:50.000000000,closed,1,Add border for the Tree component 
1430,2018-10-23 15:58:58.000000000,2019-03-11 12:12:38.000000000,closed,0,Rework TwinColumn using Vaadin 8
1429,2018-10-23 11:31:41.000000000,2018-10-30 13:55:02.000000000,closed,4,Implement `focusFirstComponent` method for ComponentContainer 
1428,2018-10-23 11:25:17.000000000,2018-11-14 17:42:34.000000000,closed,0,SQLIntegrityConstraintViolationException while using FileUploadField
1427,2018-10-23 10:49:54.000000000,1970-01-01 00:00:00.000000001,open,0,DataGrid Editor doesn't focus all subcomponents of combined editor field
1426,2018-10-22 17:19:20.000000000,2018-10-29 17:05:59.000000000,closed,0,Unable to open screen with OpenMode#THIS_TAB when no tabs opened
1425,2018-10-22 15:25:59.000000000,2018-10-26 18:56:35.000000000,closed,0,StandardEditor should check and notify about unsaved changes on cancel 
1424,2018-10-22 14:28:07.000000000,2018-10-22 19:17:03.000000000,closed,0,Support any value type by MaskedField
1423,2018-10-22 13:59:28.000000000,2018-10-22 19:17:08.000000000,closed,0,Support any value type by MaskedField
1422,2018-10-22 13:56:24.000000000,2018-10-22 19:17:12.000000000,closed,0,Support any value type by MaskedField
1421,2018-10-22 13:53:42.000000000,2018-11-28 12:17:24.000000000,closed,0,Support any datatype by MaskedField
1420,2018-10-22 13:53:06.000000000,2018-10-22 19:16:35.000000000,closed,0,Support any type by MaskedField
1419,2018-10-22 13:52:46.000000000,2018-10-22 16:01:14.000000000,closed,0,Support any type by MaskedField
1418,2018-10-22 12:02:39.000000000,2018-11-01 22:36:33.000000000,closed,1,StandardEditor should check and notify about unsaved changes on cancel 
1417,2018-10-19 15:02:56.000000000,2019-04-15 14:00:50.000000000,closed,0,Increase the padding between the buttonsPanel and the caption of the Tree/Table/DataGrid
1416,2018-10-18 13:02:38.000000000,2018-10-23 16:29:55.000000000,closed,0,UI is refreshed after first opening
1415,2018-10-18 11:36:32.000000000,2018-10-24 12:34:00.000000000,closed,0,"Strange caption in ""nothing is found"" notification in FTS search"
1414,2018-10-17 14:40:44.000000000,1970-01-01 00:00:00.000000001,open,1,Table horizontal scroll is disabled on desktop client by default
1413,2018-10-17 14:38:18.000000000,2018-10-19 11:51:57.000000000,closed,0,Unable to open Application Log menu item
1412,2018-10-17 14:11:15.000000000,2018-11-29 17:24:33.000000000,closed,2,Implement master-detail screen
1411,2018-10-16 19:14:18.000000000,2018-12-17 11:56:34.000000000,closed,1,Client-side error in VMenuBar on page resize
1410,2018-10-16 18:39:29.000000000,2018-10-17 10:21:49.000000000,closed,1,Multiple columns are added simultaneously in chart when it using CollectionContainer
1409,2018-10-16 18:08:35.000000000,2018-12-20 14:58:52.000000000,closed,0,Implement `@Install` for table column generator
1408,2018-10-16 14:35:48.000000000,2018-10-22 13:22:02.000000000,closed,0,IllegalArgumentException at the opening Credit Cart Editor
1407,2018-10-16 13:56:08.000000000,2018-10-22 16:59:17.000000000,closed,0,Provide declarative way to set CSS properties for UI component
1406,2018-10-16 13:31:08.000000000,2018-10-23 11:34:57.000000000,closed,1,NPE occured if the screen controller has injection
1405,2018-10-16 10:11:24.000000000,2018-10-16 10:17:05.000000000,closed,0,Error when merging new entity
1404,2018-10-16 09:50:51.000000000,2018-10-24 12:29:24.000000000,closed,1,UnsupportedOperationException when open EntityLog
1403,2018-10-16 09:49:45.000000000,2018-10-24 17:29:33.000000000,closed,1,UniqueConstraintViolation occurs when file uploads in the IMMEDIATE mode
1402,2018-10-15 22:01:05.000000000,2018-10-16 11:23:32.000000000,closed,0,Ad-hoc HTML attributes API for setting DOM and CSS attributes
1401,2018-10-15 18:00:57.000000000,2018-10-17 16:21:35.000000000,closed,0,Rename Form's CaptionAlignment to CaptionPosition
1400,2018-10-15 13:26:53.000000000,2019-02-28 13:35:48.000000000,closed,0,Backport EntityLog NPE fixes
1399,2018-10-14 17:18:25.000000000,2018-10-16 13:22:49.000000000,closed,0,Missing dataContainer attribute for Label
1398,2018-10-14 17:09:48.000000000,1970-01-01 00:00:00.000000001,open,0,Provide `rollback` method for Transaction
1397,2018-10-14 13:06:42.000000000,2019-01-17 16:32:46.000000000,closed,1,Pessimistic locking
1396,2018-10-13 17:02:24.000000000,2018-10-16 18:55:24.000000000,closed,0,Support force dialog mode for Window
1395,2018-10-12 19:14:53.000000000,2018-11-09 14:55:57.000000000,closed,2,DRY out similarities in Entity Log Tests
1394,2018-10-12 15:51:56.000000000,2018-10-19 16:53:45.000000000,closed,1,Table and tree styles are not applied
1393,2018-10-12 13:48:11.000000000,2018-10-16 12:41:01.000000000,closed,0,BulkEditor is always disabled
1392,2018-10-12 13:22:07.000000000,1970-01-01 00:00:00.000000001,open,0,One-to-many association: wrong (unassociated) items are added to the nested collectionDatasource
1391,2018-10-12 12:49:34.000000000,2018-11-07 16:38:26.000000000,closed,1,Set default field width for the Hover theme 
1390,2018-10-12 12:35:07.000000000,2019-01-16 21:40:56.000000000,closed,0,Entity log UI should show base entity name instead of extended entity name
1389,2018-10-12 11:38:59.000000000,2018-10-16 10:12:51.000000000,closed,2,Merging entity referenced to new entity that is instance of subclass of original attribute class
1388,2018-10-12 10:45:04.000000000,2018-10-12 10:50:54.000000000,closed,0,Copy security state on composition copy
1387,2018-10-12 10:25:21.000000000,2018-11-29 13:45:09.000000000,closed,1,PSQLException when filter name contains more that 255 symbols
1386,2018-10-11 19:48:04.000000000,2018-10-12 16:44:31.000000000,closed,0,Add the dataContainer attribute to the CheckBox component XSD
1385,2018-10-11 19:03:18.000000000,2018-10-18 11:23:59.000000000,closed,0,IllegalArgumentException at the opening Models screen in Refapp
1384,2018-10-11 19:00:02.000000000,2018-10-23 12:13:45.000000000,closed,1,IllegalArgumentException after clicking create on CreditCardBrowser screen
1383,2018-10-11 18:55:34.000000000,2018-12-12 15:44:15.000000000,closed,0,Add support for the Form component by the components preview tree in RoleEditor UiPermissions tab
1382,2018-10-11 18:00:51.000000000,2018-12-07 12:41:46.000000000,closed,1,Abilty to clear ClientCacheManager config cache on web client through jmx
1381,2018-10-11 16:50:33.000000000,2018-10-15 16:16:50.000000000,closed,0,ClassCastException when trying select entity instances for report
1380,2018-10-11 16:36:21.000000000,2018-10-18 12:08:37.000000000,closed,0,IllegalStateException after trying to find something by FTS
1379,2018-10-11 14:58:16.000000000,1970-01-01 00:00:00.000000001,open,1,Could not save Association when referenced entity is inherited with the JOINED strategy
1378,2018-10-11 13:26:02.000000000,2018-10-16 11:56:11.000000000,closed,1,TabSheet ignores component caption when adding a new tab
1377,2018-10-11 12:24:38.000000000,2018-10-23 16:38:00.000000000,closed,2,Internal Server Error if backward slash is put to URL
1376,2018-10-11 11:35:49.000000000,2018-10-16 14:32:07.000000000,closed,1,Clarify test case intents in DataManagerCommitTest
1375,2018-10-11 11:32:07.000000000,2019-12-25 18:37:22.000000000,closed,3,Add flexible positioning and aligning for the Form component
1374,2018-10-11 11:27:28.000000000,2019-01-15 10:30:28.000000000,closed,1,InstanceContainer should be aware of dynamic attribute changes 
1373,2018-10-11 11:14:52.000000000,2018-12-25 17:08:22.000000000,closed,0,Create a default component for a collection dynamic attribute while laoding the Form component
1372,2018-10-11 11:12:57.000000000,2018-12-20 20:14:23.000000000,closed,1,Rework ListEditor
1371,2018-10-11 10:44:18.000000000,2019-05-20 18:13:06.000000000,closed,0,Transaction listener should support the list of dirty entities in the afterCompletion 
1370,2018-10-10 15:06:30.000000000,2018-10-11 19:25:25.000000000,closed,0,Simplify migration to the new login window with old XML template
1369,2018-10-10 12:48:55.000000000,2018-10-10 14:05:04.000000000,closed,1,Studio throws java.util.zip.ZipException when try to unpack cuba-portal-6.7.13-sources.jar
1368,2018-10-10 12:48:23.000000000,2018-10-15 18:59:27.000000000,closed,0,MySQL database creation error in case of using utf8mb4 encoding
1367,2018-10-10 12:44:13.000000000,2018-10-11 10:36:51.000000000,closed,0,Refactoring EntityLogDynamicAttributesTest - Test case split up
1366,2018-10-10 11:13:37.000000000,2018-10-12 10:46:30.000000000,closed,2,Copy security state on composition copy
1365,2018-10-10 10:46:29.000000000,1970-01-01 00:00:00.000000001,open,0,Advanced support for currency storage and editing
1364,2018-10-10 10:28:27.000000000,2018-11-28 13:27:52.000000000,closed,1,Hierarchy column is not saved in the settings for the TreeDataGrid
1363,2018-10-10 10:00:38.000000000,2018-10-16 15:56:03.000000000,closed,0,Inability to move the column to the first position in the DataGrid if SelectionMode=MULTI
1362,2018-10-09 18:45:27.000000000,2018-10-19 17:29:22.000000000,closed,1,NPE while opening a hot deployed screen
1361,2018-10-09 17:57:11.000000000,2018-10-29 13:29:38.000000000,closed,2,Sorting does not work correctly in the TreeTable component
1360,2018-10-09 17:06:50.000000000,2019-05-17 17:06:14.000000000,closed,2,Foreign key constraint error with joined inheritance
1359,2018-10-09 16:08:38.000000000,2018-10-11 13:41:03.000000000,closed,0,Unable to close message dialog shown on modal window init
1358,2018-10-09 15:58:34.000000000,2018-10-17 15:31:26.000000000,closed,0,FieldGroup Field generation method called before the Injections
1357,2018-10-09 15:00:17.000000000,2018-10-09 15:47:55.000000000,closed,2,Updated CONTRIBUTING.md info on IDEA usage
1356,2018-10-09 14:29:16.000000000,2018-12-12 14:14:44.000000000,closed,2,Dynamic attribute editor should display only screens that refer to the selected entity type
1355,2018-10-09 14:22:20.000000000,2018-10-29 13:27:26.000000000,closed,0,IllegalArgumentException when trying to expand tree in Application properties screen
1354,2018-10-09 14:09:58.000000000,2018-10-10 15:54:51.000000000,closed,0,Unable to close window with overridden preClose callback
1353,2018-10-09 11:55:49.000000000,2018-11-30 19:26:15.000000000,closed,1,Add an ability to set background of aggregation row with SCSS variable
1352,2018-10-08 21:30:41.000000000,2018-10-10 16:58:24.000000000,closed,0,ClassCastException on nested datasource search in DsContext
1351,2018-10-08 19:08:29.000000000,2018-10-08 19:32:06.000000000,closed,0,Do not use AppBeans where it is possible
1350,2018-10-08 17:56:00.000000000,2018-10-10 15:38:59.000000000,closed,0,ClassCastException when clicking invoke button in any bean from JMX console
1349,2018-10-08 13:58:00.000000000,2018-10-08 13:59:26.000000000,closed,0,Refactor deprecated StrBuilder and StrSubstitutor usages
1348,2018-10-08 13:39:02.000000000,2018-10-22 15:52:33.000000000,closed,0,Required indicator isn't displayed
1347,2018-10-08 11:16:19.000000000,2018-10-08 11:44:30.000000000,closed,0,Remove deprecated Instance addListener / removeListener methods
1346,2018-10-07 22:41:31.000000000,2018-11-21 18:37:12.000000000,closed,6,Problem in audimex-dashboardscomponent after switching to 6.10.0 
1345,2018-10-06 14:23:12.000000000,1970-01-01 00:00:00.000000001,open,10,Email template params interpolation
1344,2018-10-06 13:59:22.000000000,2018-12-17 10:48:24.000000000,closed,1,IllegalArgumentException when trying to copy settings for user
1343,2018-10-06 13:44:25.000000000,2018-11-07 13:40:21.000000000,closed,1,The Change password dialog has an incorrect caption
1342,2018-10-06 11:03:22.000000000,1970-01-01 00:00:00.000000001,open,6,EmailInfo TemplateParameters are ignored
1341,2018-10-05 17:53:06.000000000,2018-10-08 16:21:17.000000000,closed,2,Cannot edit non-persistent entity using standard browser-editor screens
1340,2018-10-05 16:05:35.000000000,2018-10-10 14:34:07.000000000,closed,0,Word wrap doesn't work in OptionDialog message
1339,2018-10-05 15:31:50.000000000,2018-10-08 12:57:35.000000000,closed,2,"NPE when invoking the ""WebPickerField.removeAction() or addAction()"" methods"
1338,2018-10-05 13:41:22.000000000,2018-10-10 14:19:23.000000000,closed,0,Log messages issued from web client don't contain user information
1337,2018-10-05 13:20:01.000000000,2018-10-15 12:35:28.000000000,closed,0,Modality curtains are not shown with Error and Warning notifications
1336,2018-10-05 08:34:49.000000000,2018-10-05 09:09:53.000000000,closed,0,Transaction is marked as rollback-only after accessing files in FileStorage
1335,2018-10-04 22:41:41.000000000,2019-03-05 14:25:05.000000000,closed,2,PickerField fires ValueChangeEvent after editor commit
1334,2018-10-04 22:38:17.000000000,2019-01-11 19:07:53.000000000,closed,1,ValueChangeEvent userOriginated for PickerField actions
1333,2018-10-04 21:51:59.000000000,2018-10-05 12:25:25.000000000,closed,0,Set inputPrompt for login and password fields on LoginWindow
1332,2018-10-04 21:50:08.000000000,2018-10-05 12:25:19.000000000,closed,0,Support inputPrompt for PasswordField
1331,2018-10-04 20:23:53.000000000,2018-10-10 16:36:53.000000000,closed,1,ClassCastException when trying to set up a query for the report
1330,2018-10-04 19:52:57.000000000,2018-10-05 13:01:58.000000000,closed,1,Typo in the `youSelectedEmbedded` filter notification for the Russian locale
1329,2018-10-04 16:16:44.000000000,2019-01-14 18:07:30.000000000,closed,0,ColumnCollapsingChangeListener returns two events simultaneously
1328,2018-10-04 15:29:04.000000000,2018-10-15 17:11:45.000000000,closed,0,Double-click on a table in a new browser closes the screen
1327,2018-10-04 12:54:15.000000000,2019-01-22 16:26:58.000000000,closed,0,Fix drag'n'drop functionality in the Edit filter screen
1326,2018-10-04 12:35:15.000000000,2018-11-14 17:28:59.000000000,closed,0,Error loading screen with RuntimePropertiesFrame
1325,2018-10-03 18:23:13.000000000,2018-10-23 12:50:12.000000000,closed,1,FileUploadField does not upload files
1324,2018-10-03 14:48:17.000000000,2019-04-25 10:31:15.000000000,closed,1,Add to current set action should open browser screen if the lookup screen is not defined
1323,2018-10-03 12:24:12.000000000,2018-11-01 15:14:20.000000000,closed,1,Update Hibernate Validator dependency
1322,2018-10-02 23:43:47.000000000,2019-03-01 16:40:55.000000000,closed,1,NPE during application start if an application component does not have any properties in descriptor
1321,2018-10-02 19:32:06.000000000,2018-10-06 11:35:32.000000000,closed,0,ClassCastException in Filter editor with Tree drag-and-drop
1320,2018-10-02 17:50:53.000000000,2018-10-05 15:43:20.000000000,closed,0,Reset settings of screens invokes ClassCastException
1319,2018-10-02 17:47:53.000000000,2018-10-06 12:23:33.000000000,closed,0,Tab isn't shown for Settings screen in main TabSheet
1318,2018-10-02 10:53:42.000000000,2018-10-08 11:11:12.000000000,closed,1,Rework FieldGroup
1317,2018-10-01 13:57:45.000000000,2018-10-11 19:12:42.000000000,closed,1,IllegalArgumentException occurs when open the screen which contains DataGrid with two or more columns
1316,2018-10-01 13:28:43.000000000,2019-05-29 16:51:02.000000000,closed,0,Error happens when multiple joins in query filter without JOIN statement 
1315,2018-10-01 11:50:02.000000000,2018-10-01 11:50:42.000000000,closed,0,Add Table Insert/Add/Remove options to predefined action shortcuts in layout.xsd
1314,2018-10-01 11:33:52.000000000,2018-10-02 11:16:42.000000000,closed,1,SecurityContextAwareCallable has an incorrect constructor modifier
1313,2018-09-30 15:30:17.000000000,2018-09-30 15:30:52.000000000,closed,0,Remove deprecated FilterApplyAction
1312,2018-09-28 18:51:42.000000000,2018-11-08 13:30:32.000000000,closed,0,New CRUD actions
1311,2018-09-28 18:51:26.000000000,2018-11-12 18:07:50.000000000,closed,3,CurrencyField value type must extend Number
1310,2018-09-28 14:23:49.000000000,2019-06-13 18:17:37.000000000,closed,3,Saved filter using wrong value selector for the unary condition
1309,2018-09-27 18:04:54.000000000,2018-12-17 12:09:29.000000000,closed,0,Reimplement UI components using Vaddin 8
1308,2018-09-27 16:58:22.000000000,2018-10-03 11:28:49.000000000,closed,0,Entity cache doesn't work for UUID entities on the MSSQL
1307,2018-09-27 15:27:03.000000000,2018-10-09 12:35:54.000000000,closed,2,Implement buffered mode for HasValue components
1306,2018-09-27 13:40:55.000000000,2018-10-16 11:36:50.000000000,closed,0,AbstractWindow getMessage() doesn't work if path to messagePack isn't defined
1305,2018-09-26 18:10:52.000000000,1970-01-01 00:00:00.000000001,open,2,Push requests stop working after resync
1304,2018-09-26 17:19:37.000000000,2018-10-04 15:27:44.000000000,closed,1,Replace lambda creation with method references in WebAbstractDataGrid
1303,2018-09-26 11:08:04.000000000,2018-10-22 19:06:40.000000000,closed,3,IllegalStateException when clicking search button in FTS search field
1302,2018-09-26 10:58:36.000000000,2018-10-23 12:28:00.000000000,closed,1,NPE when creating report using wizard
1301,2018-09-25 17:25:47.000000000,2019-04-23 20:08:19.000000000,closed,1,Using RowsCount with KeyValueCollectionLoader
1300,2018-09-25 14:31:59.000000000,2018-12-03 16:50:47.000000000,closed,0,Support data containers in the TokenList component
1299,2018-09-25 11:21:45.000000000,2018-09-26 12:05:00.000000000,closed,0,DataGrid edit causes misaligned columns
1298,2018-09-25 11:19:10.000000000,2018-09-25 12:31:10.000000000,closed,0,Migrate to Vaadin 7.7.14
1297,2018-09-25 09:15:05.000000000,1970-01-01 00:00:00.000000001,open,0,Declarative asynchronous loading of data in screens
1296,2018-09-24 19:33:33.000000000,2018-11-02 19:01:46.000000000,closed,1,Fix CubaFoldersPane
1295,2018-09-24 16:38:27.000000000,2018-09-26 12:39:02.000000000,closed,0,Improve EntityLog API to enable logging of non-persistent attributes
1294,2018-09-24 16:35:29.000000000,2018-09-24 16:35:42.000000000,closed,1,Improve EntityLog API to enable logging of non-persistent attributes
1293,2018-09-24 10:58:59.000000000,2018-10-01 14:45:57.000000000,closed,0,DataGrid doesn't handle shortcuts
1292,2018-09-24 10:54:26.000000000,2018-10-05 10:36:37.000000000,closed,0,Exception if null DataGridSource is set
1291,2018-09-24 10:52:48.000000000,2019-06-22 14:14:06.000000000,closed,0,Implement new features of the Tree component
1290,2018-09-24 10:45:00.000000000,2019-02-05 17:47:22.000000000,closed,1,Fix drag'n'drop functionality in the Access Groups screen
1289,2018-09-24 10:39:13.000000000,2019-01-14 17:23:45.000000000,closed,1,No ability to control jgroups logging via logback.xml
1288,2018-09-23 09:17:10.000000000,1970-01-01 00:00:00.000000001,open,0,"Ability to use primitive types (boolean, int, etc.) in entity attributes"
1287,2018-09-21 17:21:43.000000000,2018-10-02 12:02:15.000000000,closed,0,Implement expandAll/collapseAll methods for TreeDataGrid
1286,2018-09-21 16:05:34.000000000,2019-02-06 17:24:03.000000000,closed,1,Tree.expandUpTo() expands all items
1285,2018-09-21 15:12:14.000000000,1970-01-01 00:00:00.000000001,open,0,Exceptions in WebBackgroundWorker when cleaning previously hanged tasks
1284,2018-09-21 12:17:11.000000000,2018-09-22 14:40:38.000000000,closed,0,Ability to log app properties for startup troubleshooting
1283,2018-09-20 18:49:46.000000000,1970-01-01 00:00:00.000000001,open,0,Double-click on JMX Console screen can open for inspect wrong MBean
1282,2018-09-20 17:13:39.000000000,2018-09-26 16:57:20.000000000,closed,0,Remove WidgetsTree component
1281,2018-09-19 22:19:43.000000000,2018-10-02 16:59:43.000000000,closed,0,Accordion shows Tab caption inside of lazy tab content
1280,2018-09-18 20:02:45.000000000,2018-10-16 18:27:49.000000000,closed,0,Declarative handlers approach with @Install annotation
1279,2018-09-18 17:27:10.000000000,2018-10-16 08:33:34.000000000,closed,0,IllegalStateException on attempt to see System Information in EntityLog viewer
1278,2018-09-18 11:39:26.000000000,2018-09-21 10:46:11.000000000,closed,0,JMX AttributeEditor uses concrete UI component classes
1277,2018-09-18 11:18:33.000000000,2018-10-23 12:01:05.000000000,closed,3,Reimplement the Tree component
1276,2018-09-17 20:14:06.000000000,2018-10-01 11:29:16.000000000,closed,0,Provide dynamic extension state for Screen and ScreenFragment
1275,2018-09-17 16:00:18.000000000,2018-11-21 18:36:39.000000000,closed,0,Incorrect displaying button clicking effect
1274,2018-09-17 12:37:32.000000000,2018-10-02 15:43:36.000000000,closed,0,REST API: fill the cause exception in the RestAPIException object
1273,2018-09-15 20:57:14.000000000,2018-11-28 13:45:05.000000000,closed,0,sys$AppFolder scripts are executed while CubaFoldersPane is disabled
1272,2018-09-15 11:47:34.000000000,2018-09-15 11:49:34.000000000,closed,0,Remove ScreenAgent support
1271,2018-09-14 19:31:28.000000000,2018-09-17 10:32:17.000000000,closed,1,Delegate assignment of audit attributes to a bean for easy override
1270,2018-09-14 18:02:49.000000000,2018-11-12 17:43:34.000000000,closed,3,SingleWar does not work on JVM 8
