id,created_at,closed_at,state,comments,title
879,2018-05-24 11:22:36.000000000,2018-07-24 13:59:57.000000000,closed,0,Attribute restrictions can be bypassed by swapping security token between entities
878,2018-05-24 11:07:16.000000000,2018-08-16 18:23:00.000000000,closed,2,Read-only attribute access restriction can be bypassed by altered remote desktop client
877,2018-05-23 18:16:24.000000000,2018-11-14 00:50:46.000000000,closed,2,Exception when sending REST API request with mistyped URL
876,2018-05-23 13:39:43.000000000,2018-05-25 14:14:13.000000000,closed,1,"Having default values for ServerConfig#getKeyForSecurityTokenEncryption, ServerConfig#getTrustedClientPassword is not fool-proof"
875,2018-05-23 12:07:35.000000000,2019-05-31 10:50:54.000000000,closed,2,Use more clear exception message in case of not enhanced entities
874,2018-05-22 18:42:23.000000000,2018-06-01 15:32:34.000000000,closed,1,Attribute security token is encrypted for all entities regardless of settings
873,2018-05-22 17:05:51.000000000,2018-05-23 17:22:59.000000000,closed,3,Exception occurs when running report with HTML template type for non-included into instance name attribute
872,2018-05-22 15:27:55.000000000,2019-03-01 13:24:59.000000000,closed,1,The last GroupTable column exceeds the table width in Chrome
871,2018-05-22 12:36:33.000000000,1970-01-01 00:00:00.000000001,open,0,Missed Role column at the Users screen
870,2018-05-22 12:29:25.000000000,2018-06-15 14:12:18.000000000,closed,0,Improve EntitySnapshotsAPI
869,2018-05-22 11:49:28.000000000,2018-05-22 19:38:27.000000000,closed,0,ExcelAction throws exception with POI 3.17
868,2018-05-22 11:11:58.000000000,2019-03-25 15:15:41.000000000,closed,2,Add more strong password hashing algorithm
867,2018-05-22 09:17:55.000000000,2018-08-06 12:37:12.000000000,closed,1,Web integration test infrastructure
866,2018-05-21 16:33:54.000000000,2018-05-23 16:32:33.000000000,closed,0,Improve programmatic grouping in GroupTable
865,2018-05-21 14:16:10.000000000,2018-06-27 17:27:32.000000000,closed,0,Support arbitrary amount of domains and sub domains in EmailValidator
864,2018-05-20 16:05:36.000000000,2018-08-08 19:04:37.000000000,closed,1,Boolean string value instead of checkbox in Entity Inspector  screen
863,2018-05-18 11:38:46.000000000,1970-01-01 00:00:00.000000001,open,0,Missing horizontal divider in Filter for first condition
862,2018-05-17 20:16:35.000000000,2018-05-25 13:10:58.000000000,closed,1,Excel action which only supports a maximum of 65536 rows
861,2018-05-17 14:01:50.000000000,2018-05-28 17:33:21.000000000,closed,0,Localization of Dynamic Attributes does not work in RuntimePropertiesFrame
860,2018-05-17 13:34:43.000000000,1970-01-01 00:00:00.000000001,open,2,Required indicator of LookupField is misplaced in Safari
859,2018-05-17 11:59:23.000000000,2018-08-01 14:33:03.000000000,closed,1,PopupButton should have ability to use existing table/window actions
858,2018-05-16 14:47:30.000000000,2018-05-18 17:10:30.000000000,closed,1,CubaEntityListViewBehavior should return a promise from the remove method
857,2018-05-15 18:10:19.000000000,2018-05-23 18:44:59.000000000,closed,0,Provide explicit application property for Vaadin heartbeatInterval
856,2018-05-15 16:57:52.000000000,2018-05-24 18:15:00.000000000,closed,0,ColorPicker's default caption is overlapped by the color indicator
855,2018-05-15 16:44:53.000000000,2018-06-19 14:37:49.000000000,closed,0,Handle EclipseLink validation exception while copy entity
854,2018-05-15 16:40:28.000000000,2018-05-18 15:39:17.000000000,closed,0,WindowManager checkModificationsAndCloseAll does not support Window.Committable
853,2018-05-15 15:01:22.000000000,2018-05-15 15:43:00.000000000,closed,0,to be removed
852,2018-05-15 15:00:11.000000000,2018-05-15 15:38:07.000000000,closed,0,Fluent interface to DataManager
851,2018-05-15 14:47:11.000000000,2018-05-15 14:49:23.000000000,closed,1,Login field is duplicated on sec$User creation screen in Entity Inspector
850,2018-05-15 13:07:01.000000000,1970-01-01 00:00:00.000000001,open,0,The platform should provide an ability not to inherit the query filter from a parent screen
849,2018-05-15 11:20:47.000000000,2018-05-15 11:24:13.000000000,closed,0,Add cuba.useLocalServiceInvocation property to PortalConfig
848,2018-05-14 17:15:03.000000000,2018-09-19 17:03:16.000000000,closed,4,Incorrect display of scrolling for Token List with fixed width
847,2018-05-14 15:16:22.000000000,2018-05-14 18:57:25.000000000,closed,1,Correct typo in WebButtonsPanel.java
846,2018-05-12 21:23:19.000000000,1970-01-01 00:00:00.000000001,open,0,Dynamic attributes - Enumeration type - programmatic setValue allows any String
845,2018-05-11 15:16:56.000000000,2019-11-27 20:00:53.000000000,closed,2,Specify CHAR length for VARCHAR2 columns in the ORACLE scripts
843,2018-05-11 11:27:56.000000000,1970-01-01 00:00:00.000000001,open,0,Return metadata in entities list response
842,2018-05-11 11:26:45.000000000,1970-01-01 00:00:00.000000001,open,0,Add PUT mapping for REST API v2 invokeServiceMethod
841,2018-05-11 11:23:56.000000000,2018-05-25 16:21:33.000000000,closed,1,User session log is not updated when REST API token is revoked
840,2018-05-10 19:10:24.000000000,2018-12-17 15:26:57.000000000,closed,1,Bulk editor should work for the entities with the embedded id type
839,2018-05-10 16:50:43.000000000,2018-10-01 12:33:59.000000000,closed,0,Unsupported web browser page
838,2018-05-10 16:28:38.000000000,2019-01-11 17:07:06.000000000,closed,1,Web components usage with Vaadin 8
837,2018-05-10 15:51:10.000000000,2018-05-25 10:11:37.000000000,closed,0,"""Run once now"" button on Scheduled Tasks screen"
836,2018-05-10 15:50:54.000000000,2018-07-17 16:12:32.000000000,closed,1,Implement ApplicationContextAware support for Entities
835,2018-05-10 15:28:51.000000000,1970-01-01 00:00:00.000000001,open,0,Define application artifacts / components in spring.xml instead of separate XML configs
834,2018-05-10 12:32:04.000000000,2018-08-08 11:28:16.000000000,closed,1,DataManager.getCount throws NPE if query is not defined in LoadContext
833,2018-05-10 12:00:06.000000000,2018-05-10 17:06:10.000000000,closed,0,Access Group Constraint Applying to All Entities
832,2018-05-08 16:25:16.000000000,1970-01-01 00:00:00.000000001,open,0,Error when downloading log from busy server
831,2018-05-08 15:03:03.000000000,2019-02-22 20:48:35.000000000,closed,1,Remove LoginService and LoginWorker
830,2018-05-08 15:00:30.000000000,2019-07-10 08:19:26.000000000,closed,0,Get rid of unsafe Component.unwrap calls
829,2018-05-08 14:06:37.000000000,2019-06-23 19:08:50.000000000,closed,0,cuba.web.standardAuthenticationUsers could not logout after logged in with ExternalUserLoginProvider
828,2018-05-08 14:01:13.000000000,2018-05-10 13:27:29.000000000,closed,0,Dynamic Attributes Enumeration Values does not maintain the order of entry
827,2018-05-08 13:32:03.000000000,2018-05-14 13:29:55.000000000,closed,0,Exception occurs when trying to reorder rows by Category column
826,2018-05-08 12:24:38.000000000,1970-01-01 00:00:00.000000001,open,0,Groovy access constraints could be executed in client through SecurityImpl
825,2018-05-07 19:38:42.000000000,2018-05-25 17:02:08.000000000,closed,0,ColorPicker's default caption is overlapped by the color indicator
824,2018-05-07 18:18:56.000000000,2018-08-17 12:32:31.000000000,closed,2,Partial localization of extended screens
823,2018-05-07 17:49:42.000000000,2018-05-08 16:00:37.000000000,closed,1,Do not escape string for LIKE JPQL query #807
821,2018-05-07 16:27:24.000000000,2019-11-19 17:33:26.000000000,closed,1,Extract bean validation on Service call to separate aspect
820,2018-05-07 15:20:00.000000000,2018-05-25 14:14:37.000000000,closed,0,ConcurrentModificationException in TasksWatchDog
819,2018-05-05 12:38:27.000000000,2018-06-13 10:23:56.000000000,closed,1,Problem with using of scrollBox on Desktop
818,2018-05-05 12:18:03.000000000,1970-01-01 00:00:00.000000001,open,0,Possible problems with using AppPropertiesLocator
817,2018-05-04 16:42:29.000000000,2018-05-25 12:28:30.000000000,closed,2,Support MySQL 8
816,2018-05-04 15:16:24.000000000,2018-05-04 16:05:51.000000000,closed,0,MetadataTools.deepCopy does not copy embedded entities
815,2018-05-04 13:24:59.000000000,2018-05-08 14:43:57.000000000,closed,0,Unobvious error message while uploading files in entity inspector
814,2018-05-04 11:48:54.000000000,2018-06-05 17:11:45.000000000,closed,0,Compatibility with Intellij Gradle plugin
813,2018-05-04 10:47:22.000000000,2018-05-06 18:54:42.000000000,closed,1,Corrrect typo in CONTRIBUTIONS.md
812,2018-05-03 17:24:24.000000000,2018-05-07 12:03:32.000000000,closed,0,Add the 'removeAll' method to the CalendarEventProvider
811,2018-05-03 17:18:04.000000000,2018-05-03 17:24:55.000000000,closed,0,More reliable Metadata session initialization
810,2018-05-03 15:55:45.000000000,2018-06-01 15:52:43.000000000,closed,0,"Use different names for spring ""scheduler""s"
809,2018-05-03 14:03:47.000000000,2018-05-07 17:56:37.000000000,closed,0,Getting DeclarativeColumnGenerator by the bean injection
808,2018-05-03 11:37:42.000000000,2018-05-07 18:05:39.000000000,closed,0,Creating the table component is extracted to separated method
807,2018-05-03 09:53:08.000000000,2018-05-10 15:14:14.000000000,closed,0,Do not escape string for LIKE JPQL query 
806,2018-05-02 10:26:00.000000000,2018-05-15 15:17:54.000000000,closed,1,Fluent interface to DataManager (PR)
805,2018-05-01 12:37:44.000000000,2018-05-07 18:01:58.000000000,closed,0,Incorrect scope of DeclarativeColumnGenerator class fields
804,2018-04-30 13:09:13.000000000,2018-10-14 16:38:05.000000000,closed,1,Extension-friendly DeclarativeColumnGenerator
803,2018-04-28 16:11:48.000000000,2018-05-04 18:13:15.000000000,closed,1,Complicated JPQL query with one-to-one related entities returns no results
802,2018-04-28 15:44:21.000000000,2018-05-08 13:59:35.000000000,closed,0,Dynamic Attributes Enumeration Values does not maintain the order of entry
801,2018-04-28 15:23:27.000000000,2018-05-21 11:53:35.000000000,closed,0,Download button is active at the opening of Administration - Application Properties
800,2018-04-28 14:45:30.000000000,2018-04-28 14:49:03.000000000,closed,0,Improve XSD for extension use cases of menu separator
798,2018-04-28 13:48:17.000000000,2019-05-30 16:07:44.000000000,closed,1,Support collections of dynamic attributes in RuntimePropertiesFrame
797,2018-04-28 13:47:03.000000000,2019-05-16 16:57:43.000000000,closed,0,"Support collection ""enumeration"" dynamic attributes"
796,2018-04-28 12:56:07.000000000,2018-05-15 15:41:47.000000000,closed,0,XLSX file can't be downloaded in the Safari browser on the iphone/ipad
795,2018-04-28 11:32:27.000000000,2018-04-28 13:05:45.000000000,closed,0,"PK field of not persistent String Id entity is not recognized by MetadataTools when the field name differs from ""ID"""
794,2018-04-28 11:10:46.000000000,2018-04-28 11:10:57.000000000,closed,0,In-memory security constraints are not applied to the FTS search result
793,2018-04-27 19:30:38.000000000,2018-06-22 18:44:35.000000000,closed,0,Provide an ability to reset user settings
792,2018-04-27 18:53:42.000000000,2018-05-08 19:57:21.000000000,closed,3,Determining remote IP address by remote client layers
791,2018-04-27 14:15:49.000000000,2018-05-08 13:47:19.000000000,closed,0,StandardAuthenticationUsers for IDP with LDAP
790,2018-04-27 11:41:24.000000000,2019-05-23 18:31:56.000000000,closed,0,Cache declared entity listeners in EntityListenerManager
789,2018-04-27 09:13:10.000000000,2019-04-05 12:09:22.000000000,closed,1,"User Filter looks cutted after applying ""Search by role"""
788,2018-04-26 18:10:59.000000000,2018-05-08 11:18:25.000000000,closed,0,Remove X_FORWARDED_FOR header support from Web Client
787,2018-04-26 16:16:53.000000000,2018-05-03 16:23:50.000000000,closed,0,Scheduler is shutdown when a child spring context is closed
786,2018-04-26 13:49:15.000000000,2018-12-26 13:20:05.000000000,closed,1,MaskedField doesn't send value on Enter press
785,2018-04-26 11:42:19.000000000,2019-08-07 15:09:38.000000000,closed,1,EntityManager.flush() breaks cascade deletion policy
784,2018-04-26 11:02:29.000000000,2018-05-07 11:06:33.000000000,closed,0,Excessive memory allocation points
783,2018-04-25 15:08:01.000000000,1970-01-01 00:00:00.000000001,open,0,TabSheet unloaded lazy tabs API
782,2018-04-25 13:44:28.000000000,2018-06-05 10:12:23.000000000,closed,0,Provide API for setting audit information
781,2018-04-25 08:58:46.000000000,2018-06-05 10:12:59.000000000,closed,1,Allow using {E} in queries instead of typing the full name of an entity in typed queries and load contexts.
780,2018-04-24 15:49:47.000000000,2018-07-10 16:21:25.000000000,closed,2,"When ""Load dynamic attributes"" is set to true dynamic attributes are loaded not regarding their existence and the entity type "
779,2018-04-24 15:24:45.000000000,2018-05-10 12:11:36.000000000,closed,0,"""Unsupported primary key type"" error occurs on combined screen for a composite PK entity without HasUuid"
778,2018-04-23 20:24:01.000000000,2018-05-15 13:17:23.000000000,closed,1,Unobvious error message while uploading files in entity inspector
777,2018-04-23 20:06:05.000000000,2018-08-22 15:27:36.000000000,closed,1,Move AceEditor resources into WebJAR
776,2018-04-23 18:43:27.000000000,2019-11-13 13:16:11.000000000,closed,0,Provide Select all / Deselect all in Table column control
775,2018-04-23 11:30:27.000000000,2018-10-12 12:30:32.000000000,closed,1,Optimize layout of Filter component
774,2018-04-23 11:26:47.000000000,2018-12-07 15:11:12.000000000,closed,1,RowsCount component uses 2 HorizontalLayouts
773,2018-04-19 17:43:15.000000000,2019-05-17 12:22:02.000000000,closed,2,IconProvider for value of PickerField
772,2018-04-19 17:21:11.000000000,1970-01-01 00:00:00.000000001,open,0,A context help icon is displayed below the component if the FieldGroup field has the 'rows' attribute
771,2018-04-19 15:50:47.000000000,2019-05-23 18:35:25.000000000,closed,1,Using application lifecycle event methods in bean which is also an MBean
770,2018-04-19 14:30:45.000000000,2019-05-23 18:36:46.000000000,closed,2,ClassCastException on hot-deploy of controller that is used from code
769,2018-04-19 14:04:52.000000000,2018-05-25 16:17:09.000000000,closed,0,"Some platform entities have lost their createTs, createdBy attributes"
768,2018-04-18 11:27:56.000000000,1970-01-01 00:00:00.000000001,open,0,Ability to manage dynamic attributes via Entity.setValue() inside a transaction 
767,2018-04-18 11:20:38.000000000,2018-07-11 16:21:38.000000000,closed,0,Query with Extract is transformed incorrectly when security constraint is applied or query contains macro
766,2018-04-18 10:16:14.000000000,2018-05-07 14:03:00.000000000,closed,0,RowLevelSecurityException on saving previously saved entity with enabled Attribute Access
765,2018-04-17 17:59:52.000000000,2018-12-24 17:56:58.000000000,closed,0,Trigger validators even if the value of UI component isEmpty
764,2018-04-17 17:18:37.000000000,2018-08-29 11:29:41.000000000,closed,0,Replace 4 boolean fields of Entity state with 1 byte variable with bits access
763,2018-04-17 13:50:15.000000000,1970-01-01 00:00:00.000000001,open,0,Consider including Embedded attributes to local/base views
762,2018-04-17 12:35:38.000000000,2018-08-04 15:44:04.000000000,closed,0,Rename TextArea wordwrap into wordWrap
761,2018-04-16 17:14:26.000000000,2018-05-26 14:35:43.000000000,closed,0,postCommit in EntityCombinedScreen
760,2018-04-16 16:32:32.000000000,2018-06-04 13:36:57.000000000,closed,0,"""Run once now"" button on Scheduled Tasks screen"
759,2018-04-13 19:29:19.000000000,2018-05-26 14:33:20.000000000,closed,1,Obtaining a next type safe value of a sequence
758,2018-04-13 12:17:45.000000000,2018-06-09 08:59:09.000000000,closed,1,Height of desktop TokenList is increased while continuous inline/position properties switching
757,2018-04-13 11:24:33.000000000,2018-08-13 14:50:06.000000000,closed,1,Update FontAwesome in Vaadin with new icons
756,2018-04-12 12:59:20.000000000,2018-05-31 11:03:09.000000000,closed,1,Atmosphere bug with Vaadin 8.4
755,2018-04-12 10:19:51.000000000,2018-05-14 13:08:03.000000000,closed,2,Ignore accents in LookupField like components
754,2018-04-11 19:04:35.000000000,2019-01-31 17:12:28.000000000,closed,0,"Unable to use attribute name ""set"" in entity"
753,2018-04-11 18:14:00.000000000,2018-11-21 15:30:34.000000000,closed,1,Save UI component settings only if users change them
752,2018-04-11 17:10:18.000000000,2018-05-30 13:16:32.000000000,closed,0,'serviceWorker' in the polymer index.html should be commented out by default
751,2018-04-11 11:01:15.000000000,2018-05-10 16:42:51.000000000,closed,1,Add the 'removeAll' method to the CalendarEventProvider
750,2018-04-10 16:04:58.000000000,2019-06-25 16:58:24.000000000,closed,0,Improve declarative validators for Field components
749,2018-04-10 14:55:56.000000000,1970-01-01 00:00:00.000000001,open,0,NPE on attempt to create an instance of entity with composite PK using Entity inspector
748,2018-04-09 10:50:47.000000000,2019-08-08 17:39:00.000000000,closed,0,Role-based security for REST services
747,2018-04-08 17:40:57.000000000,1970-01-01 00:00:00.000000001,open,0,There is the problem with cyrillic on MacOS and MySQL
746,2018-04-07 17:02:49.000000000,2019-04-11 16:13:05.000000000,closed,1,Implicitly add columns to table
745,2018-04-06 18:50:02.000000000,2019-04-12 14:45:15.000000000,closed,0,Add double-click listener to OptionsList component
744,2018-04-06 17:31:35.000000000,2019-04-05 14:33:05.000000000,closed,7,Get rid of default implicit conversion of JPQL query parameters
743,2018-04-03 23:39:41.000000000,2018-06-01 12:31:59.000000000,closed,1,Use new Dom4j API
742,2018-04-03 22:07:23.000000000,2018-08-14 19:15:22.000000000,closed,2,Kryo incorrectly deserializes HashSet instances
741,2018-04-03 13:58:01.000000000,2019-01-14 12:55:24.000000000,closed,0,JPQLException occurs on attempt to restore a Detail entity when @OnDeleteInverse is set on the collection attribute of the Master entity
740,2018-04-02 17:34:56.000000000,1970-01-01 00:00:00.000000001,open,0,Add an ability to setup URL that should be opened in new window after Button / LinkButton click
739,2018-04-02 13:44:48.000000000,2019-08-05 15:41:47.000000000,closed,0,Could not save SYS_SENDING_ATTACHMENT when the attached file is too big for the BLOB type on MySQL
737,2018-03-29 17:51:44.000000000,2018-11-27 12:10:27.000000000,closed,1,Code completion in Edit Condition screen does not overwrite entered part of attribute name
736,2018-03-27 15:56:52.000000000,2019-02-25 15:11:21.000000000,closed,0,SQL exception occurs in Entity Inspector when creating instance of PK entity
735,2018-03-27 12:26:12.000000000,1970-01-01 00:00:00.000000001,open,0,Captions are absent for components that are not Fields in desktop
734,2018-03-26 14:41:17.000000000,2018-04-28 17:47:22.000000000,closed,1,ORM uses inner join instead of outer join
733,2018-03-24 15:21:47.000000000,1970-01-01 00:00:00.000000001,open,0,HTTP Session gets expired right after login
732,2018-03-22 15:24:26.000000000,2018-05-26 14:30:42.000000000,closed,0,Unfetched attribute access error in edit screen after reload of created entity in BeforeInsertEntityListener
731,2018-03-20 15:08:19.000000000,2018-05-08 15:04:00.000000000,closed,0,Server Log: Show Tail button does not scroll to bottom
730,2018-03-20 12:22:47.000000000,2019-03-06 17:35:04.000000000,closed,2,Remove testId from MenuBar
729,2018-03-19 17:53:10.000000000,2019-08-07 17:06:51.000000000,closed,1,Add an ability to obtain metadata for enumerations that are used as field datatypes
728,2018-03-19 11:58:49.000000000,2018-05-26 14:30:07.000000000,closed,0,Desktop client doesn't start: input line too long
727,2018-03-18 12:07:19.000000000,2019-06-25 15:25:51.000000000,closed,0,Move REST v1 to app component
726,2018-03-16 15:49:40.000000000,1970-01-01 00:00:00.000000001,open,0,MetadataTools.getStoreName() should return non-null for MappedSuperclasses
725,2018-03-15 19:51:42.000000000,2018-05-26 14:28:40.000000000,closed,0,Provide convinient variant of PersistenceTools.getOldValue() 
724,2018-03-15 10:56:27.000000000,1970-01-01 00:00:00.000000001,open,0,Inline SVG icons support
723,2018-03-13 17:14:37.000000000,2019-03-22 10:19:11.000000000,closed,1,Swagger schema errors
722,2018-03-13 16:11:37.000000000,2018-09-07 17:34:42.000000000,closed,1,Add an ability to setup web resources cache time
721,2018-03-12 10:27:58.000000000,2019-07-02 23:00:40.000000000,closed,1,Expose an API to change the theme
720,2018-03-12 10:23:31.000000000,2019-11-06 14:45:18.000000000,closed,2,Show currently running schedulers in scheduled tasks screen
719,2018-03-11 23:02:20.000000000,2018-11-19 17:27:25.000000000,closed,5,Separate RadioButtonGroup and CheckBoxGroup components
718,2018-03-11 21:42:43.000000000,2018-12-07 20:16:00.000000000,closed,2,New UI component data binding API
717,2018-03-11 21:41:43.000000000,2019-01-31 16:17:10.000000000,closed,0,Component error indication rework
716,2018-03-09 19:20:50.000000000,2018-06-18 22:48:44.000000000,closed,0,Move cuba.gui.showIconsForPopupMenuActions to theme properties
715,2018-03-09 16:33:24.000000000,2018-10-31 17:13:46.000000000,closed,0,Move tabbed windows specifics from WebScreens to AppWorkArea implementation
714,2018-03-07 15:41:20.000000000,2019-08-07 17:13:32.000000000,closed,1,Internal Server Error while trying to use REST without authorization and with disabled cuba.rest.anonymousEnabled app property
713,2018-03-07 10:22:24.000000000,2019-11-22 19:49:55.000000000,closed,2,Add an ability to set popup position for the PopupView component
712,2018-03-06 16:48:34.000000000,2018-06-13 17:20:51.000000000,closed,0,"Different behavior of ""Default value"" field in Filter edit screen at Russian locale"
711,2018-03-05 18:25:36.000000000,1970-01-01 00:00:00.000000001,open,0,Safari can't open files for viewing
710,2018-03-05 18:20:25.000000000,2018-07-02 17:02:48.000000000,closed,0,Issue with Eclipse Link cache
708,2018-03-05 14:28:01.000000000,1970-01-01 00:00:00.000000001,open,0,Remove tight dependency from JPQL moving it to the RDBMS store implementation
707,2018-03-05 13:33:04.000000000,2019-03-22 10:17:08.000000000,closed,1,Swagger documentation is not generated correctly for overloaded REST service methods
705,2018-03-01 13:52:23.000000000,2019-09-18 20:12:43.000000000,closed,2,Scrolling doesn't work for Table header in case of disabled Table
704,2018-03-01 12:53:51.000000000,2018-09-04 13:46:04.000000000,closed,0,Exclude properties from filter for the whole object graph
703,2018-02-28 17:09:07.000000000,2018-06-05 10:12:20.000000000,closed,0,Convert EntityManagerImpl and QueryImpl into Spring prototype beans
702,2018-02-27 12:13:21.000000000,2018-05-26 16:07:00.000000000,closed,0,Java Security blocks Java Web Start
701,2018-02-26 11:41:59.000000000,2018-06-09 14:02:57.000000000,closed,0,"Make Excel export to output null Boolean values as ""No"""
700,2018-02-26 11:32:41.000000000,2019-04-08 20:01:32.000000000,closed,0,GridLayout doesn't set correct width of columns in case of changed columns amount
699,2018-02-25 23:17:51.000000000,1970-01-01 00:00:00.000000001,open,1,FieldGroup has incorrect size in PopupView
698,2018-02-22 12:21:23.000000000,2018-07-20 17:22:12.000000000,closed,0,"""More"" button in ColorPicker component has strange behavior"
697,2018-02-21 18:54:43.000000000,2019-12-06 16:47:49.000000000,closed,4,Ability to use local.app.properties with UberJAR
696,2018-02-19 14:00:55.000000000,2018-05-07 13:00:17.000000000,closed,2,RowLevelSecurityException on saving previously saved entity
695,2018-02-16 19:50:42.000000000,2019-04-26 12:13:19.000000000,closed,0,Polymer client theming
694,2018-02-15 13:59:37.000000000,2018-08-03 17:36:02.000000000,closed,2,Header of GroupTable has wrong height after grouping
693,2018-02-14 12:05:29.000000000,2019-05-30 15:26:02.000000000,closed,2,Incorrect display of icon inside of LookupField if SVG icons used
692,2018-02-13 17:36:32.000000000,1970-01-01 00:00:00.000000001,open,0,Read-Only permissions for UI components don't work for setEditable method
691,2018-02-13 14:02:26.000000000,2019-08-06 19:26:41.000000000,closed,2,Optionally do not return entity JSON for REST API entity create and update operations
689,2018-02-13 12:22:04.000000000,2019-08-04 09:58:50.000000000,closed,0,How to deploy 2+ applications to the same Tomcat instance in Jelastic
688,2018-02-12 19:22:40.000000000,1970-01-01 00:00:00.000000001,open,0,Ability to provide class of UI component from app component depending on some runtime conditions
687,2018-02-12 18:40:29.000000000,2018-09-07 19:17:49.000000000,closed,1,Sequence with long name can't be generated on the Oracle database
686,2018-03-02 12:49:19.000000000,1970-01-01 00:00:00.000000001,open,0,IllegalArgumentException occurs after opening saved filter for associative attribute
685,2018-02-09 13:21:43.000000000,2018-08-06 12:55:24.000000000,closed,0,"Entity cache doesn't put entity into the cache, if you can access a JDBC connection in the load transaction "
684,2018-02-08 18:45:28.000000000,2018-08-16 16:39:17.000000000,closed,5,GroupTable columns are misaligned in case of aggregatable table
683,2018-02-02 18:24:09.000000000,1970-01-01 00:00:00.000000001,open,0,Adding InputPromt for DateField component just like in TextField
682,2018-02-02 18:19:38.000000000,1970-01-01 00:00:00.000000001,open,0,BackgroundTask lambda API
681,2018-02-02 17:38:57.000000000,2018-06-09 15:14:08.000000000,closed,0,TokenList: tokens don't look like disabled when the component does
680,2018-02-02 17:01:02.000000000,2018-06-05 10:47:03.000000000,closed,1,Use original Maven group and artifact ids for EclipseLink
679,2018-02-02 12:41:54.000000000,2020-02-10 20:10:36.000000000,closed,2,MSSQL init scripts do not match model
